"Post ID",Permalink,"Post Message",Type,Countries,Languages,Posted,"Audience Targeting","Lifetime Post Total Reach","Lifetime Post organic reach","Lifetime Post Paid Reach","Lifetime Post Total Impressions","Lifetime Post Organic Impressions","Lifetime Post Paid Impressions","Lifetime Engaged Users","Lifetime Matched Audience Targeting Consumers on Post","Lifetime Matched Audience Targeting Consumptions on Post","Lifetime Negative Feedback from Users","Lifetime Negative Feedback","Lifetime Post Impressions by people who have liked your Page","Lifetime Post reach by people who like your Page","Lifetime Post Paid Impressions by people who have liked your Page","Lifetime Paid reach of a post by people who like your Page","Lifetime People who have liked your Page and engaged with your post","Lifetime Organic views to 95%","Lifetime Organic views to 95%","Lifetime Paid views to 95%","Lifetime Paid views to 95%","Lifetime Organic Video Views","Lifetime Organic Video Views","Lifetime Paid Video Views","Lifetime Paid Video Views","Lifetime Average time video viewed","Lifetime Video length","Lifetime Talking About This (Post) by action type - share","Lifetime Talking About This (Post) by action type - like","Lifetime Talking About This (Post) by action type - comment","Lifetime Post Stories by action type - share","Lifetime Post Stories by action type - like","Lifetime Post Stories by action type - comment","Lifetime Post Audience Targeting Unique Consumptions by Type - other clicks","Lifetime Post Audience Targeting Unique Consumptions by Type - link clicks","Lifetime Post Audience Targeting Unique Consumptions by Type - photo view","Lifetime Post Audience Targeting Unique Consumptions by Type - video play","Lifetime Matched Audience Targeting Consumptions by Type - other clicks","Lifetime Matched Audience Targeting Consumptions by Type - link clicks","Lifetime Matched Audience Targeting Consumptions by Type - photo view","Lifetime Matched Audience Targeting Consumptions by Type - video play","Lifetime Negative Feedback from Users by Type - hide_clicks","Lifetime Negative Feedback from Users by Type - hide_all_clicks","Lifetime Negative Feedback from Users by Type - report_spam_clicks","Lifetime Negative Feedback by Type - hide_clicks","Lifetime Negative Feedback by Type - hide_all_clicks","Lifetime Negative Feedback by Type - report_spam_clicks"
,,,,,,,,"Lifetime: The number of people who had your Page's post enter their screen. Posts include statuses, photos, links, videos and more. (Unique Users)","Lifetime: The number of people who had your Page's post enter their screen through unpaid distribution. (Unique Users)","Lifetime: The number of people who had your Page's post enter their screen through paid distribution such as an ad. (Unique Users)","Lifetime: The number of times your Page's post entered a person's screen. Posts include statuses, photos, links, videos and more. (Total Count)","Lifetime: The number of times your Page's posts entered a person's screen through unpaid distribution. (Total Count)","Lifetime: The number of times your Page's post entered a person's screen through paid distribution such as an ad. (Total Count)","Lifetime: The number of unique people who engaged in certain ways with your Page post, for example by commenting on, liking, sharing, or clicking upon particular elements of the post. (Unique Users)","Lifetime: The number of people who matched the audience targeting that clicked anywhere in your post on News Feed. (Unique Users)","Lifetime: The number of clicks anywhere in your post on News Feed from the user that matched the audience targeting on it. (Total Count)","Lifetime: The number of people who have given negative feedback to your post. (Unique Users)","Lifetime: The number of times people have given negative feedback to your post. (Total Count)","Lifetime: The number of impressions of your Page post to people who have liked your Page. (Total Count)","Lifetime: The number of people who saw your Page post because they've liked your Page (Unique Users)","Lifetime: The number of paid impressions of your Page post to people who have liked your Page. (Total Count)","Lifetime: The number of people who like your Page and who saw your Page post in an ad or sponsored story. (Unique Users)","Lifetime: The number of people who have liked your Page and clicked anywhere in your posts. (Unique Users)","Lifetime: Number of times your video was viewed to 95% of its length without any paid promotion. (Unique Users)","Lifetime: Number of times your video was viewed to 95% of its length without any paid promotion. (Total Count)","Lifetime: Number of times your video was viewed to 95% of its length after paid promotion. (Unique Users)","Lifetime: Number of times your video was viewed to 95% of its length after paid promotion. (Total Count)","Lifetime: Number of times your video was viewed for more than 3 seconds without any paid promotion. (Unique Users)","Lifetime: Number of times your video was viewed for more than 3 seconds without any paid promotion. (Total Count)","Lifetime: Number of times your video was viewed more than 3 seconds after paid promotion. (Unique Users)","Lifetime: Number of times your video was viewed more than 3 seconds after paid promotion. (Total Count)","Lifetime: Average time video viewed (Total Count)","Lifetime: Length of a video post (Total Count)","Lifetime: The number of unique people who created a story about your Page post by interacting with it. (Unique Users)",,,"Lifetime: The number of stories created about your Page post, by action type. (Total Count)",,,"Lifetime: The number of people who matched the audience targeting on the post that clicked anywhere in the post on News Feed, by type. (Unique Users)",,,,"Lifetime: The number of clicks anywhere in the post on News Feed from users that matched the audience targeting on the post, by type. (Total Count)",,,,"Lifetime: The number of times people have given negative feedback to your post, by type. (Total Count)",,,"Lifetime: The number of people who have given negative feedback to your post, by type. (Unique Users)",,
130268756992804_2235939173092408,https://www.facebook.com/YaleClimateConnections/posts/2235939173092408,"David may gain an edge on Goliath, but that might not be good news here:",Link,,,"12/31/2018 06:02:02 AM"," ",3259,3259,0,4478,4478,0,138,71,83,6,6,3970,2792,0,0,124,0,0,0,0,0,0,0,0,0,0,10,84,,10,84,,27,50,,,33,50,,,6,,,6,,
130268756992804_2231245666895092,https://www.facebook.com/YaleClimateConnections/posts/2231245666895092,"Each day, this art exhibit begins as a vivid encounter with a coral reef. But, things change when you look closer and wait:",Link,,,"12/28/2018 06:01:42 AM"," ",3221,3221,0,4611,4611,0,138,63,78,6,7,3542,2511,0,0,76,0,0,0,0,0,0,0,0,0,0,12,108,4,12,110,5,47,17,,,61,17,,,7,,,6,,
130268756992804_2229809097038749,https://www.facebook.com/YaleClimateConnections/posts/2229809097038749,"This pension is an investment in everybody’s future:",Link,,,"12/27/2018 06:00:27 AM"," ",31712,8815,23065,44894,12163,32731,5282,310,380,14,15,5012,3510,4,4,234,0,0,0,0,0,0,0,0,0,0,420,4827,75,430,4940,117,176,141,1,,235,144,1,,12,2,1,11,2,1
130268756992804_2228155143870811,https://www.facebook.com/YaleClimateConnections/posts/2228155143870811,"It might sound gross, but it works:",Link,,,"12/26/2018 06:01:15 AM"," ",40318,15715,25479,53013,21766,31247,4891,599,759,12,12,7750,5389,3,3,391,0,0,0,0,0,0,0,0,0,0,657,4181,197,674,4181,315,268,356,1,,401,357,1,,12,,,12,,
130268756992804_2226719624014363,https://www.facebook.com/YaleClimateConnections/posts/2226719624014363,"The U.S. Green Building Council announces a “net zero” certification for buildings that prevent as much pollution as they cause:",Link,,,"12/25/2018 06:05:27 AM"," ",12512,6821,5803,17610,9229,8381,1725,154,174,6,6,6084,4267,4,3,258,0,0,0,0,0,0,0,0,0,0,144,1599,8,148,1650,9,85,75,,,96,78,,,6,,,6,,
130268756992804_2225102680842724,https://www.facebook.com/YaleClimateConnections/posts/2225102680842724,"Liliana Jaramillo seeks out native drought-resistant plants that could help her city weather the weather:",Link,,,"12/24/2018 06:01:03 AM"," ",15878,9221,6984,21327,12855,8472,2158,324,445,8,10,6747,4399,2,2,406,0,0,0,0,0,0,0,0,0,0,197,1935,32,199,1960,54,206,136,,,307,138,,,10,,,8,,
130268756992804_2219522744734051,https://www.facebook.com/YaleClimateConnections/posts/2219522744734051,"Communities across California are still dealing with the aftermath of this year’s record-breaking wildfires. Here’s how climate change is making fires more destructive than ever: http://bit.ly/2T5amyH",Video,,,"12/21/2018 11:00:00 AM"," ",35698,8774,26947,45815,11523,34292,1357,639,795,16,16,4299,3365,0,0,166,148,150,758,758,3240,3504,16328,19264,8927,92042,233,601,122,241,643,172,280,20,,377,352,20,,423,13,3,,13,3,
130268756992804_2220422541310738,https://www.facebook.com/YaleClimateConnections/posts/2220422541310738,"When your plane is idling on the runway, it’s not just an annoyance:",Link,,,"12/21/2018 06:00:28 AM"," ",4569,3063,1503,5852,4087,1765,493,105,136,5,5,3464,2591,0,0,130,0,0,0,0,0,0,0,0,0,0,21,420,15,21,420,25,62,44,,,91,45,,,5,,,5,,
130268756992804_2219237318095927,https://www.facebook.com/YaleClimateConnections/posts/2219237318095927,"Feel the heat in 2018?  Here’s why. 

https://www.yaleclimateconnections.org/2018/12/2018-the-hottest-la-nina-year-ever-recorded/",Link,,,"12/20/2018 10:08:27 AM"," ",7163,5593,1742,9545,7429,2116,756,166,212,7,7,4245,3168,1,1,225,0,0,0,0,0,0,0,0,0,0,129,595,22,132,614,50,95,77,,,134,78,,,7,,,7,,
130268756992804_2218958801457112,https://www.facebook.com/YaleClimateConnections/posts/2218958801457112,"New worries about the impacts of climate change on fishing in North Carolina — a billion-dollar industry:",Link,,,"12/20/2018 06:01:01 AM"," ",5886,4061,1711,7615,5510,2105,664,130,180,7,7,4009,2892,2,2,186,0,0,0,0,0,0,0,0,0,0,80,534,31,81,546,48,91,44,,,135,45,,,6,1,,6,1,
130268756992804_2216544901698502,https://www.facebook.com/YaleClimateConnections/posts/2216544901698502,"Even as worldwide demand for coffee has increased, farmers' fortunes have actually declined.

https://www.yaleclimateconnections.org/2018/12/coffee-farmers-adapt-to-climate-change/",Link,,,"12/19/2018 09:00:02 AM"," ",1935,1935,0,2530,2530,0,69,29,35,4,5,2244,1732,0,0,69,0,0,0,0,0,0,0,0,0,0,8,49,,8,50,,15,14,,,20,15,,,5,,,4,,
130268756992804_2217529938266665,https://www.facebook.com/YaleClimateConnections/posts/2217529938266665,"And now for some good news:",Link,,,"12/19/2018 06:01:12 AM"," ",15054,4635,10568,19702,6207,13495,2772,154,176,10,11,3683,2591,2,2,160,0,0,0,0,0,0,0,0,0,0,173,2645,26,178,2684,53,73,82,,,95,81,,,11,,,10,,
130268756992804_2216526948366964,https://www.facebook.com/YaleClimateConnections/posts/2216526948366964,"Some people have honest misunderstandings about climate change. Here's how to weed out the trolls. 

https://www.yaleclimateconnections.org/2018/12/identifying-good-faith-questions-about-climate/",Link,,,"12/18/2018 11:57:53 AM"," ",5645,5135,621,7383,6655,728,401,206,344,6,6,4393,3259,0,0,198,0,0,0,0,0,0,0,0,0,0,57,250,23,58,253,76,136,110,1,,230,113,1,,5,1,,5,1,
130268756992804_2216097895076536,https://www.facebook.com/YaleClimateConnections/posts/2216097895076536,"Troubling signs in recent winters:",Link,,,"12/18/2018 06:00:08 AM"," ",12981,6419,6961,16967,8805,8162,1707,306,425,10,10,4730,3350,3,2,288,0,0,0,0,0,0,0,0,0,0,223,1396,97,232,1433,135,166,151,2,,275,148,2,,8,2,,8,2,
130268756992804_2214645258555133,https://www.facebook.com/YaleClimateConnections/posts/2214645258555133,"You don’t have to quit your day job to make a difference on climate change:",Link,,,"12/17/2018 06:00:36 AM"," ",5845,3726,2202,7965,5173,2792,608,235,283,5,5,3892,2678,2,2,188,0,0,0,0,0,0,0,0,0,0,52,402,21,56,408,39,62,187,,,93,190,,,5,,,5,,
130268756992804_2203749519644707,https://www.facebook.com/YaleClimateConnections/posts/2203749519644707,"This has been a big year for books about climate change. Take a look at these 12. https://www.yaleclimateconnections.org/2018/12/climate-books-as-holiday-gifts/",Link,,,"12/14/2018 08:30:00 AM"," ",3920,2843,1063,5372,3879,1493,309,93,113,14,15,3061,2228,0,0,100,0,0,0,0,0,0,0,0,0,0,35,235,5,36,239,5,35,67,,,43,70,,,12,3,,11,3,
130268756992804_2210030195683306,https://www.facebook.com/YaleClimateConnections/posts/2210030195683306,"This LA nonprofit has created a blueprint that they hope can help cities everywhere to protect low-income communities from pollution:",Link,,,"12/14/2018 06:00:13 AM"," ",1995,1995,0,2808,2808,0,90,46,63,8,9,2600,1850,0,0,87,0,0,0,0,0,0,0,0,0,0,4,58,2,4,58,2,31,19,,,44,19,,,8,1,,7,1,
130268756992804_2207496765936649,https://www.facebook.com/YaleClimateConnections/posts/2207496765936649,"To convert the grid to renewable energy, we'll need a way to store it.

https://www.yaleclimateconnections.org/2018/12/energy-storage-options-for-renewables/",Link,,,"12/13/2018 09:00:00 AM"," ",13305,6145,7405,17275,8074,9201,1489,398,479,9,9,4252,3201,2,2,256,0,0,0,0,0,0,0,0,0,0,227,1168,51,233,1215,92,113,309,3,,157,319,3,,9,,,9,,
130268756992804_2208442432508749,https://www.facebook.com/YaleClimateConnections/posts/2208442432508749,"A Department of Energy study found that homes with solar panels sold for, on average, about $15,000 more than similar homes without solar.",Link,,,"12/13/2018 06:00:37 AM"," ",10430,4754,6055,13788,6359,7429,1307,173,220,7,7,3571,2470,0,0,177,0,0,0,0,0,0,0,0,0,0,143,1141,26,144,1178,40,88,88,,,131,89,,,6,1,,6,1,
130268756992804_2206977755988550,https://www.facebook.com/YaleClimateConnections/posts/2206977755988550,"“If you see ecological injustice, for goodness’ sakes, speak out.” — George Pakenham",Link,,,"12/12/2018 06:00:07 AM"," ",10242,4514,5967,13201,6350,6851,1177,260,342,10,13,3742,2563,2,2,173,0,0,0,0,0,0,0,0,0,0,81,958,56,85,983,85,113,166,,,179,163,,,13,,,10,,
130268756992804_2205853639434295,https://www.facebook.com/YaleClimateConnections/posts/2205853639434295,"Climate/health care look-alike challenge: How will Congress handle?

https://www.yaleclimateconnections.org/2018/12/congress-to-confront-climate-change-health-care-nexus/",Link,,,"12/11/2018 12:50:00 PM"," ",2001,2001,0,2586,2586,0,63,40,54,4,4,2359,1794,0,0,56,0,0,0,0,0,0,0,0,0,0,5,35,3,5,36,3,26,18,,,35,19,,,4,,,4,,
130268756992804_2205339816152344,https://www.facebook.com/YaleClimateConnections/posts/2205339816152344,"There’s a hidden cost to giant e-commerce warehouses, and low-income areas end up paying it:",Link,,,"12/11/2018 06:00:03 AM"," ",2566,2566,0,3431,3431,0,124,69,115,6,6,3081,2288,0,0,116,0,0,0,0,0,0,0,0,0,0,13,60,4,13,60,10,32,42,,,72,43,,,6,,,6,,
130268756992804_2203746732978319,https://www.facebook.com/YaleClimateConnections/posts/2203746732978319,"No one is completely immune. https://www.yaleclimateconnections.org/2018/12/will-climate-change-make-us-sick/",Link,,,"12/10/2018 08:30:01 AM"," ",3666,3666,0,4901,4901,0,192,107,153,8,8,4047,3036,0,0,158,0,0,0,0,0,0,0,0,0,0,23,99,16,23,101,21,69,46,,,105,48,,,8,,,8,,
130268756992804_2203626736323652,https://www.facebook.com/YaleClimateConnections/posts/2203626736323652,"“This is a way of resiliency that comes from our own people, from our own traditions,” says Andrea Carmen of the International Indian Treaty Council.",Link,,,"12/10/2018 06:00:33 AM"," ",33415,12085,22152,41698,16173,25525,4991,393,447,13,13,4577,3216,4,3,262,0,0,0,0,0,0,0,0,0,0,724,4664,61,745,4759,105,196,206,,,244,203,,,13,,,13,,
130268756992804_2198967623456230,https://www.facebook.com/YaleClimateConnections/posts/2198967623456230,"Mom power:",Link,,,"12/07/2018 06:00:46 AM"," ",9681,4425,5604,13171,6170,7001,1686,118,152,8,8,3882,2704,5,4,173,0,0,0,0,0,0,0,0,0,0,105,1601,13,107,1624,25,70,50,1,,102,49,1,,7,1,,7,1,
130268756992804_2197365780283081,https://www.facebook.com/YaleClimateConnections/posts/2197365780283081,"“When you talk to scientists — and climate scientists in particular — they’re not arguing about whether it’s happening or not.” — Eric Pyle",Link,,,"12/06/2018 06:00:07 AM"," ",34142,15088,19268,44430,20081,24349,5365,527,782,23,24,6183,4307,2,2,449,0,0,0,0,0,0,0,0,0,0,584,4734,149,594,4743,302,343,188,,,596,186,,,21,3,,20,3,
130268756992804_2195762757110050,https://www.facebook.com/YaleClimateConnections/posts/2195762757110050,"Today is World Soil Day, a time to celebrate one of the world’s greatest carbon sinks:",Link,,,"12/05/2018 06:00:05 AM"," ",5824,4235,1652,7698,5626,2072,616,116,142,11,12,3815,2784,1,1,171,0,0,0,0,0,0,0,0,0,0,58,535,6,58,550,6,72,49,,,90,52,,,9,3,,8,3,
130268756992804_2194273347258991,https://www.facebook.com/YaleClimateConnections/posts/2194273347258991,"Mayor Serge Dedina’s city is already experiencing the effects of sea-level rise. “We’re not going to take this lying down. We think that those who cause climate change should pay up,” he says.",Link,,,"12/04/2018 06:00:08 AM"," ",15920,9249,7789,21972,12926,9046,2587,904,1313,7,7,7094,4902,5,5,693,0,0,0,0,0,0,0,0,0,0,334,1907,93,348,1945,372,312,651,,,645,668,,,7,,,7,,
130268756992804_2192811590738500,https://www.facebook.com/YaleClimateConnections/posts/2192811590738500,"“Our job is to bring light into the dark time,” says Rabbi Arthur Waskow.",Link,,,"12/03/2018 06:00:15 AM"," ",21493,7209,14841,26081,9406,16675,3720,286,348,15,16,4239,3063,4,4,264,0,0,0,0,0,0,0,0,0,0,294,3532,35,301,3622,81,144,149,,,201,147,,,15,1,,14,1,
130268756992804_2188363107850015,https://www.facebook.com/YaleClimateConnections/posts/2188363107850015,"Latinos are often underrepresented in the environmental movement. Colomba Sainz is working to change that.",Link,,,"11/30/2018 06:01:38 AM"," ",26465,6428,20208,32293,8099,24194,4487,235,279,12,12,3443,2605,2,2,234,0,0,0,0,0,0,0,0,0,0,307,4267,51,317,4377,98,122,117,,,160,119,,,10,2,,10,2,
130268756992804_2186886951330964,https://www.facebook.com/YaleClimateConnections/posts/2186886951330964,"Against rising seas and increasingly intense storms, a community stands together.",Link,,,"11/29/2018 06:00:49 AM"," ",6573,2900,3566,7907,3767,4140,886,142,165,13,13,2909,2294,1,1,139,0,0,0,0,0,0,0,0,0,0,54,779,18,55,781,33,52,98,,,66,99,,,11,2,,11,2,
130268756992804_2185307854822207,https://www.facebook.com/YaleClimateConnections/posts/2185307854822207,"Footage from one of the world’s top cycling events shows climate change happening right before our eyes:",Link,,,"11/28/2018 06:00:16 AM"," ",32113,12400,19921,38694,16257,22437,4046,2784,2980,18,21,6047,4616,3,3,699,0,0,0,0,0,0,0,0,0,0,436,1615,57,447,1682,85,285,2542,,,401,2579,,,16,5,,15,3,
130268756992804_2183745048311821,https://www.facebook.com/YaleClimateConnections/posts/2183745048311821,"In a warmer Arctic, more shipping/more risks ... https://www.yaleclimateconnections.org/2018/11/more-arctic-shipping-more-risks-to-sea-mammals/",Link,,,"11/27/2018 06:12:57 AM"," ",2270,2270,0,2843,2843,0,127,36,43,5,6,2534,2060,0,0,119,0,0,0,0,0,0,0,0,0,0,9,100,2,9,103,3,16,20,,,23,20,,,6,,,5,,
130268756992804_2183731901646469,https://www.facebook.com/YaleClimateConnections/posts/2183731901646469,"In Connecticut, low-income homeowners install solar at the same rates as homeowners with higher incomes. Find out why:",Link,,,"11/27/2018 06:00:34 AM"," ",10079,6298,3802,12162,7815,4347,1140,225,291,7,8,3510,2811,2,2,233,0,0,0,0,0,0,0,0,0,0,126,977,15,126,1015,19,138,105,,,182,109,,,6,2,,5,2,
130268756992804_2182282828458043,https://www.facebook.com/YaleClimateConnections/posts/2182282828458043,"“We can't get away with saying that humans are not responsible for the carbon that's been added to the atmosphere. The isotopes don't lie and they show it.” - James Powell of the National Physical Sciences Consortium",Link,,,"11/26/2018 06:00:47 AM"," ",65513,43993,19592,82382,59169,23213,6679,1847,3056,41,45,10875,8043,4,4,1127,0,0,0,0,0,0,0,0,0,0,1619,4714,372,1707,4871,1109,1349,612,4,,2419,633,4,,37,8,,35,8,
130268756992804_2177753235577669,https://www.facebook.com/YaleClimateConnections/posts/2177753235577669,"Carlos Zegarra says environmental groups have often failed to include Latinos in climate action. Now he’s changing that.",Link,,,"11/23/2018 06:01:45 AM"," ",3019,3019,0,3893,3893,0,155,71,81,11,11,3487,2711,0,0,144,0,0,0,0,0,0,0,0,0,0,15,107,4,15,109,5,52,20,,,61,20,,,11,,,11,,
130268756992804_2176270532392606,https://www.facebook.com/YaleClimateConnections/posts/2176270532392606,"Can fiction help people understand climate change?",Link,,,"11/22/2018 06:05:13 AM"," ",12833,4946,8123,16236,6182,10054,1539,194,287,7,7,3671,2917,4,4,143,0,0,0,0,0,0,0,0,0,0,129,1345,68,134,1385,120,88,114,,,169,118,,,6,1,,6,1,
130268756992804_2174818909204435,https://www.facebook.com/YaleClimateConnections/posts/2174818909204435,"Whether or not you like their Swedish meatballs, you’ll probably like Ikea’s new delivery fleet:",Link,,,"11/21/2018 06:02:04 AM"," ",28250,9716,18683,33842,12257,21585,3023,387,491,13,13,3492,2700,3,2,166,0,0,0,0,0,0,0,0,0,0,159,2645,63,167,2645,121,243,156,,,334,157,,,10,3,,10,3,
130268756992804_2172027619483564,https://www.facebook.com/YaleClimateConnections/posts/2172027619483564,"Tired of sleepless nights spent arguing on the internet? This one’s for you ... https://www.yaleclimateconnections.org/2018/11/focus-on-those-with-an-open-mind/",Link,,,"11/19/2018 08:30:00 AM"," ",2757,2757,0,3638,3638,0,151,110,255,8,9,2802,2196,0,0,128,0,0,0,0,0,0,0,0,0,0,18,68,9,19,70,45,71,52,,,205,51,,,8,1,,7,1,
130268756992804_2172049476148045,https://www.facebook.com/YaleClimateConnections/posts/2172049476148045,"“These things are now things a lot of scientists talk about and they're examining and they’re studying, but we didn't need all that…we live on the land!” — Queen Quet Marquetta Goodwine",Link,,,"11/19/2018 06:02:34 AM"," ",2147,2147,0,2822,2822,0,100,57,94,7,9,2423,1808,0,0,95,0,0,0,0,0,0,0,0,0,0,11,53,2,11,56,2,30,33,,,60,34,,,6,3,,5,2,
130268756992804_2167456959940630,https://www.facebook.com/YaleClimateConnections/posts/2167456959940630,"In her new book, Trebbe Johnson accounts for climate change, fracking, mountaintop mining, and pollution, and asks “How do we live with this?”",Link,,,"11/16/2018 06:01:21 AM"," ",3720,3720,0,4936,4936,0,218,101,152,10,10,4043,2984,0,0,183,0,0,0,0,0,0,0,0,0,0,29,123,7,34,124,8,63,43,,,108,44,,,10,,,10,,
130268756992804_2166039276749065,https://www.facebook.com/YaleClimateConnections/posts/2166039276749065,"Doctors have figured out better ways to break bad news to patients. People who care about climate change can learn a lot from them.",Link,,,"11/15/2018 06:26:15 AM"," ",4332,4332,0,5920,5920,0,320,238,313,9,10,4574,3360,0,0,260,0,0,0,0,0,0,0,0,0,0,35,120,11,39,121,12,89,171,,,135,178,,,8,2,,7,2,
130268756992804_2166023153417344,https://www.facebook.com/YaleClimateConnections/posts/2166023153417344,"U.S. and Mexican residents are increasingly turning to groundwater sources along the border, but no one knows how much water is left.",Link,,,"11/15/2018 06:00:19 AM"," ",3648,3648,0,5035,5035,0,228,132,187,7,8,4120,2959,0,0,209,0,0,0,0,0,0,0,0,0,0,31,113,15,32,117,19,92,46,,,141,46,,,8,,,7,,
130268756992804_2164777673541892,https://www.facebook.com/YaleClimateConnections/posts/2164777673541892,"In his first column for us, Dana Nuccitelli writes about global warming/California wildfires connections. https://www.yaleclimateconnections.org/2018/11/the-many-ways-climate-change-worsens-california-wildfires/",Link,,,"11/14/2018 09:00:02 AM"," ",6546,6546,0,8488,8488,0,402,225,354,5,6,5204,4053,0,0,270,0,0,0,0,0,0,0,0,0,0,93,224,23,94,237,33,160,87,,,264,90,,,6,,,5,,
130268756992804_2164640150222311,https://www.facebook.com/YaleClimateConnections/posts/2164640150222311,"Now retired, Allen Hubbard devotes his time to climate action with Citizens’ Climate Lobby.",Link,,,"11/14/2018 06:00:43 AM"," ",3309,3309,0,4451,4451,0,228,109,161,8,9,3728,2715,0,0,195,0,0,0,0,0,0,0,0,0,0,21,157,7,23,162,8,83,32,1,,128,32,1,,7,2,,6,2,
130268756992804_2163507833668876,https://www.facebook.com/YaleClimateConnections/posts/2163507833668876,"Dam good to hear it. https://www.yaleclimateconnections.org/2018/11/beavers-can-help-combat-global-warming/",Link,,,"11/13/2018 11:00:01 AM"," ",9595,9595,0,13021,13021,0,792,352,482,11,11,6122,4382,0,0,529,0,0,0,0,0,0,0,0,0,0,134,587,30,136,612,33,228,155,,,329,153,,,10,1,,10,1,
130268756992804_2163232317029761,https://www.facebook.com/YaleClimateConnections/posts/2163232317029761,"This past summer, Faith Ward helped lead a climate change march through her hometown of Ft. Lauderdale.",Link,,,"11/13/2018 06:00:43 AM"," ",2497,2497,0,3609,3609,0,138,49,78,10,10,3146,2181,0,0,127,0,0,0,0,0,0,0,0,0,0,11,110,2,11,110,2,31,20,,,57,21,,,10,,,10,,
130268756992804_2161900413829618,https://www.facebook.com/YaleClimateConnections/posts/2161900413829618,"The Navy is responding to climate change.",Link,,,"11/12/2018 06:00:42 AM"," ",9642,9642,0,13079,13079,0,940,443,735,13,13,8322,5879,0,0,795,0,0,0,0,0,0,0,0,0,0,179,617,25,180,636,28,303,167,,,561,174,,,11,2,,11,2,
130268756992804_2157511514268508,https://www.facebook.com/YaleClimateConnections/posts/2157511514268508,"Telling the story of climate change through data visualization and wall art:",Link,,,"11/09/2018 06:02:05 AM"," ",7995,7995,0,11584,11584,0,571,252,359,11,12,6118,4235,0,0,330,0,0,0,0,0,0,0,0,0,0,84,404,29,85,414,34,169,113,,,241,118,,,11,1,,10,1,
130268756992804_2156056811080645,https://www.facebook.com/YaleClimateConnections/posts/2156056811080645,"Bike sharing is taking U.S. cities by storm. Now, some are taking it a step further:",Link,,,"11/08/2018 06:00:59 AM"," ",2335,2335,0,3241,3241,0,91,55,61,6,6,2926,2101,0,0,76,0,0,0,0,0,0,0,0,0,0,8,48,,8,50,,22,33,,,28,33,,,6,,,6,,
