YCC,YCC Pub Date,      ,YCC Categories,Ad Name,Ad set,Campaign,Link,Amount Spent (USD),Ad ID,Reach,Post Engagement,Post Shares,Landing Page Views,Cost/Engagement,Cost/Share,Cost/LPV,Relevance Score,Engagements per 1k reached,Landing Page Views per 1k reach,FB Copy,FB Title,FB post link,End Date
Not in database,n/a,n/a,n/a,"2017-01-26 Yale Climate Connections -- Do we live in a world of ""alternative facts""? Climate ...",#N/A,#N/A,https://www.facebook.com/YaleClimateConnections/videos/1404191159600551/,"$1,007.11",6063609293094,"409,916","413,443","12,023",,$0.0024,$0.084,#DIV/0!,,1008.604,0,"Do we live in a world of ""alternative facts""? Climate scientists stand up and speak out about what's actually happening on our shared planet. #climatechange #globalwarming 

Learn more at: http://www.yaleclimateconnections.org",Stand Up for Science,https://www.facebook.com/YaleClimateConnections/videos/1404191159600551/,2/16/2017
Not in database,n/a,n/a,n/a,"2018-03-21 Yale Climate Connections -- Are you dealing with the snow today, even through spri...",#N/A,#N/A,https://www.facebook.com/YaleClimateConnections/videos/1835782939774702/,$287.26,6086259014294,"103,641","106,788",629,20,$0.0027,$0.457,$14.36,,1030.364,0,"Are you dealing with the snow today, even through spring has sprung? Global warming may play a role: http://bit.ly/2CJD2ES",Global Warming and Snow,https://www.facebook.com/YaleClimateConnections/videos/1835782939774702/,4/4/2018
Not in database,n/a,n/a,n/a,2018-04-02 Yale Climate Connections -- More poisonous poison ivy? We may have climate change ...,#N/A,#N/A,https://www.facebook.com/YaleClimateConnections/videos/1849191185100544/,$191.61,6086998588294,"71,582","58,243",619,,$0.0033,$0.310,#DIV/0!,,813.654,0,More poisonous poison ivy? We may have climate change to thank for that.,Poison Ivy and Climate Change,https://www.facebook.com/YaleClimateConnections/videos/1849191185100544/,5/4/2018
Not in database,n/a,n/a,n/a,2018-05-07 Yale Climate Connections -- Melting Arctic sea ice is having an impact far beyond ...,#N/A,#N/A,https://www.facebook.com/YaleClimateConnections/videos/1886491828037146/,$255.92,6089849986094,"91,553","77,379",982,13,$0.0033,$0.261,$19.69,,845.183,0,Melting Arctic sea ice is having an impact far beyond the poles: https://bit.ly/2KFiItk,Arctic ice melt and California droughts,https://www.facebook.com/YaleClimateConnections/videos/1886491828037146/,6/4/2018
Not in database,n/a,n/a,n/a,"2018-04-15 Yale Climate Connections -- This family farm is rethinking waste, and powering all...",#N/A,#N/A,https://www.facebook.com/YaleClimateConnections/videos/1863061187046877/,$231.30,6087810256294,"78,494","66,798",656,39,$0.0035,$0.353,$5.93,,850.995,0,"This family farm is rethinking waste, and powering all its operations with manure. https://bit.ly/2rOv8tx",Manure Powers the Whole Farm,https://www.facebook.com/YaleClimateConnections/videos/1863061187046877/,5/4/2018
Not in database,n/a,n/a,n/a,2018-04-27 Yale Climate Connections -- More evidence that air pollution from coal plants is a...,#N/A,#N/A,https://www.facebook.com/YaleClimateConnections/videos/1871206439565685/,$267.79,6089238999494,"73,583","68,624",766,11,$0.0039,$0.350,$24.34,,932.607,0,More evidence that air pollution from coal plants is a public health hazard with serious implications for children's health: https://bit.ly/2GyfpSj,Air pollution and children's health,https://www.facebook.com/YaleClimateConnections/videos/1871206439565685/,5/4/2018
Not in database,n/a,n/a,n/a,"2018-03-02 Yale Climate Connections -- If global warming is real, why is it snowing? Meteorol...",#N/A,#N/A,https://www.facebook.com/YaleClimateConnections/videos/1809829429036720/,$255.52,6085068715094,"63,919","64,662",629,32,$0.0040,$0.406,$7.99,,1011.624,1,"If global warming is real, why is it snowing? Meteorologist Dr. Marshall Shepherd has a response for questions like these: http://bit.ly/2CJD2ES",Global Warming and Snow,https://www.facebook.com/YaleClimateConnections/videos/1809829429036720/,4/4/2018
Not in database,n/a,n/a,n/a,2018-03-30 Yale Climate Connections -- This sunny Hawaiian island can power itself completely...,#N/A,#N/A,https://www.facebook.com/YaleClimateConnections/videos/1845636062122723/,$255.57,6086851032294,"84,864","59,418",637,11,$0.0043,$0.401,$23.23,,700.156,0,This sunny Hawaiian island can power itself completely using solar energy. https://bit.ly/2rOv8tx,This Hawaiian Island is Now a Solar Paradise,https://www.facebook.com/YaleClimateConnections/videos/1845636062122723/,4/4/2018
Not in database,n/a,n/a,n/a,2018-04-23 Yale Climate Connections -- Rooftops are getting a makeover – see how rooftop gard...,#N/A,#N/A,https://www.facebook.com/YaleClimateConnections/videos/1871201932899469/,$158.63,6088717398694,"45,983","34,198",214,6,$0.0046,$0.741,$26.44,,743.710,0,Rooftops are getting a makeover – see how rooftop gardens are changing the look and feel of cities like Denver: https://bit.ly/2G4Ql5i,Rooftop Gardens,https://www.facebook.com/YaleClimateConnections/videos/1871201932899469/,5/4/2018
Not in database,n/a,n/a,n/a,"2018-03-06 Yale Climate Connections -- Henry David Thoreau created a ""gold mine"" for climate ...",#N/A,#N/A,https://www.facebook.com/YaleClimateConnections/videos/1818250464861283/,$250.51,6085279128094,"46,444","52,442",598,40,$0.0048,$0.419,$6.26,,1129.145,1,"Henry David Thoreau created a ""gold mine"" for climate change researchers during his time at Walden Pond, according to Richard Primack of Boston University:
https://www.yaleclimateconnections.org/2016/11/thoreaus-surprising-climate-legacy/",Thoreau's Surprising Climate Legacy,https://www.facebook.com/YaleClimateConnections/videos/1818250464861283/,4/4/2018
AME church calls for climate action,11/14/2016,"African Methodist Episcopal Church, climate and religion, episcopalian, Sara Peach",Faith & Ethics,2016-11-14 Yale Climate Connections -- One of the oldest and largest black churches in Americ...,#N/A,#N/A,http://www.yaleclimateconnections.org/2016/11/african-methodist-episcopal-church-calls-for-climate-action/,$125.21,6059849729894,"22,152","2,922",273,,$0.0429,$0.459,#DIV/0!,,131.907,0,One of the oldest and largest black churches in America has taken a stand against #climatechange.  Listen in to hear how the African Methodist Episcopal Church integrates climate change into its teachings.,AME Church Calls for Climate Action ,https://www.facebook.com/130268756992804/posts/1321215384564796/,12/4/2016
Not in database,n/a,n/a,n/a,2018-05-25 Yale Climate Connections -- With the warmer weather comes a return to yard work. H...,#N/A,#N/A,https://www.facebook.com/YaleClimateConnections/videos/1905418516144477/,$188.83,6091021767894,"38,440","32,725",162,9,$0.0058,$1.166,$20.98,,851.327,0,With the warmer weather comes a return to yard work. How climate friendly is your landscaping routine? https://bit.ly/2IFD3S7,Climate Friendly Landscaping,https://www.facebook.com/YaleClimateConnections/videos/1905418516144477/,6/4/2018
Global warming: A family affair,3/20/2017,"Sara Peach, sustainability",Sustainability,2017-03-20 Yale Climate Connections -- Has climate change ever made you feel afraid for your ...,#N/A,#N/A,http://www.yaleclimateconnections.org/2017/03/global-warming-a-family-affair/,$60.88,6066473711894,"19,499","2,058",281,,$0.0296,$0.217,#DIV/0!,,105.544,0,Has climate change ever made you feel afraid for your children? A new group called Conceivable Future sparks discussion on how rising temperatures will affect the next generation.,Global warming: A family affair ,https://www.facebook.com/130268756992804/posts/1453612741325059/,4/4/2017
Indoor CO2: Dumb and dumber?,7/27/2016,"CO2, Daniel Grossman, indoor air, public health","Feature Article, Public Health",What if high levels of carbon dioxide indoors impair humans' decisionmaking s...,#N/A,#N/A,http://www.yaleclimateconnections.org/2016/07/indoor-co2-dumb-and-dumber/,$30.77,6054040685094,"6,682",449,82,,$0.0685,$0.375,#DIV/0!,,67.195,0,What if high levels of carbon dioxide indoors impair humans' decisionmaking skills ... ?,Indoor CO2: Dumb and dumber? - Yale Climate Connections,https://www.facebook.com/130268756992804/posts/1223818017637867/,9/4/2016
How climate change could hurt bald eagles,7/4/18 7:00,Samantha Harrington,Species &amp; Ecosystems,2018-07-04 Yale Climate Connections -- Climate change is making the USA a less ideal habitat ...,#N/A,#N/A,https://www.yaleclimateconnections.org/2018/07/how-climate-change-could-hurt-bald-eagles/,$225.29,6093817003894,"27,193","5,397",717,109,$0.0417,$0.314,$2.07,6,198.470,4,Climate change is making the USA a less ideal habitat for our national bird.,How climate change could hurt bald eagles,https://www.facebook.com/130268756992804/posts/1960643043955357/,8/4/2018
Climate change: unwelcome guest in Galapagos,9/12/2016,"Bud Ward, Galapagos","Ecosystems, Feature Article",Some of the exotic species in The Galapagos Archipelago are facing population...,#N/A,#N/A,http://www.yaleclimateconnections.org/2016/09/climate-change-unwelcome-guest-in-galapagos/,$28.99,6056393671694,"6,114",603,78,,$0.0481,$0.372,#DIV/0!,,98.626,0,"Some of the exotic species in The Galapagos Archipelago are facing population declines and other challenges as a result of a warming atmosphere, ocean acidification, and other stressors. 

Learn more ...",Climate change: unwelcome guest in Galapagos - Yale Climate Connections,https://www.facebook.com/130268756992804/posts/1264708710215464/,10/4/2016
Not in database,n/a,n/a,n/a,2018-08-03 Yale Climate Connections -- Male loggerhead turtle hatchlings are in hot sand – li...,#N/A,#N/A,https://www.facebook.com/YaleClimateConnections/videos/2007222239297437/,$274.71,6095837860294,"52,816","42,764",368,9,$0.0064,$0.746,$30.52,7,809.679,0,Male loggerhead turtle hatchlings are in hot sand – literally. Rising temperatures are decreasing the odds that turtle eggs will be male: https://bit.ly/2kkP1C5,Sea turtles hatch female,https://www.facebook.com/YaleClimateConnections/videos/2007222239297437/,9/4/2018
Not in database,n/a,n/a,n/a,2018-04-06 Yale Climate Connections -- Clean energy and energy efficiency jobs are growing fa...,#N/A,#N/A,https://www.facebook.com/YaleClimateConnections/videos/1853764387976557/,$169.29,6087282517694,"36,960","26,325",211,6,$0.0064,$0.802,$28.22,,712.256,0,"Clean energy and energy efficiency jobs are growing fast in the Land of 10,000 Lakes. What do you think? http://bit.ly/2FD45UA",Clean energy in Minnesota,https://www.facebook.com/YaleClimateConnections/videos/1853764387976557/,5/4/2018
Not in database,n/a,n/a,n/a,2017-11-22 Yale Climate Connections -- Who says you have to be young to act on climate? http:...,#N/A,#N/A,https://www.facebook.com/YaleClimateConnections/videos/1706758139343850/,$272.77,6080172403094,"40,004","42,374",546,36,$0.0064,$0.500,$7.58,,1059.244,1,Who says you have to be young to act on climate? http://bit.ly/2zYQrvH,Senior Citizens Act on Climate,https://www.facebook.com/YaleClimateConnections/videos/1706758139343850/,12/4/2017
Not in database,n/a,n/a,n/a,"2018-02-27 Yale Climate Connections -- This year's Winter Olympics may have ended, but climat...",#N/A,#N/A,https://www.facebook.com/YaleClimateConnections/videos/1808644952488501/,$219.61,6084841698694,"35,605","28,418",250,2,$0.0077,$0.878,$109.81,,798.146,0,"This year's Winter Olympics may have ended, but climate change poses a threat to future Games: http://bit.ly/2EM8Kaa",Climate change threatens the Winter Olympics,https://www.facebook.com/YaleClimateConnections/videos/1808644952488501/,3/4/2018
Not in database,n/a,n/a,n/a,2018-06-30 Yale Climate Connections -- The Everglades are a crucial wetland in South Florida....,#N/A,#N/A,https://www.facebook.com/YaleClimateConnections/videos/1952692014750460/,$583.70,6093518185694,"73,999","66,124",399,9,$0.0088,$1.463,$64.86,5,893.580,0,The Everglades are a crucial wetland in South Florida. Are restoration managers accounting for all of the threats this key ecosystem is facing? https://bit.ly/2IeLvHC,Sea Level Rise and the Everglades,https://www.facebook.com/YaleClimateConnections/videos/1952692014750460/,7/4/2018
Not in database,n/a,n/a,n/a,"2019-02-15 Yale Climate Connections -- Greta Thunberg, a 16-year-old Swede, makes a moving pl...",#N/A,#N/A,https://www.facebook.com/YaleClimateConnections/videos/2221505744765578/,$270.50,6109851436494,"36,017","28,770",227,,$0.0094,$1.192,#DIV/0!,7,798.789,0,"Greta Thunberg, a 16-year-old Swede, makes a moving plea for climate action, and scientists explain the rationale for it.",A Swedish Teenager's Compelling Plea on Climate,https://www.facebook.com/130268756992804/posts/2305035679516090/,3/4/2019
Not in database,n/a,n/a,n/a,2016-12-27 Yale Climate Connections -- From Thomson Reuters - Hopeful news for the air travel...,#N/A,#N/A,http://sustainability.thomsonreuters.com/2016/12/08/solar-impulse-founder-sees-electric-passenger-plane-in-10-years/,$24.91,6062082709094,"7,190",641,63,,$0.0389,$0.395,#DIV/0!,,89.152,0,From Thomson Reuters - Hopeful news for the air travel industry which currently emits about 2 percent of global warming pollution worldwide.,Solar Impulse founder sees electric passenger plane in 10 years | | Thomson Reuters,https://www.facebook.com/130268756992804/posts/1364246150261719/,1/4/2017
Advancing renewable energy storage,8/12/2016,"Diana Madson, energy storage",Energy,How do you get solar energy at night or wind power on a still day? These rene...,#N/A,#N/A,http://www.yaleclimateconnections.org/2016/08/michigan-team-advancing-renewable-energy-storage/,$12.15,6054756376294,"1,863",278,39,,$0.0437,$0.312,#DIV/0!,,149.222,0,How do you get solar energy at night or wind power on a still day? These renewable energy sources are not available on demand . . . but they soon could be. Hear about cutting edge research in energy storage on today's episode.,Advancing renewable energy storage,https://www.facebook.com/130268756992804/posts/1234533006566368/,9/4/2016
Netherlands moving to ban diesel cars,8/11/2016,"ban diesel cars, Diana Madson, electric cars, Jan Vos, The Netherlands","Energy, Policy",The Netherlands is making moves to green all vehicles by 2025. Hear more abou...,#N/A,#N/A,http://www.yaleclimateconnections.org/2016/08/netherlands-moving-to-ban-diesel-and-gas-cars/,$30.50,6054693247494,"5,304",826,119,,$0.0369,$0.256,#DIV/0!,,155.732,0,The Netherlands is making moves to green all vehicles by 2025. Hear more about the plan to make it happen on today's episode.,Netherlands moving to ban diesel and gas cars,https://www.facebook.com/130268756992804/posts/1233931553293180/,9/4/2016
Wildfires turn forests into sci-fi scenes,9/10/18 7:00,Sarah Kennedy,Species &amp; Ecosystems,"2018-09-10 Yale Climate Connections -- A recent study found that over the past 30 years, the ...",#N/A,#N/A,https://www.yaleclimateconnections.org/2018/09/wildfires-turn-forests-into-sci-fi-scenes/,$113.94,6098384881494,"16,984","3,080",364,179,$0.0370,$0.313,$0.64,8,181.347,11,"A recent study found that over the past 30 years, the area burned in western wildfires is almost twice as large as it would have been without the influence of climate change.",Colorado wildfires are turning forests into sci-fi scenes,https://www.facebook.com/130268756992804/posts/2070438889642438/,10/4/2018
Not in database,n/a,n/a,n/a,2019-03-19 Yale Climate Connections -- A low-tech practice that could help farmers earn extra...,#N/A,#N/A,https://bit.ly/2F6jwXm,$228.62,6112178442694,"27,394","7,011",906,917,$0.0326,$0.252,$0.25,10,255.932,33,A low-tech practice that could help farmers earn extra income and adapt to climate change:,Why some farmers are planting trees alongside their crops,https://www.facebook.com/130268756992804/posts/2354271941259130/,4/4/2019
How family size shapes your carbon footprint,3/29/19 7:05,Craig K. Chandler,"Feature Article, Religion &amp; Morality","2019-03-12 Yale Climate Connections -- Springtime is getting strange. But weirdly enough, thi...",#N/A,#N/A,https://www.yaleclimateconnections.org/2019/03/how-will-global-warming-change-springtime/,$19.73,6111680921094,"1,904",425,37,52,$0.0464,$0.533,$0.38,5,223.214,27,"Springtime is getting strange. But weirdly enough, this piece of classical music can help you understand how the season is changing.",Climate change is making springtime weird. Vivaldi’s music can show you how.,https://www.facebook.com/130268756992804/posts/2344207505598907/,4/4/2019
Website hosts children's climate discussions,6/21/18 7:00,Sara Peach,Youth,2018-06-21 Yale Climate Connections -- It’s important for kids to connect with other young pe...,#N/A,#N/A,https://www.yaleclimateconnections.org/2018/06/website-hosts-childrens-climate-discussions/,$67.02,6092858057694,"10,720","1,425",133,17,$0.0470,$0.504,$3.94,7,132.929,2,"It’s important for kids to connect with other young people on the topic of climate change, says this elementary school teacher.","At this website, children are talking about how to slow climate change",https://www.facebook.com/130268756992804/posts/1939546146065047/,7/4/2018
Not in database,n/a,n/a,n/a,2018-12-22 Yale Climate Connections -- Communities across California are still dealing with t...,#N/A,#N/A,https://www.facebook.com/YaleClimateConnections/videos/590636484722480/,$212.21,6106012355894,"27,344","19,887",158,8,$0.0107,$1.343,$26.53,7,727.289,0,Communities across California are still dealing with the aftermath of this year’s record-breaking wildfires. Here’s how climate change is making fires more destructive than ever: http://bit.ly/2T5amyH,Climate change and California's fires,https://www.facebook.com/130268756992804/posts/2219522744734051/,1/4/2019
Should a Green New Deal include nuclear power?,4/9/19 14:17,Peter Sinclair,"Energy, Policy &amp; Politics",2019-04-19 Yale Climate Connections -- Cities and towns across the country are responding to ...,#N/A,#N/A,https://www.yaleclimateconnections.org/2019/04/u-s-cities-pledge-to-switch-to-renewables/,$143.90,6114722366294,"14,816","3,284",299,42,$0.0438,$0.481,$3.43,8,221.652,3,Cities and towns across the country are responding to public demand for 100% renewable energy.,More than 100 U.S. cities have pledged to switch to renewable energy,https://www.facebook.com/130268756992804/posts/2403515653001425/,5/4/2019
Zika's link to climate change,6/15/2017,"Eileen Mignoni, public health","Latino Communities, Public Health",2017-06-15 Yale Climate Connections -- Climate change may create the optimal conditions for Z...,#N/A,#N/A,https://www.yaleclimateconnections.org/2017/06/zikas-link-to-climate-change/,$27.33,6070739216694,"11,944","1,522",290,89,$0.0180,$0.094,$0.31,,127.428,7,"Climate change may create the optimal conditions for Zika to spread. Institute of Infection and Global Health, University of Liverpool",Zika’s link to climate change,https://www.facebook.com/130268756992804/posts/1520438821309117/,7/4/2017
U.S. coasts are flooding twice as often,9/24/18 7:00,Sarah Kennedy,Weather Extremes,2018-09-24 Yale Climate Connections -- Coastal communities need to plan for a future with mor...,#N/A,#N/A,https://www.yaleclimateconnections.org/2018/09/u-s-coasts-are-flooding-twice-as-often/,$195.10,6099391925294,"14,104","2,972",424,67,$0.0656,$0.460,$2.91,9,210.720,5,Coastal communities need to plan for a future with more water.,U.S. coasts are flooding twice as often at high tide as they used to,https://www.facebook.com/130268756992804/posts/2088110527875274/,10/4/2018
Not in database,n/a,n/a,n/a,"2019-02-03 Yale Climate Connections -- Through their lending and investment strategies, banks...",#N/A,#N/A,https://www.yaleclimateconnections.org/2019/01/amalgamated-bank-wont-lend-to-fossil-fuel-projects,$89.44,6108899689694,"9,666","1,881",120,120,$0.0475,$0.745,$0.75,9,194.600,12,"Through their lending and investment strategies, banks and customers can help grow a more climate-friendly economy:",This bank won’t lend your money to fossil fuel projects,https://www.facebook.com/130268756992804/posts/2251452754874383/,3/4/2019
"To save corals, study science ... and writing",1/12/2017,"Bud Ward, coral",Oceans,"2017-01-12 Yale Climate Connections -- As global warming threatens coral reefs, Unity College...",#N/A,#N/A,http://www.yaleclimateconnections.org/2017/01/to-save-corals-study-science-and-writing/,$80.02,6062890132494,"21,192","2,292",308,,$0.0349,$0.260,#DIV/0!,,108.154,0,"As global warming threatens coral reefs, Unity College in Maine has developed an innovative marine biology curriculum to prepare its graduates to make a difference.

Coral Reef Alliance  Caribbean Challenge Initiative  Global Island Partnership  National Geographic Ocean","To Save Corals, Study Science … and Writing",https://www.facebook.com/130268756992804/posts/1377535098932824/,2/16/2017
How family size shapes your carbon footprint,3/29/19 7:05,Craig K. Chandler,"Feature Article, Religion &amp; Morality",2019-04-03 Yale Climate Connections -- “We need to construct our streets and our cities for p...,#N/A,#N/A,https://www.yaleclimateconnections.org/2019/04/gop-mayor-turns-city-into-pedestrian-paradise/,$70.37,6113368877494,"9,019","1,882",138,231,$0.0374,$0.510,$0.30,10,208.671,26,“We need to construct our streets and our cities for people. Not for cars.” —Mayor Jim Brainard,A GOP mayor turned his city into a pedestrian paradise,https://www.facebook.com/130268756992804/posts/2377504038935920/,5/4/2019
How the Red Cross uses climate science,7/12/18 7:00,Jan OBrien,Weather Extremes,2018-07-12 Yale Climate Connections -- Climate science is saving lives—here’s one way:,#N/A,#N/A,https://www.yaleclimateconnections.org/2018/07/how-the-red-cross-uses-climate-science/,$132.62,6094347589294,"20,144","2,807",230,83,$0.0472,$0.577,$1.60,7,139.347,4,Climate science is saving lives—here’s one way:,The Red Cross is using climate science to prepare for disasters,https://www.facebook.com/130268756992804/posts/1973649585988036/,8/4/2018
Private Wisconsin co-op goes solar,8/10/2016,"Diana Madson, solar energy",Energy,"A rural, member-owned electric cooperative in Wisconsin is taking steps to in...",#N/A,#N/A,http://www.yaleclimateconnections.org/2016/08/private-wisconsin-co-op-goes-solar/,$26.86,6054646072094,"3,964",618,70,,$0.0435,$0.384,#DIV/0!,,155.903,0,"A rural, member-owned electric cooperative in Wisconsin is taking steps to increase the state's solar capacity. Hear more on today's episode.",Private Wisconsin co-op goes solar ,https://www.facebook.com/130268756992804/posts/1233298656689803/,9/4/2016
This technique could restore part of the Amazon,3/12/18 7:00,Bruce Lieberman,Species &amp; Ecosystems,2018-03-12 Yale Climate Connections -- They’re spreading a mix of seeds from over 200 native ...,#N/A,#N/A,https://www.yaleclimateconnections.org/2018/03/this-technique-could-restore-part-of-the-amazon/,$136.99,6085632099294,"51,210","10,639","1,188",506,$0.0129,$0.115,$0.27,,207.752,10,"They’re spreading a mix of seeds from over 200 native species across 70,000 acres. 🌿🌾🌳",This technique could restore a big chunk of Amazon rainforest ,https://www.facebook.com/130268756992804/posts/1825140037505659/,4/4/2018
Not in database,n/a,n/a,n/a,"2017-07-03 Yale Climate Connections -- According to professor Benjamin Zuckerberg, when even ...",#N/A,#N/A,https://www.yaleclimateconnections.org/2017/07/bird-populations-shift-north-as-climate-changes,$79.19,6071480545894,"38,583","5,954","1,174",412,$0.0133,$0.067,$0.19,,154.317,11,"According to professor Benjamin Zuckerberg, when even a single species is introduced or removed from an ecosystem, it can have a cascading effect.",Birds are moving north in response to rising temperatures,https://www.facebook.com/130268756992804/posts/1559776320708700/,8/4/2017
"North of Lake Tahoe, pika vanishes",1/26/18 7:00,Diana Madson,Species &amp; Ecosystems,2018-01-26 Yale Climate Connections -- The disappearance of pikas in this area is just one ex...,#N/A,#N/A,https://www.yaleclimateconnections.org/2018/01/north-of-lake-tahoe-pika-vanishes/,$150.88,6083203596694,"53,130","11,339","1,427",391,$0.0133,$0.106,$0.39,,213.420,7,The disappearance of pikas in this area is just one example of how climate change threatens wildlife.,"North of Lake Tahoe, the pika has gone locally extinct",https://www.facebook.com/130268756992804/posts/1776050385747958/,2/4/2018
NYC bans cars from Central Park,8/22/18 7:00,Bruce Lieberman,Policy &amp; Politics,2018-08-30 Yale Climate Connections -- The biggest park in Manhattan just got a little safer:,#N/A,#N/A,https://www.yaleclimateconnections.org/2018/08/nyc-bans-cars-from-central-park/,$149.81,6097682069694,"30,922","6,379",304,159,$0.0235,$0.493,$0.94,9,206.293,5,The biggest park in Manhattan just got a little safer:,New York City has banned cars from Central Park,https://www.facebook.com/130268756992804/posts/2056653431020984/,9/4/2018
Waste-to-energy plants could reduce methane,5/11/2017,"Bruce Lieberman, waste-to-energy",Energy,"2017-05-11 Yale Climate Connections -- In today’s story, we’re looking at the pros and cons o...",#N/A,#N/A,https://www.yaleclimateconnections.org/2017/05/waste-to-energy-plants-could-slash-methane/,$104.54,6069243412494,"21,410","3,094",361,145,$0.0338,$0.290,$0.72,,144.512,7,"In today’s story, we’re looking at the pros and cons of waste-to-energy plants and landfills. Tune in to hear from a Columbia University professor and express your opinion in the comments below. Waste-to-Energy Research and Technology Council (WTERT) Columbia Engineering",New waste-to-energy plants could slash methane emissions ,https://www.facebook.com/130268756992804/posts/1505124019507264/,6/4/2017
How family size shapes your carbon footprint,3/29/19 7:05,Craig K. Chandler,"Feature Article, Religion &amp; Morality",2019-03-15 Yale Climate Connections -- Vanessa Hauc has made it her mission to help Latinx pe...,#N/A,#N/A,https://www.yaleclimateconnections.org/2019/03/tv-journalist-spreads-the-word-about-climate-change/,$118.77,6111906948094,"13,052","2,814",146,56,$0.0422,$0.813,$2.12,9,215.599,4,Vanessa Hauc has made it her mission to help Latinx people stay informed about climate change. “This is a community that is ready to work for the protection of the planet:”,How a TV journalist is spreading the word about climate change ,https://www.facebook.com/130268756992804/posts/2348137191872605/,4/4/2019
Why California has a power surplus,9/26/2017,"Bruce Lieberman, energy",Energy,2017-09-26 Yale Climate Connections -- The Golden State has more electricity than it knows wh...,#N/A,#N/A,https://www.yaleclimateconnections.org/2017/09/why-california-has-a-power-surplus/,$218.78,6077432040094,"69,094","15,246","1,688",563,$0.0143,$0.130,$0.39,,220.656,8,The Golden State has more electricity than it knows what to do with.,California bet on solar and natural gas. Now it has a power surplus. ,https://www.facebook.com/130268756992804/posts/1653429981343333/,10/4/2017
Floods and droughts: What it's like to live in communities hit hard by climate change,5/24/19 7:05,SueEllen Campbell,"Feature Article, Weather Extremes",2019-05-17 Yale Climate Connections -- Let’s hear it for the first line of defense against sh...,#N/A,#N/A,https://www.yaleclimateconnections.org/2019/05/salt-marshes-help-protect-shorelines/,$166.74,6116971444694,"21,080","4,402",394,56,$0.0379,$0.423,$2.98,8,208.824,3,Let’s hear it for the first line of defense against shore erosion:,Salt marshes can be surprisingly effective in protecting eroding shorelines ,https://www.facebook.com/130268756992804/posts/2450977798255210/,6/4/2019
Artist teams up with NASA on climate education,1/24/2017,"Arctic sea ice, Justin Brice Guariglia, Sara Peach","Arts, Polar Ice",2017-01-25 Yale Climate Connections -- Justin Brice Guariglia is the first artist to be offic...,#N/A,#N/A,http://www.yaleclimateconnections.org/2017/01/artist-teams-up-with-nasa-on-climate-education/,$9.79,6063517211494,"4,450",545,79,,$0.0180,$0.124,#DIV/0!,,122.472,0,"Justin Brice Guariglia is the first artist to be officially embedded inside a NASA mission. As part of NASA’s Oceans Melting Greenland initiative, he works closely with scientists to document the melting ice sheets. Tune in to learn how he’s educating the public on sea-level rise through his art. 

NASA Climate Change WBAI 99.5 FM New York 88.1 FM WCWP.org WKCR-FM  #climatechange #art #artist",Artist teams up with NASA on climate education,https://www.facebook.com/130268756992804/posts/1401779746508359/,2/16/2017
Massachusetts prepares for wind energy,5/22/2017,"Jan Ellen Spiegel, wind energy",Energy,2017-05-22 Yale Climate Connections -- Offshore wind farms are picking up speed in the U.S. M...,#N/A,#N/A,https://www.yaleclimateconnections.org/2017/05/massachusetts-prepares-for-wind-energy/,$150.34,6069682323694,"30,367","5,326",400,105,$0.0282,$0.376,$1.43,,175.388,3,Offshore wind farms are picking up speed in the U.S. Massachusetts Clean Energy Center,"Massachusetts prepares for wind energy
",https://www.facebook.com/130268756992804/posts/1516688841684115/,6/4/2017
Not in database,n/a,n/a,n/a,"2017-03-15 Yale Climate Connections -- ""Water efficiency is improving at farms across the Wes...",#N/A,#N/A,http://www.csmonitor.com/Environment/Inhabit/2017/0303/America-s-biggest-water-users-farmers-learn-to-use-less-of-it,$71.84,6066232986694,"21,794","2,471",266,,$0.0291,$0.270,#DIV/0!,,113.380,0,"""Water efficiency is improving at farms across the West. That’s important because agriculture consumes 80 percent of the nation’s water – and actually more than 90 percent of what’s used in many Western states, according to the US Department of Agriculture."" Learn more via The Christian Science Monitor",America's biggest water users – farmers – learn to use less of it,https://www.facebook.com/130268756992804/posts/1444312852255048/,4/4/2017
Intergenerational conversation: An antidote to climate despair,2/28/19 7:00,NULL,"Communicating Climate, Youth",2019-02-06 Yale Climate Connections -- This technique could help farmers around the world res...,#N/A,#N/A,https://www.yaleclimateconnections.org/2019/02/scientists-empowers-farmers-to-breed-seeds/,$20.90,6109186602694,"3,186",607,67,34,$0.0344,$0.312,$0.61,5,190.521,11,This technique could help farmers around the world respond to problems posed by climate change.,Scientists empowers farmers to breed seeds » Yale Climate Connections,https://www.facebook.com/130268756992804/posts/2292533710766287/,3/4/2019
GOP mayor turns city into solar powerhouse,4/18/18 7:00,Diana Madson,Energy,2018-04-18 Yale Climate Connections -- All that solar created more than a thousand local jobs...,#N/A,#N/A,https://www.yaleclimateconnections.org/2018/04/republican-mayor-turns-city-into-solar-powerhouse/,$88.32,6088012139094,"30,344","5,883",640,301,$0.0150,$0.138,$0.29,,193.877,10,All that solar created more than a thousand local jobs. ☀️⚡️,A Republican mayor transformed his city into a solar powerhouse ,https://www.facebook.com/130268756992804/posts/1866482536704742/,5/4/2018
Not in database,n/a,n/a,n/a,2017-01-23 Yale Climate Connections -- In 2016 North America was hit by more natural disaster...,#N/A,#N/A,http://sustainability.thomsonreuters.com/2017/01/05/insurers-paid-out-50-billion-for-natural-disasters-in-2016/,$10.81,6063449924894,"2,330",227,34,,$0.0476,$0.318,#DIV/0!,,97.425,0,"In 2016 North America was hit by more natural disasters than in any year since 1980, with overall losses for the Insurance industry totaling $10.2 billion (Via Thomson Reuters).",Insurers paid out $50 billion for natural disasters in 2016 | | Thomson Reuters,https://www.facebook.com/130268756992804/posts/1396351207051213/,2/16/2017
Giant concrete domes could protect shorelines,1/2/18 7:00,Jan Ellen Spiegel,Species &amp; Ecosystems,"2018-01-02 Yale Climate Connections -- The experiment started on a hunch. Now, it’s protectin...",#N/A,#N/A,https://www.yaleclimateconnections.org/2018/01/giant-concrete-domes-could-protect-shorelines/,$187.67,6082073877894,"80,971","12,129","1,108",3572,$0.0155,$0.169,$0.05,,149.794,44,"The experiment started on a hunch. Now, it’s protecting and replenishing a shoreline.",Giant gumball-shaped concrete domes could protect shorelines from further erosion. ,https://www.facebook.com/130268756992804/posts/1750600461626284/,2/4/2018
Louisville tree program aims to cool the city,4/28/2017,"Eileen Mignoni, trees, urban heat island",Sustainability,"2017-04-28 Yale Climate Connections -- Louisville, home of the Kentucky Derby, is warming fas...",#N/A,#N/A,http://www.yaleclimateconnections.org/2017/04/louisville-tree-program-aims-to-cool-the-city/,$91.32,6068654853494,"9,335","1,201",114,,$0.0760,$0.801,#DIV/0!,,128.656,0,"Louisville, home of the Kentucky Derby, is warming faster than other similar cities. To help, a group called “Love Louisville Trees” is planting trees to create shade. Tune in to learn more. 

Louisville Grows  Urban Resources Initiative",Louisville tree program aims to cool the city,https://www.facebook.com/130268756992804/posts/1492635290756137/,5/4/2017
Not in database,n/a,n/a,n/a,2018-05-10 Yale Climate Connections -- A sign of the times.,#N/A,#N/A,https://bit.ly/2rlqWhy,$95.81,6090043483694,"36,064","6,135",500,143,$0.0156,$0.192,$0.67,,170.114,4,A sign of the times.,Southern Ute tribe invests in solar energy ,https://www.facebook.com/130268756992804/posts/1889415727744756/,6/4/2018
Drought threatens family farm,10/4/2016,"agriculture, drought, farming, Sara Peach","Food & Agriculture, Weather",2016-10-04 Yale Climate Connections -- “The biggest challenge with the drought has been not h...,#N/A,#N/A,http://www.yaleclimateconnections.org/2016/10/five-year-drought-threatens-family-farm/,$55.64,6057600167694,"8,996",980,132,,$0.0568,$0.422,#DIV/0!,,108.937,0,"“The biggest challenge with the drought has been not having enough surface water to farm all of the land, leaving anywhere from 30 to 40 percent of the land unfarmed.” #climatechange #drought #climateadaptation #agriculture  #farming

Learn more about how Tom Barcellos is adapting his 800 cows and 1,200 acres to central California's change in climate on today’s episode of Yale Climate Connections Radio Show.",Drought threatens family farm,https://www.facebook.com/130268756992804/posts/1284403324912669/,11/4/2016
Sidewalks soak up carbon pollution,2/23/2017,"Bruce Lieberman, carbon emissions",Science,2017-02-23 Yale Climate Connections -- Manufacturing cement is responsible for about 5 percen...,#N/A,#N/A,http://www.yaleclimateconnections.org/2017/02/your-sidewalk-is-soaking-up-carbon-pollution/,$97.24,6065037519894,"23,735","2,310",270,,$0.0421,$0.360,#DIV/0!,,97.325,0,"Manufacturing cement is responsible for about 5 percent of total global carbon dioxide emissions. Here’s the weird twist: Cement can actually reabsorb some of that CO2 from the atmosphere. Tune in. 

California Institute of Technology - Caltech KPCC",Your Sidewalk Is Soaking Up Carbon Pollution,https://www.facebook.com/130268756992804/posts/1425155180837482/,3/4/2017
Not in database,n/a,n/a,n/a,"2017-02-02 Yale Climate Connections -- What do NASA's satellites tell us about our ""challengi...",#N/A,#N/A,http://h2oradio.org/NASA_JPL.html,$139.84,6063919427094,"54,609","8,705","1,782",,$0.0161,$0.078,#DIV/0!,,159.406,0,"What do NASA's satellites tell us about our ""challenging water future""?  explained here in an interview with NASA's senior water scientist Jay Famiglietti (Via H2O Radio)",Vanishing Act: NASA scientist Jay Famiglietti on Our Changing Water Future,https://www.facebook.com/130268756992804/posts/1401926003160400/,3/4/2017
Muslim group divests from fossil fuels,5/26/2017,"climate and religion, energy, Samantha Harrington","Energy, Faith & Ethics","2017-05-26 Yale Climate Connections -- The largest Muslim organization in the U.S., the Islam...",#N/A,#N/A,https://www.yaleclimateconnections.org/2017/05/muslim-group-divests-from-fossil-fuels/,$128.86,6069873464694,"29,927","4,858",347,65,$0.0265,$0.371,$1.98,,162.328,2,"The largest Muslim organization in the U.S., the Islamic Society of North America (ISNA), has committed to sell off all its investments in coal, oil, and natural gas within three years.",Muslim group divests from fossil fuels,https://www.facebook.com/130268756992804/posts/1516701741682825/,6/4/2017
Coal employment prospects bleak and bleaker,3/8/2017,"Bruce Lieberman, coal","Economics, Energy, Feature Article, Policy",2017-03-12 Yale Climate Connections -- “Everybody had their dreams about being a basketball p...,#N/A,#N/A,http://www.yaleclimateconnections.org/2017/03/coal-employment-prospects-bleak-and-bleaker/,$69.46,6066066083094,"17,958","2,725",352,,$0.0255,$0.197,#DIV/0!,,151.743,0,"“Everybody had their dreams about being a basketball player, football player,” young Dakota Hall said. “I always just wanted to be a coal miner.”

Coal will continue to be in decline — and it’s not because the federal government is regulating it out of existence. Read more ...","Coal employment prospects bleak and bleaker, by Bruce Lieberman",https://www.facebook.com/130268756992804/posts/1449273795092287/,4/4/2017
Not in database,n/a,n/a,n/a,2017-01-04 Yale Climate Connections -- China follows Japan and the United States in monitorin...,#N/A,#N/A,http://sustainability.thomsonreuters.com/2016/12/22/china-launches-carbon-tracking-satellite-into-space-xinhua/,$107.36,6062475611694,"31,288","3,201",325,,$0.0335,$0.330,#DIV/0!,,102.308,0,China follows Japan and the United States in monitoring greenhouse gases with its own satellite. Via Thomson Reuters,China launches carbon-tracking satellite into space: Xinhua | | Thomson Reuters,https://www.facebook.com/130268756992804/posts/1376735952346072/,2/16/2017
A 'forest city' is growing in China,12/26/2017,Daisy Simmons,Sustainability,2017-12-26 Yale Climate Connections -- This city will be so green that from a distance it’ll ...,#N/A,#N/A,https://www.yaleclimateconnections.org/2017/12/a-forest-city-is-growing-in-china/,$187.00,6081807334294,"60,779","11,390","1,255",849,$0.0164,$0.149,$0.22,,187.400,14,This city will be so green that from a distance it’ll just look like rolling hills. 🌳🌱🌿,China is building a futuristic ‘forest city’ with more trees than people ,https://www.facebook.com/130268756992804/posts/1743472259005771/,1/4/2018
Armadillos are moving north,4/4/19 7:00,Samantha Harrington,Species &amp; Ecosystems,2019-04-02 Yale Climate Connections -- Some people worry that climate action is too expensive...,#N/A,#N/A,https://www.yaleclimateconnections.org/2019/04/researcher-tackling-climate-will-help-protect-economy/,$64.37,6113276076494,"7,514","1,714",229,22,$0.0376,$0.281,$2.93,9,228.108,3,Some people worry that climate action is too expensive. But researcher Felix Pretis of the University of Victoria in British Columbia says “the costs of inaction are much higher.”,"Tackling climate change is actually good for the economy, researcher says",https://www.facebook.com/130268756992804/posts/2375983929087931/,5/4/2019
Not in database,n/a,n/a,n/a,"Amidst all the challenges currently facing our world, what are Christian lead...",#N/A,#N/A,http://www.yaleclimateconnections.org/2016/06/christian-values-and-climate-change-2/,$11.43,6053438211494,"1,847",139,25,,$0.0822,$0.457,#DIV/0!,,75.257,0,"Amidst all the challenges currently facing our world, what are Christian leaders saying about climate change? Hear more below.",Christian values and climate change ,https://www.facebook.com/130268756992804/posts/1217797358239933/,8/4/2016
Closing fossil fuel plants reduces preterm births,8/13/18 7:00,Samantha Harrington,Health,2018-08-13 Yale Climate Connections -- Imagine what would happen if we made a complete transi...,#N/A,#N/A,https://www.yaleclimateconnections.org/2018/08/closing-fossil-fuel-plants-reduces-preterm-births/,$144.10,6096486883694,"28,184","5,693",778,133,$0.0253,$0.185,$1.08,9,201.994,5,Imagine what would happen if we made a complete transition to renewable energy.,Study: Closing fossil fuel plants reduces premature births,https://www.facebook.com/130268756992804/posts/2028092583877069/,9/4/2018
Alabama's largest solar farm completed,3/9/2017,"Bruce Lieberman, solar",Energy,"2017-03-09 Yale Climate Connections -- The largest solar energy project in Alabama, with abou...",#N/A,#N/A,http://www.yaleclimateconnections.org/2017/03/alabamas-largest-solar-farm-completed/,$139.27,6065790842294,"52,150","8,220","1,044",,$0.0169,$0.133,#DIV/0!,,157.622,0,"The largest solar energy project in Alabama, with about 300,000 solar panels, produces enough power to supply 15,000 homes with carbon-free electricity. Tune in to learn more about the River Bend Solar Energy Center.

Photo courtesy of Tennessee Valley Authority
Tennessee Valley Authority WUTK The Rock Talk Radio 92.3 / AM 760 WETR Solar Energy International (SEI) Tesla U.S. Department of Energy",Alabama’s largest solar farm completed ,https://www.facebook.com/130268756992804/posts/1438921496127517/,4/4/2017
Not in database,n/a,n/a,n/a,2016-12-02 Yale Climate Connections -- Check out this article by The Christian Science Monito...,#N/A,#N/A,http://www.csmonitor.com/Environment/Inhabit/2016/1116/Eye-on-Trump-Kerry-promotes-the-business-case-for-climate-action?cmpid=FB,$88.39,6060888235094,"24,744","2,861",172,,$0.0309,$0.514,#DIV/0!,,115.624,0,"Check out this article by The Christian Science Monitor on why Secretary of State John Kerry believes the president-elect has reason ""to reconsider his stance opposing the Paris agreement"".","Eye on Trump, Kerry promotes the business case for climate action",https://www.facebook.com/130268756992804/posts/1349840781702256/,1/4/2017
Male loggerhead hatchlings now rare in Florida,5/22/18 7:00,Daisy Simmons,Species &amp; Ecosystems,"2018-05-22 Yale Climate Connections -- “The environment is getting warmer, and it has consequ...",#N/A,#N/A,https://www.yaleclimateconnections.org/2018/05/male-loggerhead-hatchlings-now-rare-in-florida/,$107.23,6090796580094,"37,176","6,261","1,105",313,$0.0171,$0.097,$0.34,,168.415,8,"“The environment is getting warmer, and it has consequences.” — Jeanette Wyneken",Nearly all of Florida’s loggerhead sea turtle hatchlings are now female ,https://www.facebook.com/130268756992804/posts/1902215646464764/,6/4/2018
San Diego commits to 100% clean electricity,6/14/2017,"Diana Madson, renewable energy",Energy,2017-06-14 Yale Climate Connections -- The bipartisan plan is designed to aggressively cut po...,#N/A,#N/A,https://www.yaleclimateconnections.org/2017/06/san-diego-commits-to-100-percent-clean-electricity/,$267.51,6070684362294,"80,529","15,550","1,207",301,$0.0172,$0.222,$0.89,,193.098,4,The bipartisan plan is designed to aggressively cut pollution and boost the local economy. City of San Diego,San Diego commits to 100% clean electricity ,https://www.facebook.com/130268756992804/posts/1520436254642707/,7/4/2017
Not in database,n/a,n/a,n/a,2018-06-15 Yale Climate Connections -- He’s reviving a landscape depleted by mountaintop remo...,#N/A,#N/A,https://www.yaleclimateconnections.org/2018/06/creating-farms-out-of-coal-mining-sites,$93.11,6092436606894,"18,344","2,852",257,236,$0.0326,$0.362,$0.39,9,155.473,13,He’s reviving a landscape depleted by mountaintop removal.,One man wants to turn Appalachia’s coal-mining sites into farms,https://www.facebook.com/130268756992804/posts/1930219576997704/,7/4/2018
When bluebonnets bloom early,3/15/18 7:00,Samantha Harrington,Species &amp; Ecosystems,2018-03-15 Yale Climate Connections -- Early bluebonnet blooms could become the norm due to c...,#N/A,#N/A,https://www.yaleclimateconnections.org/2018/03/when-bluebonnets-bloom-early/,$65.52,6085857992494,"16,935","2,852",329,194,$0.0230,$0.199,$0.34,,168.409,11,Early bluebonnet blooms could become the norm due to climate change.,When bluebonnets bloom early ,https://www.facebook.com/130268756992804/posts/1828668180486178/,4/4/2018
Law helps low-income people go solar,11/1/2017,Eileen Mignoni,Energy,2017-11-01 Yale Climate Connections -- This new program aims to bring solar power to low-inco...,#N/A,#N/A,https://www.yaleclimateconnections.org/2017/11/california-law-helps-low-income-people-go-solar/,$139.61,6079166524094,"38,943","8,019",841,176,$0.0174,$0.166,$0.79,,205.916,5,"This new program aims to bring solar power to low-income renters in more than 200,000 households statewide.",New California law allows  low-income people go solar ,https://www.facebook.com/130268756992804/posts/1687314307954900/,12/4/2017
Volunteers unearth climate data in ships' logs,5/23/18 7:00,"Diana Madson, weather",Weather Extremes,2018-05-23 Yale Climate Connections -- This is a gold mine for climate scientists. Or maybe “...,#N/A,#N/A,https://www.yaleclimateconnections.org/2018/05/volunteers-unearth-climate-data-in-ships-logs/,$94.64,6090868787894,"33,768","5,397",674,365,$0.0175,$0.140,$0.26,,159.826,11,This is a gold mine for climate scientists. Or maybe “treasure trove” would be a better term?,Citizen scientists are unearthing climate data from old ships’ logs ,https://www.facebook.com/130268756992804/posts/1903251966361132/,6/4/2018
Climate change visible in Glacier National Park,8/8/2017,"ecosystems, national parks, Samantha Harrington",Ecosystems,2017-08-08 Yale Climate Connections -- Looking for evidence of a changing climate? Jeff Wegan...,#N/A,#N/A,https://www.yaleclimateconnections.org/2017/08/in-glacier-national-park-you-can-see-climate-change-firsthand/,$103.13,6073527359894,"36,248","5,798",797,310,$0.0178,$0.129,$0.33,,159.954,9,Looking for evidence of a changing climate? Jeff Wegand went swimming in it.," In Glacier National Park, you can see the effects of climate change firsthand",https://www.facebook.com/130268756992804/posts/1606058592747139/,9/4/2017
Why rooftop gardens cool cities,3/19/18 7:00,Jan Ellen Spiegel,Energy,2018-03-19 Yale Climate Connections -- City rooftops are getting a makeover.,#N/A,#N/A,https://www.yaleclimateconnections.org/2018/03/why-rooftop-gardens-cool-cities/,$129.34,6086103892094,"40,805","7,261",874,211,$0.0178,$0.148,$0.61,,177.944,5,City rooftops are getting a makeover.,Why rooftop gardens cool cities ,https://www.facebook.com/130268756992804/posts/1833160540036942/,4/4/2018
Costa Rica is 98% renewable-powered,4/26/2017,"Diana Madson, renewable energy","Energy, Latino Communities",2017-04-26 Yale Climate Connections -- Costa Rica is 98% renewable-powered and aiming for car...,#N/A,#N/A,http://www.yaleclimateconnections.org/2017/04/costa-rica-is-98-percent-renewable-powered/,$142.27,6068560853294,"28,329","4,643",527,,$0.0306,$0.270,#DIV/0!,,163.896,0,"Costa Rica is 98% renewable-powered and aiming for carbon neutrality within four years. ""It is possible to achieve a very good balance of sustainable development and economic development,” says Javier Orozco of the Costa Rican Electricity Institute.

Photo by Alberto Font The Tico Times - Costa Rica’s Pirrís hydroelectric dam. 

Grupo ICE RenewableEnergyWorld.com U.S. Department of Energy Office of Energy Efficiency and Renewable Energy",Costa Rica is powered by 98% clean energy,https://www.facebook.com/130268756992804/posts/1492614934091506/,5/4/2017
Fighting gentrification: ultra-efficient homes,3/14/18 7:00,Eileen Mignoni,"Energy, Jobs &amp; Economy",2018-03-14 Yale Climate Connections -- “We’re preserving affordability in a very quickly gent...,#N/A,#N/A,https://www.yaleclimateconnections.org/2018/03/nonprofit-fights-gentrification-with-ultra-efficient-homes/,$38.76,6085779584694,"13,335","1,613",157,187,$0.0240,$0.247,$0.21,,120.960,14,"“We’re preserving affordability in a very quickly gentrifying area.” 
— Juan Carlos Linares, executive director of LUCHA",Nonprofit fights gentrification with ultra-efficient homes,https://www.facebook.com/130268756992804/posts/1827461227273540/,4/4/2018
Solar even in Alaska: Really? Really!,8/18/2016,"Alaska, Bruce Lieberman, solar energy",Energy,Solar power has the potential to replace diesel generators in Alaska. Listen ...,#N/A,#N/A,http://www.yaleclimateconnections.org/2016/08/solar-even-in-alaska-really-really/,$26.77,6055084486294,"5,900",535,70,,$0.0500,$0.382,#DIV/0!,,90.678,0,Solar power has the potential to replace diesel generators in Alaska. Listen in to today's episode for more.,Solar even in Alaska: Really? Really! ,https://www.facebook.com/130268756992804/posts/1239875742698761/,9/4/2016
Flooding is the new normal in Miami,2/6/2017,"Eileen Mignoni, nuisance flooding, sea level rise","Latino Communities, Sea Level Rise",2017-02-06 Yale Climate Connections -- “The water is here. It’s not that I’m talking about so...,#N/A,#N/A,http://www.yaleclimateconnections.org/2017/02/flooding-is-the-new-normal-in-miami/,$133.03,6064155128894,"46,099","7,376","1,490",,$0.0180,$0.089,#DIV/0!,,160.003,0,"“The water is here. It’s not that I’m talking about some sci-fi movie ...” Listen in to one South Beach resident’s present-day reality with sea-level rise.

WVUM 90.5 FM The Voice Kiss 99.9 Florida Climate Institute  Department of Homeland Security U.S. Department of Health and Human Services South Beach Classics",Flooding Is the New Normal in Miami,https://www.facebook.com/130268756992804/posts/1414928301860170/,3/4/2017
Renewables rise in conservative southern states,5/29/18 7:00,Diana Madson,"Energy, Jobs &amp; Economy",2018-05-29 Yale Climate Connections -- The free market is demanding more renewable energy.,#N/A,#N/A,https://www.yaleclimateconnections.org/2018/05/renewables-rise-in-conservative-southern-states/,$107.12,6091230696694,"28,552","5,210",503,218,$0.0206,$0.213,$0.49,,182.474,8,The free market is demanding more renewable energy.,Renewables are on the rise in conservative southern states,https://www.facebook.com/130268756992804/posts/1909640279055634/,6/4/2018
Not in database,n/a,n/a,n/a,2017-02-20 Yale Climate Connections -- Coming up with a model to measure the social cost of c...,#N/A,#N/A,http://www.csmonitor.com/Environment/2017/0201/Why-a-climate-economist-is-giving-carbon-s-social-cost-a-second-look,$42.16,6064881673694,"13,467","1,518",182,,$0.0278,$0.232,#DIV/0!,,112.720,0,Coming up with a model to measure the social cost of carbon is a challenge. Learn why here:  (Via The Christian Science Monitor),Why a climate economist is giving carbon's 'social cost' a second look,https://www.facebook.com/130268756992804/posts/1422286291124371/,3/4/2017
Native American tribe helps forest adapt,9/7/2017,"forests, Samantha Harrington",Ecosystems,2017-09-07 Yale Climate Connections -- Forestry is a long term game. That means it’s importan...,#N/A,#N/A,https://www.yaleclimateconnections.org/2017/09/a-native-american-tribe-is-helping-a-forest-adapt-to-climate-change/,$210.02,6074852239894,"56,568","11,442","1,288",881,$0.0184,$0.163,$0.24,,202.270,16,Forestry is a long term game. That means it’s important to start adapting to climate change now.,A Native American tribe is helping a forest adapt to climate change,https://www.facebook.com/130268756992804/posts/1635205506499114/,10/4/2017
Not in database,n/a,n/a,n/a,2017-11-10 Yale Climate Connections -- These ex-combat divers are coping with their PTSD as t...,#N/A,#N/A,https://yaleclimateconnections.org/2017/11/military-trained-combat-divers-restore-coral-reefs/,$156.64,6079608758094,"34,107","8,487","1,044",202,$0.0185,$0.150,$0.78,,248.835,6,These ex-combat divers are coping with their PTSD as they restore coral reefs.,Military-trained combat divers are restoring coral reefs ,https://www.facebook.com/130268756992804/posts/1696123393740658/,12/4/2017
Not in database,n/a,n/a,n/a,"2017-02-08 Yale Climate Connections -- Russia is taking ""aggressive steps"" in the r...",#N/A,#N/A,http://sustainability.thomsonreuters.com/2017/01/30/putins-russia-in-biggest-arctic-military-push-since-soviet-fall/,$77.85,6064295195694,"39,088","4,193",922,,$0.0186,$0.084,#DIV/0!,,107.271,0,"Russia is taking ""aggressive steps"" in the race to get hold of the energy reserves in the Arctic. The reaction in Washington and the dilemmas this might pose for the Trump administration explained. (Via Thomson Reuters)",Putin’s Russia in biggest Arctic military push since Soviet fall | | Thomson Reuters,https://www.facebook.com/130268756992804/posts/1412908715395462/,3/4/2017
Construction workers fight for breaks,8/9/2017,"Eileen Mignoni, public health",Public Health,"2017-08-09 Yale Climate Connections -- Working in the heat can be deadly, which is why Dallas...",#N/A,#N/A,https://www.yaleclimateconnections.org/2017/08/as-climate-heats-up-construction-workers-fight-for-breaks/,$121.08,6073588546894,"42,582","6,520",575,215,$0.0186,$0.211,$0.56,,153.116,5,"Working in the heat can be deadly, which is why Dallas, Texas, passed a new law requiring breaks for construction workers.","As climate heats up, construction workers fight for breaks ",https://www.facebook.com/130268756992804/posts/1606996639320001/,9/4/2017
Not in database,n/a,n/a,n/a,2018-12-25 Yale Climate Connections -- The U.S. Green Building Council announces a “net zero”...,#N/A,#N/A,https://bit.ly/2Ra7TWl,$46.85,6106203773894,"5,790","1,379",96,22,$0.0340,$0.488,$2.13,8,238.169,4,The U.S. Green Building Council announces a “net zero” certification for buildings that prevent as much pollution as they cause:,New low-pollution ‘net zero’ buildings are starting to catch on,https://www.facebook.com/130268756992804/posts/2226719624014363/,1/4/2019
Not in database,n/a,n/a,n/a,2019-04-08 Yale Climate Connections -- Solar can save lives: https://bit.ly/2IfTIKp,#N/A,#N/A,https://bit.ly/2IfTIKp,$153.18,6113784749294,"19,932","4,859",403,42,$0.0315,$0.380,$3.65,10,243.779,2,Solar can save lives: https://bit.ly/2IfTIKp,"At more than 400 Zimbabwe health clinics, solar panels keep the lights on ",https://www.facebook.com/130268756992804/posts/2385286834824307/,5/4/2019
States could lead on climate in 2017,12/12/2016,"Bruce Lieberman, California, Policy, state initiatives","Energy, Feature Article, Policy","2017-02-02 Yale Climate Connections -- In Case You Missed It: California, New York and some o...",#N/A,#N/A,http://www.yaleclimateconnections.org/2016/12/states-in-lead-role-if-us-backs-off/,$48.32,6063973139694,"16,747","2,501",163,,$0.0193,$0.296,#DIV/0!,,149.340,0,"In Case You Missed It: California, New York and some other states may pick up the pace on their own climate change initiatives in 2017 and beyond.","States Could Lead on Climate in 2017, by Bruce Lieberman",https://www.facebook.com/130268756992804/posts/1404481072904893/,3/4/2017
Not in database,n/a,n/a,n/a,2017-04-15 Yale Climate Connections -- Here's an article that says focusing on the economic b...,#N/A,#N/A,http://sustainability.thomsonreuters.com/2017/04/07/make-climate-change-an-economic-not-green-issue-urges-ex-president-of-maldives/,$77.99,6068102148894,"11,780","1,694",195,,$0.0460,$0.400,#DIV/0!,,143.803,0,"Here's an article that says focusing on the economic benefits of stepping up climate action to bring different sectors on board may be more productive.
Via Thomson Reuters","Make climate change an economic – not green – issue, urges ex-president of Maldives | | Thomson Reuters",https://www.facebook.com/130268756992804/posts/1486567938029539/,5/4/2017
"Warmer oceans, stronger hurricanes",8/3/2016,"extreme weather, hurricanes, ocean temperatures, Sara Peach","Oceans, Science Questions, Weather","2017-08-28 Yale Climate Connections -- In this 2016 episode, Florida State University profess...",#N/A,#N/A,https://www.yaleclimateconnections.org/2016/08/warmer-oceans-stronger-hurricanes/,$112.39,6074425159494,"37,601","5,939","1,419",495,$0.0189,$0.079,$0.23,,157.948,13,"In this 2016 episode, Florida State University professor James Elsner explains how global warming contributes to more severe hurricanes.",The relationship between climate change and hurricanes,https://www.facebook.com/130268756992804/posts/1625476167472048/,9/4/2017
Is this the coolest job in the wind industry?,4/13/18 7:00,Daisy Simmons,Energy,2018-04-13 Yale Climate Connections -- Hanging from ropes 350 feet in the air? All in a day’s...,#N/A,#N/A,https://www.yaleclimateconnections.org/2018/04/is-this-the-coolest-job-in-the-wind-industry/,$62.62,6087699775894,"14,811","2,484",183,79,$0.0252,$0.342,$0.79,,167.713,5,Hanging from ropes 350 feet in the air? All in a day’s work.,This rock climber might have the coolest job in the wind industry ,https://www.facebook.com/130268756992804/posts/1861281473891515/,5/4/2018
The link between hurricanes and climate change,8/28/2017,Sara Peach,"Feature Article, Sea Level Rise, Weather",2017-08-29 Yale Climate Connections -- Climate change is making hurricanes like Harvey strong...,#N/A,#N/A,https://www.yaleclimateconnections.org/2017/08/the-link-between-hurricanes-and-climate-change/,$131.37,6074466153294,"38,274","6,895","1,183",251,$0.0191,$0.111,$0.52,,180.148,7,Climate change is making hurricanes like Harvey stronger and more dangerous.,The link between hurricanes and climate change,https://www.facebook.com/130268756992804/posts/1626323024054029/,9/4/2017
Not in database,n/a,n/a,n/a,"2017-11-24 Yale Climate Connections -- “Climate change is a one-way street,” says artist Hann...",#N/A,#N/A,https://www.yaleclimateconnections.org/2017/11/artists-posters-show-climate-change-in-national-parks,$53.11,6080294994894,"9,898","1,658",183,303,$0.0320,$0.290,$0.18,,167.509,31,"“Climate change is a one-way street,” says artist Hannah Rothstein. “There’s not really a lot of going back.”",Posters show climate change in national parks,https://www.facebook.com/130268756992804/posts/1710316908987973/,12/4/2017
"Study: Yes, global warming is real",9/27/2017,"Bruce Lieberman, oceans","Oceans, Science",2017-09-27 Yale Climate Connections -- Add this to the pile of evidence: Old data collected b...,#N/A,#N/A,https://www.yaleclimateconnections.org/2017/09/yet-another-study-concludes-that-global-warming-is-real/,$134.16,6077491043894,"36,258","6,992",947,309,$0.0192,$0.142,$0.43,,192.840,9,Add this to the pile of evidence: Old data collected by sailors builds the case that the oceans are getting hotter.,Yet another study concludes that global warming is happening ,https://www.facebook.com/130268756992804/posts/1654288607924137/,10/4/2017
Youth climate lawsuit heads to trial,2/2/2017,"lawsuit, Sara Peach",Latino Communities,2017-02-02 Yale Climate Connections -- “We have the most at stake when it comes to climate ch...,#N/A,#N/A,http://www.yaleclimateconnections.org/2017/02/youth-climate-lawsuit-heads-to-trial/,$112.71,6063951272694,"35,064","5,873",549,,$0.0192,$0.205,#DIV/0!,,167.494,0,"“We have the most at stake when it comes to climate change.” Listen in as 16-year-old Xiuhtezcatl Tonatiuh shares why he decided to sue the government.

Our Children's Trust  Climate Change Policy & Practice Nature Climate Change KOCF 92.5 Fern Ridge Community Radio KWVA",Youth climate lawsuit heads to trial,https://www.facebook.com/130268756992804/posts/1397505750269092/,3/4/2017
Not in database,n/a,n/a,n/a,2017-05-10 Yale Climate Connections -- The declining cost of renewables is making the green e...,#N/A,#N/A,http://www.csmonitor.com/Environment/Inhabit/2017/0406/More-for-less-Renewable-power-surges-into-mainstream-as-costs-fall,$143.22,6069207687094,"38,561","7,459",773,,$0.0192,$0.185,#DIV/0!,,193.434,0,"The declining cost of renewables is making the green energy revolution ""irreversible"". Read more via The Christian Science Monitor",More for less': Renewable power surges into mainstream as costs fall,https://www.facebook.com/130268756992804/posts/1509474422405557/,6/4/2017
"After weather disasters, mental health problems spike",3/20/18 7:00,Daisy Simmons,Health,2018-03-20 Yale Climate Connections -- Climate change is increasing the frequency and intensi...,#N/A,#N/A,https://www.yaleclimateconnections.org/2018/03/after-weather-disasters-mental-health-problems-spike/,$30.23,6086177191494,"9,220","1,331",198,43,$0.0227,$0.153,$0.70,,144.360,5,"Climate change is increasing the frequency and intensity of weather disasters, which can take a toll on mental health.","After weather disasters, mental health problems spike ",https://www.facebook.com/130268756992804/posts/1834365169916479/,4/4/2018
Western coalition aims to cut emissions,6/7/2017,"CO2 emissions, Diana Madson",Energy,"2017-06-07 Yale Climate Connections -- To achieve more than they could alone, US and Canadian...",#N/A,#N/A,https://www.yaleclimateconnections.org/2017/06/pacific-states-british-columbia-team-up-to-cut-global-warming-pollution/,$192.25,6070368454494,"53,702","9,996",908,365,$0.0192,$0.212,$0.53,,186.138,7,"To achieve more than they could alone, US and Canadian governments on the Pacific Coast have banded together to combat climate change.",West Coast coalition aims to cut emissions ,https://www.facebook.com/130268756992804/posts/1520100558009610/,7/4/2017
"School goes solar, saves money, buys laptops",5/21/18 7:00,"Bud Ward, energy",Energy,"2018-05-21 Yale Climate Connections -- For students at this Nevada school, it pays to go solar:",#N/A,#N/A,https://www.yaleclimateconnections.org/2018/05/school-goes-solar-saves-money-buys-laptops/,$75.42,6090726717694,"21,018","3,677",421,53,$0.0205,$0.179,$1.42,,174.945,3,"For students at this Nevada school, it pays to go solar:",Solar power helped this school provide laptops for students,https://www.facebook.com/130268756992804/posts/1901159529903709/,6/4/2018
What's the big deal with El NiÃ±o?,11/15/2016,"Bud Ward, El Nino, global temperatures, La Nina","Science, Science Questions, Weather","2016-11-15 Yale Climate Connections -- What's the difference between El Niño, La Niña and wha...",#N/A,#N/A,http://www.yaleclimateconnections.org/2016/11/whats-the-big-deal-with-el-nino/,$79.03,6059906590094,"19,356","1,607",336,,$0.0492,$0.235,#DIV/0!,,83.023,0,"What's the difference between El Niño, La Niña and what do each have to do with #climatechange? Hear meteorologist Bob Henson of Weather Underground explain in today's story.",What’s the Big Deal with El Nino? ,https://www.facebook.com/130268756992804/posts/1321218697897798/,12/4/2016
Spin class sends electricity to the grid,7/13/18 7:00,Sarah Kennedy,Energy,2018-07-13 Yale Climate Connections -- Seeing how much effort you have to expend to produce 6...,#N/A,#N/A,https://www.yaleclimateconnections.org/2018/07/spin-class-sends-electricity-to-the-grid/,$101.44,6094417262494,"17,144","2,169",157,62,$0.0468,$0.646,$1.64,7,126.517,4,Seeing how much effort you have to expend to produce 60 watts of power is a real eye-opener.,"In this spin class, the bikes send electricity to the grid",https://www.facebook.com/130268756992804/posts/1975284779157850/,8/4/2018
Could seaweed reduce methane from cows?,9/27/18 7:00,Diana Madson,Climate Science,"2018-09-27 Yale Climate Connections -- When cows burp, it’s not just bad manners.",#N/A,#N/A,https://www.yaleclimateconnections.org/2018/09/could-seaweed-reduce-methane-from-cows/,$39.70,6099635293294,"3,397",624,34,13,$0.0636,$1.168,$3.05,9,183.691,4,"When cows burp, it’s not just bad manners.",Could seaweed prevent cows from belching so much methane?,https://www.facebook.com/130268756992804/posts/2092012414151752/,10/4/2018
"Farming while black' author Leah Penniman wants to create a just, climate-friendly food system",6/19/19 7:00,NULL,Food &amp; Agriculture,2019-06-04 Yale Climate Connections -- It's not just the Great Barrier Reef. These nine touri...,#N/A,#N/A,https://www.yaleclimateconnections.org/2019/06/which-vacation-spots-are-being-harmed-by-climate-change/,$80.77,6118528834894,"6,958","1,348",162,97,$0.0599,$0.499,$0.83,7,193.734,14,It's not just the Great Barrier Reef. These nine tourist destinations in the U.S. are also in danger from global warming.,Which vacation spots could be permanently damaged by global warming?' » Yale Climate Connections,https://www.facebook.com/130268756992804/posts/2482945078391815/,7/4/2019
Not in database,n/a,n/a,n/a,"2017-01-23 Yale Climate Connections -- Where some see rooftops, Gotham Greens sees farmland. ...",#N/A,#N/A,http://www.yaleclimateconnections.org/2017/growing-lettuce-on-worlds-largest-rooftop-farm/,$61.58,6063426044494,"35,728","3,143",458,,$0.0196,$0.134,#DIV/0!,,87.970,0,"Where some see rooftops, Gotham Greens sees farmland. A rooftop in Chicago hosts a farm that produces nearly 10 million heads of lettuce each year. Tune in to learn about the farm and its climate-friendly food production. #farming #Agriculture 

Yale Sustainable Food Program Urban Farming American Farmers Network Food and Agriculture Organization of the United Nations (FAO)",Growing Lettuce on World’s Largest Rooftop Farm,https://www.facebook.com/130268756992804/posts/1392766614076339/,2/16/2017
"Community views trees as key to health, wealth",5/31/18 7:00,Diana Madson,Food &amp; Agriculture,2018-05-31 Yale Climate Connections -- Urban forestry: It’s a community thing.,#N/A,#N/A,https://www.yaleclimateconnections.org/2018/05/community-views-trees-as-key-to-health-wealth/,$235.30,6091369728694,"69,984","11,991","1,058",615,$0.0196,$0.222,$0.38,,171.339,9,Urban forestry: It’s a community thing.,Why this Chicago neighborhood views trees as key to health and wealth,https://www.facebook.com/130268756992804/posts/1911726902180305/,6/4/2018
A pre-Civil War mansion is going solar,8/20/18 7:00,Sarah Kennedy,Energy,2018-08-20 Yale Climate Connections -- Do you think clean energy has a role to play in histor...,#N/A,#N/A,https://www.yaleclimateconnections.org/2018/08/a-pre-civil-war-mansion-is-going-solar/,$98.30,6096961227494,"17,788","3,198",159,126,$0.0307,$0.618,$0.78,8,179.784,7,Do you think clean energy has a role to play in historical preservation?,A pre-Civil War mansion is going solar,https://www.facebook.com/130268756992804/posts/2040854195934241/,9/4/2018
The Northeast is poised to regain momentum on clean energy,2/14/19 7:05,Jan Ellen Spiegel,"Energy, Feature Article, Policy &amp; Politics","2019-02-14 Yale Climate Connections -- “It’s time to act!” said Maine’s new governor, Democra...",#N/A,#N/A,https://www.yaleclimateconnections.org/2019/02/clean-energy-the-northeast-is-back/,$13.44,6109790430094,"2,228",513,27,16,$0.0262,$0.498,$0.84,8,230.251,7,"“It’s time to act!” said Maine’s new governor, Democrat Janet Mills.",Clean energy: The Northeast is back » by Jan Ellen Spiegel,https://www.facebook.com/130268756992804/posts/2304722716214053/,3/4/2019
How vanishing lizards in Madagascar led to a troubling discovery about deforestation and climate change,4/30/19 7:10,Daniel Grossman,"Feature Article, Species &amp; Ecosystems","2019-05-20 Yale Climate Connections -- Craig Mathews, an avid hunter and fisherman, says ever...",#N/A,#N/A,https://www.yaleclimateconnections.org/2019/05/climate-change-threatens-hunting-and-fishing-in-yellowstone-country/,$150.66,6117203882494,"15,632","3,151",343,70,$0.0478,$0.439,$2.15,8,201.574,4,"Craig Mathews, an avid hunter and fisherman, says everyone who loves the outdoors should help reduce global warming:", Headline: Climate change is a threat to hunting and fishing in Yellowstone country,https://www.facebook.com/130268756992804/posts/2456245247728465/,6/4/2019
Earth Day: Report card for the planet,4/21/2017,"Arctic sea ice, CO2, global temperature, Sara Peach","Polar Ice, Science","2017-04-21 Yale Climate Connections -- Did you know that 2014, 2015, and 2016 were the hottes...",#N/A,#N/A,http://www.yaleclimateconnections.org/2017/04/earth-day-report-card-for-the-planet/,$103.73,6068372595094,"17,231","2,199",404,,$0.0472,$0.257,#DIV/0!,,127.619,0,"Did you know that 2014, 2015, and 2016 were the hottest three years on record? “Climate change is not just about the distant future. It’s something that’s happening now,” says Anthony Broccoli, a climate scientist at Rutgers University. 

Earth Day Network #earthday",Report card for the planet	,https://www.facebook.com/130268756992804/posts/1481101508576182/,5/4/2017
Not in database,n/a,n/a,n/a,2016-12-16 Yale Climate Connections -- This article from  The Christian Science Monitor dives...,#N/A,#N/A,http://www.csmonitor.com/Environment/Inhabit/2016/1213/In-U-turn-EPA-says-fracking-can-pose-a-threat-to-drinking-water,$187.20,6061639263294,"56,447","9,446","1,178",,$0.0198,$0.159,#DIV/0!,,167.343,0,This article from  The Christian Science Monitor dives into the controversies behind the EPA's final report on fracking.,"In U-turn, EPA says fracking can pose a threat to drinking water",https://www.facebook.com/130268756992804/posts/1364257280260606/,1/4/2017
Retired couple says solar is a good investment,12/13/18 7:00,NULL,Jobs &amp; Economy,2018-12-13 Yale Climate Connections -- A Department of Energy study found that homes with sol...,#N/A,#N/A,https://www.yaleclimateconnections.org/2018/12/retired-couple-says-solar-is-a-good-investment/,$83.78,6105359106094,"6,076","1,058",99,31,$0.0792,$0.846,$2.70,9,174.128,5,"A Department of Energy study found that homes with solar panels sold for, on average, about $15,000 more than similar homes without solar.",Why this retired couple invested in solar — at age 80,https://www.facebook.com/130268756992804/posts/2208442432508749/,1/4/2019
The problem with ignoring people's emotions about climate change,4/4/19 7:05,Jeffrey T. Kiehl,"Communicating Climate, Feature Article","2019-04-04 Yale Climate Connections -- Years ago, a scientist made one key change to the way ...",#N/A,#N/A,https://www.yaleclimateconnections.org/2019/04/scientists-dont-ignore-peoples-emotions/,$13.52,6113503684694,"1,554",361,27,53,$0.0375,$0.501,$0.26,9,232.304,34,"Years ago, a scientist made one key change to the way he talks about the climate. It made a crucial difference.",Scientists: Don't ignore people's emotions » by Jeffrey T. Kiehl,https://www.facebook.com/130268756992804/posts/2379483292071328/,5/4/2019
Perfect lawns can make climate change worse,4/19/18 7:00,Samantha Harrington,"Energy, Food &amp; Agriculture","2019-04-18 Yale Climate Connections -- As springtime arrives, here’s some advice for climate-...",#N/A,#N/A,https://www.yaleclimateconnections.org/2018/04/how-perfect-lawns-can-make-climate-change-worse/,$10.64,6114646646294,853,230,23,24,$0.0463,$0.463,$0.44,8,269.637,28,"As springtime arrives, here’s some advice for climate-friendly lawn maintenance #TBT: https://www.yaleclimateconnections.org/2018/04/how-perfect-lawns-can-make-climate-change-worse/",Perfect lawns can make climate change worse » Yale Climate Connections,https://www.facebook.com/130268756992804/posts/2402023249817332/,5/4/2019
Not in database,n/a,n/a,n/a,"2018-07-24 Yale Climate Connections -- “For a lot of people across the U.S., they’re not goin...",#N/A,#N/A,https://bit.ly/2Le25sC,$42.63,6095102447894,"6,214","1,238",111,42,$0.0344,$0.384,$1.02,9,199.228,7,"“For a lot of people across the U.S., they’re not going to take climate change seriously unless their friends and their families start talking about it with them.” 
— Kyle Meyaard-Schaap, national organizer of Young Evangelicals for Climate Action",An evangelical Christian’s path from climate skeptic to climate leader,https://www.facebook.com/130268756992804/posts/1993353740684287/,8/4/2018
Northeastern states cut global-warming pollution,2/9/2017,"carbon emissions, Diana Madson",Energy,2017-02-09 Yale Climate Connections -- Nine northeastern states have teamed up to reduce carb...,#N/A,#N/A,http://www.yaleclimateconnections.org/2017/02/nine-northeastern-states-cut-global-warming-pollution/,$154.86,6064330430894,"51,535","7,660",663,,$0.0202,$0.234,#DIV/0!,,148.637,0,"Nine northeastern states have teamed up to reduce carbon pollution from electric power plants.

Center for Climate and Energy Solutions #RGGI WNYC Radio WPRB 103.3 FM NASA Climate Change Connecticut Climate Change",Nine Northeastern States Cut Global Warming Pollution,https://www.facebook.com/130268756992804/posts/1414885961864404/,3/4/2017
Aruba commits to 100 percent renewables,11/8/2016,"Diana Madson, renewable energy",Energy,2016-11-08 Yale Climate Connections -- Aruba gets nearly 40% of its energy from clean power a...,#N/A,#N/A,http://www.yaleclimateconnections.org/2016/11/aruba-commits-to-100-percent-renewables/,$114.57,6059505388494,"28,920","3,737",506,,$0.0307,$0.226,#DIV/0!,,129.219,0,Aruba gets nearly 40% of its energy from clean power and is aiming for 100%. Island states like Aruba provide a blueprint for what a renewable economy could look like. Listen in to learn more about the clean energy revolution. Carbon War Room,Aruba Commits to 100 Percent Renewables,https://www.facebook.com/130268756992804/posts/1317202111632790/,12/4/2016
Not in database,n/a,n/a,n/a,2019-05-01 Yale Climate Connections -- Improving energy efficiency could be a win-win for the...,#N/A,#N/A,https://bit.ly/2GQQH22,$236.69,6115647163894,"17,948","3,878",262,57,$0.0610,$0.903,$4.15,8,216.069,3,Improving energy efficiency could be a win-win for the climate and the economy:,Energy efficiency could help the world meet Paris agreement goals,https://www.facebook.com/130268756992804/posts/2423913640961626/,6/4/2019
Turn your lawn into a farm,6/26/2017,"agriculture, Eileen Mignoni",Food & Agriculture,"2017-06-26 Yale Climate Connections -- Goodbye grass, hello healthy snacks.",#N/A,#N/A,https://www.yaleclimateconnections.org/2017/06/turn-your-lawn-into-a-farm/,$184.47,6071186245694,"63,461","9,085","1,068",482,$0.0203,$0.173,$0.38,,143.159,8,"Goodbye grass, hello healthy food.",Growing food instead of lawns ,https://www.facebook.com/130268756992804/posts/1554532977899701/,7/4/2017
How family size shapes your carbon footprint,3/29/19 7:05,Craig K. Chandler,"Feature Article, Religion &amp; Morality",2019-04-23 Yale Climate Connections -- “We’re essentially all in on electric buses right now....,#N/A,#N/A,https://www.yaleclimateconnections.org/2019/04/greensboro-n-c-invests-in-electric-buses/,$102.37,6114995946694,"11,112","2,423",199,54,$0.0422,$0.514,$1.90,9,218.053,5,"“We’re essentially all in on electric buses right now.” — Adam Fischer, director of transportation of Greensboro, North Carolina",A Southern city says it can save big with new electric buses ,https://www.facebook.com/130268756992804/posts/2410952932257697/,5/4/2019
How climate change could harm your health,5/29/2017,"Daisy Simmons, public health",Public Health,2017-05-29 Yale Climate Connections -- “Every American is vulnerable to the health impacts as...,#N/A,#N/A,https://www.yaleclimateconnections.org/2017/05/how-climate-change-could-harm-your-health/,$53.89,6069982405894,"16,966","2,056",267,235,$0.0262,$0.202,$0.23,,121.184,14,"“Every American is vulnerable to the health impacts associated with climate change,” says scientist Jesse Bell of the Cooperative Institute for Climate and Satellites (CICS-NC).","How climate change could harm your health
",https://www.facebook.com/130268756992804/posts/1517698544916478/,6/4/2017
Not in database,n/a,n/a,n/a,"2017-01-02 Yale Climate Connections -- ""Three quarters of Americans rarely or never discuss g...",#N/A,#N/A,http://sustainability.thomsonreuters.com/2016/12/22/digital-media-are-shaking-up-reporting-on-climate-change/,$22.09,6062368344894,"5,102",644,68,,$0.0343,$0.325,#DIV/0!,,126.225,0,"""Three quarters of Americans rarely or never discuss global warming with family or friends"":  http://bit.ly/2cQGHqz. New digital-born players like Huffington Post, BuzzFeed and Vice are finding ways to tackle this issue. Via Thomson Reuters",Digital media are shaking up reporting on climate change | | Thomson Reuters,https://www.facebook.com/130268756992804/posts/1376857655667235/,2/16/2017
Not in database,n/a,n/a,n/a,"2016-12-19 Yale Climate Connections -- “It looks like a triple whammy – a warm ocean, a warm ...",#N/A,#N/A,http://sustainability.thomsonreuters.com/2016/12/12/executive-perspective-rare-dual-polar-ice-minimum-stuns-scientists/,$95.17,6061763835294,"35,176","4,655",861,,$0.0204,$0.111,#DIV/0!,,132.335,0,"“It looks like a triple whammy – a warm ocean, a warm atmosphere, and a wind pattern all working against the ice in the Arctic,” says an NSIDC expert. Thomson Reuters's Paul Huttner reports here on it.",EXECUTIVE PERSPECTIVE: Rare dual polar ice minimum stuns scientists | | Thomson Reuters,https://www.facebook.com/130268756992804/posts/1365049510181383/,1/4/2017
Clean energy is getting really cheap,7/23/18 7:00,Diana Madson,"Energy, Jobs &amp; Economy",2018-07-23 Yale Climate Connections -- A future without fossil fuels is on the horizon.,#N/A,#N/A,https://www.yaleclimateconnections.org/2018/07/clean-energy-is-getting-really-cheap/,$134.11,6095026665294,"21,088","3,887",433,87,$0.0345,$0.310,$1.54,8,184.323,4,A future without fossil fuels is on the horizon.,"Clean energy is getting really, really cheap",https://www.facebook.com/130268756992804/posts/1991669420852719/,8/4/2018
Dutch trains ride the wind,5/4/2017,"Diana Madson, energy","Energy, Sustainability",2017-05-04 Yale Climate Connections -- A passenger railway in the Netherlands now powers its ...,#N/A,#N/A,http://www.yaleclimateconnections.org/2017/05/dutch-trains-ride-the-wind/,$114.89,6068915909094,"28,594","5,066",862,51,$0.0227,$0.133,$2.25,,177.170,2,"A passenger railway in the Netherlands now powers its 1,200 electric trains with wind energy. That’s a big deal, considering that the trains use as much electricity as all Amsterdam residents. NS__Online",Dutch trains ride the wind ,https://www.facebook.com/130268756992804/posts/1498188666867466/,6/4/2017
Not in database,n/a,n/a,n/a,2019-04-16 Yale Climate Connections -- Climate change is a public health issue:,#N/A,#N/A,https://bit.ly/2IgTQdm,$115.38,6114469722694,"13,842","2,750",389,28,$0.0420,$0.297,$4.12,9,198.671,2,Climate change is a public health issue:,Climate change is making air pollution worse,https://www.facebook.com/130268756992804/posts/2398722956814028/,5/4/2019
How family size shapes your carbon footprint,3/29/19 7:05,Craig K. Chandler,"Feature Article, Religion &amp; Morality",2019-04-24 Yale Climate Connections -- Earth Day activities continue for many throughout the ...,#N/A,#N/A,https://www.yaleclimateconnections.org/2019/04/key-readings-in-recognition-of-earth-day-2019/,$204.58,6115107058694,"20,646","5,251",409,46,$0.0390,$0.500,$4.45,9,254.335,2,Earth Day activities continue for many throughout the week. These 12 recommended reads will help you keep in the spirit:,Key readings in recognition of Earth Day 2019 » by Michael Svoboda,https://www.facebook.com/130268756992804/posts/2411367888882868/,5/4/2019
What's the difference between the ozone hole and global warming?,5/28/19 7:00,NULL,Climate Science,2019-05-27 Yale Climate Connections -- Climate change has altered a Memorial Day tradition:,#N/A,#N/A,https://www.yaleclimateconnections.org/2019/05/somethings-changed-in-a-kansas-cemetary/,$149.46,6117808859294,"16,884","3,151",176,1557,$0.0474,$0.849,$0.10,9,186.626,92,Climate change has altered a Memorial Day tradition:,Something’s changed in a Kansas cemetery. A local resident blames global warming.,https://www.facebook.com/130268756992804/posts/2468304986522491/,6/4/2019
Veteran fights for clean energy,7/4/2017,"Daisy Simmons, energy, national security","Energy, National Security",2017-07-04 Yale Climate Connections -- This former Army captain’s experience of being station...,#N/A,#N/A,https://www.yaleclimateconnections.org/2017/07/veteran-fights-for-clean-energy/,$308.59,6071530947694,"82,529","14,776","1,631",464,$0.0209,$0.189,$0.67,,179.040,6,This former Army captain’s experience of being stationed near Iraq’s largest oil refinery convinced him that U.S. dependence on foreign oil puts soldiers and the economy at risk.,Former Army captain fights for clean energy in the U.S.,https://www.facebook.com/130268756992804/posts/1559792930707039/,8/4/2017
Community builds dunes with Christmas trees,1/5/18 7:00,Erika Street Hopman,Species &amp; Ecosystems,2018-01-05 Yale Climate Connections -- Learn why communities of Carolina Beach are burying th...,#N/A,#N/A,https://www.yaleclimateconnections.org/2018/01/community-builds-dunes-with-christmas-trees/,$274.93,6082218115294,"80,779","13,130","1,325",1433,$0.0209,$0.207,$0.19,,162.542,18,Learn why communities of Carolina Beach are burying their Christmas trees in the sand. 🌊🎄🏖,Coastal community builds dunes out of old Christmas trees,https://www.facebook.com/130268756992804/posts/1754018884617775/,2/4/2018
A new relief shelter in Puerto Rico will be made from tires and mud,10/11/18 7:00,Monica Isola,Weather Extremes,2018-10-12 Yale Climate Connections -- Wow:,#N/A,#N/A,https://www.yaleclimateconnections.org/2018/10/a-new-puerto-rico-shelter-is-made-from-tires/,$381.67,6100800321894,"32,576","8,793",959,659,$0.0434,$0.398,$0.58,10,269.923,20,Wow:,Volunteers are building a shelter in Puerto Rico out of tires and mud,https://www.facebook.com/130268756992804/posts/2112060312146962/,11/4/2018
Airborne camera captures coral reef changes,9/15/2016,"Bud Ward, coral reefs, ocean temperatures","Ecosystems, Oceans",Coral reefs are home to as many as a quarter of all ocean species. But most h...,#N/A,#N/A,http://www.yaleclimateconnections.org/2016/09/airborne-camera-captures-coral-reef-changes/,$21.64,6056517222094,"5,520",435,57,,$0.0497,$0.380,#DIV/0!,,78.804,0,"Coral reefs are home to as many as a quarter of all ocean species. But most have never been surveyed. And, they are very vulnerable to climate change. On today's episode hear about a NASA camera that attempts to paint the picture of how climate change is impacting delicate reef ecosystems. NASA Climate Change",Airborne camera captures coral reef changes ,https://www.facebook.com/130268756992804/posts/1266489490037386/,10/4/2016
Native Americans move toward energy independence,6/7/18 7:00,Bruce Lieberman,Energy,2018-06-07 Yale Climate Connections -- The Oglala Lakota Sioux tribe has a new reason to cele...,#N/A,#N/A,https://www.yaleclimateconnections.org/2018/06/native-americans-move-toward-energy-independence/,$310.30,6091859141694,"70,944","14,594","1,295",407,$0.0213,$0.240,$0.76,9,205.712,6,The Oglala Lakota Sioux tribe has a new reason to celebrate the sun.,How this man is helping Native Americans gain energy independence,https://www.facebook.com/130268756992804/posts/1919644084721920/,7/4/2018
Larsen C's 'Delaware-size' iceberg has calved,7/12/2017,"Peter Sinclair, polar ice, This is not cool","Polar Ice, Science",2017-07-12 Yale Climate Connections -- The massive Larsen C ice shelf has broken off. What's ...,#N/A,#N/A,https://www.yaleclimateconnections.org/2017/07/larsen-cs-delaware-size-iceberg-calving/,$108.85,6072322893694,"48,397","5,064",589,1050,$0.0215,$0.185,$0.10,,104.635,22,A massive iceberg has broken off from the Larsen C ice shelf. What's next?,Larsen C's 'Delaware-size' iceberg has calved,https://www.facebook.com/130268756992804/posts/1577985462221119/,8/4/2017
A pianist's elegy for the Arctic,9/12/2016,"Arctic sea ice, Ludovico Einaudi, Sara Peach","Arts, Polar Ice","Today hear about a composer and his beautiful piece ""Elegy to the Arctic,"" pe...",#N/A,#N/A,http://www.yaleclimateconnections.org/2016/09/a-pianists-elegy-for-the-arctic/,$9.25,6056382515094,"1,579",188,35,,$0.0492,$0.264,#DIV/0!,,119.063,0,"Today hear about a composer and his beautiful piece ""Elegy to the Arctic,"" performed live in front of a disintegrating glacier.",A pianist's elegy for the Arctic ,https://www.facebook.com/130268756992804/posts/1263505053669163/,10/4/2016
Artist marks places threatened by floods,2/20/18 7:00,Diana Madson,Arts &amp; Culture,2018-02-20 Yale Climate Connections -- Eve Mosher’s artwork shows us that climate change isn’...,#N/A,#N/A,https://www.yaleclimateconnections.org/2018/02/artist-marks-places-threatened-by-floods/,$142.91,6084531362494,"35,687","6,565",919,1268,$0.0218,$0.156,$0.11,,183.961,36,Eve Mosher’s artwork shows us that climate change isn’t a distant threat — it’s also about our own neighborhoods.,She marked places threatened by rising seas. Then they flooded. ,https://www.facebook.com/130268756992804/posts/1802801253072871/,3/4/2018
"It's data (not just models), scientists say",5/23/2017,"climate modeling, Peter Sinclair, This is not cool, videos",Science,2017-06-02 Yale Climate Connections -- Ice has 'no political baggage .... it just melts.' Wat...,#N/A,#N/A,https://www.yaleclimateconnections.org/2017/05/its-the-data-not-just-the-models-scientists-emphasize/,$216.45,6070175884094,"65,782","9,942","1,698",1494,$0.0218,$0.127,$0.14,,151.136,23,Ice has 'no political baggage .... it just melts.' Watch our new 5-minute video to learn more.,"It's data (not just models), scientists say - Yale Climate Connections",https://www.facebook.com/130268756992804/posts/1534889846530681/,7/4/2017
Former EPA administrator Gina McCarthy: Climate change hurts children's health,1/9/19 7:00,NULL,Health,2019-01-09 Yale Climate Connections -- An important perspective on climate change from Gina M...,#N/A,#N/A,https://www.yaleclimateconnections.org/2019/01/gina-mccarthy-says-climate-change-hurts-kids/,$173.86,6107147576094,"20,060","4,182",516,239,$0.0416,$0.337,$0.73,8,208.475,12,An important perspective on climate change from Gina McCarthy:,Why a former EPA administrator says climate change is a children’s health issue,https://www.facebook.com/130268756992804/posts/2249940425025616/,2/4/2019
Coastal states tackle Trump offshore drilling plan,3/13/18 7:05,Bruce Lieberman,"Feature Article, Policy &amp; Politics","2018-03-14 Yale Climate Connections -- Coastal states, environmentalists see 'two-year fight ...",#N/A,#N/A,https://www.yaleclimateconnections.org/2018/03/coastal-states-vs-trump-offshore-drilling-plan/,$47.46,6085816642094,"13,295","1,939",302,54,$0.0245,$0.157,$0.88,,145.844,4,"Coastal states, environmentalists see 'two-year fight ... everywhere' on Trump offshore drilling plan. Read more about the concerns and opposition.",Coastal states vs. Trump offshore drilling plan | Bruce Lieberman,https://www.facebook.com/130268756992804/posts/1827977200555276/,4/4/2018
Seniors organize against climate change,11/3/2017,Daisy Simmons,Policy,2017-11-03 Yale Climate Connections -- “I had been a conscientious objector to the Vietnam Wa...,#N/A,#N/A,https://www.yaleclimateconnections.org/2017/11/seniors-organize-against-climate-change/,$190.32,6079269134094,"34,725","8,723",732,402,$0.0218,$0.260,$0.47,,251.202,12,"“I had been a conscientious objector to the Vietnam War in the late sixties,” Grady McGonagill says. “I decided I was a conscientious objector to climate change.”",These seniors are organizing against climate change,https://www.facebook.com/130268756992804/posts/1689189381100726/,12/4/2017
Not in database,n/a,n/a,n/a,2017-03-07 Yale Climate Connections -- With only 8 percent of its electricity coming from coa...,#N/A,#N/A,http://www.yaleclimateconnections.org/2017/03/finland-is-abandoning-coal,$59.98,6065621044694,"17,586","3,713",292,,$0.0162,$0.205,#DIV/0!,,211.134,0,"With only 8 percent of its electricity coming from coal today, Finland is relying more on biomass and nuclear energy. The country could phase out coal entirely by 2030. 

SolarCity GreenEnergy Finland Oy Consulate General of Finland in New York Nordic Green Energy Radio NRJ Finland Radio Nova (Finland)",Finland is abandoning coal ,https://www.facebook.com/130268756992804/posts/1438908066128860/,4/4/2017
Grannies' crusade against fossil fuels,10/18/2017,Daisy Simmons,Sustainability,"2017-10-18 Yale Climate Connections -- “We’ve got to do this for our kids, and grandkids and ...",#N/A,#N/A,https://www.yaleclimateconnections.org/2017/10/grannies-crusade-against-fossil-fuels/,$215.89,6078483057494,"45,170","9,845",816,340,$0.0219,$0.265,$0.63,,217.954,8,"“We’ve got to do this for our kids, and grandkids and their kids.” — Ann Christenson 💪",These ‘grannies’ are on a crusade against fossil fuels ,https://www.facebook.com/130268756992804/posts/1673692852650379/,11/4/2017
Manure powers an entire farm,3/23/18 7:00,Sarah Kennedy,"Energy, Food &amp; Agriculture",2018-03-23 Yale Climate Connections -- “I was able to put together a fully electric truck to ...,#N/A,#N/A,https://www.yaleclimateconnections.org/2018/03/at-this-dairy-manure-powers-an-entire-farm/,$21.78,6086384391694,"8,692","1,761",258,34,$0.0124,$0.084,$0.64,,202.600,4,"“I was able to put together a fully electric truck to feed the cows that’s powered by the cow’s waste. We claim that’s the first one in the world to do that.” 
— Albert Straus, CEO of Straus Family Creamery in Marin County, California.","At this dairy, manure powers the whole farm ",https://www.facebook.com/130268756992804/posts/1837870012899328/,4/4/2018
Designers memorialize sea-level rise,9/2/2016,"Climate Chronograph, National Park Service, Sara Peach, sea level rise","Arts, Ecosystems, Sea Level Rise","Can you imagine a memorial to sea level rise in Washington, D.C.? Hear more a...",#N/A,#N/A,http://www.yaleclimateconnections.org/2016/09/designers-memorialize-sea-level-rise/,$45.63,6055817704894,"5,536",541,59,,$0.0843,$0.773,#DIV/0!,,97.724,0,"Can you imagine a memorial to sea level rise in Washington, D.C.? Hear more about a proposal for just that on today's episode.",Designers memorialize sea-level rise,https://www.facebook.com/130268756992804/posts/1253584331327902/,10/4/2016
Solar advocates defeat controversial amendment,3/28/2017,"Eileen Mignoni, energy, solar","Energy, Policy",2017-03-28 Yale Climate Connections -- Florida voters rejected an amendment to the state’s co...,#N/A,#N/A,http://www.yaleclimateconnections.org/2017/03/solar-advocates-defeat-controversial-amendment/,$109.69,6066920618894,"21,710","3,153",344,,$0.0348,$0.319,#DIV/0!,,145.233,0,"Florida voters rejected an amendment to the state’s constitution that would have made it easier to impose new fees on rooftop solar users. Tune in to learn how solar advocates defeated the amendment — with a budget of $0. 

Floridians for Solar Choice Floridian Solar Florida Solar Energy 90.7 WMFE WLRN Public Radio and Television El Zol 106.7 FM",How solar advocates defeated a controversial amendment,https://www.facebook.com/130268756992804/posts/1458569890829344/,4/4/2017
Texas GM factory commits to wind energy,2/17/2017,"Bruce Lieberman, wind power",Energy,"2017-02-17 Yale Climate Connections -- Your SUV doesn’t run on wind power, but it can be buil...",#N/A,#N/A,http://www.yaleclimateconnections.org/2017/02/texas-general-motors-factory-commits-to-wind-energy/,$177.92,6064728333294,"55,570","8,023",996,,$0.0222,$0.179,#DIV/0!,,144.376,0,"Your SUV doesn’t run on wind power, but it can be built with it. General Motors commits its Arlington, Texas, plant to run on 100 percent wind energy by the end of 2018. 

94.9 KLTY - Safe For The Whole Family! KERA Wind Energy Foundation American Wind Energy Association Solar Thermal Magazine's Clean Energy Page",Texas General Motors factory commits to wind energy,https://www.facebook.com/130268756992804/posts/1418984924787841/,3/4/2017
Puerto Rico's solar-powered energy oasis,4/3/18 7:00,Eileen Mignoni,Energy,"2018-04-03 Yale Climate Connections -- By rebuilding its grid using solar, Puerto Rico could ...",#N/A,#N/A,https://www.yaleclimateconnections.org/2018/04/puerto-ricos-solar-powered-energy-oasis/,$54.71,6087047476094,"21,184","4,392",363,93,$0.0125,$0.151,$0.59,,207.326,4,"By rebuilding its grid using solar, Puerto Rico could help communities recover faster from natural disasters.",Puerto Rico’s solar-powered energy oasis ,https://www.facebook.com/130268756992804/posts/1850436608309335/,5/4/2018
Where Americans will move as seas rise,12/11/2017,Eileen Mignoni,Sea Level Rise,2017-12-11 Yale Climate Connections -- Millions of Americans may need to move inland.,#N/A,#N/A,https://www.yaleclimateconnections.org/2017/12/where-americans-will-move-as-seas-rise/,$165.68,6081114282494,"46,117","7,462",448,4833,$0.0222,$0.370,$0.03,,161.806,105,Millions of Americans may need to move inland.,Here’s where U.S. residents will move to escape rising seas ,https://www.facebook.com/130268756992804/posts/1728271543859176/,1/4/2018
Intergenerational conversation: An antidote to climate despair,2/28/19 7:00,NULL,"Communicating Climate, Youth",2019-02-27 Yale Climate Connections -- “It is 100 percent clear that the endangerment finding...,#N/A,#N/A,https://www.yaleclimateconnections.org/2019/02/what-is-the-epa-endangerment-finding/,$187.81,6110719398094,"21,667","4,786",807,170,$0.0392,$0.233,$1.10,8,220.889,8,"“It is 100 percent clear that the endangerment finding was justified in 2009, and now the evidence is totally overwhelming that, in fact, these greenhouse gases — through their effects on climate change — do endanger public health and welfare.” — Chris Field of the Stanford Woods Institute for the Environment",The ‘endangerment finding’: The EPA science that Trump can’t refute ,https://www.facebook.com/130268756992804/posts/2325939150759076/,3/4/2019
Not in database,n/a,n/a,n/a,"2018-11-21 Yale Climate Connections -- Whether or not you like their Swedish meatballs, you’l...",#N/A,#N/A,https://www.yaleclimateconnections.org/2018/11/ikea-wants-a-zero-emissions-delivery-fleet,$238.50,6103662824094,"17,910","2,473",119,54,$0.0964,$2.004,$4.42,9,138.079,3,"Whether or not you like their Swedish meatballs, you’ll probably like Ikea’s new delivery fleet:",Ikea wants to deliver your furniture with electric vehicles,https://www.facebook.com/130268756992804/posts/2174818909204435/,12/4/2018
"Boulder boosts solar, cuts carbon pollution",7/11/2017,"carbon emissions, Diana Madson",Energy,"2017-07-11 Yale Climate Connections -- Boulder, Colorado, changes how it thinks to reduce its...",#N/A,#N/A,https://www.yaleclimateconnections.org/2017/07/boulder-boosts-solar-and-cuts-carbon-pollution/,$161.07,6072256387694,"44,820","7,181",494,522,$0.0224,$0.326,$0.31,,160.219,12,"Boulder, Colorado, changes how it thinks to reduce its carbon emissions.","Boulder, Colorado takes on global warming pollution",https://www.facebook.com/130268756992804/posts/1576609409025391/,8/4/2017
This group is tackling deforestation,4/10/18 7:00,Daisy Simmons,Food &amp; Agriculture,2018-04-10 Yale Climate Connections -- They’re planting the forest of the future.,#N/A,#N/A,https://www.yaleclimateconnections.org/2018/04/this-group-is-tackling-deforestation/,$103.03,6087483997894,"28,919","5,086",474,254,$0.0203,$0.217,$0.41,,175.871,9,They’re planting the forest of the future.,Billions of trees are killed each year. This group wants to help. ,https://www.facebook.com/130268756992804/posts/1857987774220885/,5/4/2018
Melting glacier offers teachable moment,12/21/2016,"Daisy Simmons, Mendenhall Glacier","Ecosystems, Polar Ice",2016-12-21 Yale Climate Connections -- Alaska's Mendenhall Glacier is rapidly melting and cha...,#N/A,#N/A,http://www.yaleclimateconnections.org/2016/12/melting-glacier-offers-teachable-moment/,$35.61,6061853788294,"10,524","1,216",166,,$0.0293,$0.215,#DIV/0!,,115.545,0,Alaska's Mendenhall Glacier is rapidly melting and changing the landscape. Listen in to learn how U.S. Forest Service rangers are educating visitors on these changes as teachable moments on #climatechange. Mendenhall Glacier Visitor Center,Melting Glacier Offers Teachable Moment ,https://www.facebook.com/130268756992804/posts/1363109703708697/,1/4/2017
Orlando plans emissions cuts,8/11/2017,"Daisy Simmons, energy",Energy,2017-08-11 Yale Climate Connections -- The home of Disney World and Universal Studios Florida...,#N/A,#N/A,https://www.yaleclimateconnections.org/2017/08/orlando-florida-plans-to-cut-global-warming-pollution/,$154.98,6073695974094,"40,625","6,808",375,174,$0.0228,$0.413,$0.89,,167.582,4,The home of Disney World and Universal Studios Florida is taking climate change seriously.,"Orlando, Florida, plans to cut global-warming pollution",https://www.facebook.com/130268756992804/posts/1608891955797136/,9/4/2017
Polar bear food search problems,8/25/2016,"Arctic ice melt, polar bears, Sara Peach","Ecosystems, Polar Ice","As polar ice recedes, human encounters with polar bears are increasing. Hear ...",#N/A,#N/A,http://www.yaleclimateconnections.org/2016/08/melting-ice-complicating-polar-bear-food-search/,$57.32,6055533535094,"11,404","1,070",147,,$0.0536,$0.390,#DIV/0!,,93.827,0,"As polar ice recedes, human encounters with polar bears are increasing. Hear more about the polar bears' habitat and struggle for food and how it could affect people on today's episode.",Polar bear food search problems ,https://www.facebook.com/130268756992804/posts/1246288575390811/,9/4/2016
A Texas community's clean energy commitment,1/10/2017,"Diana Madson, renewable energy",Energy,"2017-01-10 Yale Climate Connections -- Georgetown, Texas, is switching to 100 percent renewab...",#N/A,#N/A,http://www.yaleclimateconnections.org/2017/01/a-texas-communitys-clean-energy-commitment/,$93.91,6062759895094,"25,648","3,553",420,,$0.0264,$0.224,#DIV/0!,,138.529,0,"Georgetown, Texas, is switching to 100 percent renewable energy. Tune in as Mayor Dale Ross explains why wind and solar are the city’s future. 

City of Georgetown, Texas - Government Sierra Club Texas Tribune  #renewableenergy",A Texas Community’s 100% Commitment to Clean Energy,https://www.facebook.com/130268756992804/posts/1377525428933791/,2/16/2017
Hawaiian island is now a solar paradise,1/29/18 7:00,Bruce Lieberman,Energy,2018-01-29 Yale Climate Connections -- This sunny destination is turning all that sunshine in...,#N/A,#N/A,https://www.yaleclimateconnections.org/2018/01/hawaiian-island-is-now-a-solar-paradise/,$295.44,6083327549894,"58,811","12,882","1,327",409,$0.0229,$0.223,$0.72,,219.041,7,This sunny destination is turning all that sunshine into some serious solar power. 🌈☀️,Hawaiian island is now a solar paradise ,https://www.facebook.com/130268756992804/posts/1779294998756830/,2/4/2018
Why climate change is like a fever,8/30/2017,"Sara Peach, science questions","Science, Science Questions",2017-08-30 Yale Climate Connections -- Earth has a fever — and that fever needs urgent care.,#N/A,#N/A,https://www.yaleclimateconnections.org/2017/08/why-climate-change-is-like-a-fever/,$57.60,6074504683294,"17,290","2,934",424,138,$0.0196,$0.136,$0.42,,169.693,8,Earth has a fever — and that fever needs urgent care.,Why climate change is like a fever for the Earth ,https://www.facebook.com/130268756992804/posts/1627105000642498/,9/4/2017
California wants to store carbon in the soil,9/28/2017,"agriculture, Bruce Lieberman",Food & Agriculture,2017-09-28 Yale Climate Connections -- California just invested $7.5 million in revitalizing ...,#N/A,#N/A,https://www.yaleclimateconnections.org/2017/09/california-wants-to-store-carbon-in-the-soil/,$213.98,6077541577894,"59,318","9,312",779,668,$0.0230,$0.275,$0.32,,156.984,11,California just invested $7.5 million in revitalizing its soils.,California wants to store carbon in the soil ,https://www.facebook.com/130268756992804/posts/1655113781174953/,10/4/2017
"Michael Mann, Warren Washington - the Yin and Yang of climate science - share 2019 Tyler prize",2/12/19 8:05,Bud Ward,"Climate Science, Feature Article",2019-02-26 Yale Climate Connections -- A concrete way to reduce global warming:,#N/A,#N/A,https://www.yaleclimateconnections.org/2019/02/company-converts-carbon-dioxide-into-building-material/,$33.85,6110638452294,"3,974","1,013",99,52,$0.0334,$0.342,$0.65,8,254.907,13,A concrete way to reduce global warming:,A company is converting carbon pollution into building material,https://www.facebook.com/130268756992804/posts/2324416210911370/,3/4/2019
Not in database,n/a,n/a,n/a,2019-04-18 Yale Climate Connections -- “Most times in education we're hoping we're preparing ...,#N/A,#N/A,https://bit.ly/2VItnbS,$86.54,6114635190494,"9,376","2,104",170,44,$0.0411,$0.509,$1.97,9,224.403,5,“Most times in education we're hoping we're preparing kids for the future. And this is one of the unique times where we've been able to sit down with the people who will be hiring that can tell us what exactly it is they want the kids know and be able to do.” — Barbara Morse,A Rhode Island high school is preparing its students to work in offshore wind,https://www.facebook.com/130268756992804/posts/2401858749833782/,5/4/2019
Bomb-cyclone' weather in a warming world,1/11/18 17:15,"Peter Sinclair, This is not cool","Climate Science, Weather Extremes","2018-01-12 Yale Climate Connections -- If you know folks who say ""we could use some global wa...",#N/A,#N/A,https://www.yaleclimateconnections.org/2018/01/understanding-bomb-cyclone-weather-in-a-climate-context/,$297.30,6082557224894,"78,709","12,857","2,910",2365,$0.0231,$0.102,$0.13,,163.349,30,"If you know folks who say ""we could use some global warming"" when winter weather events like last week's ""bomb cyclone"" hit, here's a handy explanation of how weather differs from climate.",Understanding 'bomb-cyclone' weather in a climate context,https://www.facebook.com/130268756992804/posts/1761595003860163/,2/4/2018
Not in database,n/a,n/a,n/a,"2017-01-30 Yale Climate Connections -- ""Criticized for hindering drilling, logging, and other...",#N/A,#N/A,http://www.csmonitor.com/Environment/2017/0118/Endangered-Species-Act-get-ready-for-big-changes-says-GOP,$17.44,6063797039894,"18,988","2,921",450,,$0.0060,$0.039,#DIV/0!,,153.834,0,"""Criticized for hindering drilling, logging, and other activities"" the Endangered Species Act under threat by the new administration. (The Christian Science Monitor)","Endangered Species Act: get ready for big changes, says GOP",https://www.facebook.com/130268756992804/posts/1401933506492983/,2/16/2017
"Man powers house, two cars with solar",8/9/18 7:00,Samantha Harrington,"Energy, Religion &amp; Morality","2018-08-09 Yale Climate Connections -- “When we burn fossil fuels, when we abuse nature, when...",#N/A,#N/A,https://www.yaleclimateconnections.org/2018/08/man-powers-house-two-cars-with-solar/,$162.32,6096238358894,"28,472","5,585",535,251,$0.0291,$0.303,$0.65,9,196.158,9,"“When we burn fossil fuels, when we abuse nature, when we abuse creation, we’re working against God’s will for the world.” — Terry Tremwel","This man powers his whole house, plus two cars, with the sun",https://www.facebook.com/130268756992804/posts/2020909924595335/,9/4/2018
Flooding in Ocean City is getting worse,9/11/18 7:00,Sara Peach,Weather Extremes,"2018-09-11 Yale Climate Connections -- “The joke around here is, ‘Don't move to Ocean City wi...",#N/A,#N/A,https://www.yaleclimateconnections.org/2018/09/flooding-in-ocean-city-is-getting-worse/,$99.77,6098463258294,"13,692","2,223",168,409,$0.0449,$0.594,$0.24,8,162.358,30,"“The joke around here is, ‘Don't move to Ocean City without a set of waders.’” — Suzanne Hornick",There’s trouble in Ocean City,https://www.facebook.com/130268756992804/posts/2071678609518466/,10/4/2018
Trap kills mosquitoes without chemicals,6/5/2017,"Eileen Mignoni, public health",Public Health,"2017-06-05 Yale Climate Connections -- This new trap is a simple, chemical-free way to fight ...",#N/A,#N/A,https://www.yaleclimateconnections.org/2017/06/a-simple-trap-kills-mosquitoes-without-chemicals/,$225.24,6070288894694,"77,306","9,608",853,4223,$0.0234,$0.264,$0.05,,124.285,55,"This new trap is a simple, chemical-free way to fight mosquito-borne diseases like Zika and dengue.","A new trap kills mosquitoes without chemicals
",https://www.facebook.com/130268756992804/posts/1520086791344320/,7/4/2017
Biscayne Bay has a sewage problem,10/12/2017,"Eileen Mignoni, public health","Public Health, Sea Level Rise",2017-10-12 Yale Climate Connections -- ���,#N/A,#N/A,https://www.yaleclimateconnections.org/2017/10/biscayne-bay-has-a-sewage-problem/,$171.45,6078197412094,"30,605","5,422",626,388,$0.0316,$0.274,$0.44,,177.161,13,😷💩🤢,Researcher finds evidence of human waste in Miami coastal waters ,https://www.facebook.com/130268756992804/posts/1667889649897366/,11/4/2017
Not in database,n/a,n/a,n/a,"2017-02-27 Yale Climate Connections -- ""Around two-thirds of people on the planet are predict...",#N/A,#N/A,http://sustainability.thomsonreuters.com/2017/02/16/climate-change-fight-will-be-won-or-lost-in-cities-say-experts/,$207.35,6065221550494,"30,953","3,446",482,,$0.0602,$0.430,#DIV/0!,,111.330,0,"""Around two-thirds of people on the planet are predicted to be city-dwellers by 2050"", and it is here where the battle against global warming will be waged. (Via Thomson Reuters)","Climate change fight will be won or lost in cities, say experts | | Thomson Reuters",https://www.facebook.com/130268756992804/posts/1430691930283807/,3/4/2017
Floods and droughts: What it's like to live in communities hit hard by climate change,5/24/19 7:05,SueEllen Campbell,"Feature Article, Weather Extremes",2019-05-22 Yale Climate Connections -- The push toward self-driving cars could have unintende...,#N/A,#N/A,https://www.yaleclimateconnections.org/2019/05/self-driving-cars-could-one-day-clog-streets-with-traffic-and-pollution/,$26.25,6117406557694,"2,629",440,24,26,$0.0597,$1.094,$1.01,7,167.364,10,The push toward self-driving cars could have unintended consequences for the fight against climate change:,Self-driving cars could one day clog streets with traffic and pollution,https://www.facebook.com/130268756992804/posts/2459734850712838/,6/4/2019
Why an Iraq war veteran is working to reduce oil dependency,1/2/19 7:00,Samantha Harrington,"Energy, National Security",2019-01-02 Yale Climate Connections -- “Climate change isn’t something about Republicans vs. ...,#N/A,#N/A,https://www.yaleclimateconnections.org/2019/01/iraq-vet-aims-to-reduce-oil-dependency/,$166.16,6106663838494,"26,816","5,924",623,149,$0.0280,$0.267,$1.12,8,220.913,6,"“Climate change isn’t something about Republicans vs. Democrats, it’s a national security issue,” says Iraq vet Chris Boggiano:",Why an Iraq veteran launched a green jobs company,https://www.facebook.com/130268756992804/posts/2239287492757576/,2/4/2019
Why a farmer is flooding his fields,6/6/2017,"Daisy Simmons, farming, water resources",Food & Agriculture,2017-06-07 Yale Climate Connections -- Groundwater levels in California’s San Joaquin Valley ...,#N/A,#N/A,https://www.yaleclimateconnections.org/2017/06/why-one-farmer-is-deliberately-flooding-his-fields/,$248.17,6070345678494,"95,903","10,544",840,3704,$0.0235,$0.295,$0.07,,109.944,39,"Groundwater levels in California’s San Joaquin Valley have been depleted from decades of overuse and drought, but one grower is creatively recharging the aquifer.","Why a farmer is flooding his fields  
",https://www.facebook.com/130268756992804/posts/1520092618010404/,7/4/2017
A gas well explosion sparks activism,10/19/2016,"Daisy Simmons, fracking, natural gas","Energy, Public Health","2016-10-19 Yale Climate Connections -- Meet Deb Thomas, a former restaurant manager turned co...",#N/A,#N/A,http://www.yaleclimateconnections.org/2016/10/a-gas-well-explosion-sparks-activism/,$38.40,6058462121294,"9,026","1,501",292,,$0.0256,$0.132,#DIV/0!,,166.297,0,"Meet Deb Thomas, a former restaurant manager turned community organizer after a gas well exploded near her home in Wyoming.  Listen to today’s episode and discover how she teaches others to measure air, water and soil pollution to demonstrate demand for tougher regulation laws on fracking.",A gas well explosion sparks activism ,https://www.facebook.com/130268756992804/posts/1299554336730901/,11/4/2016
Not in database,n/a,n/a,n/a,2018-02-21 Yale Climate Connections -- “The idea is to disconnect the lagoon from the sea so ...,#N/A,#N/A,https://bit.ly/2EOxWfu,$115.99,6084587221894,"24,399","4,398",627,278,$0.0264,$0.185,$0.42,,180.253,11,“The idea is to disconnect the lagoon from the sea so the high water will stay outside.” —Sonia Silvestri of the University of Padua,Venice is building huge gates to keep out the rising sea ,https://www.facebook.com/130268756992804/posts/1803823816303948/,3/4/2018
Photographer documents change in the Arctic,9/13/2017,"arts, Bud Ward, polar ice","Arts, Polar Ice","2017-09-13 Yale Climate Connections -- “When words become unclear, I shall focus with photogr...",#N/A,#N/A,https://www.yaleclimateconnections.org/2017/09/photographer-luca-bracali-documents-change-in-the-arctic/,$171.07,6075117263294,"37,991","7,230",806,454,$0.0237,$0.212,$0.38,,190.308,12,"“When words become unclear, I shall focus with photographs.” — Ansel Adams",This photographer is documenting radical change in the Arctic ,https://www.facebook.com/130268756992804/posts/1640814735938191/,10/4/2017
Not in database,n/a,n/a,n/a,2017-07-27 Yale Climate Connections -- A glimpse of a world where renewable energy is simply ...,#N/A,#N/A,https://www.yaleclimateconnections.org/2017/when-clean-energy-is-the-default/,$132.55,6072982577094,"37,661","5,594",409,112,$0.0237,$0.324,$1.18,,148.536,3,A glimpse of a world where renewable energy is simply ordinary is amazing in its own right.,"In some U.S. communities, clean electricity is now the default ",https://www.facebook.com/130268756992804/posts/1594219890597676/,8/4/2017
California climate law aims high,12/6/2016,"Bruce Lieberman, California SB 32, Policy","Energy, Policy",2016-12-06 Yale Climate Connections -- California seeks to reduce its carbon emissions to 40%...,#N/A,#N/A,http://www.yaleclimateconnections.org/2016/12/california-climate-law-aims-high/,$162.51,6061057897694,"45,424","6,829",562,,$0.0238,$0.289,#DIV/0!,,150.339,0,"California seeks to reduce its carbon emissions to 40% less than what it emitted in 1990, from 384 to 230 million metric tons of carbon.  Listen to learn how this ambitious state plans on implementing its new climate change law. Stanford University (photo credit: Rich Pedroncelli)",California Climate Law Aims High,https://www.facebook.com/130268756992804/posts/1339821606037507/,1/4/2017
Not in database,n/a,n/a,n/a,"2017-05-24 Yale Climate Connections -- When demands for solar electricity increase, we can’t ...",#N/A,#N/A,https://www.yaleclimateconnections.org/2017/05/why-a-natural-gas-disaster-could-boost-clean-energy,$70.18,6069780305494,"14,467","1,862",177,59,$0.0377,$0.396,$1.19,,128.707,4,"When demands for solar electricity increase, we can’t turn up the sun. But we can install more batteries to store energy for later use, and that’s exactly what California did after a natural gas storage facility ruptured in 2015. Greentech Media","Why a natural gas disaster could boost clean energy
",https://www.facebook.com/130268756992804/posts/1516696815016651/,6/4/2017
Mexico launches a carbon market,10/23/2017,Eileen Mignoni,Energy,2017-10-23 Yale Climate Connections -- Mexico’s new cap-and-trade system puts pressure on hea...,#N/A,#N/A,https://www.yaleclimateconnections.org/2017/10/mexico-launches-a-carbon-market/,$234.05,6078716790294,"39,212","9,738",806,164,$0.0240,$0.290,$1.43,,248.342,4,Mexico’s new cap-and-trade system puts pressure on heavy polluters by making them pay for emissions.,Mexico takes a big step in addressing carbon emissions ,https://www.facebook.com/130268756992804/posts/1678402635512734/,11/4/2017
IKEA converts roof into solar farm,3/2/2017,"Daisy Simmons, rooftop solar","Economics, Energy",2017-03-02 Yale Climate Connections -- IKEA is installing what will soon be the largest rooft...,#N/A,#N/A,http://www.yaleclimateconnections.org/2017/03/ikea-converts-roof-into-solar-farm/,$158.83,6065364504094,"50,647","6,510",621,,$0.0244,$0.256,#DIV/0!,,128.537,0,"IKEA is installing what will soon be the largest rooftop solar array in Illinois. The array will generate the clean energy equivalent of taking 500 cars off the road annually. 

SolarCity Solar Energy International (SEI) American Solar Energy Society RenewableEnergyWorld.com World Renewable Energy Technology Congress (WRETC) Renewable Energy Business",IKEA converts roof into solar farm ,https://www.facebook.com/130268756992804/posts/1433279003358433/,4/4/2017
The southeastern U.S. is losing trees fast,7/25/18 7:00,Bruce Lieberman,Species &amp; Ecosystems,2018-07-25 Yale Climate Connections -- What’s driving the loss of forests?,#N/A,#N/A,https://www.yaleclimateconnections.org/2018/07/this-u-s-region-is-losing-trees-fast/,$71.33,6095176391694,"14,268","2,194",315,457,$0.0325,$0.226,$0.16,8,153.771,32,What’s driving the loss of forests?,The southeastern U.S. is losing trees fast,https://www.facebook.com/130268756992804/posts/1995110297175298/,8/4/2018
Meet the Press' climate change episode shows a better way to cover the issue,1/21/19 7:05,Michael Svoboda,"Feature Article, Policy &amp; Politics","2019-01-26 Yale Climate Connections -- “We’re not going to debate climate change, the existen...",#N/A,#N/A,https://www.yaleclimateconnections.org/2019/01/nbc-meet-the-press-goes-long-on-climate-change/,$192.95,6108387729094,"29,456","7,109",376,181,$0.0271,$0.513,$1.07,10,241.343,6,"“We’re not going to debate climate change, the existence of it. The Earth is getting hotter. And human activity is a major cause, period. We’re not going to give time to climate deniers.” — Chuck Todd

https://www.yaleclimateconnections.org/2019/01/nbc-meet-the-press-goes-long-on-climate-change/",Meet the Press' goes long on climate change » by Michael Svoboda,https://www.facebook.com/130268756992804/posts/2268396706513321/,2/4/2019
3D maps show famous landmarks under water,12/28/2017,Bud Ward,Sea Level Rise,2017-12-28 Yale Climate Connections -- “When you see these familiar places being completely c...,#N/A,#N/A,https://www.yaleclimateconnections.org/2017/12/3d-maps-show-famous-landmarks-under-water/,$270.03,6081896556494,"79,606","11,002","1,207",4408,$0.0245,$0.224,$0.06,,138.206,55,"“When you see these familiar places being completely covered by water, you start to really realize the impact of this.” — Carl Parker, The Weather Channel.",3D maps show famous landmarks swamped by sea-level rise,https://www.facebook.com/130268756992804/posts/1745352878817709/,1/4/2018
Not in database,n/a,n/a,n/a,2017-01-18 Yale Climate Connections -- California is moving forward with long-term plans to m...,#N/A,#N/A,http://www.csmonitor.com/Environment/Inhabit/2017/0109/California-gets-rains-but-drought-still-means-fewer-lawns-in-future,$102.80,6063210268894,"40,304","4,159",330,,$0.0247,$0.312,#DIV/0!,,103.191,0,"California is moving forward with long-term plans to make aggressive conservation a way of life, and one of the most visible indicators of this wider shift is how a new generation of Angelenos is seeking to recast, both physically and socially, their relationship with water. (Via The Christian Science Monitor)","California gets rains, but drought still means fewer lawns in future",https://www.facebook.com/130268756992804/posts/1389541414398859/,2/16/2017
Wildfires and climate change fuel each other,6/12/2017,"Diana Madson, wildfires","Ecosystems, Weather","2017-06-12 Yale Climate Connections -- Right now, forests absorb global-warming pollution. Bu...",#N/A,#N/A,https://www.yaleclimateconnections.org/2017/06/wildfires-and-climate-change-fuel-each-other/,$105.76,6070587821294,"22,733","2,936",455,93,$0.0360,$0.232,$1.14,,129.151,4,"Right now, forests absorb global-warming pollution. But that’s changing as temperatures rise.",Wildfires and climate change fuel each other,https://www.facebook.com/130268756992804/posts/1520420747977591/,7/4/2017
Sioux tribes harness the wind,9/26/18 7:00,Samantha Harrington,Energy,2018-09-26 Yale Climate Connections -- “We really believe that we are stewards of our climate...,#N/A,#N/A,https://www.yaleclimateconnections.org/2018/09/great-sioux-nation-is-investing-in-wind-power/,$253.20,6099548442894,"18,459","4,726",458,131,$0.0536,$0.553,$1.93,9,256.027,7,"“We really believe that we are stewards of our climate, stewards of our environment.” — Daniel Gargan of @RSTOfficial",Sioux tribes harness the wind,https://www.facebook.com/130268756992804/posts/2090836190936041/,10/4/2018
Why coastal insurance costs are rising,8/10/2017,"Bruce Lieberman, sea level rise",Sea Level Rise,2017-08-10 Yale Climate Connections -- What’s in store for shoreline properties?,#N/A,#N/A,https://www.yaleclimateconnections.org/2017/08/why-coastal-insurance-costs-are-rising/,$46.12,6073662427694,"16,266","2,211",325,142,$0.0209,$0.142,$0.32,,135.928,9,What’s in store for shoreline properties?,"Waters rise, and so does the cost of coastal home insurance",https://www.facebook.com/130268756992804/posts/1607920759227589/,9/4/2017
How solar windows could collect electricity,11/17/2017,"Bruce Lieberman, solar",Energy,2017-11-17 Yale Climate Connections -- We’re living in the future.,#N/A,#N/A,https://www.yaleclimateconnections.org/2017/11/how-solar-windows-could-collect-electricity/,$217.33,6079936035694,"37,205","8,599",750,142,$0.0253,$0.290,$1.53,,231.125,4,We’re living in the future.,Solar windows could one day collect electricity for skyscrapers ,https://www.facebook.com/130268756992804/posts/1703235496362781/,12/4/2017
Great Lakes heat up,9/19/2016,"Daisy Simmons, Great Lakes",Ecosystems,"The Great Lakes are not exactly known for balmy temperatures, but in recent w...",#N/A,#N/A,http://www.yaleclimateconnections.org/2016/09/great-lakes-heat-up/,$28.38,6056718800294,"6,906",936,140,,$0.0303,$0.203,#DIV/0!,,135.534,0,"The Great Lakes are not exactly known for balmy temperatures, but in recent winters, they’ve had less ice cover than in the past. That could be a problem for drinking water, summertime recreation, and local fisheries. Hear more on today's episode.",Great Lakes heat up ,https://www.facebook.com/130268756992804/posts/1270137906339211/,10/4/2016
"Scientists want to make fuel from water, air",3/26/18 7:00,Daisy Simmons,"Climate Science, Energy",2018-03-26 Yale Climate Connections -- This emerging gasoline substitute wouldn’t add additio...,#N/A,#N/A,https://www.yaleclimateconnections.org/2018/03/scientists-want-to-make-fuel-from-water-air/,$79.87,6086551071094,"28,184","4,454",517,294,$0.0179,$0.154,$0.27,,158.033,10,This emerging gasoline substitute wouldn’t add additional CO2 to the atmosphere.,Scientists want to make a climate-friendly fuel from water and air ,https://www.facebook.com/130268756992804/posts/1841097399243256/,4/4/2018
The evolution of a one-time climate skeptic,2/20/18 10:57,"Bud Ward, Peter Sinclair, This is not cool","Climate Science, Policy &amp; Politics",2018-02-23 Yale Climate Connections -- Jerry Taylor once was one of the highest-profile clima...,#N/A,#N/A,https://www.yaleclimateconnections.org/2018/02/the-evolution-of-a-one-time-climate-skeptic/,$153.89,6084710233494,"24,287","5,096",819,780,$0.0302,$0.188,$0.20,,209.824,32,"Jerry Taylor once was one of the highest-profile climate change ""skeptics"" in the conservative movement. Now, though, he advocates for taking action on climate — what changed?",The evolution of a one-time climate skeptic » Yale Climate Connections,https://www.facebook.com/130268756992804/posts/1805030396183290/,3/4/2018
"Farming while black' author Leah Penniman wants to create a just, climate-friendly food system",6/19/19 7:00,NULL,Food &amp; Agriculture,2019-06-05 Yale Climate Connections -- It’s a vicious cycle: Rising temperatures ➡️ More dema...,#N/A,#N/A,https://www.yaleclimateconnections.org/2019/06/rising-demand-for-air-conditioning-could-make-climate-change-even-worse/,$133.36,6118639035494,"11,504","2,132",245,63,$0.0626,$0.544,$2.12,7,185.327,5,It’s a vicious cycle: Rising temperatures ➡️ More demand for A.C. ➡️ More energy consumption and fossil fuel burning ➡️ Rising temperatures,Rising demand for air conditioning could make climate change even worse >> by Sarah Wesseler,https://www.facebook.com/130268756992804/posts/2484569898229333/,7/4/2019
Florida city prepares for rising seas,12/15/2016,"Bud Ward, Florida, sea level rise","Oceans, Sea Level Rise",2016-12-15 Yale Climate Connections -- Miami and the Florida Keys are already experiencing th...,#N/A,#N/A,http://www.yaleclimateconnections.org/2016/12/florida-city-prepares-for-rising-seas/,$58.30,6061563573694,"18,432","2,171",405,,$0.0269,$0.144,#DIV/0!,,117.784,0,"Miami and the Florida Keys are already experiencing the effects of sea-level rise, and Florida's Satellite Beach is thinking ‘not in my city’. Listen in as George Winsten of Stetson University discusses his work to create a more resilient #SatelliteBeach. #Flordia #sealevelrise",Florida City Prepares for Rising Seas,https://www.facebook.com/130268756992804/posts/1347913591894975/,1/4/2017
Not in database,n/a,n/a,n/a,2017-07-26 Yale Climate Connections -- There are no age restrictions on fighting climate change.,#N/A,#N/A,https://www.yaleclimateconnections.org/2017/middle-schoolers-take-climate-action,$169.26,6072932548894,"41,590","6,632",288,74,$0.0255,$0.588,$2.29,,159.461,2,There are no age restrictions on fighting climate change.,These middle-school students are taking action on climate change ,https://www.facebook.com/130268756992804/posts/1593115454041453/,8/4/2017
Not in database,n/a,n/a,n/a,2017-08-01 Yale Climate Connections -- The largest coal plant in the West is scheduled to clo...,#N/A,#N/A,,$47.81,6073194474694,"20,990","3,199",228,81,$0.0149,$0.210,$0.59,,152.406,4,,,,9/4/2017
Arctic ice loss threatens indigenous Alaskans' way of life,2/14/19 7:00,NULL,Snow &amp; Ice,2019-02-14 Yale Climate Connections -- At least 31 indigenous Alaskan villages are at risk fr...,#N/A,#N/A,https://www.yaleclimateconnections.org/2019/02/arctic-ice-loss-threatens-indigenous-way-of-life/,$67.02,6109776099894,"10,306","2,556",313,30,$0.0262,$0.214,$2.23,9,248.011,3,"At least 31 indigenous Alaskan villages are at risk from climate-change-induced coastal erosion, extreme storms, and thawing permafrost:",Loss of sea ice threatens indigenous Alaskans’ way of life,https://www.facebook.com/130268756992804/posts/2304789416207383/,3/4/2019
"1,000 newborns receive gift of trees",7/16/18 7:00,Sarah Kennedy,Food &amp; Agriculture,2018-07-16 Yale Climate Connections -- Not your typical baby shower gift:,#N/A,#N/A,https://www.yaleclimateconnections.org/2018/07/1000-newborns-receive-gift-of-trees/,$146.63,6094586151694,"26,216","2,871",107,1570,$0.0511,$1.370,$0.09,7,109.513,60,Not your typical baby shower gift:,One thousand Pittsburgh newborns are receiving a gift that will last,https://www.facebook.com/130268756992804/posts/1980030435349951/,8/4/2018
Not in database,n/a,n/a,n/a,"2017-01-09 Yale Climate Connections -- ""Cities (like Detroit) are learning that green infrast...",#N/A,#N/A,http://www.csmonitor.com/Environment/Inhabit/2016/1220/Cities-enlist-nature-to-tame-rising-flood-risks,$113.11,6062721009094,"33,568","4,383",582,,$0.0258,$0.194,#DIV/0!,,130.571,0,"""Cities (like Detroit) are learning that green infrastructure could prove a low-cost approach to relieving inundated pipelines as climate change intensifies storms, all the while adding community amenities like greenspace."" (Via The Christian Science Monitor)",Cities enlist nature to tame rising flood risks,https://www.facebook.com/130268756992804/posts/1376732805679720/,2/16/2017
Why Australian Mina Guli attempted to run 100 marathons in 100 days,3/28/19 7:00,NULL,"Policy &amp; Politics, Youth","2019-03-27 Yale Climate Connections -- Above California, “atmospheric rivers” flow through th...",#N/A,#N/A,https://www.yaleclimateconnections.org/2019/03/california-could-see-intense-rains-in-the-future/,$141.18,6112828577894,"16,754","3,317",397,152,$0.0426,$0.356,$0.93,8,197.983,9,"Above California, “atmospheric rivers” flow through the sky. As the climate warms, they could cause more extreme floods:",California could experience more intense rains in the future ,https://www.facebook.com/130268756992804/posts/2366516733367984/,4/4/2019
Sea-level rise threatens Everglades restoration,5/14/18 7:00,Eileen Mignoni,Species &amp; Ecosystems,2018-05-14 Yale Climate Connections -- “What happens in the future depends on what we do toda...,#N/A,#N/A,https://www.yaleclimateconnections.org/2018/05/sea-level-rise-threatens-everglades-restoration/,$181.11,6090279002494,"42,084","6,989","1,311",175,$0.0259,$0.138,$1.03,,166.073,4,“What happens in the future depends on what we do today.” — Shimelis Dessu,Sea-level rise is threatening Everglades restoration,https://www.facebook.com/130268756992804/posts/1893815700638092/,6/4/2018
"K-12 students should be taught climate science, teachers' association says",12/6/18 7:00,Daisy Simmons,Education,2018-12-06 Yale Climate Connections -- “When you talk to scientists — and climate scientists ...,#N/A,#N/A,https://www.yaleclimateconnections.org/2018/12/teach-climate-science-teachers-association-urges/,$171.11,6104839451294,"19,617","4,378",421,63,$0.0391,$0.406,$2.72,10,223.174,3,“When you talk to scientists — and climate scientists in particular — they’re not arguing about whether it’s happening or not.” — Eric Pyle,Teachers’ association says K-12 students need to know climate science,https://www.facebook.com/130268756992804/posts/2197365780283081/,1/4/2019
Natural gas and wind are supplanting coal,1/19/2017,"Bruce Lieberman, natural gas, wind",Energy,"2017-01-19 Yale Climate Connections -- During the past decade, coal’s role in U.S. electricit...",#N/A,#N/A,http://www.yaleclimateconnections.org/2017/01/natural-gas-and-wind-are-supplanting-coal/,$77.25,6063246025294,"30,584","3,293",370,,$0.0235,$0.209,#DIV/0!,,107.671,0,"During the past decade, coal’s role in U.S. electricity production has shrunk dramatically. Listen in as Doug Vine from the Center for Climate and Energy Solutions shares this and other surprising facts about America’s energy use.  

U.S. Department of Energy U.S. Department of Energy Office of Energy Efficiency and Renewable Energy Clean Energy Collective Heartland Renewable Energy Society",Natural Gas and Wind are Supplanting Coal,https://www.facebook.com/130268756992804/posts/1386819961337671/,2/16/2017
Not in database,n/a,n/a,n/a,2018-02-12 Yale Climate Connections -- Nasty.,#N/A,#N/A,https://bit.ly/2s1dfYp,$100.88,6084090180094,"16,864","2,335",222,277,$0.0432,$0.454,$0.36,,138.461,16,Nasty.,Cow manure is a sticky problem for the climate  ,https://www.facebook.com/130268756992804/posts/1790741130945550/,3/4/2018
How wildfires threaten human health,10/11/2017,"iSeeChange, Samantha Harrington, wildfires","Ecosystems, Feature Article",2017-10-14 Yale Climate Connections -- The National Climate Assessment reports that the chang...,#N/A,#N/A,https://www.yaleclimateconnections.org/2017/10/wildfires-threaten-human-health/,$240.33,6078311976694,"46,630","9,219","1,768",363,$0.0261,$0.136,$0.66,,197.705,8,The National Climate Assessment reports that the changing climate has already led to more frequent and bigger fires. It also predicts that the median annual area burned by wildfires in the Northwest will quadruple by the 2080s.,How climate change is fueling wildfires and threatening human health,https://www.facebook.com/130268756992804/posts/1669163936436604/,11/4/2017
Climate change activism ... It's elementary,10/24/2016,"Daisy Simmons, youth activists",Science,2016-10-24 Yale Climate Connections -- Six-year-old Mars Engel Dixon may be the youngest clim...,#N/A,#N/A,http://www.yaleclimateconnections.org/2016/10/climate-change-activism-its-elementary/,$10.34,6058707261294,"2,696",306,38,,$0.0338,$0.272,#DIV/0!,,113.501,0,"Six-year-old Mars Engel Dixon may be the youngest climate-change activist in America. Listen to his story and learn more about what it means for kids to grow up in a time when climate change is affecting their health and environment, on today's 90-second Yale Climate Connections.",Climate change activism ... It's elementary ,https://www.facebook.com/130268756992804/posts/1304302142922787/,11/4/2016
Is natural gas a bridge fuel?,8/23/2016,"natural gas, pros and cons, Zeke Hausfather","Energy, Feature Article",Is natural gas a good bridge fuel? It depends in part on whether you care abo...,#N/A,#N/A,http://www.yaleclimateconnections.org/2016/08/is-natural-gas-a-bridge-fuel/,$22.28,6055402354494,"3,590",213,25,,$0.1046,$0.891,#DIV/0!,,59.331,0,Is natural gas a good bridge fuel? It depends in part on whether you care about the short or long term. Read more ...,Is Natural Gas A Bridge Fuel? - Yale Climate Connections,https://www.facebook.com/130268756992804/posts/1246108792075456/,9/4/2016
The connection between A/C and snow,8/21/18 7:00,Daisy Simmons,"Energy, Weather Extremes",2018-08-21 Yale Climate Connections -- Winter: Good for more than just memories of what cool ...,#N/A,#N/A,https://www.yaleclimateconnections.org/2018/08/the-connection-between-a-c-and-snow/,$69.66,6097032695294,"17,324","2,322",229,771,$0.0300,$0.304,$0.09,8,134.034,45,Winter: Good for more than just memories of what cool weather was like.,The surprising connection between summer A/C and last winter’s snow,https://www.facebook.com/130268756992804/posts/2042647839088210/,9/4/2018
"In San Francisco suburb, NIMBY concerns lead city manager to resign",1/28/19 7:10,Bruce Lieberman,"Feature Article, Policy &amp; Politics",2019-02-01 Yale Climate Connections -- Even small cities need to address ‘the most significan...,#N/A,#N/A,https://www.yaleclimateconnections.org/2019/01/city-manager-resigns-over-nimby-climate-concerns/,$92.67,6108805340894,"11,572","1,550",114,483,$0.0598,$0.813,$0.19,7,133.944,42,"Even small cities need to address ‘the most significant challenges of our time” -- climate change, income inequality, and affordable housing -- writes a frustrated city manager in his resignation letter.",City manager resigns over NIMBY/climate concerns » by Bruce Lieberman,https://www.facebook.com/130268756992804/posts/2282717901747868/,3/4/2019
"Michael Mann, Warren Washington - the Yin and Yang of climate science - share 2019 Tyler prize",2/12/19 8:05,Bud Ward,"Climate Science, Feature Article",2019-02-12 Yale Climate Connections -- Two of climate science’s most well-known researchers j...,#N/A,#N/A,https://www.yaleclimateconnections.org/2019/02/climate-scientists-share-200000-prize/,$37.19,6109617995494,"5,408","1,311",114,67,$0.0284,$0.326,$0.56,8,242.419,12,Two of climate science’s most well-known researchers just won a prize sometimes referred to as the ‘Nobel’ of environmental protection. https://www.yaleclimateconnections.org/2019/02/climate-scientists-share-200000-prize/,"Climate scientists share $200,000 prize » by Bud Ward",https://www.facebook.com/130268756992804/posts/2301355036550821/,3/4/2019
Evangelicals aim to protect the environment,9/1/2017,"Eileen Mignoni, evangelical","Faith & Ethics, Latino Communities",2017-09-01 Yale Climate Connections -- These Latino pastors believe Scripture demands protect...,#N/A,#N/A,https://www.yaleclimateconnections.org/2017/09/these-evangelicals-see-environmentalism-as-a-religious-imperative/,$278.77,6074601634294,"59,834","10,623",794,670,$0.0262,$0.351,$0.42,,177.541,11,These Latino pastors believe Scripture demands protection of nature.,These evangelicals see environmentalism as a religious imperative ,https://www.facebook.com/130268756992804/posts/1629157247103940/,10/4/2017
New evidence of western forest decline,8/17/2017,"Daniel Grossman, drought, forests","Ecosystems, Feature Article","2017-08-22 Yale Climate Connections -- ""As the plot thins, the plot thickens,"" says biologist...",#N/A,#N/A,https://www.yaleclimateconnections.org/2017/08/researcher-finds-new-evidence-of-western-forest-decline/,$215.49,6074172530894,"53,866","8,180","1,181",1068,$0.0263,$0.182,$0.20,,151.858,20,"""As the plot thins, the plot thickens,"" says biologist Leander Anderegg.",New evidence of western forest decline,https://www.facebook.com/130268756992804/posts/1619166801436318/,9/4/2017
A utility's offer: Leave the grid,7/10/18 7:00,Jan Ellen Spiegel,Energy,2018-07-10 Yale Climate Connections -- What if more utility companies thought this way?,#N/A,#N/A,https://www.yaleclimateconnections.org/2018/07/a-utilitys-offer-leave-the-grid/,$136.64,6094202971494,"24,456","3,779",375,316,$0.0362,$0.364,$0.43,8,154.522,13,What if more utility companies thought this way?,A Vermont utility offers to help its customers leave the grid,https://www.facebook.com/130268756992804/posts/1970458792973782/,8/4/2018
Climate change makes trees vulnerable to pests,12/20/2017,Daisy Simmons,Ecosystems,2017-12-20 Yale Climate Connections -- These trees didn’t even stand a chance. ��,#N/A,#N/A,https://www.yaleclimateconnections.org/2017/12/climate-change-makes-trees-vulnerable-to-pests/,$142.13,6081578517694,"25,687","4,876",870,257,$0.0291,$0.163,$0.55,,189.824,10,These trees didn’t even stand a chance. 🌲🙆,How climate change makes trees vulnerable to pests ,https://www.facebook.com/130268756992804/posts/1737577332928597/,1/4/2018
Arctic melting could worsen California droughts,4/9/18 7:00,Diana Madson,"Snow &amp; Ice, Weather Extremes",2018-04-09 Yale Climate Connections -- This is going to be everyone’s problem.,#N/A,#N/A,https://www.yaleclimateconnections.org/2018/04/arctic-melting-could-worsen-california-droughts/,$95.29,6087415095494,"30,224","6,254","1,092",351,$0.0152,$0.087,$0.27,,206.922,12,This is going to be everyone’s problem.,Arctic melting could worsen future California droughts ,https://www.facebook.com/130268756992804/posts/1856859251000404/,5/4/2018
Solar installations set new record in 2016,4/12/2017,"Bruce Lieberman, solar",Energy,"2017-04-12 Yale Climate Connections -- Solar still faces challenges, but it's becoming a form...",#N/A,#N/A,http://www.yaleclimateconnections.org/2017/04/solar-installations-set-new-record-in-2016/,$67.72,6067822360694,"13,154","1,836",175,,$0.0369,$0.387,#DIV/0!,,139.577,0,"Solar still faces challenges, but it's becoming a formidable industry. It's grown “from essentially a minimal to nonexistent market five or 10 years ago, to what is now many thousands of megawatts per year,” says Chris Namovicz at the U.S. Energy Information Administration.

North American Renewable Energy Network U.S. Department of Energy",More utility-scale solar was added last year than in all the years before 2013 — combined. ,https://www.facebook.com/130268756992804/posts/1467744333245233/,5/4/2017
Rural Virginians pledge to cut carbon pollution,6/19/18 7:00,Daisy Simmons,Religion &amp; Morality,2018-06-19 Yale Climate Connections -- Residents of a tiny town in rural Virginia are leading...,#N/A,#N/A,https://www.yaleclimateconnections.org/2018/06/rural-virginians-pledge-to-cut-carbon-pollution/,$193.77,6092699421294,"23,328","2,877",186,156,$0.0674,$1.042,$1.24,6,123.328,7,"Residents of a tiny town in rural Virginia are leading a campaign to slow global warming, one signature at a time.",Rural Virginians pledge to cut carbon pollution,https://www.facebook.com/130268756992804/posts/1936384316381230/,7/4/2018
Airline experiment has pilots conserving fuel,2/16/2017,"Bruce Lieberman, fuel efficiency",Energy,2017-02-16 Yale Climate Connections -- Researchers at the The London School of Economics and ...,#N/A,#N/A,http://www.yaleclimateconnections.org/2017/02/virgin-atlantic-experiment-has-pilots-conserving-fuel/,$90.37,6064676915894,"33,938","3,387",265,,$0.0267,$0.341,#DIV/0!,,99.800,0,"Researchers at the The London School of Economics and Political Science - LSE tried an experiment with Virgin Atlantic Airlines in reducing airline fuel consumption without compromising safety. The results are in… 

Green Business Network U.S. Environmental Protection Agency",Virgin Atlantic experiment has pilots conserving fuel ,https://www.facebook.com/130268756992804/posts/1418978148121852/,3/4/2017
Citizen scientists are documenting priceless archaeological sites,10/23/18 7:00,Sarah Kennedy,Climate Science,2018-10-23 Yale Climate Connections -- Volunteers like Sarah Miller are rolling up their slee...,#N/A,#N/A,https://www.yaleclimateconnections.org/2018/10/citizen-scientists-document-archaeological-sites/,$118.48,6101540498094,"6,228",940,102,53,$0.1260,$1.162,$2.24,8,150.931,9,Volunteers like Sarah Miller are rolling up their sleeves to help document Florida history in advance of rising seas.,Citizen scientists document priceless archaeological sites,https://www.facebook.com/130268756992804/posts/2128526210500372/,11/4/2018
Drought threatens Joshua trees,8/31/2017,"Diana Madson, national parks",Ecosystems,"2017-08-31 Yale Climate Connections -- “Unless someone like you cares a whole awful lot, noth...",#N/A,#N/A,https://www.yaleclimateconnections.org/2017/08/drought-threatens-joshua-trees/,$203.80,6074553461094,"46,749","7,628",927,446,$0.0267,$0.220,$0.46,,163.169,10,"“Unless someone like you cares a whole awful lot, nothing is going to get better. It's not.” — The Lorax",Climate change threatens California’s iconic ‘Dr. Seuss’ trees,https://www.facebook.com/130268756992804/posts/1628111250541873/,9/4/2017
Students aim to protect the oceans,1/18/18 7:00,Daisy Simmons,Oceans,"2018-01-18 Yale Climate Connections -- “There are solutions and there are things we can do,” ...",#N/A,#N/A,https://www.yaleclimateconnections.org/2018/01/students-aim-to-protect-the-oceans/,$242.33,6082813963494,"41,025","9,049",720,218,$0.0268,$0.337,$1.11,,220.573,5,"“There are solutions and there are things we can do,” says 14-year-old Kiran Garewal of Heirs To Our Oceans.",Middle- and high-school students aim to protect the oceans ,https://www.facebook.com/130268756992804/posts/1767292206623776/,2/4/2018
Not in database,n/a,n/a,n/a,2019-03-06 Yale Climate Connections -- The We Are Still In coalition has helped keep major pl...,#N/A,#N/A,http://www.yaleclimateconnections.org/2019/03/u-s-businesses-work-toward-paris-goals/,$169.29,6111247834894,"18,831","3,821",309,85,$0.0443,$0.548,$1.99,7,202.910,5,The We Are Still In coalition has helped keep major players engaged in the Paris climate agreement despite President Trump’s announcement of withdrawal:,Why U.S. businesses are still working towards the goals of the Paris agreement:,https://www.facebook.com/130268756992804/posts/2336046526415005/,4/4/2019
Wedding interrupted when disaster strikes,9/17/18 7:00,Daisy Simmons,Weather Extremes,"2018-09-17 Yale Climate Connections -- Wishing you a lifetime of love, happiness, and … a saf...",#N/A,#N/A,https://www.yaleclimateconnections.org/2018/09/wedding-interrupted-when-disaster-strikes/,$178.25,6098885557294,"15,528","3,159",162,547,$0.0564,$1.100,$0.33,9,203.439,35,"Wishing you a lifetime of love, happiness, and … a safe dash for higher ground.",‘We’re evacuating!’ Wedding interrupted when disaster strikes,https://www.facebook.com/130268756992804/posts/2079247998761527/,10/4/2018
Detroit forecast: hot ... and informed,11/9/2016,"Sara Peach, weather","Science, Weather",2016-11-09 Yale Climate Connections -- “Climate change is not just what’s happening in your b...,#N/A,#N/A,http://www.yaleclimateconnections.org/2016/11/detroit-forecast-hot-and-informed/,$22.25,6059571342494,"5,498",617,111,,$0.0361,$0.200,#DIV/0!,,112.223,0,"“Climate change is not just what’s happening in your backyard, it’s what’s happening to the planet as a whole” says meteorologist Paul Gross of WDIV Local 4 / ClickOnDetroit.  Listen in as Paul clears up common misconceptions and connects the dots between weather reports and climate science.",Detroit Forecast: Hot … and Informed,https://www.facebook.com/130268756992804/posts/1317225481630453/,12/4/2016
Not in database,n/a,n/a,n/a,2017-11-08 Yale Climate Connections -- Here’s one more way clean energy helps people breathe ...,#N/A,#N/A,https://yaleclimateconnections.org/2017/11/study-renewables-save-americans-billions-in-health-care-costs/,$108.97,6079498931094,"29,510","6,775",942,152,$0.0161,$0.116,$0.72,,229.583,5,Here’s one more way clean energy helps people breathe easy.,Wind and solar has been reported to save Americans billions in healthcare costs ,https://www.facebook.com/130268756992804/posts/1694219217264409/,12/4/2017
Heat seems to make us stupider,10/29/18 7:00,Diana Madson,"Health, Weather Extremes",2018-10-29 Yale Climate Connections -- It’s not just a matter of comfort.,#N/A,#N/A,https://www.yaleclimateconnections.org/2018/10/heat-seems-to-make-us-stupider/,$325.99,6101916614494,"27,128","4,480",638,741,$0.0728,$0.511,$0.44,9,165.143,27,It’s not just a matter of comfort.,Heat seems to make us stupider,https://www.facebook.com/130268756992804/posts/2138225869530406/,11/4/2018
"Tiny Phoenix, Louisiana, makes a stand against sea-level rise",11/29/18 7:00,Sara Peach,Weather Extremes,"2018-11-29 Yale Climate Connections -- Against rising seas and increasingly intense storms, a...",#N/A,#N/A,https://www.yaleclimateconnections.org/2018/11/phoenix-louisiana-makes-a-stand-against-rising-seas/,$40.05,6104344942494,"3,577",694,35,33,$0.0577,$1.144,$1.21,9,194.017,9,"Against rising seas and increasingly intense storms, a community stands together.",How a tiny community in Louisiana is making a stand against sea-level rise,https://www.facebook.com/130268756992804/posts/2186886951330964/,12/4/2018
Glacier melt motivates teen,6/29/2017,"Daisy Simmons, water resources",Ecosystems,2017-06-29 Yale Climate Connections -- When 17 year-old Caroline Hallee visited the Swiss Alp...,#N/A,#N/A,https://www.yaleclimateconnections.org/2017/06/witnessing-glacier-melt-motivated-teens-action-on-climate-change/,$171.90,6071332631094,"37,752","6,325",491,173,$0.0272,$0.350,$0.99,,167.541,5,"When 17 year-old Caroline Hallee visited the Swiss Alps and saw the ice melting, it changed her life forever.",Seeing glaciers melt drives teen to fight climate change ,https://www.facebook.com/130268756992804/posts/1554561441230188/,7/4/2017
A low-energy alternative to cremation,5/1/18 7:00,Eileen Mignoni,"Energy, Health","2018-05-01 Yale Climate Connections -- “There’s just no 2,000-degree heat. There’s no smokest...",#N/A,#N/A,https://www.yaleclimateconnections.org/2018/05/a-low-energy-alternative-to-cremation/,$177.43,6089467942494,"63,087","6,526",452,3604,$0.0272,$0.393,$0.05,,103.444,57,"“There’s just no 2,000-degree heat. There’s no smokestacks. There’s no fossil fuels being burned. There’s nothing released into the atmosphere.” 
— Ryan Cattoni of Aquagreen Dispositions",There’s a low-energy alternative to cremation,https://www.facebook.com/130268756992804/posts/1879997298686599/,6/4/2018
"Even in Texas, people worry about climate change",2/21/2017,"extreme weather, public attitudes, Sara Peach","Sustainability, Weather",2017-02-21 Yale Climate Connections -- You don’t need to be an environmentalist to understand...,#N/A,#N/A,http://www.yaleclimateconnections.org/2017/02/even-in-texas-people-worry-about-climate-change/,$162.32,6064920834694,"41,587","5,966",744,,$0.0272,$0.218,#DIV/0!,,143.458,0,"You don’t need to be an environmentalist to understand the reality of climate change. “Texans feel like they’re seeing their land and water and air change in this state … and there’s solid indications that climate change is playing a role in this.” – Andrew Dobbs, Texas Campaign for the Environment

Texas Parks and Wildlife 90.1 FM KPFT Houston Environment Texas","Even in Texas, people worry about climate change",https://www.facebook.com/130268756992804/posts/1429796520373348/,3/4/2017
Hawaii tests wave energy,12/28/2016,"Bruce Lieberman, renewable energy, wave energy",Energy,"2016-12-28 Yale Climate Connections -- Move over surfers, there’s more than just boards ridin...",#N/A,#N/A,http://www.yaleclimateconnections.org/2016/12/hawaii-tests-wave-energy/,$56.93,6062157868294,"13,492","1,414",174,,$0.0403,$0.327,#DIV/0!,,104.803,0,"Move over surfers, there’s more than just boards riding waves these days.  Take 90 seconds to learn how Hawaii Natural Energy Institute - HNEI is testing wave energy capture off its shores.",Hawaii Tests Wave Energy,https://www.facebook.com/130268756992804/posts/1364453906907610/,1/4/2017
Scientist: How I feel about climate change,11/24/2016,"Is This How You Feel, Peter Tans, Sara Peach",Science,2016-11-24 Yale Climate Connections -- Scientists put their feelings aside to remain objectiv...,#N/A,#N/A,http://www.yaleclimateconnections.org/2016/11/scientist-how-i-feel-about-climate-change/,$33.67,6060413264294,"5,956",732,96,,$0.0460,$0.351,#DIV/0!,,122.901,0,"Scientists put their feelings aside to remain objective but, thanks to the forum ""Is This How You Feel?"", they can openly share their feelings.  Listen in to hear Peter Tans of National Oceanic and Atmospheric Administration (NOAA) express his feelings about climate change.",Climate Scientist: How I Feel About Climate Change,https://www.facebook.com/130268756992804/posts/1325048227514845/,12/4/2016
Vets train for the solar industry,10/31/2016,"Sara Peach, solar, Solar Ready Vets, veterans",Energy,2016-10-31 Yale Climate Connections -- Meet the Solar Soldiers.  They fought for our foredoom...,#N/A,#N/A,http://www.yaleclimateconnections.org/2016/10/vets-train-for-the-solar-industry/,$35.98,6059058939494,"6,238",851,131,,$0.0423,$0.275,#DIV/0!,,136.422,0,"Meet the Solar Soldiers.  They fought for our freedom and now fight for our energy independence.  Listen in to learn how the Solar Ready Vets program, a collaboration between the U.S. Department of Energy and U.S. Department of Defense (DoD) prepares American veterans to join the solar industry. U.S. Department of Energy Office of Energy Efficiency and Renewable Energy",Vets train for the solar industry ,https://www.facebook.com/130268756992804/posts/1312243352128666/,11/4/2016
Intergenerational conversation: An antidote to climate despair,2/28/19 7:00,NULL,"Communicating Climate, Youth",2019-03-26 Yale Climate Connections -- Put down that leaf blower. Here’s a climate-friendly w...,#N/A,#N/A,https://www.yaleclimateconnections.org/2019/03/3-ways-to-cut-carbon-at-home/,$27.44,6112771033694,"2,527",634,66,169,$0.0433,$0.416,$0.16,8,250.890,67,"Put down that leaf blower. Here’s a climate-friendly way to care for your lawn. 

This is the second installment of a 5-part series this week on how to reduce your carbon footprint. Check it out.",3 ways to cut carbon at home » by Craig K. Chandler,https://www.facebook.com/130268756992804/posts/2365367800149544/,4/4/2019
Explore warming where you live,12/27/2016,"Bruce Lieberman, The Climate Explorer","Science, Weather","2016-12-27 Yale Climate Connections -- Climate is weather over time, making it difficult to p...",#N/A,#N/A,http://www.yaleclimateconnections.org/2016/12/explore-warming-where-you-live/,$168.87,6062109537894,"49,632","6,100",577,,$0.0277,$0.293,#DIV/0!,,122.905,0,"Climate is weather over time, making it difficult to perceive gradual change.  To help, NOAA Climate.Gov created a tool for you to access local climate data and help you prepare for what’s expected in the future. Listen in. #ClimateExplorer",Explore Warming Where You Live,https://www.facebook.com/130268756992804/posts/1364446453575022/,1/4/2017
Not in database,n/a,n/a,n/a,2017-02-03 Yale Climate Connections -- An article dissecting the future prospects of the coal...,#N/A,#N/A,http://www.csmonitor.com/Environment/Inhabit/2017/0124/Behind-Trump-pipeline-orders-a-pledge-to-deliver-energy-jobs,$23.33,6064036805494,"5,585",922,41,,$0.0253,$0.569,#DIV/0!,,165.085,0,An article dissecting the future prospects of the coal and gas industries and the likelihood of Trump fulfilling his promises in that arena. (Via The Christian Science Monitor),"Behind Trump pipeline orders, a pledge to deliver energy jobs",https://www.facebook.com/130268756992804/posts/1412903998729267/,3/4/2017
A health insurance company's climate worries,2/27/2017,"insurance industry, public health, Sara Peach",Public Health,2017-02-27 Yale Climate Connections -- Blue Cross Blue Shield of Massachusetts isn’t just sel...,#N/A,#N/A,http://www.yaleclimateconnections.org/2017/02/a-health-insurance-companys-climate-worries/,$100.90,6065200722094,"14,491","1,718",196,,$0.0587,$0.515,#DIV/0!,,118.556,0,"Blue Cross Blue Shield of Massachusetts isn’t just selling health insurance policies these days. The company is working to address climate change, with the view that tackling the problem will help people stay healthy. Tune in. 

New England Public Radio WHMP",A health insurance company worries about global warming ,https://www.facebook.com/130268756992804/posts/1433223123364021/,3/4/2017
Miami Beach spends to hold back the sea,5/10/2017,"Diana Madson, nuisance flooding, sea level rise",Sea Level Rise,"2017-05-10 Yale Climate Connections -- Even on days without rain, Miami Beach now experiences...",#N/A,#N/A,https://www.yaleclimateconnections.org/2017/05/miami-beach-is-spending-millions-to-hold-back-the-sea/,$53.87,6069190041094,"13,860","1,990",485,148,$0.0271,$0.111,$0.36,,143.579,11,"Even on days without rain, Miami Beach now experiences flooding as a result of rising seas. In today’s episode, the city’s chief resilience officer talks about Miami Beach’s multi-million-dollar project to pump water and raise streets. City of Miami Beach Government",Miami Beach is spending millions to hold back the sea,https://www.facebook.com/130268756992804/posts/1505673172785682/,6/4/2017
Citizen observations on climate change,9/6/2016,"citizen science, Daisy Simmons","Ecosystems, Science",How does climate change impact people who depend on the environment for their...,#N/A,#N/A,http://www.yaleclimateconnections.org/2016/09/citizen-observers-offer-unexpected-insights-on-climate-change/,$17.50,6056005806694,"2,928",302,43,,$0.0579,$0.407,#DIV/0!,,103.142,0,"How does climate change impact people who depend on the environment for their livelihood? Today on the show Simon Fraser University scientists describe their look at the firsthand experiences of 92,000 people around the world – specifically people who obtain their food directly by farming, hunting, or fishing.",Citizen observations on climate change,https://www.facebook.com/130268756992804/posts/1257518297601172/,10/4/2016
Raising climate awareness with humor,5/5/2017,"ad campaigns, Bruce Lieberman",Arts,"2017-05-05 Yale Climate Connections -- A little laughter can go a long way, especially in Ont...",#N/A,#N/A,https://www.yaleclimateconnections.org/2017/05/ad-campaign-raises-climate-awareness-with-humor/,$99.04,6068971610894,"32,325","4,724",281,2482,$0.0210,$0.352,$0.04,,146.141,77,"A little laughter can go a long way, especially in Ontario, Canada, where the government created humorous advertisements about #ClimateChange. In one, a fisherman is unable to impress his wife with a fresh-catch story. And then there is the one where, well, just tune in and hear for yourself. Environment Ontario",Ad campaign raises climate awareness with humor,https://www.facebook.com/130268756992804/posts/1498226786863654/,6/4/2017
Worrisome first quarter of 2017 climate trends,4/27/2017,"coral bleaching, global temperatures, sea ice, Zeke Hausfather","Feature Article, Oceans, Polar Ice, Science",2017-05-02 Yale Climate Connections -- It’s only one-fourth of the full 2017 calendar year th...,#N/A,#N/A,https://www.yaleclimateconnections.org/2017/04/worrisome-first-quarter-of-2017-climate-trends/,$305.22,6068798556294,"70,068","10,882","2,640",888,$0.0280,$0.116,$0.34,,155.306,13,"It’s only one-fourth of the full 2017 calendar year thus far of high temps, sea ice record lows, and mounting risks to coral reefs ... Get some details on the science.",Worrisome first quarter of 2017 climate trends | by Zeke Hausfather,https://www.facebook.com/130268756992804/posts/1502935783059421/,6/4/2017
Teen activist blocks incinerator,4/10/2017,"Daisy Simmons, energy","Energy, Public Health",2017-04-10 Yale Climate Connections -- Here’s the story of an environmental victory – one ach...,#N/A,#N/A,http://www.yaleclimateconnections.org/2017/04/teen-activist-blocks-incinerator-in-polluted-neighborhood/,$127.06,6067709355294,"26,965","4,470",392,,$0.0284,$0.324,#DIV/0!,,165.770,0,"Here’s the story of an environmental victory – one achieved by high school student Destiny Watford. When she learned of plans to build an incinerator in a polluted Baltimore neighborhood, Watford was stunned. But she and her classmates championed a campaign that blocked the plant. 

Photo credit: United Workers Media Team 
 Student Activism for Equality (SAFE)",Teen activist blocks incinerator in polluted neighborhood ,https://www.facebook.com/130268756992804/posts/1467718259914507/,5/4/2017
Not in database,n/a,n/a,n/a,"2017-05-09 Yale Climate Connections -- Survey finds broad American public support, across all...",#N/A,#N/A,http://climatecommunication.yale.edu/publications/paris_agreement_by_state/,$78.53,6069141064894,"24,742","4,608",497,174,$0.0170,$0.158,$0.45,,186.242,7,"Survey finds broad American public support, across all states ""blue"" and ""red,"" on staying part of 2015 Paris Climate Agreement.",Majorities of Americans in Every State Support Participation in the Paris Agreement - Yale Program on Climate Change Communication,https://www.facebook.com/130268756992804/posts/1509502042402795/,6/4/2017
A solar future for the Navajo?,8/1/2017,"Diana Madson, energy, sustainability","Energy, Sustainability",2017-08-02 Yale Climate Connections -- The largest coal plant in the West is scheduled to clo...,#N/A,#N/A,https://www.yaleclimateconnections.org/2017/08/is-solar-the-future-for-the-navajo-nation/,$201.53,6073261972094,"40,995","7,178",445,110,$0.0281,$0.453,$1.83,,175.095,3,"The largest coal plant in the West is scheduled to close in 2019 — now, one environmental group is pushing for a clean energy future for Navajo Nation.",Is solar the future for the Navajo Nation? ,https://www.facebook.com/130268756992804/posts/1600114173341581/,9/4/2017
Climate change affecting bird migrations,1/2/2017,"bird migration patterns, Daisy Simmons",Ecosystems,"2017-01-02 Yale Climate Connections -- Every year, 5,000,000 song birds migrate through Chica...",#N/A,#N/A,http://www.yaleclimateconnections.org/2017/01/climate-change-affecting-bird-migrations/,$140.84,6062354455094,"50,880","5,016",787,,$0.0281,$0.179,#DIV/0!,,98.585,0,"Every year, 5,000,000 song birds migrate through Chicago, but climate change is influencing their patterns.  Today, The Field Museum describes effects this can have across ecosystems.  National Audubon Society",Climate Change Affecting Bird Migrations,https://www.facebook.com/130268756992804/posts/1371310349555299/,2/16/2017
Moroccan mosques go solar,12/29/2016,"Diana Madson, religion, solar energy","Energy, Faith & Ethics","2016-12-29 Yale Climate Connections -- Mosques are an important part of Moroccan social life,...",#N/A,#N/A,http://www.yaleclimateconnections.org/2016/12/moroccan-mosques-go-solar/,$76.68,6062203012294,"15,304","2,216",166,,$0.0346,$0.462,#DIV/0!,,144.799,0,"Mosques are an important part of Moroccan social life, and 600 of them are scheduled to be made green.  The benefits of this renewable energy project go beyond just clean energy, take 90 seconds to learn more. 

UN Sustainable Development Solutions Network Ministry Of Islamic Affairs #Energiewende",Moroccan Mosques Go Solar,https://www.facebook.com/130268756992804/posts/1364909950195339/,1/4/2017
Not in database,n/a,n/a,n/a,"2018-02-07 Yale Climate Connections -- Higher temperatures -> Less Arctic ice
Less Arctic ice...",#N/A,#N/A,https://bit.ly/2s5v7Bu,$131.21,6083812727294,"30,509","5,039",940,301,$0.0260,$0.140,$0.44,,165.164,10,"Higher temperatures -> Less Arctic ice
Less Arctic ice -> Higher temperatures
You see the issue here:",Why feedback loops are one of the most troubling parts of global warming  ,https://www.facebook.com/130268756992804/posts/1788654391154224/,3/4/2018
Not in database,n/a,n/a,n/a,2019-02-13 Yale Climate Connections -- “I've come to realize you can't be a feminist if you'r...,#N/A,#N/A,https://bit.ly/2DSc8OS,$16.64,6109688121494,"2,447",487,14,13,$0.0342,$1.189,$1.28,10,199.019,5,“I've come to realize you can't be a feminist if you're not an environmentalist.” — Kathy Calvin https://bit.ly/2DSc8OS,The CEO of the UN Foundation says climate change is a feminist issue,https://www.facebook.com/130268756992804/posts/2303073916378933/,3/4/2019
"Skara Brae, an ancient village made of stone, could be lost to climate change",1/3/19 7:00,Diana Madson,Oceans,"2019-04-29 Yale Climate Connections -- When places like this are destroyed, their history can...",#N/A,#N/A,https://www.yaleclimateconnections.org/2019/01/stone-age-village-could-be-lost/,$50.23,6115453332494,"6,649","1,220",101,114,$0.0412,$0.497,$0.44,7,183.486,17,"When places like this are destroyed, their history can never be recovered.","Skara Brae, an ancient village made of stone, could be lost to climate change",https://www.facebook.com/130268756992804/posts/2415904905095833/,5/4/2019
The Everglades' superpower: absorbing CO2,3/6/2017,"carbon capture, Erika Street Hopman",Ecosystems,2017-03-06 Yale Climate Connections -- Mangrove forests in the Florida Everglades soak up a l...,#N/A,#N/A,http://www.yaleclimateconnections.org/2017/03/the-everglades-superpower-absorbing-co2/,$87.43,6065562135094,"27,058","3,221",427,,$0.0271,$0.205,#DIV/0!,,119.041,0,"Mangrove forests in the Florida Everglades soak up a lot of carbon dioxide, but they are at risk. Tune in to learn what’s being done to preserve them. 

Everglades National Park Florida International University LaNueva883 WLRN Public Radio and Television Everglades Foundation Everglades Hostel and Tours",The Everglades’ superpower: absorbing carbon pollution ,https://www.facebook.com/130268756992804/posts/1438901486129518/,4/4/2017
2018 - the hottest La Ni√±a year ever recorded,12/20/18 7:10,Dana Nuccitelli,"Climate Science, Weather Extremes","2018-12-20 Yale Climate Connections -- Feel the heat in 2018?  Here’s why. 

https://www.yale...",#N/A,#N/A,https://www.yaleclimateconnections.org/2018/12/2018-the-hottest-la-nina-year-ever-recorded/,$15.94,6105901932494,"1,734",441,63,15,$0.0361,$0.253,$1.06,6,254.325,9,"Feel the heat in 2018?  Here’s why. 

https://www.yaleclimateconnections.org/2018/12/2018-the-hottest-la-nina-year-ever-recorded/",2018 - hottest La Niña year ever recorded » Yale Climate Connections,https://www.facebook.com/130268756992804/posts/2219237318095927/,1/4/2019
Dead trees stoke wildfire fears,7/18/2017,"Bruce Lieberman, wildfires",Ecosystems,2017-07-18 Yale Climate Connections -- These dead trees could provide the fuel to turn a norm...,#N/A,#N/A,https://www.yaleclimateconnections.org/2017/07/dead-trees-stoke-wildfire-fears/,$209.90,6072586691694,"52,040","7,319",761,287,$0.0287,$0.276,$0.73,,140.642,6,These dead trees could provide the fuel to turn a normal wildfire into an inferno.,Long-term drought killed more than 100 million trees in California,https://www.facebook.com/130268756992804/posts/1584594274893571/,8/4/2017
Energy storage goes underground,11/17/2016,"Bruce Lieberman, energy storage, renewable energy",Energy,2016-11-17 Yale Climate Connections -- Our transition to renewables will require innovation i...,#N/A,#N/A,http://www.yaleclimateconnections.org/2016/11/energy-storage-goes-underground/,$48.91,6060028153694,"8,330",821,95,,$0.0596,$0.515,#DIV/0!,,98.559,0,Our transition to renewables will require innovation in energy storage.  Startup Quidnet Energy proposes we store energy in old oil wells by filling them with high pressure water.  Listen in to today's story and find out more.,Energy Storage Goes Underground,https://www.facebook.com/130268756992804/posts/1321226487897019/,12/4/2016
Mangrove forests can help fight the effects of climate change,1/16/19 7:00,NULL,Species &amp; Ecosystems,2019-01-27 Yale Climate Connections -- Mangrove trees aren’t just strange and elegant — they ...,#N/A,#N/A,https://www.yaleclimateconnections.org/2019/01/mangroves-help-protect-us-from-climate-impacts/,$44.15,6108409268294,"7,707","1,871",207,43,$0.0236,$0.213,$1.03,8,242.766,6,"Mangrove trees aren’t just strange and elegant — they help fight climate change. Now, though, they’re in danger:",Mangroves could help protect us from the impacts of climate change,https://www.facebook.com/130268756992804/posts/2260725050613820/,2/4/2019
Military powering down fossil fuels,9/22/2016,"Diana Madson, military, renewable energy","Energy, National Security",National security and renewable energy are linked. By switching to clean ener...,#N/A,#N/A,http://www.yaleclimateconnections.org/2016/09/military-powering-down-fossil-fuels/,$46.73,6056878907894,"13,756","1,662",254,,$0.0281,$0.184,#DIV/0!,,120.820,0,"National security and renewable energy are linked. By switching to clean energy, the Department of Defense is improving the nation’s energy security and reducing the roughly $4 billion spent to power military installations each year. Hear more on today's episode.",Military powering down fossil fuels ,https://www.facebook.com/130268756992804/posts/1272631489423186/,10/4/2016
Mutant plants could absorb carbon pollution,3/3/2017,"Bruce Lieberman, carbon dioxide","Food & Agriculture, Science","2017-03-03 Yale Climate Connections -- Plants naturally absorb carbon dioxide, but scientists...",#N/A,#N/A,http://www.yaleclimateconnections.org/2017/03/mutant-plants-could-absorb-carbon-pollution/,$64.94,6065421001694,"23,273","2,437",316,,$0.0266,$0.206,#DIV/0!,,104.714,0,"Plants naturally absorb carbon dioxide, but scientists at the Max Planck Institute in Germany are trying to accelerate that process. If they succeed, their mutant plants could become a new tool for removing global warming pollution from the atmosphere. Tune in. 

Max Planck Institute of Molecular Cell Biology and Genetics
Climate Change SG  Virgin Earth Challenge",Mutant plants could absorb carbon pollution  ,https://www.facebook.com/130268756992804/posts/1433313430021657/,4/4/2017
I was an Exxon-funded climate scientist,8/31/2017,Katharine Hayhoe,"Faith & Ethics, Feature Article, Science","2017-09-07 Yale Climate Connections -- ""This latest study underscores why many are calling on...",#N/A,#N/A,https://www.yaleclimateconnections.org/2017/08/i-was-an-exxon-funded-climate-scientist/,$78.05,6074829453094,"28,477","4,279",764,700,$0.0182,$0.102,$0.11,,150.262,25,"""This latest study underscores why many are calling on Exxon to be held responsible for knowingly misleading the public on such a critical issue. For scientists and academics, though, it may fuel another, different, yet similarly moral debate.

Are we willing to accept financial support that is offered as a sop to the public conscience?"" — Katharine Hayhoe",I was an Exxon-funded climate scientist,https://www.facebook.com/130268756992804/posts/1632807653405566/,10/4/2017
Old seeds could help indigenous farmers adapt to climate change,12/10/18 7:00,NULL,Food &amp; Agriculture,2018-12-10 Yale Climate Connections -- “This is a way of resiliency that comes from our own p...,#N/A,#N/A,https://www.yaleclimateconnections.org/2018/12/old-seeds-could-help-indigenous-farmers-adapt/,$196.01,6105109981294,"21,980","4,715",603,110,$0.0416,$0.325,$1.78,9,214.513,5,"“This is a way of resiliency that comes from our own people, from our own traditions,” says Andrea Carmen of the International Indian Treaty Council.",Old seeds could help indigenous farmers deal with a new climate,https://www.facebook.com/130268756992804/posts/2203626736323652/,1/4/2019
Local governments team up to reduce pollution,3/15/2017,"Diana Madson, greenhouse gas emissions",Policy,2017-03-15 Yale Climate Connections -- Frustrated by inaction from the federal government on ...,#N/A,#N/A,http://www.yaleclimateconnections.org/2017/03/local-governments-team-up-to-reduce-global-warming-pollution/,$145.66,6066207445094,"36,925","5,006",662,,$0.0291,$0.220,#DIV/0!,,135.572,0,"Frustrated by inaction from the federal government on climate change? The Climate Group is organizing cities, states, and regions to pledge to dramatically reduce their greenhouse gas emissions. Tune in. 

The Climate Group Climate Change SG Climate Change Cook Islands Global Island Partnership",Local governments team up to reduce global warming pollution,https://www.facebook.com/130268756992804/posts/1449218461764487/,4/4/2017
Not in database,n/a,n/a,n/a,"2018-12-26 Yale Climate Connections -- It might sound gross, but it works:",#N/A,#N/A,https://bit.ly/2LsKNVs,$181.82,6106255404094,"25,752","4,390",544,153,$0.0414,$0.334,$1.19,9,170.472,6,"It might sound gross, but it works:",This company is selling renewable diesel made from animal fat and vegetable oil,https://www.facebook.com/130268756992804/posts/2228155143870811/,1/4/2019
How family size shapes your carbon footprint,3/29/19 7:05,Craig K. Chandler,"Feature Article, Religion &amp; Morality",2019-04-30 Yale Climate Connections -- Biologist Barry Sinervo says he was 'blown away' by ho...,#N/A,#N/A,https://www.yaleclimateconnections.org/2019/04/how-deforestation-can-worsen-warming/,$133.27,6115568521294,"13,348","2,506",433,136,$0.0532,$0.308,$0.98,9,187.743,10,Biologist Barry Sinervo says he was 'blown away' by how much deforestation is heating up tropical areas.,How vanishing lizards in Madagascar led to a troubling discovery about deforestation,https://www.facebook.com/130268756992804/posts/2422454057774251/,5/4/2019
Two top TV mets address climate change,1/17/2017,"John Toohey-Morales, Mike Nelson, tv meteorologists","Feature Article, Science, Science Questions, Weather","2017-01-25 Yale Climate Connections -- ""Albert Einstein was right in advising us that we cann...",#N/A,#N/A,http://www.yaleclimateconnections.org/2017/01/two-top-tv-meteorologists-address-climate-change/,$23.81,6063528788494,"11,752","1,093",106,,$0.0218,$0.225,#DIV/0!,,93.005,0,"""Albert Einstein was right in advising us that we cannot solve the problems we face with the same level of thinking we used in creating them.""

Thoughts from a veteran TV meteorologist in Denver and more from one in Miami ... on addressing climate change on-air.",Two top TV mets address climate change - Yale Climate Connections,https://www.facebook.com/130268756992804/posts/1398663883486612/,2/16/2017
New test road could charge electric cars,7/30/18 7:00,Bruce Lieberman,Energy,2018-07-30 Yale Climate Connections -- You couldn’t do this with fossil fuels. ⚡️🚗,#N/A,#N/A,https://www.yaleclimateconnections.org/2018/07/new-test-road-could-charge-electric-cars/,$249.19,6095484131494,"52,320","8,478","1,015",262,$0.0294,$0.246,$0.95,9,162.041,5,You couldn’t do this with fossil fuels. ⚡️🚗,Sweden tests a road that could charge your electric car as you drive,https://www.facebook.com/130268756992804/posts/2003717269647934/,8/4/2018
"As sea levels rise, 'ghost forests' expand",12/6/2017,Sarah Kennedy,Sea Level Rise,"2017-12-06 Yale Climate Connections -- In the marshlands of New Jersey’s Pine Barrens, you ma...",#N/A,#N/A,https://www.yaleclimateconnections.org/2017/12/as-sea-levels-rise-ghost-forests-expand/,$254.43,6080868049894,"67,449","8,634",923,3868,$0.0295,$0.276,$0.07,,128.008,57,"In the marshlands of New Jersey’s Pine Barrens, you may stumble across a spooky sight.",‘Ghost forests’ are expanding as sea levels rise ,https://www.facebook.com/130268756992804/posts/1723068064379524/,1/4/2018
Scottish whisky-makers adopt clean energy,5/23/2017,"Bruce Lieberman, energy","Energy, Food & Agriculture",2017-05-23 Yale Climate Connections -- The Scotch Whisky Association pledges to make your whi...,#N/A,#N/A,https://www.yaleclimateconnections.org/2017/05/scottish-whisky-makers-adopt-clean-energy/,$106.39,6069751657694,"19,898","2,872",270,45,$0.0370,$0.394,$2.36,,144.336,2,The Scotch Whisky Association pledges to make your whisky using 80 percent renewable energy by 2050.,Scottish whisky-makers adopt clean energy ,https://www.facebook.com/130268756992804/posts/1516693981683601/,6/4/2017
How family size shapes your carbon footprint,3/29/19 7:05,Craig K. Chandler,"Feature Article, Religion &amp; Morality","2019-03-26 Yale Climate Connections -- 'Somewhere in Ohio, it got real.'",#N/A,#N/A,https://www.yaleclimateconnections.org/2019/03/why-a-climate-scientist-biked-across-the-u-s/,$44.89,6112735512894,"5,178","1,014",68,118,$0.0443,$0.660,$0.38,8,195.829,23,"Somewhere in Ohio, it got real.'",Why a climate scientist biked across the U.S. » Yale Climate Connections,https://www.facebook.com/130268756992804/posts/2363922733627384/,4/4/2019
How family size shapes your carbon footprint,3/29/19 7:05,Craig K. Chandler,"Feature Article, Religion &amp; Morality",2019-03-22 Yale Climate Connections -- Jana Ganion says her tribe’s microgrid provides benefi...,#N/A,#N/A,https://www.yaleclimateconnections.org/2019/03/microgrid-system-saves-tribe-200000-a-year/,$89.78,6112447919694,"11,092","2,372",235,120,$0.0378,$0.382,$0.75,9,213.848,11,Jana Ganion says her tribe’s microgrid provides benefits beyond her immediate community by helping to green the larger grid:,"A microgrid system is saving a tribe $200,000 a year ",https://www.facebook.com/130268756992804/posts/2358600847492906/,4/4/2019
Las Vegas city buildings go 100% renewable,4/4/2017,"Diana Madson, renewables",Energy,"2017-04-04 Yale Climate Connections -- Las Vegas has placed its bets on renewable energy, and...",#N/A,#N/A,http://www.yaleclimateconnections.org/2017/04/las-vegas-city-buildings-go-100-renewable/,$78.84,6067324745694,"17,756","2,645",349,,$0.0298,$0.226,#DIV/0!,,148.964,0,"Las Vegas has placed its bets on renewable energy, and it’s winning. The city of lights has invested so much in renewables that its greenhouse gas emissions are no higher than they were in 1950. Tune in to hear from the city’s chief sustainability officer. 

City of Las Vegas Government 100 Resilient Cities - Pioneered by the Rockefeller Foundation Center for Resilient Cities Asian Cities Climate Change Resilience Network (ACCCRN) Renewable Energy Jobs Nevada Public Radio","Las Vegas city buildings go 100% renewable
",https://www.facebook.com/130268756992804/posts/1462659163753750/,5/4/2017
Not in database,n/a,n/a,n/a,"2017-11-07 Yale Climate Connections -- Alaska's permafrost is melting, putting some people’s ...",#N/A,#N/A,https://yaleclimateconnections.org/2017/11/melting-permafrost-puts-alaska-homes-on-shaky-ground/,$72.73,6079441126094,"23,574","4,577",748,247,$0.0159,$0.097,$0.29,,194.155,10,"Alaska's permafrost is melting, putting some people’s homes at risk.",Melting permafrost is leaving some people’s homes on shaky ground ,https://www.facebook.com/130268756992804/posts/1693279130691751/,12/4/2017
"Skara Brae, an ancient village made of stone, could be lost to climate change",1/3/19 7:00,Diana Madson,Oceans,2019-01-03 Yale Climate Connections -- When the Stone Age meets climate change:,#N/A,#N/A,https://www.yaleclimateconnections.org/2019/01/stone-age-village-could-be-lost/,$106.88,6106746472494,"18,012","3,243",247,225,$0.0330,$0.433,$0.48,9,180.047,12,When the Stone Age meets climate change:,An ancient village made of stone could be lost to climate change,https://www.facebook.com/130268756992804/posts/2240805525939106/,2/4/2019
"Scientist is fascinated, frightened by her work",12/8/2016,"Is This How You Feel, Ruth Mottram, Sara Peach","Science, Sustainability",2016-12-08 Yale Climate Connections -- Scientists that work intimately with Earth’s climate a...,#N/A,#N/A,http://www.yaleclimateconnections.org/2016/12/scientist-is-fascinated-frightened-by-her-work/,$134.41,6061169379894,"43,312","4,507",608,,$0.0298,$0.221,#DIV/0!,,104.059,0,"Scientists that work intimately with Earth’s climate and ecosystems have the clearest vision of what they could look like in the future, and that has Dr. Ruth Mottram frightened.  Listen in and hear what has Ruth so distressed about the environment her children will inherit by 2050. Is This How You Feel?","Scientist Is Fascinated, Frightened by Her Work",https://www.facebook.com/130268756992804/posts/1339831632703171/,1/4/2017
Not in database,n/a,n/a,n/a,2018-09-07 Yale Climate Connections -- “It’s a matter of justice. It’s a matter of equality. ...,#N/A,#N/A,https://www.yaleclimateconnections.org/2018/09/making-solar-accessible-to-everyone,$191.28,6098209591094,"15,851","3,132",180,51,$0.0611,$1.063,$3.75,8,197.590,3,"“It’s a matter of justice. It’s a matter of equality. It’s a matter of being fair.” 
— Dant’e King, Director of Community Engagement with Groundswell",How one organization is working to make solar accessible to everyone,https://www.facebook.com/130268756992804/posts/2066658533353807/,10/4/2018
Norfolk prepares for sea-level rise and more,7/26/2016,"Bud Ward, sea level rise, sinking land","Sea Level Rise, Sustainability, Weather","Is Norfolk, VA the ""canary in the coal mine"" for cities combating climate cha...",#N/A,#N/A,http://www.yaleclimateconnections.org/2016/07/norfolk-prepares-for-sea-level-rise-and-more/,$75.07,6053767567894,"17,788","1,329",250,,$0.0565,$0.300,#DIV/0!,,74.713,0,"Is Norfolk, VA the ""canary in the coal mine"" for cities combating climate change? Hear more on today's episode.",Norfolk prepares for sea-level rise and more ,https://www.facebook.com/130268756992804/posts/1221797804506555/,8/4/2016
Solar power is saving this farmer money,10/2/18 7:00,NULL,"Energy, Food &amp; Agriculture","2018-10-08 Yale Climate Connections -- “I would highly encourage any grower, no matter the si...",#N/A,#N/A,https://www.yaleclimateconnections.org/2018/10/solar-power-is-saving-this-farmer-money/,$317.29,6100416957294,"19,192","4,414",436,74,$0.0719,$0.728,$4.29,9,229.992,4,"“I would highly encourage any grower, no matter the size, to explore solar. The financial aspect of it just makes sense.” — A. J. Hood, manager of Tillar and Company",Solar power is saving this farmer money » Yale Climate Connections,https://www.facebook.com/130268756992804/posts/2106460116040315/,11/4/2018
Teen gets city to pass solar rules,1/25/18 7:00,Eileen Mignoni,Policy &amp; Politics,2018-01-25 Yale Climate Connections -- “It’s my goal to see the Sunshine State become the sol...,#N/A,#N/A,https://www.yaleclimateconnections.org/2018/01/teen-gets-city-to-pass-solar-rules/,$97.86,6083150676894,"30,904","7,340",432,232,$0.0133,$0.227,$0.42,,237.510,8,“It’s my goal to see the Sunshine State become the solar state.” — Delaney Reynolds,How one teenager got a city to pass new solar rules ,https://www.facebook.com/130268756992804/posts/1774969982522665/,2/4/2018
What 18 states and Puerto Rico are doing to meet the goals of the Paris agreement,1/31/19 7:00,NULL,Policy &amp; Politics,2019-01-31 Yale Climate Connections -- President Trump pulled the U.S. out of the Paris clima...,#N/A,#N/A,https://www.yaleclimateconnections.org/2019/01/16-states-work-toward-paris-goals/,$210.54,6108722391094,"34,200","6,984",612,204,$0.0301,$0.344,$1.03,10,204.211,6,"President Trump pulled the U.S. out of the Paris climate accord. But at the state and local level, Americans continue to take climate action:",What 18 states and Puerto Rico are doing to meet the goals of the Paris Agreement ,https://www.facebook.com/130268756992804/posts/2283460998340225/,2/4/2019
Pave the way for solar panel roads?,12/1/2016,"Bruce Lieberman, solar roads",Energy,"2016-12-01 Yale Climate Connections -- When it comes to roads, there hasn’t been much radical...",#N/A,#N/A,http://www.yaleclimateconnections.org/2016/12/pave-the-way-for-solar-panel-roads/,$182.17,6060802304894,"42,440","6,033",864,,$0.0302,$0.211,#DIV/0!,,142.154,0,"You've heard of rooftop solar, but how about solar roads? Scott and Julie Brusaw of Solar Roadways, are building and testing solar panel roadways, which could become a major source of electricity. Listen in to learn more.",Pave the Way for … Solar Panel Roadways?,https://www.facebook.com/130268756992804/posts/1331806626839005/,1/4/2017
Climate films to watch in 2017,2/10/2017,"Daisy Simmons, films","Arts, Energy, Feature Article, National Security","2017-02-11 Yale Climate Connections -- Four recommendations for provocative, intelligently ma...",#N/A,#N/A,http://www.yaleclimateconnections.org/2017/02/climate-films-to-watch-in-2017/,$48.77,6064442555894,"24,388","2,062",392,,$0.0237,$0.124,#DIV/0!,,84.550,0,"Four recommendations for provocative, intelligently made films on climate change that can make you think, feel, and act. You can also view trailers for them.",Climate Films to Watch in 2017 | by Daisy Simmons,https://www.facebook.com/130268756992804/posts/1420405211312479/,3/4/2017
Not in database,n/a,n/a,n/a,2017-01-27 Yale Climate Connections -- The Portland Public Schools board voted unanimously to...,#N/A,#N/A,http://www.yaleclimateconnections.org/2017/teaching-climate-change-in-portland-oregon/,$14.82,6063650109694,"22,108","2,988",245,,$0.0050,$0.060,#DIV/0!,,135.155,0,"The Portland Public Schools board voted unanimously to put climate change in the classroom – teaching kids accurate science and options for action. Listen in.  #climatechange 

AFT - American Federation of Teachers  U.S. Department of Education","Teaching Climate Change in Portland, Oregon",https://www.facebook.com/130268756992804/posts/1392804834072517/,2/16/2017
The Northeast is poised to regain momentum on clean energy,2/14/19 7:05,Jan Ellen Spiegel,"Energy, Feature Article, Policy &amp; Politics","2019-02-22 Yale Climate Connections -- For the first time in 25 years, a Nobel Prize winning ...",#N/A,#N/A,https://www.yaleclimateconnections.org/2019/02/climate-music-project-turns-data-into-concerts/,$71.99,6110366812694,"8,135","1,649",222,102,$0.0437,$0.324,$0.71,7,202.704,13,"For the first time in 25 years, a Nobel Prize winning climate scientist had an audience member come up to him and say, “This has changed my life, I now realize how urgent the issue is and I'm going to take action.” What was different? This time, the scientist communicated through music.",The Climate Music Project is turning data into concerts ,https://www.facebook.com/130268756992804/posts/2317914461561545/,3/4/2019
Intergenerational conversation: An antidote to climate despair,2/28/19 7:00,NULL,"Communicating Climate, Youth","2019-03-27 Yale Climate Connections -- If you’ve already cut back on meat, here are four addi...",#N/A,#N/A,https://www.yaleclimateconnections.org/2019/03/4-ways-to-cut-carbon-from-your-diet/,$13.43,6112852491494,"1,222",300,21,70,$0.0448,$0.640,$0.19,7,245.499,57,"If you’ve already cut back on meat, here are four additional ways to reduce the climate impact of your food and drink. 

This is the third installment of a 5-part series this week on how to reduce your carbon footprint. Check it out.",4 ways to cut carbon from your diet » by Craig K. Chandler,https://www.facebook.com/130268756992804/posts/2366587000027624/,4/4/2019
"Biologist wants to use green roofs, help her city cope with extreme weather",12/24/18 7:00,NULL,"Food &amp; Agriculture, Weather Extremes",2018-12-24 Yale Climate Connections -- Liliana Jaramillo seeks out native drought-resistant p...,#N/A,#N/A,https://www.yaleclimateconnections.org/2018/12/biologist-says-green-roofs-could-protect-her-city/,$48.63,6106150944894,"6,884","1,453",102,34,$0.0335,$0.477,$1.43,9,211.069,5,Liliana Jaramillo seeks out native drought-resistant plants that could help her city weather the weather:,This biologist says green roofs could help her city cope with weather extremes,https://www.facebook.com/130268756992804/posts/2225102680842724/,1/4/2019
How family size shapes your carbon footprint,3/29/19 7:05,Craig K. Chandler,"Feature Article, Religion &amp; Morality",2019-04-04 Yale Climate Connections -- Armadillos receive a “warm” welcome in North Carolina:,#N/A,#N/A,https://www.yaleclimateconnections.org/2019/04/armadillos-are-moving-north/,$162.35,6113473360494,"20,739","4,800",507,189,$0.0338,$0.320,$0.86,9,231.448,9,Armadillos receive a “warm” welcome in North Carolina:,Armadillos are moving north,https://www.facebook.com/130268756992804/posts/2379172965435694/,5/4/2019
Deadly threat to dogs on the rise,5/31/2017,"Daisy Simmons, public health",Public Health,"2017-05-31 Yale Climate Connections -- Climate change is helping toxic algae spread, a lethal...",#N/A,#N/A,https://www.yaleclimateconnections.org/2017/05/temperatures-rise-and-so-does-a-deadly-threat-to-dogs/,$154.20,6070067705494,"35,037","5,037","1,215",576,$0.0306,$0.127,$0.27,,143.762,16,"Climate change is helping toxic algae spread, a lethal risk to animals.",Deadly threat to dogs on the rise. ,https://www.facebook.com/130268756992804/posts/1517704911582508/,6/4/2017
Not in database,n/a,n/a,n/a,2018-04-27 Yale Climate Connections -- The YCC radio show has been selected as part of the Ap...,#N/A,#N/A,https://www.facebook.com/YaleClimateConnections/photos/a.705159666170374/1876273889058940/?type=3,$3.15,6089264791094,993,190,12,,$0.0166,$0.263,#DIV/0!,,191.339,0,"The YCC radio show has been selected as part of the Apple Podcasts ""Every Day is Earth Day"" collection. Check the entire list out here: http://apple.co/earthDay",,https://www.facebook.com/130268756992804/posts/1876273935725602/,5/4/2018
Could we turn traffic into ... electricity?,3/14/2017,"Diana Madson, energy",Energy,2017-03-14 Yale Climate Connections -- Scientists are bringing a whole new meaning to the phr...,#N/A,#N/A,http://www.yaleclimateconnections.org/2017/03/could-we-turn-traffic-into-electricity/,$77.37,6066157222694,"28,363","3,308",587,,$0.0234,$0.132,#DIV/0!,,116.631,0,"Scientists are bringing a whole new meaning to the phrase “good vibrations.” The California Energy Commission is exploring a technology that would convert the vibrations from vehicles on roads into electricity. Listen to learn just how much energy this tech could create. 

California Energy Commission Californians for Energy Independence Clean Energy California Energy Upgrade California Clean Energy Collective Capital Public Radio La Tricolor 99.9",Could we turn traffic into … electricity? ,https://www.facebook.com/130268756992804/posts/1449210628431937/,4/4/2017
The Great Barrier Reef's color is fading,10/27/2016,"coral bleaching, Daisy Simmons, Great Barrier Reef","Ecosystems, Oceans","2016-10-27 Yale Climate Connections -- After the recent El Niño, more than 90 percent of the ...",#N/A,#N/A,http://www.yaleclimateconnections.org/2016/10/the-great-barrier-reefs-color-is-fading/,$10.59,6058869808094,"2,210",390,61,,$0.0272,$0.174,#DIV/0!,,176.471,0,"After the recent El Niño, more than 90 percent of the 1,400-mile long Great Barrier Reef is bleaching.  This dying habitat supports 30 kinds of whales and dolphins, 1,500 kinds of fish and generates over 5 billion dollars in annual revenue.  Tune in today to learn more about this tragedy and what needs to happen to reverse the damage.",The Great Barrier Reef's color is fading ,https://www.facebook.com/130268756992804/posts/1307758662577135/,11/4/2016
Not in database,n/a,n/a,n/a,2019-03-12 Yale Climate Connections -- Frances Seymour of the World Resources Institute says ...,#N/A,#N/A,https://bit.ly/2CcK9YJ,$219.40,6111673674694,"29,136","6,206",588,62,$0.0354,$0.373,$3.54,9,213.001,2,"Frances Seymour of the World Resources Institute says that when countries give indigenous people more control over land, deforestation slows:  https://bit.ly/2CcK9YJ",Researcher says indigenous people are the best stewards of tropical forests ,https://www.facebook.com/130268756992804/posts/2344107008942290/,4/4/2019
Warm oceans can turn reefs into graveyard,9/19/2017,"Bruce Lieberman, coral bleaching, oceans",Oceans,"2017-09-19 Yale Climate Connections -- Corals are extremely sensitive to warm waters, and glo...",#N/A,#N/A,https://www.yaleclimateconnections.org/2017/09/warm-oceans-can-turn-coral-reefs-into-graveyard/,$264.21,6077097289294,"48,407","8,602","1,667",178,$0.0307,$0.158,$1.48,,177.702,4,"Corals are extremely sensitive to warm waters, and global warming is putting the world’s reefs at risk.",How warm oceans can turn coral reefs into graveyards,https://www.facebook.com/130268756992804/posts/1646576782028653/,10/4/2017
Google 'street view' cars hunt for methane,4/13/2017,"Bruce Lieberman, greenhouse gas emissions",Science,2017-04-13 Yale Climate Connections -- Google partnered with the Environmental Defense Fund t...,#N/A,#N/A,http://www.yaleclimateconnections.org/2017/04/google-street-view-cars-hunt-for-methane/,$67.96,6068024837494,"18,188","1,975",325,,$0.0344,$0.209,#DIV/0!,,108.588,0,"Google partnered with the Environmental Defense Fund to map the invisible. Methane, a global-warming gas 84 times more potent than carbon dioxide, leaks from old and worn-out pipelines. By equipping its ‘Street View’ cars with methane sensors, Google is helping cities to map leaks and fix them.",Google ‘Street View’ cars hunt for global warming pollution ,https://www.facebook.com/130268756992804/posts/1467753093244357/,5/4/2017
Kids send postcards to Trump,3/31/2017,"Bruce Lieberman, Earth Day",Policy,"2017-03-31 Yale Climate Connections -- Politicians, leaders, and activists alike can speak fo...",#N/A,#N/A,http://www.yaleclimateconnections.org/2017/03/kids-send-global-warming-postcards-to-trump/,$245.65,6067113536294,"41,958","7,991",692,,$0.0307,$0.355,#DIV/0!,,190.452,0,"Politicians, leaders, and activists alike can speak for today’s children, but what if they were able to speak for themselves? “Kids 4 Planet Earth” gives future generations a voice to speak out about climate change by sending postcards to the president. Tune in to learn what these children have to say. #planetearth 

Our Children's Trust Commonwealth Youth Climate Change Network Ghana Youth Climate Coalition",Kids send global warming postcards to Trump ,https://www.facebook.com/130268756992804/posts/1458606774158989/,4/4/2017
How climate change hurts children's health,4/17/18 7:00,Sarah Kennedy,Health,2018-04-17 Yale Climate Connections -- Nobody is exempt from the effects of climate change — ...,#N/A,#N/A,https://www.yaleclimateconnections.org/2018/04/how-climate-change-hurts-childrens-health/,$32.42,6087932558094,"11,604","2,303",375,53,$0.0141,$0.086,$0.61,,198.466,5,Nobody is exempt from the effects of climate change — but children’s health is especially at risk.,Children’s health is disproportionately affected by climate change,https://www.facebook.com/130268756992804/posts/1865452146807781/,5/4/2018
Regulating self-driving vehicles,9/1/2016,"autonomous vehicles, Bud Ward, safety, self driving cars","Energy, Policy","As part of our ongoing series on self-driving vehicles, today's episode highl...",#N/A,#N/A,http://www.yaleclimateconnections.org/2016/09/regulators-keeping-eye-on-self-driving-vehicles/,$7.97,6056308995094,"1,029",61,4,,$0.1307,$1.993,#DIV/0!,,59.281,0,"As part of our ongoing series on self-driving vehicles, today's episode highlights the regulatory picture. As technology advances, how are regulatory agencies focusing on making sure the vehicles are safe before they hit the market? Listen in below.",Regulating self-driving vehicles,https://www.facebook.com/130268756992804/posts/1252835748069427/,10/4/2016
Father-son chats led to climate action,6/26/18 7:00,Eileen Mignoni,Communicating Climate,2018-06-26 Yale Climate Connections -- How a father-and-son chat led to a $400 million bond t...,#N/A,#N/A,https://www.yaleclimateconnections.org/2018/06/father-son-chats-led-to-climate-action/,$220.43,6093175979894,"24,824","3,678",256,205,$0.0599,$0.861,$1.08,7,148.163,8,How a father-and-son chat led to a $400 million bond that will address flooding in Miami:,The son of Miami’s mayor persuaded him to take action on sea-level rise,https://www.facebook.com/130268756992804/posts/1947549165264745/,7/4/2018
Climate adaptation key: wild apples,7/18/2016,"apples, climate change adaptation, Sara Peach",Food & Agriculture,Wild apple varieties may be more climate change-resistant than those we curre...,#N/A,#N/A,http://www.yaleclimateconnections.org/2016/07/climate-adaptation-key-wild-apples/,$31.20,6053307329294,"8,686",287,61,,$0.1087,$0.511,#DIV/0!,,33.042,0,"Wild apple varieties may be more climate change-resistant than those we currently see in stores. The USDA is helping bring these resilient varietals to breeders and, eventually, to market. Listen to the story on today's episode.",Climate adaptation key: wild apples - Yale Climate Connections,https://www.facebook.com/130268756992804/posts/1216693818350287/,8/4/2016
Not in database,n/a,n/a,n/a,"2018-08-03 Yale Climate Connections -- Human-tested, canine-approved.",#N/A,#N/A,https://www.yaleclimateconnections.org/2018/08/los-angeles-is-cooling-down-hot-asphalt,$44.09,6095820508494,"9,960","1,929",178,390,$0.0229,$0.248,$0.11,8,193.675,39,"Human-tested, canine-approved.",How Los Angeles is cooling down hot asphalt,https://www.facebook.com/130268756992804/posts/2010511522301842/,9/4/2018
Lawyer helps wind grow in Iowa,3/30/2017,"agriculture, Bruce Lieberman, energy, wind","Energy, Food & Agriculture",2017-03-30 Yale Climate Connections -- Wind power is on the rise in Iowa and with a backgroun...,#N/A,#N/A,http://www.yaleclimateconnections.org/2017/03/lawyer-helps-wind-grow-in-iowa/,$100.02,6067051769694,"20,498","3,270",351,,$0.0306,$0.285,#DIV/0!,,159.528,0,"Wind power is on the rise in Iowa and with a background in agriculture, attorney Kathy Law is helping farmers secure steady streams of income with wind turbine leases. “It’s a product just like our corn and soybeans. Why not harness it and benefit from it?” she says.
 
Nyemaster Goode Iowa Public Radio Red Fern Farm Corn Farmers Coalition Iowa Wind and Solar"," Lawyer helps wind grow in Iowa 
",https://www.facebook.com/130268756992804/posts/1458596294160037/,4/4/2017
How family size shapes your carbon footprint,3/29/19 7:05,Craig K. Chandler,"Feature Article, Religion &amp; Morality",2019-04-03 Yale Climate Connections -- The Midwest and Plains aren't out of danger yet.,#N/A,#N/A,https://www.yaleclimateconnections.org/2019/04/did-climate-change-cause-midwest-flooding/,$27.43,6113367051894,"3,134",748,70,75,$0.0367,$0.392,$0.37,9,238.673,24,The Midwest and Plains aren't out of danger yet.,Did climate change cause the flooding in the Midwest and Plains?,https://www.facebook.com/130268756992804/posts/2376617052357952/,5/4/2019
Company turns piped water into electricity,3/22/2017,"Erika Street Hopman, renewable energy, water",Energy,"2017-03-22 Yale Climate Connections -- To reach your tap, water flows through pressurized pip...",#N/A,#N/A,http://www.yaleclimateconnections.org/2017/03/company-turns-piped-water-into-electricity/,$163.36,6066584861294,"34,714","5,189",882,,$0.0315,$0.185,#DIV/0!,,149.479,0,"To reach your tap, water flows through pressurized pipes. By attaching turbines and generators to those pipes, Lucid Energy is converting water pressure into electricity. Tune in to learn more about this innovative source of hydroelectricity. 

Oregon Public Broadcasting- OPB Clean Energy Collective Oregon Zoo U.S. Department of Energy U.S. Environmental Protection Agency",Company turns piped water into electricity ,https://www.facebook.com/130268756992804/posts/1453660954653571/,4/4/2017
"Doctor: To fight asthma, fight global warming",3/27/2017,"Daisy Simmons, public health",Public Health,"2017-03-27 Yale Climate Connections -- Children, with developing immune systems, are vulnerab...",#N/A,#N/A,http://www.yaleclimateconnections.org/2017/03/doctor-to-fight-asthma-fight-global-warming/,$62.89,6066865565494,"13,492","1,530",289,,$0.0411,$0.218,#DIV/0!,,113.401,0,"Children, with developing immune systems, are vulnerable to airborne allergens, and climate change is causing longer allergy seasons. Tune in to hear from pediatric asthma and allergy specialist Jennifer Caicedo. 

Asthma & Allergy Specialists, P.A. Allergy & Asthma Network Global Climate & Health Alliance","Doctor: To fight asthma, fight global warming ",https://www.facebook.com/130268756992804/posts/1458561497496850/,4/4/2017
How the World Evangelical Alliance engages climate skeptics,2/4/19 7:00,NULL,Religion &amp; Morality,2019-02-25 Yale Climate Connections -- This new hybrid is designed to be more efficient and m...,#N/A,#N/A,https://www.yaleclimateconnections.org/2019/02/hybrid-facility-captures-sun-and-wind-energy/,$204.63,6110555067694,"30,615","6,257",751,181,$0.0327,$0.272,$1.13,9,204.377,6,This new hybrid is designed to be more efficient and more reliable than either solar or wind farms., A new hybrid power plant in Minnesota can capture both solar and wind energy,https://www.facebook.com/130268756992804/posts/2322788867740771/,3/4/2019
New stoves cut carbon pollution in Uganda,12/16/2016,"Bud Ward, cookstoves, Uganda",Public Health,2016-12-16 Yale Climate Connections -- Around 3 billion people cook and heat their homes usin...,#N/A,#N/A,http://www.yaleclimateconnections.org/2016/12/new-stoves-cut-carbon-pollution-in-uganda/,$6.56,6061625906894,"1,753",251,17,,$0.0261,$0.386,#DIV/0!,,143.183,0,"Around 3 billion people cook and heat their homes using open fires. Over 4 million of them die prematurely from illness attributable to the household air pollution. Listen in to learn how ""Cool Effect"" is addressing this concern in Uganda. Uganda Premier League  Outreach Uganda  Peace Corps Uganda World Health Organization (WHO)",New Stoves Cut Carbon Pollution in Uganda,https://www.facebook.com/130268756992804/posts/1347954281890906/,1/4/2017
"Thanks to energy efficiency, Michigan residents save billions of dollars on utility bills",10/16/18 7:00,Daisy Simmons,Energy,2018-10-16 Yale Climate Connections -- Bottom line: Utility energy efficiency programs save e...,#N/A,#N/A,https://www.yaleclimateconnections.org/2018/10/energy-efficiency-is-saving-michigan-residents-money/,$34.15,6101043611294,"2,522",497,41,8,$0.0687,$0.833,$4.27,9,197.066,3,"Bottom line: Utility energy efficiency programs save energy and money. $3.3 billion in Michigan, to be exact.",Energy efficiency is saving Michigan residents billions of dollars on utility bills,https://www.facebook.com/130268756992804/posts/2119056274780699/,11/4/2018
How solar can transform poor communities,8/14/18 7:00,Sarah Kennedy,"Energy, Jobs &amp; Economy",2018-08-14 Yale Climate Connections -- “This is a way of attempting to rebalance the scales.”...,#N/A,#N/A,https://www.yaleclimateconnections.org/2018/08/how-solar-can-transform-low-income-communities/,$238.79,6096580081694,"36,488","7,478",926,354,$0.0319,$0.258,$0.67,8,204.944,10,“This is a way of attempting to rebalance the scales.”  — Frank Ortiz of Serenity Soular,How solar projects can transform low-income communities,https://www.facebook.com/130268756992804/posts/2029910027028658/,9/4/2018
Not in database,n/a,n/a,n/a,2016-12-12 Yale Climate Connections -- Check out this article by The Christian Science Monito...,#N/A,#N/A,http://www.csmonitor.com/Environment/Inhabit/2016/1205/Protesters-Dakota-pipeline-win-may-be-both-short-and-long-lived,$163.96,6061389128694,"38,520","5,133",569,,$0.0319,$0.288,#DIV/0!,,133.255,0,Check out this article by The Christian Science Monitor explaining how Standing Rock could mark a turning point in climate activism.,Protesters' Dakota pipeline win may be both short- and long-lived,https://www.facebook.com/130268756992804/posts/1355128134506854/,1/4/2017
Not in database,n/a,n/a,n/a,2018-02-08 Yale Climate Connections -- “Our goal has been to create the most sustainable new ...,#N/A,#N/A,https://bit.ly/2rYs3ai,$208.42,6083928030894,"35,902","6,518",491,548,$0.0320,$0.424,$0.38,,181.550,15,“Our goal has been to create the most sustainable new town in America.” — developer Syd Kitson,Developer wants to build a town where no one will need to drive ,https://www.facebook.com/130268756992804/posts/1789612037725126/,3/4/2018
Not in database,n/a,n/a,n/a,2018-01-23 Yale Climate Connections -- The short version: climate ≠ weather.,#N/A,#N/A,https://www.yaleclimateconnections.org/2018/01/if-global-warming-is-real-why-is-it-snowing,$52.20,6083045631494,"16,775","2,638",343,177,$0.0198,$0.152,$0.29,,157.258,11,The short version: climate ≠ weather.,"“If global warming is real, why is it snowing?” ",https://www.facebook.com/130268756992804/posts/1772769779409352/,2/4/2018
Changing minds on a changing climate,4/18/2017,"climate change communications, Karin Kirk, public attitudes","Feature Article, Science","2017-04-22 Yale Climate Connections -- 1. Learning about the science
2. Stewardship and care ...",#N/A,#N/A,http://www.yaleclimateconnections.org/2017/04/changing-minds-on-a-changing-climate/,$74.61,6068404912894,"11,394","1,439",114,,$0.0518,$0.654,#DIV/0!,,126.295,0,"1. Learning about the science
2. Stewardship and care for Earth have universal appeal
3. Weird, warm, and wild weather changes minds
4. ______",4 Reasons Climate Change Deniers Left Denial Behind,https://www.facebook.com/130268756992804/posts/1491262067560126/,5/4/2017
Florida teen speaks out on sea-level rise,1/24/18 7:00,Eileen Mignoni,"Policy &amp; Politics, Youth","2018-01-24 Yale Climate Connections -- At 18, she’s already helped draft environmental policy...",#N/A,#N/A,https://www.yaleclimateconnections.org/2018/01/south-florida-teen-speaks-out-on-sea-level-rise/,$77.79,6083095310694,"21,792","5,166",467,166,$0.0151,$0.167,$0.47,,237.059,8,"At 18, she’s already helped draft environmental policy, and now she’s writing a book to inspire others to take action.",South Florida teen educates others on the dangers of sea-level rise ,https://www.facebook.com/130268756992804/posts/1773910299295300/,2/4/2018
Wildfire-fighting challenges in Colorado,8/24/2016,"drought, firefighters, Sara Peach, wildfires","Ecosystems, Weather",#Wildfires are plaguing the western US this summer season. Hear more about ho...,#N/A,#N/A,http://www.yaleclimateconnections.org/2016/08/wildfire-fighting-challenges-in-colorado/,$43.36,6055637144694,"6,374",488,68,,$0.0889,$0.638,#DIV/0!,,76.561,0,#Wildfires are plaguing the western US this summer season. Hear more about how longer fire seasons and drier conditions are making fires more ferocious – and capable of surprising even the most experienced firefighters – on today's episode.,Wildfire-fighting challenges in Colorado ,https://www.facebook.com/130268756992804/posts/1245351125484556/,9/4/2016
Seeing tomorrow's sea-level rise today,1/3/2017,"Sara Peach, sea level rise","Oceans, Sea Level Rise",2017-01-03 Yale Climate Connections -- This was awesome! The County of San Mateo had installe...,#N/A,#N/A,http://www.yaleclimateconnections.org/2017/01/virtual-reality-view-of-sea-level-rise/,$56.98,6062404329894,"21,784","1,772",189,,$0.0322,$0.301,#DIV/0!,,81.344,0,"This was awesome! The County of San Mateo had installed virtual reality viewfinders in California's Coyote Point Park that allowed people a glimpse of what sea-level rise could look like. 

San Mateo County Parks Foundation  Look Ahead - San Mateo","SEE TOMORROW’S SEA-LEVEL RISE, TODAY        ",https://www.facebook.com/130268756992804/posts/1371329892886678/,2/16/2017
Not in database,n/a,n/a,n/a,2017-07-25 Yale Climate Connections -- According to Florida State University climatologist Da...,#N/A,#N/A,https://www.yaleclimateconnections.org/2017/drought-heat-spark-florida-wildfires/,$71.41,6072894599094,"21,521","1,981",200,86,$0.0360,$0.357,$0.83,,92.050,4,"According to Florida State University climatologist David Zierden, Florida needs to prepare for more severe fire seasons like this in the future.",Unusual drought and heat spark Florida wildfires,https://www.facebook.com/130268756992804/posts/1592045580815107/,8/4/2017
Pastor mobilizes black churches on climate,3/22/18 7:00,Diana Madson,Religion &amp; Morality,"2018-03-22 Yale Climate Connections -- Rev. Dr. Ambrose F. Carroll preaches renewable energy,...",#N/A,#N/A,https://www.yaleclimateconnections.org/2018/03/pastor-mobilizes-black-churches-to-act-on-climate/,$21.09,6086312421694,"7,695","1,664",93,17,$0.0127,$0.227,$1.24,,216.244,2,"Rev. Dr. Ambrose F. Carroll preaches renewable energy, food security, and environmental justice.", Pastor mobilizes black churches to act on climate ,https://www.facebook.com/130268756992804/posts/1836760623010267/,4/4/2018
"San Diego building owners pledge to cut pollution, conserve resources",12/19/18 7:00,NULL,Energy,2018-12-19 Yale Climate Connections -- And now for some good news:,#N/A,#N/A,https://www.yaleclimateconnections.org/2018/12/san-diego-building-owners-to-reduce-pollution/,$114.33,6105794375894,"10,916","2,501",132,26,$0.0457,$0.866,$4.40,9,229.113,2,And now for some good news:,"San Diego building owners pledge to cut pollution, conserve resources",https://www.facebook.com/130268756992804/posts/2217529938266665/,1/4/2019
Hayhoe video: why facts aren't enough,1/18/2017,"Global Weirding, Katharine Hayhoe","Feature Article, Science","2017-01-18 Yale Climate Connections -- If I just explain the climate science facts, they'll g...",#N/A,#N/A,http://www.yaleclimateconnections.org/2017/01/video-why-facts-arent-enough/,$31.12,6063209283694,"15,780","1,653",263,,$0.0188,$0.118,#DIV/0!,,104.753,0,"If I just explain the climate science facts, they'll get it, right? Listen in to scientist Katharine Hayhoe's new 7-1/2 minute video.",Why Facts Aren't Enough,https://www.facebook.com/130268756992804/posts/1395654243787576/,2/16/2017
Baseball team embraces solar power,7/27/18 7:00,Jan Ellen Spiegel,Energy,2018-07-27 Yale Climate Connections -- A co-benefit of solar: shade. 😎,#N/A,#N/A,https://www.yaleclimateconnections.org/2018/07/baseball-team-embraces-solar-power/,$62.10,6095324455494,"8,402","1,316",69,64,$0.0472,$0.900,$0.97,8,156.629,8,A co-benefit of solar: shade. 😎,Why this baseball team embraced solar power,https://www.facebook.com/130268756992804/posts/1998557716830556/,8/4/2018
"As seas rise, a South Carolina realtor worries people will be priced out of their homes",2/20/19 7:00,NULL,"Jobs &amp; Economy, Oceans",2019-02-21 Yale Climate Connections -- There is no age limit for climate advocacy:,#N/A,#N/A,https://www.yaleclimateconnections.org/2019/02/retired-doctor-fights-climate-change/,$161.61,6110288741694,"17,130","3,079",132,46,$0.0525,$1.224,$3.51,8,179.743,3,There is no age limit for climate advocacy:,A doctor is using his retirement to fight climate change,https://www.facebook.com/130268756992804/posts/2316249661728025/,3/4/2019
Four scientists make creativity a key to communicating their research,5/21/19 7:05,Peter Sinclair,"Arts &amp; Culture, Communicating Climate","2019-05-08 Yale Climate Connections -- In low-income ZIP codes, customers pay an additional $...",#N/A,#N/A,https://www.yaleclimateconnections.org/2019/05/led-bulbs-cost-more-in-poor-areas/,$148.18,6116195452294,"18,569","3,193",427,224,$0.0464,$0.347,$0.66,8,171.953,12,"In low-income ZIP codes, customers pay an additional $6 to buy an LED bulb over an incandescent bulb. In higher-income zip codes, customers only pay an additional $3. What’s up with that?",Energy efficient bulbs save money. But they cost more in poor neighborhoods. ,https://www.facebook.com/130268756992804/posts/2435201653166158/,6/4/2019
Connecting Latino communities to climate change action: One woman's story,1/1/19 7:00,Daisy Simmons,Policy &amp; Politics,"2019-01-01 Yale Climate Connections -- In the U.S., one out of two Spanish-speaking people li...",#N/A,#N/A,https://www.yaleclimateconnections.org/2019/01/connecting-latino-communities-to-climate-action/,$77.12,6106606806894,"9,730","1,983",127,48,$0.0389,$0.607,$1.61,9,203.803,5,"In the U.S., one out of two Spanish-speaking people live in areas where air quality violates health standards:",She grew up in a polluted neighborhood. Now she’s a bridge.,https://www.facebook.com/130268756992804/posts/2237842782902047/,2/4/2019
California's groundwater problem lingers,9/6/2017,"Bruce Lieberman, drought, water resources",Sustainability,2017-09-06 Yale Climate Connections -- Is California's water consumption sustainable?,#N/A,#N/A,https://www.yaleclimateconnections.org/2017/09/californias-drought-is-over-but-its-groundwater-problem-isnt/,$69.56,6074795510694,"27,942","4,171",624,252,$0.0167,$0.111,$0.28,,149.273,9,Is California's water consumption sustainable?,"California’s drought is over, but its groundwater problem isn’t ",https://www.facebook.com/130268756992804/posts/1634220963264235/,10/4/2017
Not in database,n/a,n/a,n/a,"2018-02-16 Yale Climate Connections -- This technology is still being refined, but developers...",#N/A,#N/A,https://bit.ly/2EABvpt,$198.02,6084346348094,"33,149","6,047",657,276,$0.0327,$0.301,$0.72,,182.419,8,"This technology is still being refined, but developers say it looks promising.",This company wants to capture energy from the tides  ,https://www.facebook.com/130268756992804/posts/1798431713509825/,3/4/2018
Kit allows you to set up a microgrid,6/18/18 7:00,Daisy Simmons,Energy,"2018-06-18 Yale Climate Connections -- “If you can put together an Ikea bed-frame, you can pr...",#N/A,#N/A,https://www.yaleclimateconnections.org/2018/06/kit-allows-you-to-set-up-a-microgrid/,$92.97,6092615947694,"30,664","2,590",261,939,$0.0359,$0.356,$0.10,9,84.464,31,"“If you can put together an Ikea bed-frame, you can probably put together our microgrid system.” —  Angelo Campus, founder of BoxPower","With this kit, you can set up a solar-powered microgrid",https://www.facebook.com/130268756992804/posts/1934989266520735/,7/4/2018
Tiny rabbit has a big climate problem,5/28/18 7:00,Diana Madson,Species &amp; Ecosystems,2018-05-28 Yale Climate Connections -- Climate change is backing this furry friend into a cor...,#N/A,#N/A,https://www.yaleclimateconnections.org/2018/05/tiny-rabbit-has-a-big-climate-problem/,$43.19,6091170329894,"16,332","2,498",265,158,$0.0173,$0.163,$0.27,,152.951,10,Climate change is backing this furry friend into a corner.,Tiny rabbit has a big climate problem,https://www.facebook.com/130268756992804/posts/1908611045825224/,6/4/2018
Not in database,n/a,n/a,n/a,2017-01-25 Yale Climate Connections -- The Silver Oak Winery found its silver lining after a ...,#N/A,#N/A,http://www.yaleclimateconnections.org/2017/winery-crushes-grapes-and-carbon-emissions/,$12.70,6063535939294,"1,391",102,14,,$0.1245,$0.907,#DIV/0!,,73.329,0,"The Silver Oak Winery found its silver lining after a devastating fire. This Napa Valley vineyard rebuilt with sustainability at its core. Listen in to learn how this LEED Platinum-certified winery now crushes more than grapes. #solar #sustainable #LEED #LEEDplatinum

Silver Oak Cellars The Napa Valley  U.S. Green Building Council (USGBC)",Winery Crushes Grapes and Carbon Emissions,https://www.facebook.com/130268756992804/posts/1392790897407244/,2/16/2017
Not in database,n/a,n/a,n/a,"2017-12-01 Yale Climate Connections -- Military operations use a lot of fossil fuels, and whe...",#N/A,#N/A,https://www.yaleclimateconnections.org/2017/11/veteran-touts-benefits-of-clean-energy/,$248.24,6080639054094,"35,740","7,538",659,119,$0.0329,$0.377,$2.09,,210.912,3,"Military operations use a lot of fossil fuels, and where they come from has major consequences.",Veteran says clean energy is good for the military,https://www.facebook.com/130268756992804/posts/1717887178230946/,1/4/2018
Southern Republican mayor goes all-in on solar,8/27/18 7:00,Diana Madson,Energy,"2018-08-27 Yale Climate Connections -- “We cannot continue to live off fossil fuel,” says Rep...",#N/A,#N/A,https://www.yaleclimateconnections.org/2018/08/southern-republican-mayor-goes-all-in-on-solar/,$106.28,6097432943894,"18,500","4,575",335,207,$0.0232,$0.317,$0.51,10,247.297,11,"“We cannot continue to live off fossil fuel,” says Republican Mayor Greg Lemons.",A Southern Republican mayor is going all-in on solar,https://www.facebook.com/130268756992804/posts/2052479698105024/,9/4/2018
Making climate change funny,8/1/2017,"arts, Bruce Lieberman, comedy","Arts, Feature Article",2017-08-24 Yale Climate Connections -- You may not consider climate change a laughing matter....,#N/A,#N/A,https://www.yaleclimateconnections.org/2017/08/making-climate-change-funny/,$191.33,6074271074294,"49,135","5,785",295,2290,$0.0331,$0.649,$0.08,,117.737,47,"You may not consider climate change a laughing matter. But every now and again, a little gallows humor may come in handy.",Making climate change funny,https://www.facebook.com/130268756992804/posts/1619170301435968/,9/4/2017
Flooding plagues lab where scientists study floods,9/4/18 7:00,Bruce Lieberman,Weather Extremes,"2018-09-04 Yale Climate Connections -- Oh, the irony.",#N/A,#N/A,https://www.yaleclimateconnections.org/2018/09/flooding-plagues-lab-where-scientists-study-floods/,$241.38,6097985428694,"38,720","7,268",876,511,$0.0332,$0.276,$0.47,9,187.707,13,"Oh, the irony.",Floodwaters are plaguing a lab where scientists study … coastal flooding,https://www.facebook.com/130268756992804/posts/2062907123728948/,10/4/2018
Clean energy jobs are booming in Minnesota,2/14/18 7:00,Daisy Simmons,"Energy, Jobs &amp; Economy",2018-02-14 Yale Climate Connections -- Skōl!,#N/A,#N/A,https://www.yaleclimateconnections.org/2018/02/clean-energy-jobs-are-booming-in-minnesota/,$136.88,6084239207294,"22,083","4,530",375,55,$0.0302,$0.365,$2.49,,205.135,2,Skōl!,Clean energy jobs are booming in Minnesota ,https://www.facebook.com/130268756992804/posts/1796245807061749/,3/4/2018
Teen activist blocks incinerator,4/10/2017,"Daisy Simmons, energy","Energy, Public Health",2017-04-10 Yale Climate Connections -- Here’s the story of an environmental victory – one ach... - Copy,#N/A,#N/A,http://www.yaleclimateconnections.org/2017/04/teen-activist-blocks-incinerator-in-polluted-neighborhood/,$139.73,6067819665894,"12,447","2,239",277,,$0.0624,$0.504,#DIV/0!,,179.883,0,"Here’s the story of an environmental victory – one achieved by high school student Destiny Watford. When she learned of plans to build an incinerator in a polluted Baltimore neighborhood, Watford was stunned. But she and her classmates championed a campaign that blocked the plant. 

Photo credit: United Workers Media Team 
 Student Activism for Equality (SAFE)",Teen activist blocks incinerator in polluted neighborhood ,https://www.facebook.com/130268756992804/posts/1467718259914507/,5/4/2017
Thoreau's surprising climate legacy,11/2/2016,"citizen science, Henry David Thoreau, Sara Peach",Ecosystems,"2016-11-02 Yale Climate Connections -- When writing his essays on Walden pond, 19th century p...",#N/A,#N/A,http://www.yaleclimateconnections.org/2016/11/thoreaus-surprising-climate-legacy/,$175.82,6059190847694,"58,912","5,271",885,,$0.0334,$0.199,#DIV/0!,,89.472,0,"When writing his essays on Walden pond, 19th century philosopher Henry David Thoreau unknowingly created a data goldmine for climate change researchers.  Listen in to hear what has scientists all abuzz.  BU Biology","Thoreau's Surprising Climate Legacy
",https://www.facebook.com/130268756992804/posts/1312792055407129/,12/4/2016
"Orlando, Florida, gives free composting kits to residents",2/15/19 7:00,NULL,Food &amp; Agriculture,2019-02-15 Yale Climate Connections -- The average American consumer wastes more than half a ...,#N/A,#N/A,https://www.yaleclimateconnections.org/2019/02/orlando-gives-away-composting-kits/,$39.31,6109855874894,"5,487","1,149",127,21,$0.0342,$0.310,$1.87,8,209.404,4,The average American consumer wastes more than half a pound of food each day. Orlando is taking the lead in changing that:,"Orlando, Florida, gives free composting kits to residents",https://www.facebook.com/130268756992804/posts/2306555616030763/,3/4/2019
Healthy forests soak up carbon,10/11/2016,"carbon, Diana Madson, forests","Ecosystems, Food & Agriculture",2016-10-11 Yale Climate Connections -- We are stuck in a catch-22. Healthy forests are critic...,#N/A,#N/A,http://www.yaleclimateconnections.org/2016/10/healthy-forests-soak-up-carbon/,$41.01,6058035722294,"8,062","1,120",179,,$0.0366,$0.229,#DIV/0!,,138.923,0,"We are stuck in a catch-22. Healthy forests are critical for fighting climate change but, climate change is threatening our forest. How do we break this cycle?  Learn more about carbon cycles on today’s episode of the Yale Climate Connections Radio Show.",Healthy forests soak up carbon ,https://www.facebook.com/130268756992804/posts/1291087940910874/,11/4/2016
Wind not blowing? Microsoft has a solution.,2/15/2017,"Diana Madson, wind power",Energy,2017-02-15 Yale Climate Connections -- Microsoft recently partnered with a local utility comp...,#N/A,#N/A,http://www.yaleclimateconnections.org/2017/02/wind-not-blowing-microsoft-has-a-solution/,$78.68,6064624900694,"22,935","2,717",313,,$0.0290,$0.251,#DIV/0!,,118.465,0,"Microsoft recently partnered with a local utility company to power its Wyoming data center with wind energy. Listen in as Microsoft’s Chief Environmental Strategist, Robert Bernard, shares the company’s strategy. Microsoft City of Cheyenne, Wyoming - Government KUNC 91.5fm Wyoming Public Radio & Media American Wind Energy Association (AWEA)",Wind not blowing? Microsoft has a solution,https://www.facebook.com/130268756992804/posts/1418095891543411/,3/4/2017
Lake Tahoe is losing its famous clarity,9/18/2017,Diana Madson,Ecosystems,"2017-09-18 Yale Climate Connections -- “Lakes are warming at different rates, but almost 100 ...",#N/A,#N/A,https://www.yaleclimateconnections.org/2017/09/lake-tahoe-is-losing-its-famous-clarity/,$164.35,6076810098094,"32,158","5,870",984,277,$0.0280,$0.167,$0.59,,182.536,9,"“Lakes are warming at different rates, but almost 100 percent of them are warming.” — Geoff Schladow, director of @terc.ucdavis",Lake Tahoe is losing its famous clarity ,https://www.facebook.com/130268756992804/posts/1645702738782724/,10/4/2017
Sixth graders learn to take on global warming,1/17/2017,"Daisy Simmons, teaching climate change",Science,2017-01-17 Yale Climate Connections -- Climate change doesn’t get much time in U.S. public sc...,#N/A,#N/A,http://www.yaleclimateconnections.org/2017/01/sixth-graders-learn-to-take-on-global-warming/,$91.60,6063128166894,"21,472","2,842",310,,$0.0322,$0.295,#DIV/0!,,132.358,0,"Climate change doesn’t get much time in U.S. public schools, but a sixth-grade teacher in Charlotte, North Carolina, wants her students to know about the evidence and what they can do. Listen in to learn about the solutions her students developed after deeper engagement with climate science.

National Science Teachers Association AFT - American Federation of Teachers NC Public Schools Public Schools First NC U.S. Department of Education WNCW","Sixth Graders Study Global Warming Causes, ‘Solutions’",https://www.facebook.com/130268756992804/posts/1386794921340175/,2/16/2017
Methane hydrates: Why scientists worry less than you might think,2/7/19 12:48,"Bud Ward, Peter Sinclair",Climate Science,2019-02-08 Yale Climate Connections -- A USGS expert offers an important science-based perspe...,#N/A,#N/A,https://www.yaleclimateconnections.org/2019/02/methane-hydrates-what-you-need-to-know/,$26.48,6109337152694,"4,002",983,136,342,$0.0269,$0.195,$0.08,7,245.627,85,A USGS expert offers an important science-based perspective on Arctic methane releases.,Methane hydrates: What you need to know » by Bud Ward,https://www.facebook.com/130268756992804/posts/2295591327127192/,3/4/2019
Could we turn chicken waste into power?,4/20/18 7:00,Diana Madson,Energy,2018-04-20 Yale Climate Connections -- There are nearly three times as many chickens on Earth...,#N/A,#N/A,https://www.yaleclimateconnections.org/2018/04/could-we-turn-chicken-waste-into-power/,$67.94,6088156601894,"20,848","3,528",297,64,$0.0193,$0.229,$1.06,,169.225,3,There are nearly three times as many chickens on Earth as humans. That’s a lot of waste to deal with.,Researchers want to convert chicken waste into power,https://www.facebook.com/130268756992804/posts/1868590473160615/,5/4/2018
Young Republican wants GOP to support clean energy,3/5/18 7:00,Daisy Simmons,Energy,2018-03-05 Yale Climate Connections -- He’s shattering the stereotype that climate action and...,#N/A,#N/A,https://www.yaleclimateconnections.org/2018/03/young-republican-wants-gop-to-support-clean-energy/,$35.35,6085197858894,"10,691","2,933",152,55,$0.0121,$0.233,$0.64,,274.343,5,He’s shattering the stereotype that climate action and environmentalism are solely liberal causes.,This Republican college student wants the GOP to support clean energy ,https://www.facebook.com/130268756992804/posts/1816951208324542/,4/4/2018
Not in database,n/a,n/a,n/a,2017-07-28 Yale Climate Connections -- What if a house could lift itself over a flood?,#N/A,#N/A,https://www.yaleclimateconnections.org/2017/house-on-jacks-rises-above-floods/,$51.09,6073037165294,"14,312","1,705",155,120,$0.0300,$0.330,$0.43,,119.131,8,What if a house could lift itself over a flood?,"When floods come, this house could lift itself above them ",https://www.facebook.com/130268756992804/posts/1595227770496888/,8/4/2017
How tree rings help teach us about our climate,2/5/19 7:05,Dan Grossman,"Climate Science, Feature Article","2019-02-05 Yale Climate Connections -- Through David Stahle’s work, tree rings are helping us...",#N/A,#N/A,https://www.yaleclimateconnections.org/2019/02/a-dendrochronologist-tree-ring-scientist-at-work/,$40.10,6109096101494,"7,074","1,401",162,139,$0.0286,$0.248,$0.29,8,198.049,20,"Through David Stahle’s work, tree rings are helping us better understand our warming climate.",A tree ring scientist at work » by Dan Grossman,https://www.facebook.com/130268756992804/posts/2291336764219315/,3/4/2019
Kids' Polar Army artwork shows youths' concerns,4/3/2017,"arts, Bryce Madder, Polar Army","Arts, Feature Article, Policy",2017-04-04 Yale Climate Connections -- A 12-year-old activist spreads awareness of climate ch...,#N/A,#N/A,http://www.yaleclimateconnections.org/2017/04/kids-polar-army-artwork-shows-youths-concerns/,$41.45,6067336137494,"8,759","1,268",169,,$0.0327,$0.245,#DIV/0!,,144.765,0,"A 12-year-old activist spreads awareness of climate change and encourages other kids to speak out, too, by posting their artwork at his website - PolarArmy.org. Learn more ...",Kids' Polar Army artwork shows youths' concerns - Yale Climate Connections,https://www.facebook.com/130268756992804/posts/1471283429557990/,5/4/2017
A living shoreline of oyster shells,7/22/2016,"Living Shorelines, Sara Peach, sea level rise","Ecosystems, Oceans",Georgia's Tybee Island is getting a new barrier made of oyster shells to prot...,#N/A,#N/A,http://www.yaleclimateconnections.org/2016/07/a-living-shoreline-of-oyster-shells/,$10.96,6053554527294,"1,594",162,17,,$0.0677,$0.645,#DIV/0!,,101.631,0,"Georgia's Tybee Island is getting a new barrier made of oyster shells to protect against rising tides. Hear more about this project, implemented by volunteers and a 4-H center, on today's episode.",A living shoreline of oyster shells ,https://www.facebook.com/130268756992804/posts/1219104734775862/,8/4/2016
Cranberry farmer grows new 'crop': solar energy,5/8/2017,"agriculture, Jan Ellen Spiegel, solar","Energy, Food & Agriculture",2017-05-08 Yale Climate Connections -- When the price of cranberries fell below the cost to g...,#N/A,#N/A,https://www.yaleclimateconnections.org/2017/05/cranberry-farmer-grows-new-crop-solar-energy/,$60.22,6069091262694,"17,830","3,490",327,132,$0.0173,$0.184,$0.46,,195.738,7,"When the price of cranberries fell below the cost to grow them, a Massachusetts berry farmer decided to farm solar energy. A solar array now covers four acres of his cranberry bogs. It’s a “win, win, win,” he says.",Cranberry farmer grows new ‘crop’: solar energy,https://www.facebook.com/130268756992804/posts/1504960696190263/,6/4/2017
Chicago sees benefits of electric buses,12/22/2016,"Daisy Simmons, electric vehicles",Energy,2016-12-22 Yale Climate Connections -- Just 1 electric bus is like taking 23 cars off the roa...,#N/A,#N/A,http://www.yaleclimateconnections.org/2016/12/chicago-sees-benefits-of-electric-buses/,$175.20,6061902620094,"38,048","5,124",517,,$0.0342,$0.339,#DIV/0!,,134.672,0,Just 1 electric bus is like taking 23 cars off the road and the Chicago Transit Authority has been using them for a few years now.  Listen in 90 seconds to learn how Chicago is saving a lot more than just fuel costs.,Chicago Sees Benefits of Electric Buses,https://www.facebook.com/130268756992804/posts/1354505101235824/,1/4/2017
The state of the climate in 2016,2/8/2017,"global temperatures, sea ice, Zeke Hausfather","Feature Article, Science",2017-02-08 Yale Climate Connections -- Donald Trump’s surprise November election as the U.S.’...,#N/A,#N/A,http://www.yaleclimateconnections.org/2017/02/the-state-of-the-climate-in-2016/,$8.28,6064283147694,"3,770",405,56,,$0.0204,$0.148,#DIV/0!,,107.427,0,"Donald Trump’s surprise November election as the U.S.’s 45th President isn’t the only development that made 2016 a landmark year for Earth’s climate. Read more ...

http://www.yaleclimateconnections.org/2017/02/the-state-of-the-climate-in-2016/",The State of the Climate in 2016 | Zeke Hausfather,https://www.facebook.com/130268756992804/posts/1417902664896067/,3/4/2017
Not in database,n/a,n/a,n/a,2019-03-07 Yale Climate Connections -- The American Institute of Architects has asked firms t...,#N/A,#N/A,https://bit.ly/2GOkLwm,$69.55,6111339075094,"6,758","1,494",107,11,$0.0466,$0.650,$6.32,7,221.071,2,"The American Institute of Architects has asked firms to make all their new buildings and major renovations carbon-neutral by 2030. So far, more than 500 firms have signed on:",Hundreds of architectural firms pledge to design carbon-neutral buildings ,https://www.facebook.com/130268756992804/posts/2337469879606003/,4/4/2019
Not in database,n/a,n/a,n/a,"2018-10-22 Yale Climate Connections -- “In the Jewish context, what we usually talk about is ...",#N/A,#N/A,https://bit.ly/2EzSkSD,$124.23,6101448404094,"6,258","1,229",86,21,$0.1011,$1.445,$5.92,9,196.389,3,"“In the Jewish context, what we usually talk about is that we are given not dominion to rule over the Earth, but really given the responsibility to care for the Earth” - Rabbi Joel Abraham",The rabbi who blessed electric vehicles,https://www.facebook.com/130268756992804/posts/2127141593972167/,11/4/2018
Hot weather may be harming our fertility,10/12/18 7:00,Samantha Harrington,Health,2018-10-12 Yale Climate Connections -- For every day with an average temperature above 80 deg...,#N/A,#N/A,https://www.yaleclimateconnections.org/2018/10/hot-weather-may-be-harming-our-fertility/,$17.87,6100798337894,"1,067",146,18,4,$0.1224,$0.993,$4.47,9,136.832,4,"For every day with an average temperature above 80 degrees, 1,000 fewer babies are born in the U.S, according to a UCLA study.",Hot weather may be making us less fertile,https://www.facebook.com/130268756992804/posts/2113474065338920/,11/4/2018
Gypsy moths attack trees in the northeast,9/26/2017,"iSeeChange, Samantha Harrington","Ecosystems, Feature Article","2017-10-19 Yale Climate Connections -- With its chief threat sidelined by climate change, the...",#N/A,#N/A,https://www.yaleclimateconnections.org/2017/09/a-very-hungry-caterpillar-is-killing-trees-in-new-england/,$87.58,6078561396494,"18,555","2,917",365,366,$0.0300,$0.240,$0.24,,157.208,20,"With its chief threat sidelined by climate change, the gypsy moth caterpillar is defoliating trees across New England.",A very hungry caterpillar is killing trees in New England,https://www.facebook.com/130268756992804/posts/1669179473101717/,11/4/2017
Could carbon farming help the climate?,10/19/2016,"agriculture, carbon farming, Daisy Simmons","Feature Article, Food & Agriculture","2016-10-21 Yale Climate Connections -- Carbon farming: What is it, and how can it help the cl...",#N/A,#N/A,http://www.yaleclimateconnections.org/2016/10/could-carbon-farming-help-the-climate/,$17.80,6058595165094,"4,430",508,92,,$0.0350,$0.193,#DIV/0!,,114.673,0,"Carbon farming: What is it, and how can it help the climate? Healthy soil could be an ally in reducing carbon levels in the atmosphere – and farmers can dig it, too. Learn more ...",Could Carbon Farming Help the Climate? by Daisy Simmons | Yale Climate Connections,https://www.facebook.com/130268756992804/posts/1301759556510379/,11/4/2016
A warmer climate could make your dog sick,4/12/18 7:00,Samantha Harrington,Species &amp; Ecosystems,2018-04-12 Yale Climate Connections -- Many vets now recommend giving preventative medication...,#N/A,#N/A,https://www.yaleclimateconnections.org/2018/04/a-warmer-climate-could-make-your-dog-sick/,$28.23,6087630693494,"7,444","1,280",200,40,$0.0221,$0.141,$0.71,,171.951,5,Many vets now recommend giving preventative medication year-round—even in some places where heartworm used to only be a summertime threat. 🐕,A warmer climate could make your dog sick ,https://www.facebook.com/130268756992804/posts/1860184057334590/,5/4/2018
No new 'ice age' likely in Earth's future,5/15/18 7:10,"Peter Sinclair, This is not cool","Climate Science, Snow &amp; Ice","2018-05-17 Yale Climate Connections -- Why are some climate change doubters talking about a ""...",#N/A,#N/A,https://www.yaleclimateconnections.org/2018/05/no-little-ice-age-likely-in-earths-future/,$127.77,6090511554294,"40,100","3,705",560,961,$0.0345,$0.228,$0.13,,92.394,24,"Why are some climate change doubters talking about a ""new ice age""? And how is the scientific community responding? The latest from Peter Sinclair:",No new 'ice age' likely in Earth's future,https://www.facebook.com/130268756992804/posts/1895976127088716/,6/4/2018
"Coal-country native, clean-energy advocate",5/1/2017,"coal, energy, Sara Peach",Energy,2017-05-01 Yale Climate Connections -- Mary Anne Hitt was devastated when she learned that mi...,#N/A,#N/A,http://www.yaleclimateconnections.org/2017/05/coal-country-native-clean-energy-advocate/,$74.22,6068756739494,"21,089","3,343",541,6,$0.0222,$0.137,$12.37,,158.519,0,"Mary Anne Hitt was devastated when she learned that mining companies were blowing the tops off mountains to extract coal. “In just my lifetime, over 500 mountains in Appalachia have been blown up and wiped off the map forever,” she says. 

Listen in to learn how this coal-country native became a clean-energy advocate for the Sierra Club. Photo credit www.mountainroadshow.com",How a coal-country native became a clean-energy advocate ,https://www.facebook.com/130268756992804/posts/1498181750201491/,6/4/2017
Floods and droughts: What it's like to live in communities hit hard by climate change,5/24/19 7:05,SueEllen Campbell,"Feature Article, Weather Extremes",2019-05-23 Yale Climate Connections -- Can a role-playing game lead to stronger global climat...,#N/A,#N/A,https://www.yaleclimateconnections.org/2019/05/role-playing-game-helps-u-n-negotiators-understand-the-consequences-of-their-decisions/,$114.18,6117481311894,"16,344","2,367",232,117,$0.0482,$0.492,$0.98,9,144.824,7,Can a role-playing game lead to stronger global climate action?,Role-playing game helps U.N. negotiators understand the consequences of their decisions,https://www.facebook.com/130268756992804/posts/2461322000554123/,6/4/2019
Four scientists make creativity a key to communicating their research,5/21/19 7:05,Peter Sinclair,"Arts &amp; Culture, Communicating Climate","2019-05-24 Yale Climate Connections -- In 2017, this energy-efficiency program helped custome...",#N/A,#N/A,https://www.yaleclimateconnections.org/2019/05/how-energy-efficiency-is-paying-off-in-wisconsin/,$36.80,6117579154294,"3,193",625,46,23,$0.0589,$0.800,$1.60,9,195.741,7,"In 2017, this energy-efficiency program helped customers save enough energy to power roughly 70,000 homes:",This state is finding that it pays to invest in energy efficiency,https://www.facebook.com/130268756992804/posts/2463091513710505/,6/4/2019
Salmon at risk as glaciers shrink,1/13/2017,"Bridgett Ennis, melting glaciers, salmon","Ecosystems, Polar Ice","2017-01-13 Yale Climate Connections -- Warmer temperatures are melting Alaska’s glaciers, thr...",#N/A,#N/A,http://www.yaleclimateconnections.org/2017/01/salmon-at-risk-as-glaciers-shrink/,$156.70,6062945160294,"37,111","4,506",932,,$0.0348,$0.168,#DIV/0!,,121.420,0,"Warmer temperatures are melting Alaska’s glaciers, threatening the cool summer meltwater that salmon need to thrive. 

U.S. Environmental Protection Agency  NOAA Fisheries Alaska Save Our Wild Salmon (Art by:  Sharon Cummings)","As glaciers melt, salmon could vanish",https://www.facebook.com/130268756992804/posts/1377541568932177/,2/16/2017
Buying a Miami home as seas rise,5/9/2017,"Eileen Mignoni, real estate, sea level rise","Latino Communities, Sea Level Rise",2017-05-09 Yale Climate Connections -- What do you do when the city you love is going underwa...,#N/A,#N/A,https://www.yaleclimateconnections.org/2017/05/with-sea-levels-rising-should-you-buy-a-house-in-miami/,$100.45,6069141859494,"21,732","3,118",488,536,$0.0322,$0.206,$0.19,,143.475,25,"What do you do when the city you love is going underwater? Mario Alejandro Ariza’s family lives in Miami, and he wanted to buy property there. But “investing in Miami … is kind of a scary prospect,” he says. Tune in to hear Ariza’s story.","With sea levels rising, should you buy a house in Miami? ",https://www.facebook.com/130268756992804/posts/1504969656189367/,6/4/2017
Debunking a renewable energy myth,10/26/2016,"Diana Madson, economics, renewable energy","Economics, Energy",2016-10-26 Yale Climate Connections -- “If we embrace new technology and re-think how we mana...,#N/A,#N/A,http://www.yaleclimateconnections.org/2016/10/debunking-a-renewable-energy-myth/,$4.95,6058813665494,"1,216",108,19,,$0.0458,$0.261,#DIV/0!,,88.816,0,"“If we embrace new technology and re-think how we manage supply and demand, there’s no built-in limit to the amount of clean electricity we can add to our energy mix” says Kenneth Gillingham. Today’s episode reports on the scuffle between fossil fuels and renewable energy within Unites States, tune in below to hear the score!",Debunking a renewable energy myth ,https://www.facebook.com/130268756992804/posts/1306523726033962/,11/4/2016
Not in database,n/a,n/a,n/a,2016-10-19 Yale Project on Climate Change Communication -- Democrats (91%) and Republicans (7...,#N/A,#N/A,https://www.facebook.com/YaleProgramOnClimateChangeCommunication/photos/a.143198235721540/1207706565937363/?type=3,$42.29,6058425542094,"21,276","3,086",268,,$0.0137,$0.158,#DIV/0!,,145.046,0,Democrats (91%) and Republicans (75%) support funding more research into #RenewableEnergy sources such as #solar and #wind power: http://bit.ly/1WRoZUm,,https://www.facebook.com/121750354532995/posts/1207706565937363/,11/4/2016
Las Vegas city buildings go 100% renewable,4/4/2017,"Diana Madson, renewables",Energy,"2017-04-04 Yale Climate Connections -- Las Vegas has placed its bets on renewable energy, and... - Copy",#N/A,#N/A,http://www.yaleclimateconnections.org/2017/04/las-vegas-city-buildings-go-100-renewable/,$26.40,6067819665494,"5,883",650,105,,$0.0406,$0.251,#DIV/0!,,110.488,0,"Las Vegas has placed its bets on renewable energy, and it’s winning. The city of lights has invested so much in renewables that its greenhouse gas emissions are no higher than they were in 1950. Tune in to hear from the city’s chief sustainability officer. 

City of Las Vegas Government 100 Resilient Cities - Pioneered by the Rockefeller Foundation Center for Resilient Cities Asian Cities Climate Change Resilience Network (ACCCRN) Renewable Energy Jobs Nevada Public Radio","Las Vegas city buildings go 100% renewable
",https://www.facebook.com/130268756992804/posts/1462659163753750/,5/4/2017
Threat of Lyme disease spreads north,7/19/2017,"Diana Madson, public health",Public Health,2017-07-19 Yale Climate Connections -- It’s more important than ever for people all over the ...,#N/A,#N/A,https://www.yaleclimateconnections.org/2017/07/threat-of-lyme-disease-spreads-north/,$40.86,6072630471094,"12,298","1,501",336,138,$0.0272,$0.122,$0.30,,122.052,11,It’s more important than ever for people all over the country to learn how to prevent and treat tick-borne diseases.,Threat of Lyme disease spreads north,https://www.facebook.com/130268756992804/posts/1585527978133534/,8/4/2017
Utah students get lawmakers to listen,7/19/18 7:00,Daisy Simmons,Policy &amp; Politics,2018-07-19 Yale Climate Connections -- Your daily inspiration:,#N/A,#N/A,https://www.yaleclimateconnections.org/2018/07/utah-students-get-lawmakers-to-listen/,$269.85,6094792758694,"34,560","7,640",409,584,$0.0353,$0.660,$0.46,9,221.065,17,Your daily inspiration:,"Conservative Utah lawmakers pass a climate resolution, thanks to students",https://www.facebook.com/130268756992804/posts/1984856964867298/,8/4/2018
"In this suburb, geothermal has arrived",5/3/18 7:00,Bruce Lieberman,Energy,2018-05-03 Yale Climate Connections -- These systems use far less energy than traditional hea...,#N/A,#N/A,https://www.yaleclimateconnections.org/2018/05/in-this-suburb-geothermal-has-arrived/,$103.29,6089601182694,"29,424","4,216",458,271,$0.0245,$0.226,$0.38,,143.284,9,"These systems use far less energy than traditional heating and cooling, producing less carbon pollution and saving residents money.","In the Atlanta suburbs, geothermal has arrived ",https://www.facebook.com/130268756992804/posts/1882240075128988/,6/4/2018
The climate-friendly ride-sharing service,4/11/18 7:00,Eileen Mignoni,Transportation,2018-04-11 Yale Climate Connections -- They’ve been offering rideshares since before it was c...,#N/A,#N/A,https://www.yaleclimateconnections.org/2018/04/the-climate-friendly-ride-sharing-service/,$9.11,6087559683294,"2,100",467,29,38,$0.0195,$0.314,$0.24,,222.381,18,They’ve been offering rideshares since before it was cool.,How an isolated city is creating a climate-friendly ride-sharing service,https://www.facebook.com/130268756992804/posts/1859076860778643/,5/4/2018
Kids' Polar Army artwork shows youths' concerns,4/3/2017,"arts, Bryce Madder, Polar Army","Arts, Feature Article, Policy",2017-04-04 Yale Climate Connections -- A 12-year-old activist spreads awareness of climate ch... - Copy,#N/A,#N/A,http://www.yaleclimateconnections.org/2017/04/kids-polar-army-artwork-shows-youths-concerns/,$51.50,6067819666294,"7,875","1,076",186,,$0.0479,$0.277,#DIV/0!,,136.635,0,"A 12-year-old activist spreads awareness of climate change and encourages other kids to speak out, too, by posting their artwork at his website - PolarArmy.org. Learn more ...",Kids' Polar Army artwork shows youths' concerns - Yale Climate Connections,https://www.facebook.com/130268756992804/posts/1471283429557990/,5/4/2017
Emirates plans to boost low-carbon energy,9/20/2016,"Diana Madson, Dubai, renewable energy",Energy,"When you think of the Middle East, renewable energy is probably not the first...",#N/A,#N/A,http://www.yaleclimateconnections.org/2016/09/emirates-plans-to-boost-low-carbon-energy/,$8.62,6056793078494,"1,671",215,18,,$0.0401,$0.479,#DIV/0!,,128.665,0,"When you think of the Middle East, renewable energy is probably not the first thing that comes to mind. But this may be changing. Hear more about what the United Arab Emirates is doing to advance renewables on today's episode.",Emirates plans to boost low-carbon energy ,https://www.facebook.com/130268756992804/posts/1271216839564651/,10/4/2016
A 10-year-old on global warming,7/14/2017,"Daisy Simmons, sustainability",Sustainability,2017-07-14 Yale Climate Connections -- By spreading the word about climate change and solutio...,#N/A,#N/A,https://www.yaleclimateconnections.org/2017/07/what-a-10-year-old-wants-you-to-know-about-global-warming/,$130.62,6072418056694,"30,674","4,343",315,174,$0.0301,$0.415,$0.75,,141.586,6,"By spreading the word about climate change and solutions, Alice Giambalvo is taking the future into her own hands.",The 10-year-old who educates adults about climate change,https://www.facebook.com/130268756992804/posts/1580011925351806/,8/4/2017
A tiny beetle is killing tamarack trees,12/14/2017,Daisy Simmons,Ecosystems,2017-12-14 Yale Climate Connections -- This tree-killing beetle is multiplying faster and fas...,#N/A,#N/A,https://www.yaleclimateconnections.org/2017/12/a-tiny-beetle-is-killing-tamarack-trees/,$206.20,6081287869494,"34,850","5,744",630,474,$0.0359,$0.327,$0.44,,164.821,14,This tree-killing beetle is multiplying faster and faster.,A tiny beetle is killing Minnesota’s tamarack trees,https://www.facebook.com/130268756992804/posts/1731309686888695/,1/4/2018
Climate change in the flower garden,11/10/2016,"gardening and climate change, Sara Peach","Ecosystems, Food & Agriculture",2016-11-11 Yale Climate Connections -- You don’t need to be a scientist to find evidence of g...,#N/A,#N/A,http://www.yaleclimateconnections.org/2016/11/climate-change-in-the-flower-garden/,$12.37,6059694572094,"3,169",324,36,,$0.0382,$0.344,#DIV/0!,,102.240,0,You don’t need to be a scientist to find evidence of global warming. Gardener Lisa Furman has noticed that her Connecticut garden blooms earlier each year. Listen to learn more about climate change and gardens in the eastern US.,Climate Change in the Flower Garden,https://www.facebook.com/130268756992804/posts/1317242734962061/,12/4/2016
How storytime can teach nature appreciation,5/4/18 7:00,Daisy Simmons,Species &amp; Ecosystems,"2018-05-04 Yale Climate Connections -- Without a healthy forest, where would Winnie-the-Pooh ...",#N/A,#N/A,https://www.yaleclimateconnections.org/2018/05/how-storytime-can-teach-nature-appreciation/,$69.59,6089672899294,"18,004","2,781",263,38,$0.0250,$0.265,$1.83,,154.466,2,"Without a healthy forest, where would Winnie-the-Pooh live?",Storytime can teach kids to appreciate nature ,https://www.facebook.com/130268756992804/posts/1883326191687043/,6/4/2018
Why this kid is poring through climate data,2/13/18 7:00,Daisy Simmons,Youth,2018-02-13 Yale Climate Connections -- “This is my future.”,#N/A,#N/A,https://www.yaleclimateconnections.org/2018/02/why-this-kid-is-poring-through-climate-data/,$116.44,6084177209294,"22,740","3,477",276,170,$0.0335,$0.422,$0.68,,152.902,7,“This is my future.”,This California teen studies climate data after school,https://www.facebook.com/130268756992804/posts/1795029907183339/,3/4/2018
Saving seeds for an uncertain climate,4/14/2017,"agriculture, Daisy Simmons","Food & Agriculture, Sustainability",2017-04-14 Yale Climate Connections -- About three quarters of the world’s fruit and vegetabl...,#N/A,#N/A,http://www.yaleclimateconnections.org/2017/04/saving-seeds-for-an-uncertain-climate/,$142.04,6068078819494,"34,382","3,941",486,,$0.0360,$0.292,#DIV/0!,,114.624,0,"About three quarters of the world’s fruit and vegetable varieties have gone extinct in the last century, simply because people stopped growing them. But now Sierra Seeds has started saving seeds for the future. “Diversity is at the foundation of resilience,” says organic farmer Rowen White.

Sierra Seed Cooperative  Urban Farming",Saving seeds for an uncertain climate,https://www.facebook.com/130268756992804/posts/1467765229909810/,5/4/2017
Creepy deer disease spreads north,11/14/2017,Samantha Harrington,Ecosystems,2017-11-14 Yale Climate Connections -- This disease is spreading to areas where deer have no ...,#N/A,#N/A,https://www.yaleclimateconnections.org/2017/11/a-deer-disease-spreads-north/,$100.31,6079779490094,"21,570","4,511",629,821,$0.0222,$0.159,$0.12,,209.133,38,This disease is spreading to areas where deer have no immunity to it.,A deer-killing disease is spreading north,https://www.facebook.com/130268756992804/posts/1700198493333148/,12/4/2017
"As the climate warms, some winter days seem more like spring",12/18/18 7:00,Sara Peach,Weather Extremes,2018-12-18 Yale Climate Connections -- Troubling signs in recent winters:,#N/A,#N/A,https://www.yaleclimateconnections.org/2018/12/some-winter-days-seem-more-like-spring/,$72.85,6105713571094,"6,765","1,286",163,48,$0.0566,$0.447,$1.52,8,190.096,7,Troubling signs in recent winters:,"As the climate warms, some winter days seem more like spring",https://www.facebook.com/130268756992804/posts/2216097895076536/,1/4/2019
San Antonio: solar powerhouse,7/31/2017,"Eileen Mignoni, solar","Economics, Energy","2017-07-31 Yale Climate Connections -- Thanks to consumer demand, the San Antonio area added ...",#N/A,#N/A,https://www.yaleclimateconnections.org/2017/07/how-san-antonio-texas-became-a-solar-powerhouse,$266.76,6073139662294,"52,042","7,394",599,144,$0.0361,$0.445,$1.85,,142.078,3,"Thanks to consumer demand, the San Antonio area added more than 250 megawatts of residential and commercial solar.","How San Antonio, Texas, became a solar powerhouse ",https://www.facebook.com/130268756992804/posts/1597984816887850/,8/4/2017
Ancient farming practice reduces pollution,10/17/2016,"agriculture, Bud Ward, farming",Food & Agriculture,"2016-10-17 Yale Climate Connections -- Composting with a twist, West African farmers combine ...",#N/A,#N/A,http://www.yaleclimateconnections.org/2016/10/ancient-farming-practice-reduces-pollution/,$8.08,6058341417694,"2,641",350,55,,$0.0231,$0.147,#DIV/0!,,132.526,0,"Composting with a twist, West African farmers combine agricultural and kitchen waste with cooking ash and char residue.  According to Dawit Solomon of Cornell University, this age old technique might be a solution to climate change.  Listen to today’s episode and learn how to produce more food, without making climate change worse.",Ancient farming practice reduces pollution,https://www.facebook.com/130268756992804/posts/1297188753634126/,11/4/2016
Not in database,n/a,n/a,n/a,"2017-05-08 Yale Climate Connections -- Investors backing the Paris Climate Accord, which they...",#N/A,#N/A,http://sustainability.thomsonreuters.com/2017/05/08/big-investors-urge-trump-to-stick-with-paris-climate-accord/,$95.33,6069105048094,"24,717","3,398",298,,$0.0281,$0.320,#DIV/0!,,137.476,0,"Investors backing the Paris Climate Accord, which they see as ""essential for the safeguarding of our investments."" 
Via Thomson Reuters",Big investors urge Trump to stick with Paris climate accord | | Thomson Reuters,https://www.facebook.com/130268756992804/posts/1509472045739128/,6/4/2017
How family size shapes your carbon footprint,3/29/19 7:05,Craig K. Chandler,"Feature Article, Religion &amp; Morality","2019-04-25 Yale Climate Connections -- “If we want to restore our Earth, we must re-story it....",#N/A,#N/A,https://www.yaleclimateconnections.org/2019/04/help-wanted-more-climate-storytellers/,$21.90,6115195704894,"2,022",404,29,40,$0.0542,$0.755,$0.55,6,199.802,20,"“If we want to restore our Earth, we must re-story it.” - author Gary Nabhan","A crucial, overlooked ingredient for transforming the fight against climate change: Storytellers",https://www.facebook.com/130268756992804/posts/2412817772071213/,5/4/2019
Dad: Parents are force for climate action,6/16/2017,"Climate Parents, Sara Peach",Sustainability,2017-06-16 Yale Climate Connections -- John Friedrich has tips to help parents leave the worl...,#N/A,#N/A,https://www.yaleclimateconnections.org/2017/06/parents-are-force-for-climate-action/,$80.86,6070787902694,"22,409","3,268",281,160,$0.0247,$0.288,$0.51,,145.834,7,John Friedrich has tips to help parents leave the world in a better condition for their kids. Climate Parents,"Parents are a force for climate action, according to this dad",https://www.facebook.com/130268756992804/posts/1520445231308476/,7/4/2017
Bright Future': New book argues that nuclear power is worth another look,1/8/19 7:00,NULL,Energy,"2019-01-08 Yale Climate Connections -- In his new book, Joshua Goldstein argues that replacin...",#N/A,#N/A,https://www.yaleclimateconnections.org/2019/01/new-book-nuclear-worth-another-look/,$65.72,6107060706694,"8,620","1,495",76,43,$0.0440,$0.865,$1.53,8,173.434,5,"In his new book, Joshua Goldstein argues that replacing coal should be a top priority, and nuclear power needs to be part of the solution:",Why a new book argues that nuclear is worth another look,https://www.facebook.com/130268756992804/posts/2248441711842154/,2/4/2019
Tiny city has big clean energy plans,12/21/2017,Daisy Simmons,Energy,2017-12-21 Yale Climate Connections -- With a dash of community activism and a teaspoon of po...,#N/A,#N/A,https://www.yaleclimateconnections.org/2017/12/tiny-city-has-big-clean-energy-plans/,$218.09,6081612414694,"35,403","5,992",456,908,$0.0364,$0.478,$0.24,,169.251,26,"With a dash of community activism and a teaspoon of political will, this small town is cooking up something big.",The tiny city with big plans for renewable energy ,https://www.facebook.com/130268756992804/posts/1738561566163507/,1/4/2018
Teaching global warming in English class,6/20/2017,"Sara Peach, teaching climate change",Sustainability,2017-06-20 Yale Climate Connections -- Even classic literature like The Great Gatsby has conn...,#N/A,#N/A,https://www.yaleclimateconnections.org/2017/06/teaching-global-warming-in-english-class/,$279.98,6070956540894,"53,714","7,688",742,449,$0.0364,$0.377,$0.62,,143.128,8,Even classic literature like The Great Gatsby has connections to climate change.,Teaching kids about global warming doesn't have to be limited to science class,https://www.facebook.com/130268756992804/posts/1546897355329930/,7/4/2017
Not in database,n/a,n/a,n/a,"2018-02-28 Yale Climate Connections -- Last year in the US, 16 weather-related disasters caus...",#N/A,#N/A,,$4.40,6084933756294,"1,303",224,42,5,$0.0196,$0.105,$0.88,,171.911,4,,,,3/4/2018
Intergenerational conversation: An antidote to climate despair,2/28/19 7:00,NULL,"Communicating Climate, Health",2019-02-22 Yale Climate Connections -- Some helpful tips for having a productive conversation...,#N/A,#N/A,https://www.yaleclimateconnections.org/2019/02/3-clean-energy-myths-debunked/,$30.93,6110362863294,"3,896",707,89,242,$0.0437,$0.348,$0.13,6,181.468,62,Some helpful tips for having a productive conversation about clean energy in the face of misconceptions.,"3 clean energy myths, debunked » by Karin Kirk",https://www.facebook.com/130268756992804/posts/2316771151675876/,3/4/2019
Cities divest from fossil fuels,1/20/2017,"Bruce Lieberman, fossil fuels, investments",Energy,2017-01-20 Yale Climate Connections -- Cities across the United States have pledged to divest...,#N/A,#N/A,http://www.yaleclimateconnections.org/2017/01/cities-divest-from-fossil-fuels/,$58.88,6063302087894,"25,528","2,568",284,,$0.0229,$0.207,#DIV/0!,,100.595,0,"Cities across the United States have pledged to divest from fossil fuels. How is your city handling its portfolio – and how are you managing yours? 

The Wharton School University of Pennsylvania Fossil Fuel Divestment Student Network Fossil Free Yale Fossil Free #divest",Cities Divest from Fossil Fuels ,https://www.facebook.com/130268756992804/posts/1386837918002542/,2/16/2017
How school cafeterias are cutting carbon pollution,9/5/18 7:00,Sarah Kennedy,Food &amp; Agriculture,2018-09-05 Yale Climate Connections -- Here’s one way to address climate change.,#N/A,#N/A,https://www.yaleclimateconnections.org/2018/09/how-school-cafeterias-are-cutting-carbon-pollution/,$53.93,6098059536894,"9,284","1,589",116,177,$0.0339,$0.465,$0.30,7,171.155,19,Here’s one way to address climate change.,How school cafeterias are cutting carbon pollution,https://www.facebook.com/130268756992804/posts/2064127926940201/,10/4/2018
Climate change? There are emojis for that.,5/25/18 7:00,Jan OBrien,Arts &amp; Culture,2018-05-25 Yale Climate Connections -- A faster way to say global warming than 🌎🌡️⬆️😰:,#N/A,#N/A,https://www.yaleclimateconnections.org/2018/05/climate-change-there-are-emojis-for-that/,$9.89,6091006945894,"4,277",528,64,82,$0.0187,$0.155,$0.12,,123.451,19,A faster way to say global warming than 🌎🌡️⬆️😰:,Climate change? There are emojis for that.,https://www.facebook.com/130268756992804/posts/1905433606142968/,6/4/2018
How family size shapes your carbon footprint,3/29/19 7:05,Craig K. Chandler,"Feature Article, Religion &amp; Morality",2019-04-22 Yale Climate Connections -- Learn how your city’s climate might feel in 60 years:,#N/A,#N/A,https://www.yaleclimateconnections.org/2019/04/map-shows-your-citys-hotter-future/,$12.07,6114909201894,"1,281",252,28,61,$0.0479,$0.431,$0.20,7,196.721,48,Learn how your city’s climate might feel in 60 years:,This interactive map shows how hot your city could get in the future ,https://www.facebook.com/130268756992804/posts/2409286465757677/,5/4/2019
Mayor electrifies tourism,11/18/2016,"electric vehicles, Sara Peach, Town of Haverstraw","Economics, Energy",2016-11-18 Yale Climate Connections -- The village of Haverstraw New York courageously invest...,#N/A,#N/A,http://www.yaleclimateconnections.org/2016/11/new-york-village-mayor-electrifies-tourism/,$101.34,6060095939294,"13,952","1,503",177,,$0.0674,$0.573,#DIV/0!,,107.726,0,The village of Haverstraw New York courageously invested in its future by installing electric vehicle charging stations. Listen in to learn how Mayor Michael Kohut revitalized his downtown to attract tourists.,Mayor Electrifies Tourism,https://www.facebook.com/130268756992804/posts/1321237731229228/,12/4/2016
Ethanol is making N.D. farmland less fertile,4/7/2017,"agriculture, Samantha Harrington",Food & Agriculture,2017-04-07 Yale Climate Connections -- When the government incentivized farmers to grow corn ...,#N/A,#N/A,http://www.yaleclimateconnections.org/2017/04/ethanol-is-making-n-d-farmland-less-fertile/,$155.20,6067560157294,"35,910","4,206",684,,$0.0369,$0.227,#DIV/0!,,117.126,0,"When the government incentivized farmers to grow corn for ethanol production, that led to unforeseen consequences. Listen in as one corn farmer from North Dakota shares the effects corn has had on his soils and what he’s doing about it. 

North Dakota Agri-Women U.S. Department of Agriculture Prairie Public I Love Farming North Dakota Men's Hockey Wild in North Dakota","How ethanol is making North Dakota farmland less fertile 
",https://www.facebook.com/130268756992804/posts/1462765353743131/,5/4/2017
Save money and energy drying clothes,8/15/2016,"Daniel Grossman, energy saving",Energy,Did you know that in the U.S. drying laundry accounts for about 6 percent of ...,#N/A,#N/A,http://www.yaleclimateconnections.org/2016/08/save-money-and-energy-drying-clothes/,$17.27,6054915823094,"6,414",349,31,,$0.0495,$0.557,#DIV/0!,,54.412,0,"Did you know that in the U.S. drying laundry accounts for about 6 percent of the electricity we use at home, and the technology hasn’t changed in nearly 30 years? Hear more about the changing future of drying technology on today's episode.",Save money and energy drying clothes ,https://www.facebook.com/130268756992804/posts/1237331652953170/,9/4/2016
"Drones, the new environmental watchdog",8/2/18 7:00,Daisy Simmons,Jobs &amp; Economy,"2018-08-02 Yale Climate Connections -- This technology’s helping people map, analyze, and mon...",#N/A,#N/A,https://www.yaleclimateconnections.org/2018/08/drones-the-new-environmental-watchdog/,$60.87,6095737962494,"9,136","1,277",75,26,$0.0477,$0.812,$2.34,7,139.777,3,"This technology’s helping people map, analyze, and monitor landscapes faster than ever before.",Drones are now being used to protect the environment,https://www.facebook.com/130268756992804/posts/2008819585804369/,9/4/2018
Depression and anxiety add to disaster's toll,5/17/18 7:00,Daisy Simmons,Health,2018-05-17 Yale Climate Connections -- The impact of weather disasters goes beyond homes and ...,#N/A,#N/A,https://www.yaleclimateconnections.org/2018/05/depression-and-anxiety-add-to-disasters-toll/,$80.97,6090493346894,"17,374","2,375",235,44,$0.0341,$0.345,$1.84,,136.699,3,The impact of weather disasters goes beyond homes and roads.,"After weather disasters, depression and anxiety can add to the toll ",https://www.facebook.com/130268756992804/posts/1896803753672620/,6/4/2018
Old cycle race footage contains clues to how much the climate has already changed,11/28/18 7:00,NULL,Climate Science,2018-11-28 Yale Climate Connections -- Footage from one of the world’s top cycling events sho...,#N/A,#N/A,https://www.yaleclimateconnections.org/2018/11/scientists-find-climate-clues-in-old-cycling-footage/,$146.07,6104250670894,"20,077","3,421",321,1693,$0.0427,$0.455,$0.09,8,170.394,84,Footage from one of the world’s top cycling events shows climate change happening right before our eyes:,Old cycle race footage shows how much the climate has already changed,https://www.facebook.com/130268756992804/posts/2185307854822207/,12/4/2018
Couple's beach-house dreams dashed,5/7/18 7:00,Samantha Harrington,Oceans,2018-05-07 Yale Climate Connections -- Rising seas are leading the Challenders to rethink the...,#N/A,#N/A,https://www.yaleclimateconnections.org/2018/05/couples-beach-house-dreams-dashed/,$13.81,6089836801094,"5,604",706,51,133,$0.0196,$0.271,$0.10,,125.981,24,Rising seas are leading the Challenders to rethink their retirement plan.,How this couple’s beach-house dreams were dashed,https://www.facebook.com/130268756992804/posts/1886451378041191/,6/4/2018
Not in database,n/a,n/a,n/a,2019-02-11 Yale Climate Connections -- What if we evaluated an economy by its social and envi...,#N/A,#N/A,https://bit.ly/2t6KlUv,$54.20,6109518119694,"8,976","1,754",191,109,$0.0309,$0.284,$0.50,9,195.410,12,What if we evaluated an economy by its social and environmental outcomes?,"In ‘Buddhist Economics,’ sustainability trumps GDP",https://www.facebook.com/130268756992804/posts/2299867553366236/,3/4/2019
How family size shapes your carbon footprint,3/29/19 7:05,Craig K. Chandler,"Feature Article, Religion &amp; Morality","2019-04-29 Yale Climate Connections -- Costs come from diminished labor productivity, damaged...",#N/A,#N/A,https://www.yaleclimateconnections.org/2019/04/climate-change-could-cost-u-s-economy-billions/,$45.70,6115468116294,"3,736",753,92,13,$0.0607,$0.497,$3.52,9,201.552,3,"Costs come from diminished labor productivity, damaged infrastructure, and the loss of human lives.",Climate change could cost the U.S. economy hundreds of billions a year by 2090 >> by Dana Nuccitelli,https://www.facebook.com/130268756992804/posts/2421094901243500/,5/4/2019
Benefits of restricting downtown car use,8/16/2016,"880 Cities, automobiles, Daisy Simmons",Public Health,"Bogota, Colombia has had 75 miles of car-free roads on Sundays for over 35 ye...",#N/A,#N/A,http://www.yaleclimateconnections.org/2016/08/benefits-of-restricting-downtown-car-use/,$13.66,6056008538094,"2,362",304,39,,$0.0449,$0.350,#DIV/0!,,128.704,0,"Bogota, Colombia has had 75 miles of car-free roads on Sundays for over 35 years. Hear about the many benefits of this trend and how it is spreading to other cities.",Benefits of restricting downtown car use ,https://www.facebook.com/130268756992804/posts/1239655892720746/,10/4/2016
Not in database,n/a,n/a,n/a,2016-12-05 Yale Climate Connections -- ‘What happens in the Arctic … doesn’t stay in the Arct...,#N/A,#N/A,http://climatecommunication.yale.edu/news-events/thawing-arctic-matters-communicate-talk-eli-kintisch-award-winning-correspondent-science-magazine/,$44.03,6061007424894,"10,244","1,735",322,,$0.0254,$0.137,#DIV/0!,,169.367,0,‘What happens in the Arctic … doesn’t stay in the Arctic.’  The thawing snowpack affects us all.  Watch this talk by an award-winning correspondent for Science Magazine to learn how and what some experts are doing about it.,"Why the thawing arctic matters, and how to communicate it: A talk with Eli Kintisch, an award-winning correspondent for Science Magazine",https://www.facebook.com/130268756992804/posts/1353057648047236/,1/4/2017
Four scientists make creativity a key to communicating their research,5/21/19 7:05,Peter Sinclair,"Arts &amp; Culture, Communicating Climate",2019-05-06 Yale Climate Connections -- “My wife and I feel like we're called to be good stewa...,#N/A,#N/A,https://www.yaleclimateconnections.org/2019/05/innovative-greenhouse-stores-heat-underground/,$120.73,6116007720094,"8,861","2,008",197,185,$0.0601,$0.613,$0.65,7,226.611,21,"“My wife and I feel like we're called to be good stewards of what we've been given, and so if we can lessen our footprint, we feel like that's the right thing to do for our farm,” says Tim Clymer of Threefold Farm:",This innovative greenhouse stores heat underground,https://www.facebook.com/130268756992804/posts/2432117166807940/,6/4/2019
Not in database,n/a,n/a,n/a,2017-01-25 Yale Climate Connections -- Where do Trump's nominees stand on climate change and ...,#N/A,#N/A,http://www.csmonitor.com/Environment/Inhabit/2017/0119/On-global-warming-Trump-nominees-try-having-it-both-ways,$11.09,6063555830494,"4,015",501,26,,$0.0221,$0.427,#DIV/0!,,124.782,0,Where do Trump's nominees stand on climate change and the scientific concensus that humans are the force driving it versus where do Americans stand on this issue. (Via The Christian Science Monitor),"On global warming, Trump nominees try having it both ways",https://www.facebook.com/130268756992804/posts/1396384320381235/,2/16/2017
Not in database,n/a,n/a,n/a,2018-02-27 Yale Climate Connections -- The hope is to create climate-friendly lifestyles that...,#N/A,#N/A,https://bit.ly/2ENmWzG,$97.43,6084874557294,"16,544","2,988",277,72,$0.0326,$0.352,$1.35,,180.609,4,The hope is to create climate-friendly lifestyles that persist beyond Easter.,Some Christians are cutting carbon for Lent,https://www.facebook.com/130268756992804/posts/1810327308986932/,3/4/2018
This device collects water from the air,8/10/18 7:00,Monica Isola,Climate Science,"2018-08-10 Yale Climate Connections -- Nature: It’s not just a place, it’s an inspiration.",#N/A,#N/A,https://www.yaleclimateconnections.org/2018/08/this-device-collects-water-from-the-air/,$72.78,6096307491294,"15,852","2,811",252,232,$0.0259,$0.289,$0.31,8,177.328,15,"Nature: It’s not just a place, it’s an inspiration.",Redwood trees inspired this device that collects water from the air,https://www.facebook.com/130268756992804/posts/2022668654419462/,9/4/2018
Renewable energy jobs on increase in California,11/21/2016,"California, Diana Madson, renewable energy","Economics, Energy",2016-11-21 Yale Climate Connections -- California is leading by example with its pro-renewabl...,#N/A,#N/A,http://www.yaleclimateconnections.org/2016/11/renewable-energy-jobs-on-increase-in-california/,$404.09,6060235051294,"74,224","10,696","1,519",,$0.0378,$0.266,#DIV/0!,,144.104,0,"California is leading by example with its pro-renewable energy policy, and creating thousands of blue-collar green jobs in the wake. Listen in to learn more about California's great success. UC Berkeley",Renewable Energy Jobs on Increase in California,https://www.facebook.com/130268756992804/posts/1324988444187490/,12/4/2016
Climate change adds stress for first responders,7/5/18 7:00,Daisy Simmons,Health,"2018-07-05 Yale Climate Connections -- ""They show up to work and keep working, likely with th...",#N/A,#N/A,https://www.yaleclimateconnections.org/2018/07/climate-change-adds-stress-for-first-responders/,$94.95,6093888259894,"12,328","2,215",189,44,$0.0429,$0.502,$2.16,7,179.672,4,"""They show up to work and keep working, likely with the knowledge that their living room is under two feet of water, and their family is driving hours away or attempting to ride out the storm on the second floor of the house.” — paramedic Greg Friese","For first responders, climate change could add even more stress",https://www.facebook.com/130268756992804/posts/1962253990460929/,8/4/2018
Former coal worker finds new solar career,11/22/2016,"coal industry, Diana Madson, solar","Economics, Energy",2016-11-22 Yale Climate Connections -- Green is the new blue! California’s investment in rene...,#N/A,#N/A,http://www.yaleclimateconnections.org/2016/11/former-coal-worker-finds-new-solar-career/,$605.35,6060292248694,"108,799","15,977","3,166",,$0.0379,$0.191,#DIV/0!,,146.849,0,"Green is the new blue! California’s investment in renewables has created thousands of blue-collar green jobs, many within its poorest counties. listen in to hear the story of a coal worker's transition from coal to solar. UC Berkeley Labor Center",Former Coal Worker Finds New Career in Solar,https://www.facebook.com/130268756992804/posts/1324999994186335/,12/4/2016
"Climate refugees aim for new, resilient home",4/30/18 7:00,Daisy Simmons,Oceans,2018-04-30 Yale Climate Connections -- What if your home disappeared?,#N/A,#N/A,https://www.yaleclimateconnections.org/2018/04/climate-refugees-aim-for-new-resilient-home/,$127.40,6089402478294,"35,208","3,343",459,441,$0.0381,$0.278,$0.29,,94.950,13,What if your home disappeared?,These climate refugees want to make their new home more resilient ,https://www.facebook.com/130268756992804/posts/1878982518788077/,5/4/2018
Park ranger witnesses climate change firsthand,11/28/2017,"national parks, Sara Peach",Ecosystems,2017-11-28 Yale Climate Connections -- Climate change is part of the conversation at Crater L...,#N/A,#N/A,https://www.yaleclimateconnections.org/2017/11/park-ranger-witnesses-climate-change-firsthand/,$373.37,6080464073694,"55,210","9,791","1,278",902,$0.0381,$0.292,$0.41,,177.341,16,Climate change is part of the conversation at Crater Lake National Park.,This park ranger is witnessing climate change firsthand ,https://www.facebook.com/130268756992804/posts/1714617761891221/,12/4/2017
What causes climate change? Carbon isotopes show it's fossil fuels.,11/26/18 7:00,Samantha Harrington,Climate Science,2018-11-26 Yale Climate Connections -- “We can't get away with saying that humans are not res...,#N/A,#N/A,https://www.yaleclimateconnections.org/2018/11/isotopes-point-to-the-culprit-behind-climate-change/,$199.77,6104044898294,"19,668","4,224",992,141,$0.0473,$0.201,$1.42,9,214.765,7,“We can't get away with saying that humans are not responsible for the carbon that's been added to the atmosphere. The isotopes don't lie and they show it.” - James Powell of the National Physical Sciences Consortium,What causes climate change? Carbon isotopes prove it’s fossil fuels.,https://www.facebook.com/130268756992804/posts/2182282828458043/,12/4/2018
Not in database,n/a,n/a,n/a,2019-03-11 Yale Climate Connections -- Peter Fiekowsky wants a safe climate for his kids. For...,#N/A,#N/A,https://bit.ly/2CbCSse,$48.68,6111588117294,"4,418",871,47,26,$0.0559,$1.036,$1.87,7,197.148,6,"Peter Fiekowsky wants a safe climate for his kids. For that to happen, he believes we need to take carbon out of the atmosphere. https://bit.ly/2CbCSse",Why one man wants to find a way to remove carbon pollution from the air,https://www.facebook.com/130268756992804/posts/2342764395743218/,4/4/2019
How New Orleans' 7th Ward is fighting back against flooding,6/3/19 7:00,NULL,Weather Extremes,2019-06-03 Yale Climate Connections -- “I don't want people to make the mistake that because ...,#N/A,#N/A,https://www.yaleclimateconnections.org/2019/06/how-new-orleans-7th-ward-is-fighting-back-against-flooding/,$148.48,6118410251494,"12,316","2,867",142,72,$0.0518,$1.046,$2.06,8,232.787,6,"“I don't want people to make the mistake that because people live in a poor community – or a non-affluent community – that they don't care about climate change. We're doing what we do. We're working!” says Angela Chalk of Healthy Community Services, a nonprofit in New Orleans’ 7th Ward:",New Orleans’ 7th Ward is fighting back against flooding,https://www.facebook.com/130268756992804/posts/2480927218593601/,7/4/2019
The teacher-friendly book on climate change,7/2/18 7:00,Sarah Kennedy,Education,2018-07-02 Yale Climate Connections -- There’s a lot of misinformation out there about climat...,#N/A,#N/A,https://www.yaleclimateconnections.org/2018/07/the-teacher-friendly-book-on-climate-change/,$65.53,6093649679094,"9,446","1,015",85,81,$0.0646,$0.771,$0.81,5,107.453,9,There’s a lot of misinformation out there about climate change. Here’s one way teachers can get the facts right:,Can this book change how climate change is taught?,https://www.facebook.com/130268756992804/posts/1957379550948373/,8/4/2018
Warming puts tea time at risk,12/23/2016,"Diana Madson, food and agriculture",Food & Agriculture,"2016-12-23 Yale Climate Connections -- Most of the world's tea is grown in China, India and T...",#N/A,#N/A,http://www.yaleclimateconnections.org/2016/12/climate-warming-puts-tea-time-at-risk/,$29.59,6061955763894,"8,446",770,104,,$0.0384,$0.285,#DIV/0!,,91.167,0,"Most of the world's tea is grown in China, India and Taiwan within subtropical climates, but those climates are changing making it harder and harder to cultivate tea.  Listen in to learn how one tea grower is attempting to adapt his methods to save his farm. Food and Agriculture Organization of the United Nations (FAO) U.S. Department of Agriculture World Resources Institute",Warming Puts Tea Time at Risk,https://www.facebook.com/130268756992804/posts/1354506454569022/,1/4/2017
Not in database,n/a,n/a,n/a,2018-03-29 Yale Climate Connections -- Carbon pricing is heading south.,#N/A,#N/A,https://bit.ly/2GoYCUK,$29.76,6086768124694,"8,386","1,289",89,104,$0.0231,$0.334,$0.29,,153.709,12,Carbon pricing is heading south.,Virginia could become the first southern state to launch a carbon market,https://www.facebook.com/130268756992804/posts/1844879035531759/,4/4/2018
How this teen was inspired to join the climate movement,10/25/18 7:00,Erika Street Hopman,Youth,"2018-10-25 Yale Climate Connections -- “We are going to continue to fight for our future, for...",#N/A,#N/A,https://www.yaleclimateconnections.org/2018/10/meet-a-teen-climate-leader/,$223.14,6101689820894,"11,292","2,300",150,45,$0.0970,$1.488,$4.96,8,203.684,4,"“We are going to continue to fight for our future, for our lives, and for our communities.” — Iris Fen Gillingham",Meet one of the teenagers behind a new youth climate movement,https://www.facebook.com/130268756992804/posts/2131242796895380/,11/4/2018
British man builds poo-powered street light,3/30/18 7:00,Bruce Lieberman,Energy,2018-03-30 Yale Climate Connections -- ���,#N/A,#N/A,https://www.yaleclimateconnections.org/2018/03/british-man-builds-dog-poo-powered-street-light/,$89.71,6086828911094,"26,543","3,814",528,186,$0.0235,$0.170,$0.48,,143.691,7,🐕💩⚡,British man builds dog-poo-powered street light,https://www.facebook.com/130268756992804/posts/1845935525426110/,4/4/2018
Not in database,n/a,n/a,n/a,"2016-10-26 Yale Climate Connections -- For more context, watch our 5 minute video on what's h...",#N/A,#N/A,http://wapo.st/2ebErsh,$50.00,6058824330894,"16,228","1,918",270,,$0.0261,$0.185,#DIV/0!,,118.191,0,"For more context, watch our 5 minute video on what's happening in Antarctica, with some of the world's leading scientists: http://bit.ly/2dJgMDb",These Antarctic glaciers have experienced staggering ice loss — and scientists think they know why,https://www.facebook.com/130268756992804/posts/1306725496013785/,11/4/2016
"After tornado, a city goes green",12/13/2016,"Diana Madson, Greensburg KS, sustainability","Energy, Sustainability","2016-12-18 Yale Climate Connections -- Almost 10 years ago, a deadly tornado ripped through t...",#N/A,#N/A,http://www.yaleclimateconnections.org/2016/12/after-tornado-a-city-goes-green/,$8.16,6061701546694,"2,114",208,18,,$0.0392,$0.453,#DIV/0!,,98.392,0,"Almost 10 years ago, a deadly tornado ripped through the City of Greensburg, KS, forever altering the fabric of this community.  Listen in as Mayor Bob Dixson of speaks about Green-Town USA's tornado-resilient recovery.","After Tornado, A City Goes Green",https://www.facebook.com/130268756992804/posts/1355468444472823/,1/4/2017
Art elevates climate's front-line voices,4/26/18 7:00,Eileen Mignoni,Arts &amp; Culture,2018-04-26 Yale Climate Connections -- “I want to change what people see and just encourage p...,#N/A,#N/A,https://www.yaleclimateconnections.org/2018/04/art-elevates-climates-front-line-voices/,$7.32,6089120773294,"2,621",569,47,17,$0.0129,$0.156,$0.43,,217.093,6,“I want to change what people see and just encourage people to see things differently.” — Favianna Rodriguez,How art is elevating voices from the front lines of climate change ,https://www.facebook.com/130268756992804/posts/1874873675865628/,5/4/2018
Not in database,n/a,n/a,n/a,2017-01-26 Yale Climate Connections -- With more than 50 percent of America’s forest land pri...,#N/A,#N/A,http://www.yaleclimateconnections.org/2017/small-landowners-protect-forests-earn-cash/,$24.47,6063594377294,"19,952","1,915",234,,$0.0128,$0.105,#DIV/0!,,95.980,0,"With more than 50 percent of America’s forest land privately owned, small parcels are important to the forest network. Ecopartners Carbon helps landowners preserve their trees while earning money. Listen in to learn how. 

WWF  American Forests  U.S. Forest Service  The Nature Conservancy","Small Landowners Protect Forests, Earn Cash",https://www.facebook.com/130268756992804/posts/1392799557406378/,2/16/2017
How vanishing lizards in Madagascar led to a troubling discovery about deforestation and climate change,4/30/19 7:10,Daniel Grossman,"Feature Article, Species &amp; Ecosystems",2019-05-28 Yale Climate Connections -- Climate change ≠ damage to the ozone layer.,#N/A,#N/A,https://www.yaleclimateconnections.org/2019/05/difference-between-the-ozone-hole-and-global-warming/,$33.40,6117909197894,"3,402",730,114,48,$0.0458,$0.293,$0.70,7,214.580,14,Climate change ≠ damage to the ozone layer.,What’s the difference between the ozone hole and global warming?,https://www.facebook.com/130268756992804/posts/2470155413004115/,6/4/2019
Not in database,n/a,n/a,n/a,"2018-02-26 Yale Climate Connections -- Maybe these birds might adapt to new diets, or move fa...",#N/A,#N/A,https://bit.ly/2EQ9zyT,$106.19,6084816249694,"21,679","4,795",621,293,$0.0221,$0.171,$0.36,,221.182,14,"Maybe these birds might adapt to new diets, or move farther inland. But we don’t know.","Back from brink of extinction, whooping cranes face a new threat",https://www.facebook.com/130268756992804/posts/1809304272422569/,3/4/2018
Big wildfires grow more common,10/5/2017,"Bruce Lieberman, wildfires",Ecosystems,2017-10-05 Yale Climate Connections -- The U.S. Forest Service has been aggressively suppress...,#N/A,#N/A,https://www.yaleclimateconnections.org/2017/10/big-wildfires-grow-more-common/,$283.20,6077871513294,"42,861","7,150","1,005",323,$0.0396,$0.282,$0.88,,166.818,8,The U.S. Forest Service has been aggressively suppressing wildfires in the West since the 1920’s. That’s almost a century of fuel wood piled up.,Big wildfires are 5 times more common in the West now than in the ‘70s,https://www.facebook.com/130268756992804/posts/1661394270546904/,11/4/2017
Judgment on Hansen's '88 climate testimony: 'He was right',6/20/18 10:20,"Peter Sinclair, This is not cool",Climate Science,2018-06-21 Yale Climate Connections -- This Saturday will be the 30th anniversary of James Ha...,#N/A,#N/A,https://www.yaleclimateconnections.org/2018/06/judgment-on-hansens-88-climate-testimony-he-was-right/,$106.67,6092881178094,"20,268","2,267",323,418,$0.0471,$0.330,$0.26,7,111.851,21,This Saturday will be the 30th anniversary of James Hansen's global warming congressional territory. How have his warnings held up?,30 Years Later: Did James Hansen Get It Right on Global Warming?,https://www.facebook.com/130268756992804/posts/1938203426199319/,7/4/2018
California passes ambitious climate law. Now what?,9/21/2016,"Bruce Lieberman, California SB 32, greenhouse gas emissions","Energy, Feature Article, Policy","The law could make California a model for the rest of the U.S., but achieving...",#N/A,#N/A,http://www.yaleclimateconnections.org/2016/09/california-passes-ambitious-climate-law-now-what/,$19.91,6056874202094,"6,506",617,43,,$0.0323,$0.463,#DIV/0!,,94.836,0,"The law could make California a model for the rest of the U.S., but achieving its goal will be a 'herculean task.' Learn more ...",California passes ambitious climate law. Now what? - Yale Climate Connections,https://www.facebook.com/130268756992804/posts/1272606676092334/,10/4/2016
Ethanol is making N.D. farmland less fertile,4/7/2017,"agriculture, Samantha Harrington",Food & Agriculture,2017-04-07 Yale Climate Connections -- When the government incentivized farmers to grow corn ... - Copy,#N/A,#N/A,http://www.yaleclimateconnections.org/2017/04/ethanol-is-making-n-d-farmland-less-fertile/,$6.47,6067819666094,"2,567",141,28,,$0.0459,$0.231,#DIV/0!,,54.928,0,"When the government incentivized farmers to grow corn for ethanol production, that led to unforeseen consequences. Listen in as one corn farmer from North Dakota shares the effects corn has had on his soils and what he’s doing about it. 

North Dakota Agri-Women U.S. Department of Agriculture Prairie Public I Love Farming North Dakota Men's Hockey Wild in North Dakota","How ethanol is making North Dakota farmland less fertile 
",https://www.facebook.com/130268756992804/posts/1462765353743131/,5/4/2017
New hope for a former whaling port,9/19/18 7:00,Jan Ellen Spiegel,"Energy, Jobs &amp; Economy",2018-09-19 Yale Climate Connections -- The whaling industry is long gone from this New Englan...,#N/A,#N/A,https://www.yaleclimateconnections.org/2018/09/offshore-wind-offers-new-hope-for-a-former-whaling-port/,$189.99,6099052541494,"14,808","3,336",237,71,$0.0570,$0.802,$2.68,9,225.284,5,"The whaling industry is long gone from this New England city, but offshore wind might become its next big business opportunity.",A former whaling port pins its hopes on offshore wind,https://www.facebook.com/130268756992804/posts/2081632735189720/,10/4/2018
Mom hopes parents will step up for kids,5/12/2017,"Diana Madson, sustainability","Policy, Sustainability",2017-05-12 Yale Climate Connections -- When Robin Ganahl learned that #ClimateChange could ha...,#N/A,#N/A,https://www.yaleclimateconnections.org/2017/05/mom-parents-need-to-step-up/,$28.55,6069291074894,"6,686",803,70,15,$0.0356,$0.408,$1.90,,120.102,2,"When Robin Ganahl learned that #ClimateChange could have a negative impact on her children’s future, she started advocating for clean energy. As a member of Mothers Out Front - Mobilizing for a Livable Climate, she is encouraging parents to make changes at the community, state, and federal levels.

Picture credit: Michele Gielis of Mothers Out Front","Mom: Parents need to “step up” for kids and “be their heroes” 
",https://www.facebook.com/130268756992804/posts/1505126149507051/,6/4/2017
"To meet goals, Denver needs clean grid",12/12/2017,Bruce Lieberman,Energy,2017-12-12 Yale Climate Connections -- Denver says it will move ahead on climate change as th...,#N/A,#N/A,https://www.yaleclimateconnections.org/2017/12/to-meet-carbon-goals-denver-needs-all-renewable-grid/,$115.75,6081177814894,"24,013","4,564",373,100,$0.0254,$0.310,$1.16,,190.064,4,Denver says it will move ahead on climate change as the Trump administration backs away.,"To meet its carbon goals, Denver will need an all-renewable grid ",https://www.facebook.com/130268756992804/posts/1729257663760564/,1/4/2018
Not in database,n/a,n/a,n/a,2019-02-08 Yale Climate Connections -- This mayor knows constituents are getting hurt by clim...,#N/A,#N/A,https://bit.ly/2HB9Pnc,$45.26,6109329035494,"7,256","1,393",51,36,$0.0325,$0.887,$1.26,9,191.979,5,"This mayor knows constituents are getting hurt by climate change. “Mayors can’t hide from that stuff,” he says.",Edmonton is an oil capital. Its mayor wants cities to lead on climate change.,https://www.facebook.com/130268756992804/posts/2295454123807579/,3/4/2019
"For Hanukkah, rabbi recommends 'Eight Days of Action' to protect the climate",12/3/18 7:00,Diana Madson,Religion &amp; Morality,"2018-12-03 Yale Climate Connections -- “Our job is to bring light into the dark time,” says R...",#N/A,#N/A,https://www.yaleclimateconnections.org/2018/12/rabbi-urges-climate-action-during-hanukkah/,$126.35,6104585954694,"14,776","3,238",198,55,$0.0390,$0.638,$2.30,9,219.139,4,"“Our job is to bring light into the dark time,” says Rabbi Arthur Waskow.",Rabbi urges people to help the climate during Hanukkah,https://www.facebook.com/130268756992804/posts/2192811590738500/,1/4/2019
Mosquito season is getting more terrible,8/2/2017,"public health, Samantha Harrington",Public Health,"2017-08-02 Yale Climate Connections -- Knock knock.
Who’s there?  
Amos.
Amos who?
A mosquito.",#N/A,#N/A,https://www.yaleclimateconnections.org/2017/08/mosquito-season-is-getting-more-terrible/,$74.19,6073248291094,"26,139","2,892",420,274,$0.0257,$0.177,$0.27,,110.639,10,"Knock knock.
Who’s there?  
Amos.
Amos who?
A mosquito.",It’s not your imagination. Mosquito season is getting more terrible.,https://www.facebook.com/130268756992804/posts/1599794046706927/,9/4/2017
Planners turn rising seas into game,8/4/2017,"Bud Ward, sea level rise",Sea Level Rise,"2017-08-04 Yale Climate Connections -- Sea level rise is no game, but there’s a new board gam...",#N/A,#N/A,https://www.yaleclimateconnections.org/2017/08/new-board-game-challenges-players-to-confront-rising-sea-levels/,$59.76,6073362070694,"20,713","2,341",368,162,$0.0255,$0.162,$0.37,,113.021,8,"Sea level rise is no game, but there’s a new board game that helps people understand climate change’s real risks to island nations.",New board game invites players to confront the challenges of rising sea levels,https://www.facebook.com/130268756992804/posts/1601851916501140/,9/4/2017
Not in database,n/a,n/a,n/a,2019-03-04 Yale Climate Connections -- The Forest Service is modeling its prescribed burns af...,#N/A,#N/A,http://www.yaleclimateconnections.org/2019/03/forest-service-works-with-tribes-to-manage-fire/,$140.86,6111073960094,"22,059","4,242",378,124,$0.0332,$0.373,$1.14,9,192.302,6,The Forest Service is modeling its prescribed burns after the practices of indigenous peoples:,The Forest Service is working with tribes to manage wildfires,https://www.facebook.com/130268756992804/posts/2333147990038192/,4/4/2019
Arizona woman organizes Latina moms to speak up on climate change,11/30/18 7:00,Samantha Harrington,Health,2018-11-30 Yale Climate Connections -- Latinos are often underrepresented in the environmenta...,#N/A,#N/A,https://www.yaleclimateconnections.org/2018/11/arizona-woman-empowers-latina-moms-to-speak-out/,$207.58,6104401891094,"20,284","3,980",220,48,$0.0522,$0.944,$4.32,9,196.214,2,Latinos are often underrepresented in the environmental movement. Colomba Sainz is working to change that.,This Arizona woman is organizing Latina moms to speak up on climate change,https://www.facebook.com/130268756992804/posts/2188363107850015/,12/4/2018
Why tree planting aids disaster recovery,4/27/18 7:00,Bruce Lieberman,Species &amp; Ecosystems,2018-04-27 Yale Climate Connections -- Trees can bring a host of benefits to a community in n...,#N/A,#N/A,https://www.yaleclimateconnections.org/2018/04/why-tree-planting-aids-disaster-recovery/,$66.54,6089214710694,"27,272","5,662",593,95,$0.0118,$0.112,$0.70,,207.612,3,Trees can bring a host of benefits to a community in need after a disaster.,Why planting trees can be an essential step in disaster recovery ,https://www.facebook.com/130268756992804/posts/1875878019098527/,5/4/2018
Not in database,n/a,n/a,n/a,2017-03-01 Yale Climate Connections -- Great solutions from a team of US engineers. (Via Thom...,#N/A,#N/A,http://sustainability.thomsonreuters.com/2017/02/17/new-solar-reflecting-film-can-cool-homes-without-air-con-scientists/,$59.64,6065329316494,"19,220","2,300",333,,$0.0259,$0.179,#DIV/0!,,119.667,0,Great solutions from a team of US engineers. (Via Thomson Reuters),New solar-reflecting film can cool homes without air con – scientists | | Thomson Reuters,https://www.facebook.com/130268756992804/posts/1430687636950903/,4/4/2017
Brooklynites sell home-grown solar energy,7/20/2017,"Eileen Mignoni, energy",Energy,2017-07-20 Yale Climate Connections -- This brings a whole new meaning to buying local.,#N/A,#N/A,https://www.yaleclimateconnections.org/2017/07/brooklynites-sell-home-grown-solar-energy/,$191.02,6072689400694,"33,308","4,552",282,181,$0.0420,$0.677,$1.06,,136.664,5,This brings a whole new meaning to buying local.,Brooklyn company experiments with locally-produced solar energy,https://www.facebook.com/130268756992804/posts/1586733511346314/,8/4/2017
Climate science in your backyard,9/14/2016,"citizen science, Jan OBrien, Nature's Notebook",Ecosystems,How is climate change influencing your own home and neighborhood? Hear more a...,#N/A,#N/A,http://www.yaleclimateconnections.org/2016/09/climate-science-in-your-backyard/,$11.16,6056485153694,"2,556",213,29,,$0.0524,$0.385,#DIV/0!,,83.333,0,How is climate change influencing your own home and neighborhood? Hear more about citizen scientists are monitoring impacts on today's episode.,Climate science in your backyard,https://www.facebook.com/130268756992804/posts/1265727160113619/,10/4/2016
New York City will invest a portion of its pension fund in climate solutions,12/27/18 7:00,Diana Madson,Jobs &amp; Economy,2018-12-27 Yale Climate Connections -- This pension is an investment in everybody’s future:,#N/A,#N/A,https://www.yaleclimateconnections.org/2018/12/nyc-pension-fund-to-invest-in-climate-solutions/,$190.87,6106342707294,"23,800","4,713",324,65,$0.0405,$0.589,$2.94,8,198.025,3,This pension is an investment in everybody’s future:,New York City’s pension fund is investing $4 billion in climate solutions,https://www.facebook.com/130268756992804/posts/2229809097038749/,1/4/2019
Growing vegetables - at the airport?,2/1/2017,"aquaponics, Daisy Simmons",Food & Agriculture,"2017-02-01 Yale Climate Connections -- Imagine an airport: busy, crowded, stressful. Now, ima...",#N/A,#N/A,http://www.yaleclimateconnections.org/2017/02/growing-vegetables-at-the-airport/,$34.12,6063895074694,"13,896","1,728",209,,$0.0197,$0.163,#DIV/0!,,124.352,0,"Imagine an airport: busy, crowded, stressful. Now, imagine a vegetable garden: calm, green, serene. In today’s segment, learn how the Chicago O'Hare International Airport has combined those two visions, creating a green space that feeds harried travelers. 

Farm to Table Talk Lakeshore Public Television Vocaloid Chicago's Underground Vegetable Gardening",Growing vegetables – at the airport?!,https://www.facebook.com/130268756992804/posts/1397480023604998/,3/4/2017
Bird populations shift north as climate changes,7/3/2017,"bird migration patterns, Samantha Harrington",Ecosystems,"2019-04-11 Yale Climate Connections -- As spring weather finally arrives, birds are calling o...",#N/A,#N/A,https://www.yaleclimateconnections.org/2017/07/bird-populations-shift-north-as-climate-changes/,$60.13,6114118370894,"7,478","1,707",210,92,$0.0352,$0.286,$0.65,9,228.270,12,"As spring weather finally arrives, birds are calling once again. But are you hearing the same ones as in years past? #TBT",Bird populations shift north as climate changes,https://www.facebook.com/130268756992804/posts/2390437460975911/,5/4/2019
Climate change support group launches,11/28/2016,"climate grief, Daisy Simmons","Feature Article, Public Health",2016-11-29 Yale Climate Connections -- Sad about climate change? There's a support group for ...,#N/A,#N/A,http://www.yaleclimateconnections.org/2016/11/climate-change-support-group-launches/,$9.91,6060649384494,"1,793",215,17,,$0.0461,$0.583,#DIV/0!,,119.911,0,Sad about climate change? There's a support group for that. The first step? Admit there's a problem. Here's what one person did for herself ... and now learn what she's doing to help others.,"Climate Change Support Group Launches, byDaisy Simmons. ",https://www.facebook.com/130268756992804/posts/1344141718938829/,12/4/2016
Changing minds on a changing climate,4/18/2017,"climate change communications, Karin Kirk, public attitudes","Feature Article, Science",2017-04-18 Yale Climate Connections -- Reddit online commenters point to reasons they went fr...,#N/A,#N/A,http://www.yaleclimateconnections.org/2017/04/changing-minds-on-a-changing-climate/,$43.84,6068227679894,"6,652",607,68,,$0.0722,$0.645,#DIV/0!,,91.251,0,Commenters on a Reddit thread point to 4 reasons they left climate change denial behind.,Changing minds on a changing climate - Yale Climate Connections,https://www.facebook.com/130268756992804/posts/1490371547649178/,5/4/2017
Talking to kids about global warming,12/14/2016,"kids and climate change, Sara Peach, Zion Lights","Public Health, Sustainability",2016-12-14 Yale Climate Connections -- It can be tough for parents to explain difficult and d...,#N/A,#N/A,http://www.yaleclimateconnections.org/2016/12/talking-to-kids-about-global-warming/,$22.37,6061496340294,"3,889",415,60,,$0.0539,$0.373,#DIV/0!,,106.711,0,"It can be tough for parents to explain difficult and dystopian topics to their children, but there are ways to help kids understand.  Listen in as a mother and author discusses her recent book on green parenting.",Talking to Kids about Global Warming,https://www.facebook.com/130268756992804/posts/1347882928564708/,1/4/2017
Two scientists' concerns over years of inaction,1/21/2017,"Bud Ward, Daniel Grossman, Donald Trump, global temperatures","Feature Article, Policy, Science, Science Questions",2017-01-23 Yale Climate Connections -- Two climate modelers examined how Trump administration...,#N/A,#N/A,http://www.yaleclimateconnections.org/2017/01/two-scientists-fears-over-4-or-8-years-of-inaction-on-climate-change/,$35.94,6063421448694,"17,212","1,643",362,,$0.0219,$0.099,#DIV/0!,,95.457,0,"Two climate modelers examined how Trump administration inaction and actions might influence future planet warming. They concluded that a 4- or 8-year delay in mitigation could lead to substantially exceeding global temperature limits for dangerous levels of emissions and concentrations, perhaps indefinitely.

Read on ... This includes a q&a with one of the study's authors.","Two Scientists' Concerns Over Years of Inaction, by Daniel Grossman & Bud Ward",https://www.facebook.com/130268756992804/posts/1398641936822140/,2/16/2017
Buildings: A surprising source of carbon pollution,2/13/2017,"Diana Madson, green building","Energy, Sustainability","2017-02-13 Yale Climate Connections -- When you think about carbon-dioxide emissions, do you ...",#N/A,#N/A,http://www.yaleclimateconnections.org/2017/02/buildings-a-surprising-source-of-carbon-pollution/,$54.72,6064494205694,"20,341","1,758",257,,$0.0311,$0.213,#DIV/0!,,86.426,0,"When you think about carbon-dioxide emissions, do you picture a smokestack or a city building? It turns out that buildings are big polluters in cities. Listen in to learn how an NRDC (Natural Resources Defense Council) project is tackling that problem.  

U.S. Green Building Council (USGBC) WBAI 99.5 FM New York SolarCity EDF Climate Corps",A surprising source of carbon pollution,https://www.facebook.com/130268756992804/posts/1418040431548957/,3/4/2017
Not in database,n/a,n/a,n/a,2017-04-20 Yale Climate Connections -- Don’t get distracted by short-term hot and cold spells...,#N/A,#N/A,http://www.yaleclimateconnections.org/2017/04/why-a-1-degree-temperature-rise-matters,$115.07,6068315702494,"22,204","3,165",487,,$0.0364,$0.236,#DIV/0!,,142.542,0,"Don’t get distracted by short-term hot and cold spells: Long-term trends tell the real story of climate change. And in fact, Earth’s average temperature has risen by more than 1 degree Celsius since the start of the 20th century. Tune in to hear what climate scientists warn could happen as temperatures continue to rise.

Rutgers School of Environmental and Biological Sciences
Rutgers University",Earth’s temperature has risen by a degree. It matters. ,https://www.facebook.com/130268756992804/posts/1476831782336488/,5/4/2017
Not in database,n/a,n/a,n/a,2017-11-09 Yale Climate Connections -- Something scary might be lurking in your shellfish.,#N/A,#N/A,https://yaleclimateconnections.org/2017/11/rising-ocean-temps-making-it-riskier-to-eat-raw-oysters,$45.70,6079556921494,"13,671","2,403",547,181,$0.0190,$0.084,$0.25,,175.774,13,Something scary might be lurking in your shellfish.,Rising ocean temperatures are making it riskier to eat raw oysters ,https://www.facebook.com/130268756992804/posts/1695152783837719/,12/4/2017
Not in database,n/a,n/a,n/a,2019-01-27 Yale Climate Connections -- Many science teachers in Mississippi will be teaching ...,#N/A,#N/A,https://bit.ly/2sh2Vcf,$30.42,6108409266894,"5,000","1,140",58,19,$0.0267,$0.524,$1.60,10,228.000,4,Many science teachers in Mississippi will be teaching about climate change this spring:,One woman’s quest to improve climate education in Mississippi,https://www.facebook.com/130268756992804/posts/2257715524248106/,2/4/2019
Farmers adapt to new water patterns,10/3/2016,"agriculture, drought, farming, Sara Peach","Food & Agriculture, Weather",2016-10-03 Yale Climate Connections -- American farmers are doing their best to prepare for c...,#N/A,#N/A,http://www.yaleclimateconnections.org/2016/10/farmers-adapt-to-new-water-patterns/,$25.28,6057476323494,"4,105",464,71,,$0.0545,$0.356,#DIV/0!,,113.033,0,"American farmers are doing their best to prepare for changes in climate such as too much and not enough water which, heavily effects harvest quantities. Ongoing droughts in states like California may lead to more produce importation, therefore farmers are adopting local adaptation methods.

Learn more about how soil scientists and farmers are working together on today’s episode of the Yale Climate Connection.",Farmers adapt to new water patterns - Yale Climate Connections,https://www.facebook.com/130268756992804/posts/1283307301688938/,11/4/2016
"Orlando, Florida, offers free trees to residents",1/11/19 7:00,NULL,Food &amp; Agriculture,"2019-02-06 Yale Climate Connections -- Planting trees has some unexpected benefits:
—Lower cr...",#N/A,#N/A,https://www.yaleclimateconnections.org/2019/01/orlando-florida-offers-free-trees-to-all/,$108.47,6109175979494,"17,272","3,649",405,76,$0.0297,$0.268,$1.43,9,211.267,4,"Planting trees has some unexpected benefits:
—Lower crime
—Lower driving speeds
—Slower stormwater runoff","Orlando, Florida, offers free trees to residents",https://www.facebook.com/130268756992804/posts/2252982804721378/,3/4/2019
Not in database,n/a,n/a,n/a,2016-10-16 Yale Climate Connections -- Which is greater: human or volcanic emissions of carbo...,#N/A,#N/A,http://www.yaleclimateconnections.org/2014/09/volcanic-vs-human-emissions/,$49.94,6058305029494,"11,168","1,498",202,,$0.0333,$0.247,#DIV/0!,,134.133,0,Which is greater: human or volcanic emissions of carbon dioxide? http://bit.ly/2elhbsI,Volcanic vs. human emissions - Yale Climate Connections,https://www.facebook.com/130268756992804/posts/1296461537040181/,11/4/2016
Teen invents app for farm workers,8/6/18 7:00,Eileen Mignoni,"Health, Youth",2018-08-06 Yale Climate Connections -- Faith Florez’s grandparents were farmworkers who educa...,#N/A,#N/A,https://www.yaleclimateconnections.org/2018/08/teen-invents-app-for-farm-workers/,$177.69,6096012877894,"32,824","6,291",640,214,$0.0282,$0.278,$0.83,8,191.659,7,"Faith Florez’s grandparents were farmworkers who educated her about heat stroke. Now, she’s developing an app to help today’s workers:",Teen invents app to help farm workers stay safe in the heat,https://www.facebook.com/130268756992804/posts/2015732488446412/,9/4/2018
Moms Clean Air Force helps mothers lobby against air pollution,12/7/18 7:00,NULL,Policy &amp; Politics,2018-12-07 Yale Climate Connections -- Mom power:,#N/A,#N/A,https://www.yaleclimateconnections.org/2018/12/moms-lobby-for-clean-air/,$56.46,6104945480494,"5,486","1,402",66,9,$0.0403,$0.855,$6.27,9,255.560,2,Mom power:,This mom wants other moms to speak up for clean air,https://www.facebook.com/130268756992804/posts/2198967623456230/,1/4/2019
TV mets seen warming to climate science,8/16/2016,"global warming, Peter Sinclair, This is not cool, tv meteorologists, video, warming temperatures","Science, Weather",“It’s irresponsible if you don’t put the current weather trends into some sor...,#N/A,#N/A,http://www.yaleclimateconnections.org/2016/08/tv-meteorologists-seen-warming-to-climate-science/,$19.36,6055008257094,"3,793",398,57,,$0.0486,$0.340,#DIV/0!,,104.930,0,"“It’s irresponsible if you don’t put the current weather trends into some sort of climate context,” one meteorologist says. “There are some people who don’t want to hear about that ...""",TV Meteorologists Seen Warming to Climate Science - Yale Climate Connections,https://www.facebook.com/130268756992804/posts/1238740642812271/,9/4/2016
Map shows human influence on extreme weather,11/13/2017,Bud Ward,Weather,2017-11-13 Yale Climate Connections -- This map lets you see how climate change is already al...,#N/A,#N/A,https://www.yaleclimateconnections.org/2017/11/map-shows-human-influence-on-extreme-weather/,$58.89,6079725327094,"12,544","2,514",527,222,$0.0234,$0.112,$0.27,,200.415,18,This map lets you see how climate change is already altering weather around the world.,Map shows human influence on extreme weather,https://www.facebook.com/130268756992804/posts/1699234123429585/,12/4/2017
How family size shapes your carbon footprint,3/29/19 7:05,Craig K. Chandler,"Feature Article, Religion &amp; Morality",2019-03-18 Yale Climate Connections -- Ever heard of an indoor solar cell?,#N/A,#N/A,https://www.yaleclimateconnections.org/2019/03/tiny-solar-cells-harvest-indoor-light/,$29.91,6112094450494,"3,045",699,87,26,$0.0428,$0.344,$1.15,8,229.557,9,Ever heard of an indoor solar cell?,These tiny solar cells run on indoor light,https://www.facebook.com/130268756992804/posts/2352888211397503/,4/4/2019
Some birds now nest earlier in spring,4/24/18 7:00,Diana Madson,Species &amp; Ecosystems,2018-04-24 Yale Climate Connections -- We aren’t the only ones who need to adapt to climate c...,#N/A,#N/A,https://www.yaleclimateconnections.org/2018/04/some-birds-now-nest-earlier-in-spring/,$22.74,6088837409894,"9,291","2,007",220,37,$0.0113,$0.103,$0.61,,216.015,4,We aren’t the only ones who need to adapt to climate change.,"Because of climate change, some birds are nesting earlier ",https://www.facebook.com/130268756992804/posts/1872757416077254/,5/4/2018
Not in database,n/a,n/a,n/a,"2019-05-07 Yale Climate Connections -- In Norway, electric vehicles are starting to become th...",#N/A,#N/A,https://bit.ly/2Y2azoC,$98.92,6116108065694,"9,616","2,113",166,75,$0.0468,$0.596,$1.32,9,219.738,8,"In Norway, electric vehicles are starting to become the new normal:",Why Norwegians love electric vehicles ,https://www.facebook.com/130268756992804/posts/2433682336651423/,6/4/2019
Not in database,n/a,n/a,n/a,2018-04-26 Yale Climate Connections -- Cow manure can do a lot more than stink. This farmer i...,#N/A,#N/A,https://www.facebook.com/YaleClimateConnections/videos/1875157602503902/,$17.17,6089137226094,"5,462","2,874",16,,$0.0060,$1.073,#DIV/0!,,526.181,0,Cow manure can do a lot more than stink. This farmer is using waste from his dairy cows to save money and produce his own energy. What do you think? https://bit.ly/2DZwxOR,Manure Powers the Whole Farm,https://www.facebook.com/YaleClimateConnections/videos/1875157602503902/,5/4/2018
Why a Georgia farmer now raises cows like his great-grandfather did,1/7/19 7:00,NULL,Food &amp; Agriculture,2019-01-07 Yale Climate Connections -- Will Harris says a more sustainable approach can work ...,#N/A,#N/A,https://www.yaleclimateconnections.org/2019/01/georgia-farmer-abandons-his-fathers-methods/,$902.61,6106985060494,"95,872","20,419","2,141",5451,$0.0442,$0.422,$0.17,8,212.982,57,"Will Harris says a more sustainable approach can work for other farmers, too:
“It could be done by other farms again and again and again across rural America.”",Why a Georgia farmer now raises cows like his great-grandfather did,https://www.facebook.com/130268756992804/posts/2246986505321008/,2/4/2019
Not in database,n/a,n/a,n/a,2018-03-07 Yale Climate Connections -- This company wants to make sustainability cool. �,#N/A,#N/A,https://bit.ly/2oJsEbK,$20.63,6085338841494,"6,314","1,249",65,58,$0.0165,$0.317,$0.36,,197.814,9,This company wants to make sustainability cool. 😎,"Meet Pacific Peak, an 18-year-old’s eco-friendly T-shirt company",https://www.facebook.com/130268756992804/posts/1819233538096309/,4/4/2018
The herald of sea-level rise,2/22/2017,"Eileen Mignoni, sea level rise","Latino Communities, Sea Level Rise",2017-02-22 Yale Climate Connections -- From researcher to activist: Nicole Hernandez Hammer n...,#N/A,#N/A,http://www.yaleclimateconnections.org/2017/02/the-herald-of-sea-level-rise/,$94.43,6064977984294,"19,339","2,474",275,,$0.0382,$0.343,#DIV/0!,,127.928,0,"From researcher to activist: Nicole Hernandez Hammer noticed that the areas most vulnerable to sea-level rise were also home to some of the fastest-growing Latino communities, but no one was talking about that. Tune in to learn how she is helping families cope, adapt and learn about climate change. 

Photo courtesy of the Union of Concerned Scientists LaNueva883 El Zol 106.7 FM South Florida Activism",The herald of sea-level rise ,https://www.facebook.com/130268756992804/posts/1424805840872416/,3/4/2017
How seaweed could protect oysters,9/13/2016,"David Appell, fisheries management, ocean acidification","Food & Agriculture, Oceans",Did you know that oysters are threatened by climate change? The oceans absorb...,#N/A,#N/A,http://www.yaleclimateconnections.org/2016/09/how-seaweed-could-protect-oysters/,$12.75,6056390962894,"3,595",242,33,,$0.0527,$0.386,#DIV/0!,,67.316,0,"Did you know that oysters are threatened by climate change? The oceans absorb about half of all human emissions of carbon dioxide, and that extra carbon makes the water more acidic and interferes with the ability of clams, mussels, and oysters to build strong shells. 

Hear what some scientists are working on to combat this trend on today's show.",How seaweed could protect oysters ,https://www.facebook.com/130268756992804/posts/1264698853549783/,10/4/2016
Earth‚Äôs oceans are routinely breaking heat records,2/4/19 7:05,Dana Nuccitelli,"Feature Article, Oceans","2019-02-04 Yale Climate Connections -- New data reinforce evidence, for one thing, that furth...",#N/A,#N/A,https://www.yaleclimateconnections.org/2019/02/earths-oceans-are-routinely-breaking-heat-records/,$108.21,6109015823894,"14,884","3,307",563,104,$0.0327,$0.192,$1.04,8,222.185,7,"New data reinforce evidence, for one thing, that further warm-up of global oceans continues.",Earth's oceans are routinely breaking heat records » by Dana Nuccitelli,https://www.facebook.com/130268756992804/posts/2289653931054265/,3/4/2019
Indy is a solar power leader,8/23/2016,"Indianapolis, Sara Peach, solar",Energy,Indianapolis is one of America’s top locations for solar – with more panels i...,#N/A,#N/A,http://www.yaleclimateconnections.org/2016/08/indy-as-a-solar-power-leader/,$23.09,6055292209494,"3,750",332,43,,$0.0695,$0.537,#DIV/0!,,88.533,0,Indianapolis is one of America’s top locations for solar – with more panels installed per person than any U.S. city but Honolulu. What's its secret? Hear more on today's episode.,Indy is a solar power leader ,https://www.facebook.com/130268756992804/posts/1244233832262952/,9/4/2016
How family size shapes your carbon footprint,3/29/19 7:05,Craig K. Chandler,"Feature Article, Religion &amp; Morality",2019-03-29 Yale Climate Connections -- A 2017 paper found that reducing family size was the m...,#N/A,#N/A,https://www.yaleclimateconnections.org/2019/03/how-family-size-shapes-your-carbon-footprint/,$38.45,6113016786494,"2,176",380,37,12,$0.1012,$1.039,$3.20,7,174.632,6,"A 2017 paper found that reducing family size was the most important lifestyle choice for reducing personal carbon emissions. 

This is the fifth installment of a 5-part series this week on how to reduce your carbon footprint. Check it out.",How family size shapes your carbon footprint » by Craig K. Chandler,https://www.facebook.com/130268756992804/posts/2369987446354246/,4/4/2019
Not in database,n/a,n/a,n/a,2017-01-27 Yale Climate Connections -- Here is a summary of the films featuring Climate Chang...,#N/A,#N/A,https://sustainability.uiowa.edu/climatenarrative/?p=3538,$3.28,6063669786694,"4,744",542,60,,$0.0061,$0.055,#DIV/0!,,114.250,0,"Here is a summary of the films featuring Climate Change at the Sundance Film Fest, going on right now and until the 29th of January. (Via University of Iowa)",Sundance Film Fest Features Climate Change | Climate Narrative Project,https://www.facebook.com/130268756992804/posts/1403217293031271/,2/16/2017
The Mississippi Delta is losing land,8/7/18 7:00,Samantha Harrington,Species &amp; Ecosystems,2018-08-07 Yale Climate Connections -- Climate change will make this problem worse if action ...,#N/A,#N/A,https://www.yaleclimateconnections.org/2018/08/the-mississippi-delta-is-losing-land/,$31.12,6096102333094,"6,618","1,080",147,127,$0.0288,$0.212,$0.25,8,163.191,19,Climate change will make this problem worse if action isn’t taken.,The Mississippi Delta is losing land. Here’s why.,https://www.facebook.com/130268756992804/posts/2017389334947394/,9/4/2018
"For the Gullah Geechee, sea-level rise is already a fact of life",11/19/18 7:00,NULL,Oceans,"2019-02-07 Yale Climate Connections -- Queen Quet, heard here in our interview from last fall...",#N/A,#N/A,https://www.yaleclimateconnections.org/2018/11/rising-seas-storms-threaten-gullah-geechee-land/,$76.17,6109254456694,"12,224","2,428",454,192,$0.0314,$0.168,$0.40,10,198.626,16,"Queen Quet, heard here in our interview from last fall, is testifying in Congress about climate change today: https://www.yaleclimateconnections.org/2018/11/rising-seas-storms-threaten-gullah-geechee-land/","Rising seas, storms threaten Gullah Geechee land » Yale Climate Connections",https://www.facebook.com/130268756992804/posts/2294292910590367/,3/4/2019
Not in database,n/a,n/a,n/a,2016-10-26 Yale Climate Connections -- New scientific research finds staggering ice loss in s...,#N/A,#N/A,https://www.youtube.com/watch?v=0pDB_C-jwkU,$7.82,6058826853294,"1,638",285,57,,$0.0274,$0.137,#DIV/0!,,173.993,0,New scientific research finds staggering ice loss in several Antarctic glaciers. http://wapo.st/2ebErsh  The short video below helps explain what's happening across Antarctica.,Trouble at Totten Glacier,https://www.facebook.com/130268756992804/posts/1306740306012304/,11/4/2016
"Turn on a streetlight, alter an ecosystem?",11/3/2016,"David Appell, ecology",Ecosystems,2016-11-03 Yale Climate Connections -- Did you know streetlights cause plants to bloom earlie...,#N/A,#N/A,http://www.yaleclimateconnections.org/2016/11/turn-on-a-streetlight-alter-an-ecosystem/,$11.33,6059240952094,"2,127",219,39,,$0.0517,$0.291,#DIV/0!,,102.962,0,Did you know streetlights cause plants to bloom earlier?  Listen in to today's story on Richard Ffrench-Constant of the University of Exeter to learn about the impacts of urban lighting on nature and what frequencies they should omit to reduce them.,"Turn On a Streetlight, Alter an Ecosystem?
",https://www.facebook.com/130268756992804/posts/1312810122071989/,12/4/2016
Climate data: business opportunity?,9/29/2016,"climate data, Sara Peach, The Collider",Economics,2016-09-29 Yale Climate Connections -- The largest archive of climate data in the world needs...,#N/A,#N/A,http://www.yaleclimateconnections.org/2016/09/climate-data-business-opportunity/,$29.86,6057283904094,"3,869",352,49,,$0.0848,$0.609,#DIV/0!,,90.980,0,"The largest archive of climate data in the world needs you!  Asheville North Carolina has recently created a space called “The Collider” to attract entrepreneurs from administrators to graphic designers to creatively turn climate data into products and services.  The Collider  NOAA National Centers for Environmental Information - Climate

Learn more about the next generation of climate jobs on today’s episode of the Yale Climate Connection's Radio Show!",Climate data: business opportunity? - Yale Climate Connections,https://www.facebook.com/130268756992804/posts/1279275218758813/,10/4/2016
Climate change could cause more sewage backups,10/24/18 7:00,Sara Peach,Weather Extremes,2018-10-24 Yale Climate Connections -- Nope. We’re good. Thanks.,#N/A,#N/A,https://www.yaleclimateconnections.org/2018/10/climate-change-could-cause-more-sewage-backups/,$129.69,6101623396294,"7,394",844,84,75,$0.1537,$1.544,$1.73,8,114.147,10,Nope. We’re good. Thanks.,Gross! Climate change could cause more sewage backups,https://www.facebook.com/130268756992804/posts/2129856230367370/,11/4/2018
Warming intensifies Colorado drought,3/21/2017,"Daisy Simmons, drought, water resources","Ecosystems, Sustainability",2017-03-21 Yale Climate Connections -- Forty million people depend on the Colorado River for ...,#N/A,#N/A,http://www.yaleclimateconnections.org/2017/03/warming-intensifies-colorado-drought/,$57.24,6066526799694,"13,314","1,686",275,,$0.0340,$0.208,#DIV/0!,,126.634,0,"Forty million people depend on the Colorado River for drinking water, a resource that’s vulnerable as temperatures rise. Tune in to learn more about how climate change is driving water shortages.

University of Arizona School of Geography and Development Arizona Public Media National Audubon SocietyColorado River Indian Tribes",Warming intensifies Colorado drought,https://www.facebook.com/130268756992804/posts/1453617721324561/,4/4/2017
How family size shapes your carbon footprint,3/29/19 7:05,Craig K. Chandler,"Feature Article, Religion &amp; Morality",2019-03-20 Yale Climate Connections -- Utility bills can be a heavy burden for low-income com...,#N/A,#N/A,https://www.yaleclimateconnections.org/2019/03/poor-you-probably-pay-more-for-electricity/,$19.30,6112275703094,"2,790",513,53,18,$0.0376,$0.364,$1.07,8,183.871,6,Utility bills can be a heavy burden for low-income communities. So Nathaniel Smith says governments and utilities should invest in energy programs for low-income people:,Poor? You probably pay more for electricity.,https://www.facebook.com/130268756992804/posts/2355714644448193/,4/4/2019
City prepares for intense storms,4/4/18 7:00,Justyna Bicz,Weather Extremes,2018-04-04 Yale Climate Connections -- Is your city preparing for climate change?,#N/A,#N/A,https://www.yaleclimateconnections.org/2018/04/how-one-city-is-preparing-for-storms-of-the-future/,$23.57,6087114013894,"8,166","1,510",181,148,$0.0156,$0.130,$0.16,,184.913,18,Is your city preparing for climate change?,How one city is getting ready for the storms of the future ,https://www.facebook.com/130268756992804/posts/1851525308200465/,5/4/2018
How a Dutch city became a cycling capital,1/19/18 7:00,Bruce Lieberman,Transportation,2018-01-22 Yale Climate Connections -- Are bicycles the future of transportation in cities? ����,#N/A,#N/A,https://www.yaleclimateconnections.org/2018/01/how-a-dutch-city-became-a-cycling-capital/,$25.57,6083000915494,"8,000","1,330",103,49,$0.0192,$0.248,$0.52,,166.250,6,Are bicycles the future of transportation in cities? 🚲🏪🚲🚲,How a Dutch city became a cycling capital of the world ,https://www.facebook.com/130268756992804/posts/1768364679849862/,2/4/2018
Curbing CO2 emissions from airplanes,9/5/2016,"airplane emissions, David Appell, GHG emissions",Energy,Air travel currently emits about 2 percent of global warming pollution worldw...,#N/A,#N/A,http://www.yaleclimateconnections.org/2016/09/curbing-co2-emissions-from-airplanes/,$15.90,6055965706294,"3,059",218,16,,$0.0729,$0.994,#DIV/0!,,71.265,0,Air travel currently emits about 2 percent of global warming pollution worldwide. But analysts believe those emissions could triple if left unchecked. Hear about research underway to curb this trend on today's episode.,Curbing airplane CO2 emissions ,https://www.facebook.com/130268756992804/posts/1256738574345811/,10/4/2016
Banking seeds for future climates,3/13/2017,"agriculture, Samantha Harrington",Food & Agriculture,"2017-03-13 Yale Climate Connections -- As a result of human activities, one out of every five...",#N/A,#N/A,http://www.yaleclimateconnections.org/2017/03/banking-seeds-for-future-climates/,$46.18,6066098515694,"17,510","2,276",415,,$0.0203,$0.111,#DIV/0!,,129.983,0,"As a result of human activities, one out of every five plant species is at risk of extinction. Climates are changing faster than plants can adapt, so the Missouri Botanical Garden and 39 other American arboretums are saving seeds in case populations go extinct in the wild. Listen in to learn more.  
Missouri Botanical Garden St. Louis Public Radio Seed Savers Exchange",Banking seeds for future climates,https://www.facebook.com/130268756992804/posts/1449197191766614/,4/4/2017
Halloween candy's link to climate change,10/31/2017,Bruce Lieberman,Food & Agriculture,2017-10-31 Yale Climate Connections -- Halloween candy isn’t just contributing to stomach aches.,#N/A,#N/A,https://www.yaleclimateconnections.org/2017/10/halloween-candys-link-to-climate-change/,$387.34,6079116063494,"61,512","8,272","1,172",1720,$0.0468,$0.330,$0.23,,134.478,28,Halloween candy isn’t just causing stomach aches.,A common ingredient in Halloween candy is contributing to climate change,https://www.facebook.com/130268756992804/posts/1686346308051700/,11/4/2017
Catholic institutions commit to climate action,8/23/18 7:00,Erika Street Hopman,Religion &amp; Morality,2018-08-23 Yale Climate Connections -- ”We would love for the Catholic church to be a leader ...,#N/A,#N/A,https://www.yaleclimateconnections.org/2018/08/catholic-institutions-commit-to-climate-action/,$67.27,6097187795894,"12,120","2,299",147,46,$0.0293,$0.458,$1.46,9,189.686,4,"”We would love for the Catholic church to be a leader and an inspiration with regard to climate action in spirit, word, and deed.” — Jose Aguto of the Catholic Climate Covenant",Catholic institutions commit to climate action,https://www.facebook.com/130268756992804/posts/2046395922046735/,9/4/2018
How artificial intelligence could help scientists track climate impacts,5/3/19 7:00,NULL,Climate Science,2019-05-31 Yale Climate Connections -- “I don't apologize for saying that one of the componen...,#N/A,#N/A,https://www.yaleclimateconnections.org/2019/05/farmer-finds-sustainable-choices-can-also-be-profitable/,$259.11,6118191660094,"20,416","4,599",375,224,$0.0563,$0.691,$1.16,8,225.264,11,"“I don't apologize for saying that one of the components of sustainability is profitability. Because if you can’t make a profit, you can’t sustain yourself, ” says farmer Ted Barbour:","This farmer is choosing sustainability  — and earning a profit, too",https://www.facebook.com/130268756992804/posts/2475436505809339/,6/4/2019
Not in database,n/a,n/a,n/a,2017-11-16 Yale Climate Connections -- Bad news for anybody who likes to go leaf peeping. ���,#N/A,#N/A,https://yaleclimateconnections.org/2017/11/climate-change-could-dull-fall-colors,$111.00,6079884591694,"17,683","3,083",362,86,$0.0360,$0.307,$1.29,,174.348,5,Bad news for anybody who likes to go leaf peeping. 🍁🍃🍂,Climate change could dull fall’s spectacular colors ,https://www.facebook.com/130268756992804/posts/1692294007456930/,12/4/2017
Gold's ugly impact on the climate,7/3/18 7:00,Eileen Mignoni,Energy,2018-07-03 Yale Climate Connections -- How much carbon pollution can mining one ounce of gold...,#N/A,#N/A,https://www.yaleclimateconnections.org/2018/07/golds-ugly-impact-on-the-climate/,$71.30,6093728570494,"9,420","1,246",166,127,$0.0572,$0.430,$0.56,7,132.272,13,"How much carbon pollution can mining one ounce of gold generate?
1. 1 pound
2. 10 pounds
3. 1,000 pounds

Answer here:",Gold’s ugly impact on the climate,https://www.facebook.com/130268756992804/posts/1959000617452933/,8/4/2018
How to plant a climate-smart garden,3/28/18 7:00,Samantha Harrington,Food &amp; Agriculture,2018-03-28 Yale Climate Connections -- Calling all gardeners—this is a must-read:,#N/A,#N/A,https://www.yaleclimateconnections.org/2018/03/how-to-plant-a-climate-smart-garden/,$62.43,6086691255294,"20,367","3,010",554,727,$0.0207,$0.113,$0.09,,147.788,36,Calling all gardeners—this is a must-read:,How to plant a climate-smart garden  ,https://www.facebook.com/130268756992804/posts/1843722765647386/,4/4/2018
The woman who helped thousands go solar,4/5/2017,"Jan Ellen Spiegel, solar","Economics, Energy","2017-04-05 Yale Climate Connections -- Financing for home solar is not widely available, and ...",#N/A,#N/A,http://www.yaleclimateconnections.org/2017/04/meet-the-woman-who-has-helped-thousands-go-solar/,$111.93,6067391577894,"20,002","2,813",348,,$0.0398,$0.322,#DIV/0!,,140.636,0,"Financing for home solar is not widely available, and one woman’s quest to install panels on her home led her to develop a unique solar finance company. She saw a problem, thought of a solution, and said, “Why not try it?” Listen in to hear from the founder of Sungage. 

Sungage Financial WGBH News Solar Energy International (SEI) Solar Energy Industries Association WBUR 90.9 FM SolarCity","Meet the woman who has helped thousands go solar 
",https://www.facebook.com/130268756992804/posts/1462677147085285/,5/4/2017
What's the best job for fighting climate change?,12/17/18 7:00,NULL,Jobs &amp; Economy,2018-12-17 Yale Climate Connections -- You don’t have to quit your day job to make a differen...,#N/A,#N/A,https://www.yaleclimateconnections.org/2018/12/the-best-job-for-fighting-climate-change/,$40.56,6105623276894,"2,279",381,30,43,$0.1065,$1.352,$0.94,6,167.179,19,You don’t have to quit your day job to make a difference on climate change:,What’s the best job for fighting climate change?,https://www.facebook.com/130268756992804/posts/2214645258555133/,1/4/2019
How family size shapes your carbon footprint,3/29/19 7:05,Craig K. Chandler,"Feature Article, Religion &amp; Morality",2019-04-09 Yale Climate Connections -- Here’s some inspiration for all renewable energy advoc...,#N/A,#N/A,https://www.yaleclimateconnections.org/2019/04/how-an-island-doubled-its-solar-capacity/,$22.18,6113889614694,"2,708",751,60,74,$0.0295,$0.370,$0.30,7,277.326,27,Here’s some inspiration for all renewable energy advocates: https://www.yaleclimateconnections.org/2019/04/how-an-island-doubled-its-solar-capacity/,How residents of an island community in Maine helped double their local solar capacity,https://www.facebook.com/130268756992804/posts/2386859308000393/,5/4/2019
Simulating the sustainability challenge,11/28/2016,"David Appell, video game","Ecosystems, Sustainability","2016-11-28 Yale Climate Connections -- A new video game by Strange Loop Games called Eco, all...",#N/A,#N/A,http://www.yaleclimateconnections.org/2016/11/new-video-game-simulates-the-global-sustainability-challenge/,$9.01,6060611127694,"1,516",177,39,,$0.0509,$0.231,#DIV/0!,,116.755,0,"A new video game by Strange Loop Games called Eco, allows players to create and manage entire worlds of integrated ecosystems, economics and civilizations.  Listen in to learn how this ambitious game could inspire the next generation of leaders.","New Video Game Simulates the Global Sustainability Challenge
",https://www.facebook.com/130268756992804/posts/1331778130175188/,12/4/2016
"In 'Buddhist Economics,' sustainability is more important than GDP",2/11/19 7:00,NULL,"Education, Religion &amp; Morality",2019-02-28 Yale Climate Connections -- An antidote to climate despair:,#N/A,#N/A,https://www.yaleclimateconnections.org/2019/02/intergenerational-conversation-an-antidote-to-climate-despair/,$31.10,6110809527294,"3,730",734,47,159,$0.0424,$0.662,$0.20,8,196.783,43,An antidote to climate despair:,Feeling hopeless about climate change? Here’s an approach you may not have considered.,https://www.facebook.com/130268756992804/posts/2327364437283214/,3/4/2019
We all have a climate story to tell,1/5/2017,"Climate Generation, Katie Siegner",Faith & Ethics,"2017-01-06 Yale Climate Connections -- The more people share, the more comfortable they are t...",#N/A,#N/A,http://www.yaleclimateconnections.org/2017/01/we-all-have-a-climate-story-to-tell/,$52.10,6062558342294,"11,276","1,197",134,,$0.0435,$0.389,#DIV/0!,,106.155,0,"The more people share, the more comfortable they are talking about climate change. Listen in to learn how a nonprofit connects people to the issue.

 Climate Generation: A Will Steger Legacy",We All Have a Climate Story to Tell,https://www.facebook.com/130268756992804/posts/1371386372881030/,2/16/2017
Pro-life Republican Michele Combs' journey to energy advocacy,3/25/19 7:00,NULL,Policy &amp; Politics,"2019-03-29 Yale Climate Connections -- Residents and businesses in Albany, California, will n...",#N/A,#N/A,https://www.yaleclimateconnections.org/2019/03/albany-california-slashes-carbon-emissions-in-one-vote/,$122.02,6112994186094,"10,337","2,234",237,87,$0.0546,$0.515,$1.40,9,216.117,8,"Residents and businesses in Albany, California, will now be automatically enrolled in carbon-free electricity plans. Has your town or city ever considered this?",How a city slashed its carbon pollution in a single vote ,https://www.facebook.com/130268756992804/posts/2369672253052432/,4/4/2019
Sea-level rise hits real estate,9/20/18 7:00,Diana Madson,Jobs &amp; Economy,2018-09-20 Yale Climate Connections -- Bad news about that beachfront property:,#N/A,#N/A,https://www.yaleclimateconnections.org/2018/09/sea-level-rise-hits-real-estate/,$131.66,6099129163694,"9,174","1,902",191,246,$0.0692,$0.689,$0.54,8,207.325,27,Bad news about that beachfront property:,Sea level rise is already hitting the real-estate market,https://www.facebook.com/130268756992804/posts/2082782608408066/,10/4/2018
A new kind of energy storage,10/14/2016,"Daniel Grossman, energy storage, flow batteries",Energy,2016-10-14 Yale Climate Connections -- Solar panels and wind turbines can generate a lot of p...,#N/A,#N/A,http://www.yaleclimateconnections.org/2016/10/flow-battery-a-new-kind-of-energy-storage/,$22.16,6058211087694,"9,578",746,85,,$0.0297,$0.261,#DIV/0!,,77.887,0,"Solar panels and wind turbines can generate a lot of power but, without a better way to store wind and solar energy, their ability to provide most of our electricity is limited. Listen to today's episode and learn about the future of energy storage.",A new kind of energy storage ,https://www.facebook.com/130268756992804/posts/1294238760595792/,11/4/2016
Some animals can't outrun climate change,12/2/2016,"David Appell, migration patterns",Ecosystems,"2016-12-02 Yale Climate Connections -- As climates change, mammals will need to adapt or relo...",#N/A,#N/A,http://www.yaleclimateconnections.org/2016/12/some-animals-cant-outrun-climate-change/,$12.88,6060865928294,"2,338",344,57,,$0.0374,$0.226,#DIV/0!,,147.134,0,"As climates change, mammals will need to adapt or relocate, but will they all be able to keep up?  Listen in to learn more about Luca Santini’s research at Sapienza Università di Roma on mammal migration speeds.",Some Animals Can’t Outrun Climate Change ,https://www.facebook.com/130268756992804/posts/1331809813505353/,1/4/2017
Climate data as classical music,1/4/2017,"Diana Madson, forests, music and climate change","Arts, Ecosystems, Science",2017-01-04 Yale Climate Connections -- Listen in to learn how data about documented change to...,#N/A,#N/A,http://www.yaleclimateconnections.org/2017/01/climate-data-as-classical-music/,$24.00,6062454478294,"7,438",660,97,,$0.0364,$0.247,#DIV/0!,,88.734,0,Listen in to learn how data about documented change to an Alaskan forest was converted into a classical orchestral arrangement. Stanford University Center for Computer Research in Music and Acoustics (CCRMA),Climate Data as Classical Music,https://www.facebook.com/130268756992804/posts/1371383736214627/,2/16/2017
Warming puts frogs and their habitats at risk,7/12/2016,"amphibians, Erika Street Hopman, frogs",Ecosystems,"Globally, about a third of amphibian species face extinction because of habit...",#N/A,#N/A,http://www.yaleclimateconnections.org/2016/07/warming-climate-puts-frogs-and-their-habitats-at-risk/,$30.82,6053895897094,"8,610",512,116,,$0.0602,$0.266,#DIV/0!,,59.466,0,"Globally, about a third of amphibian species face extinction because of habitat loss, pollution, invasive species . . . and now global warming. Hear more on today's episode.",Warming puts frogs and their habitats at risk - Yale Climate Connections,https://www.facebook.com/130268756992804/posts/1223358944350441/,8/4/2016
Bookshelf: Transit for a warming world,8/29/2016,"book reviews, electric cars, Michael Svoboda, self driving cars, transportation","Energy, Feature Article, Sustainability","This month's Book Shelf focuses on ""transportation"" ... What might the future...",#N/A,#N/A,http://www.yaleclimateconnections.org/2016/08/book-shelf-on-transit-for-a-warming-world/,$12.53,6055786101294,"1,174",100,9,,$0.1253,$1.392,#DIV/0!,,85.179,0,"This month's Book Shelf focuses on ""transportation"" ... What might the future hold in a warming world?",Bookshelf: Transit for a warming world - Yale Climate Connections,https://www.facebook.com/130268756992804/posts/1252600501426285/,10/4/2016
How family size shapes your carbon footprint,3/29/19 7:05,Craig K. Chandler,"Feature Article, Religion &amp; Morality",2019-03-26 Yale Climate Connections -- “Business as usual” in providing permits for mining an...,#N/A,#N/A,https://www.yaleclimateconnections.org/2019/03/researcher-suggests-limiting-fossil-fuel-production/,$60.64,6112740292294,"5,330","1,334",100,16,$0.0455,$0.606,$3.79,9,250.281,3,“Business as usual” in providing permits for mining and drilling doesn’t help achieve stated goals to reduce carbon emissions:,"Governments should consider limiting new fossil fuel development, researcher says ",https://www.facebook.com/130268756992804/posts/2364736270212697/,4/4/2019
A cord-free way to charge electric cars,11/25/2016,"Bruce Lieberman, electric vehicles",Energy,2016-11-25 Yale Climate Connections -- Who would've thought that going wireless could ever ap...,#N/A,#N/A,http://www.yaleclimateconnections.org/2016/11/a-cord-free-way-to-charge-electric-cars/,$36.30,6060481981694,"3,387",343,40,,$0.1058,$0.908,#DIV/0!,,101.270,0,Who would've thought that going wireless could ever apply to your car? Listen in to learn more about the next phase of electric vehicle charging.,A Cord-free Way to Charge Electric Cars,https://www.facebook.com/130268756992804/posts/1325061817513486/,12/4/2016
The Cornhusker State's corn is at risk,10/26/2017,Daisy Simmons,Food & Agriculture,"2017-10-26 Yale Climate Connections -- By the end of the century, the climate in Nebraska cou...",#N/A,#N/A,https://www.yaleclimateconnections.org/2017/10/as-the-climate-warms-the-cornhusker-states-corn-is-at-risk/,$321.11,6078889262294,"32,902","6,559","1,118",239,$0.0490,$0.287,$1.34,,199.350,7,"By the end of the century, the climate in Nebraska could be more like southern Oklahoma — bad news for corn and soybean growers.","As the climate warms, the Cornhusker State's corn is at risk ",https://www.facebook.com/130268756992804/posts/1681387291880935/,11/4/2017
Rising seas threaten FL state revenues,11/7/2016,"Sara Peach, sea level rise","Economics, Sea Level Rise",2016-11-07 Yale Climate Connections -- Florida relies heavily on its property taxes because i...,#N/A,#N/A,http://www.yaleclimateconnections.org/2016/11/rising-seas-threaten-fl-state-revenues/,$25.24,6059440150894,"5,538",827,133,,$0.0305,$0.190,#DIV/0!,,149.332,0,"Florida relies heavily on its property taxes because it does not collect income tax.  Dick Jacobs, a retired Florida tax attorney views sea-level rise as a serious threat to the state’s property tax based economy.  Listen in for more on preventing climate change from washing away Florida’s largest revenue.",Rising Seas Could Swallow Florida’s Tax Base,https://www.facebook.com/130268756992804/posts/1317185268301141/,12/4/2016
Wisconsin walleyes feeling the climate heat,7/10/2017,"ecosystems, Samantha Harrington",Ecosystems,2017-07-10 Yale Climate Connections -- Global warming is putting pressure on what fishermen s...,#N/A,#N/A,https://www.yaleclimateconnections.org/2017/07/wisconsin-walleyes-feeling-the-climate-heat/,$44.11,6072208486494,"19,852","2,025",296,181,$0.0218,$0.149,$0.24,,102.005,9,Global warming is putting pressure on what fishermen say is one of the tastiest fish in the world.,Global warming has Wisconsin’s iconic walleyes in distress,https://www.facebook.com/130268756992804/posts/1575581752461490/,8/4/2017
"Wind energy now competitive, bipartisan",7/29/2016,"Bruce Lieberman, wind energy","Economics, Energy, Policy","As the general election season officially kicks off in the US, listen in to h...",#N/A,#N/A,http://www.yaleclimateconnections.org/2016/07/wind-energy-now-competitive-bipartisan/,$15.45,6053942036694,"2,452",200,28,,$0.0773,$0.552,#DIV/0!,,81.566,0,"As the general election season officially kicks off in the US, listen in to hear why #windenergy is a #bipartisan issue.","Wind energy competitive, bipartisan",https://www.facebook.com/130268756992804/posts/1223867954299540/,8/4/2016
"When climate changes, moose move in",7/20/2016,"Alaska, David Appell, moose",Ecosystems,"As the climate changes in Alaska, moose are changing their habitat and are no...",#N/A,#N/A,http://www.yaleclimateconnections.org/2016/07/when-climate-changes-moose-move-in/,$28.94,6053454675294,"5,904",372,59,,$0.0778,$0.491,#DIV/0!,,63.008,0,"As the climate changes in Alaska, moose are changing their habitat and are now present across the state. Hear more about the migration of these majestic animals on today's episode.","When climate changes, moose move in ",https://www.facebook.com/130268756992804/posts/1217979871555015/,8/4/2016
Perfect lawns can make climate change worse,4/19/18 7:00,Samantha Harrington,"Energy, Food &amp; Agriculture","2018-04-19 Yale Climate Connections -- With a more climate-friendly yard, you’ll have less la...",#N/A,#N/A,https://www.yaleclimateconnections.org/2018/04/how-perfect-lawns-can-make-climate-change-worse/,$20.38,6088084481094,"7,536","1,294",205,195,$0.0157,$0.099,$0.10,,171.709,26,"With a more climate-friendly yard, you’ll have less lawn to mow.",How perfect lawns can make climate change worse,https://www.facebook.com/130268756992804/posts/1867523396600656/,5/4/2018
How family size shapes your carbon footprint,3/29/19 7:05,Craig K. Chandler,"Feature Article, Religion &amp; Morality",2019-04-24 Yale Climate Connections -- Farmer Leah Penniman of Soul Fire Farm says supporting...,#N/A,#N/A,https://www.yaleclimateconnections.org/2019/04/leah-penniman-reclaims-a-farming-legacy/,$57.79,6115087880094,"6,818","1,313",119,38,$0.0440,$0.486,$1.52,9,192.578,6,Farmer Leah Penniman of Soul Fire Farm says supporting aspiring farmers of color is one step toward creating a more just food system — and one that is better prepared for climate change:,Leah Penniman is helping people of color reclaim a farming legacy ,https://www.facebook.com/130268756992804/posts/2412468528772804/,5/4/2019
Pumped storage could help put more wind and solar on the grid,12/12/18 7:05,Peter Sinclair,Energy,"2018-12-13 Yale Climate Connections -- To convert the grid to renewable energy, we'll need a ...",#N/A,#N/A,https://www.yaleclimateconnections.org/2018/12/energy-storage-options-for-renewables/,$85.08,6105366459694,"7,294","1,301",165,161,$0.0654,$0.516,$0.53,7,178.366,22,"To convert the grid to renewable energy, we'll need a way to store it.

https://www.yaleclimateconnections.org/2018/12/energy-storage-options-for-renewables/",Energy-storage options for renewables » New video by Peter Sinclair,https://www.facebook.com/130268756992804/posts/2207496765936649/,1/4/2019
Two scientists' upbeat views on Marrakech,11/17/2016,"2016 presidential election, Bud Ward, COP22, Donald Trump, Peter Sinclair",Policy,2016-11-18 Yale Climate Connections -- Two scientists who participated in a recent global cli...,#N/A,#N/A,http://www.yaleclimateconnections.org/2016/11/two-scientists-upbeat-views-on-marrakech/,$14.51,6060097890494,"1,684",201,25,,$0.0722,$0.580,#DIV/0!,,119.359,0,"Two scientists who participated in a recent global climate change meeting (COP22) in Marrakech, Morocco, come across in a new Yale Climate Connections video as hopeful, bordering on optimistic, about continued international efforts to address the problem.",Two Scientists' Upbeat Views on Marrakech,https://www.facebook.com/130268756992804/posts/1332459260107075/,12/4/2016
Wind power is getting more efficient,8/30/18 7:00,Bruce Lieberman,"Energy, Jobs &amp; Economy","2018-08-30 Yale Climate Connections -- Over the past decade, wind power generation in the U.S...",#N/A,#N/A,https://www.yaleclimateconnections.org/2018/08/wind-power-is-getting-more-efficient/,$49.42,6097659635294,"10,566","2,614",237,70,$0.0189,$0.209,$0.71,9,247.397,7,"Over the past decade, wind power generation in the U.S. has tripled.",Wind power is getting more efficient,https://www.facebook.com/130268756992804/posts/2056234654396195/,9/4/2018
The [Olympics] year the rain forest burned,8/16/2016,"Amazon, Dan Grossman, drought, rain forest fires","Ecosystems, Feature Article, Science, Sustainability",Near-record early Amazon forest fires - not far from the Rio Olympics and com...,#N/A,#N/A,http://www.yaleclimateconnections.org/2016/08/the-olympics-year-the-rain-forest-burned/,$10.65,6054971353094,"2,761",205,39,,$0.0520,$0.273,#DIV/0!,,74.248,0,Near-record early Amazon forest fires - not far from the Rio Olympics and coming on top of recent droughts - raise concerns that 'we're in a different regime.',The [Olympics] Year the Rain Forest Burned - Yale Climate Connections,https://www.facebook.com/130268756992804/posts/1238145699538432/,9/4/2016
How family size shapes your carbon footprint,3/29/19 7:05,Craig K. Chandler,"Feature Article, Religion &amp; Morality",2019-04-18 Yale Climate Connections -- Carbon pollution from fossil fuels is contributing to:...,#N/A,#N/A,https://www.yaleclimateconnections.org/2019/04/ocean-advocates-worry-about-the-climate/,$24.10,6114658472094,"2,362",568,76,3,$0.0424,$0.317,$8.03,9,240.474,1,"Carbon pollution from fossil fuels is contributing to: 
 ✅ ocean acidification 
 ✅ the loss of marine oxygen 
 ✅ sea-level rise","For ocean advocates, climate change used to be a side issue. Not anymore. >> by Daisy Simmons",https://www.facebook.com/130268756992804/posts/2400711323281858/,5/4/2019
Georgia Republican champions solar energy,10/10/2016,"Sara Peach, solar energy",Energy,2016-10-13 Yale Climate Connections -- Solar energy is not a partisan issue according to Laur...,#N/A,#N/A,http://www.yaleclimateconnections.org/2016/10/georgia-republican-champions-solar-energy/,$9.05,6058169128494,"1,999",252,24,,$0.0359,$0.377,#DIV/0!,,126.063,0,"Solar energy is not a partisan issue according to Lauren ‘Bubba’ McDonald, a lifelong Republican, chairman of the Georgia Public Service Commission and one of Georgia’s biggest advocates for solar energy.  He recently directed the state’s power utility to add 525 megawatts of solar power to its energy mix over the next three years.  Listen to the full story on today's episode of the Yale Climate Connections Radio Show  #solar #climatechange #renewableenergy",Georgia Republican champions solar energy ,https://www.facebook.com/130268756992804/posts/1290092617677073/,11/4/2016
Man makes game of saving energy,8/17/2017,"energy, Sara Peach",Energy,2017-08-17 Yale Climate Connections -- What if you made saving energy into a game? That’s wha...,#N/A,#N/A,https://www.yaleclimateconnections.org/2017/08/man-makes-game-of-saving-energy/,$279.42,6073958220694,"61,285","5,484",377,2052,$0.0510,$0.741,$0.14,,89.484,33,"What if you made saving energy into a game? That’s what David Herbert did, and he’s saving hundreds on beating the meter.",Man cuts his utility bill down to $15 a month ,https://www.facebook.com/130268756992804/posts/1615035401849458/,9/4/2017
Meteorologist knows which way the wind blows,1/10/18 7:00,Eileen Mignoni,Weather Extremes,"2018-01-10 Yale Climate Connections -- Since age 12, she has been fascinated by extreme weath...",#N/A,#N/A,https://www.yaleclimateconnections.org/2018/01/meteorologist-knows-which-way-the-wind-blows/,$131.25,6082450506494,"26,247","3,373",156,172,$0.0389,$0.841,$0.76,,128.510,7,"Since age 12, she has been fascinated by extreme weather. Nearly 20 years later, it’s her job to communicate it.",Meteorologist Erika Navarro knows which way the wind is blowing ,https://www.facebook.com/130268756992804/posts/1759512954068368/,2/4/2018
Should I tell my Republican friend that her Florida mansion is doomed by sea-level rise?,9/24/18 7:05,Sara Peach,"Feature Article, Oceans","2018-09-25 Yale Climate Connections -- In today's advice column, Sara Peach shares how to hav...",#N/A,#N/A,https://www.yaleclimateconnections.org/2018/09/advice-should-i-warn-my-friend-about-rising-sea-levels/,$15.62,6099504312894,"1,516",325,22,32,$0.0481,$0.710,$0.49,8,214.380,21,"In today's advice column, Sara Peach shares how to have a sensitive conversation about climate change with a coastal conservative friend.",Advice: Should I warn a friend about rising sea levels?,https://www.facebook.com/130268756992804/posts/2090002097686117/,10/4/2018
12 books on how climate change is transforming businesses and the global economy,5/31/19 7:10,Michael Svoboda,"Arts &amp; Culture, Jobs &amp; Economy",2019-06-05 Yale Climate Connections -- A workforce development program helped Richard Quaofio...,#N/A,#N/A,https://www.yaleclimateconnections.org/2019/06/a-career-in-energy-efficiency-could-be-one-mans-path-to-financial-security/,$46.74,6118611987094,"3,157",716,44,11,$0.0653,$1.062,$4.25,8,226.798,3,"A workforce development program helped Richard Quaofio find his path in the energy efficiency sector.  “I love this. I’m passionate about it, I’m excited about it. I’m settled. This is the path for me.”",A career in energy efficiency could be one man’s path to financial security,https://www.facebook.com/130268756992804/posts/2484480818238241/,7/4/2019
Energy efficiency is crucial to fighting climate change,10/26/18 7:00,Daisy Simmons,Energy,2018-10-26 Yale Climate Connections -- How have you improved energy efficiency in your home o...,#N/A,#N/A,https://www.yaleclimateconnections.org/2018/10/energy-efficiency-is-key-to-addressing-climate/,$62.12,6101742951094,"3,474",779,65,20,$0.0797,$0.956,$3.11,7,224.237,6,How have you improved energy efficiency in your home or at work?,Energy efficiency is crucial to addressing climate change,https://www.facebook.com/130268756992804/posts/2132624453423881/,11/4/2018
We're on the verge of a wind revolution,8/23/18 7:05,Jan Ellen Spiegel,"Energy, Feature Article","2018-08-29 Yale Climate Connections -- The U.S. is late to invest in offshore wind, but East ...",#N/A,#N/A,https://www.yaleclimateconnections.org/2018/08/were-on-the-verge-of-a-wind-revolution/,$37.59,6097603833694,"8,814","1,967",173,74,$0.0191,$0.217,$0.51,9,223.168,8,"The U.S. is late to invest in offshore wind, but East Coast states are making up for lost time.",We're on the verge of a wind revolution,https://www.facebook.com/130268756992804/posts/2055041374515523/,9/4/2018
How vanishing lizards in Madagascar led to a troubling discovery about deforestation and climate change,4/30/19 7:10,Daniel Grossman,"Feature Article, Species &amp; Ecosystems",2019-05-15 Yale Climate Connections -- Eduardo Nájera of nonprofit Wildcoast says protecting ...,#N/A,#N/A,https://www.yaleclimateconnections.org/2019/05/desert-mangroves-store-vast-amounts-of-carbon/,$132.93,6116783142894,"12,794","2,947",333,59,$0.0451,$0.399,$2.25,7,230.342,5,"Eduardo Nájera of nonprofit Wildcoast says protecting carbon-rich ecosystems, like mangroves, is one of the best and most cost-effective ways to keep carbon out of the atmosphere.",These scrubby trees store a vast amount of carbon,https://www.facebook.com/130268756992804/posts/2447537185265938/,6/4/2019
"Spring, and syrup, start early",2/3/2017,"maple syrup, Samantha Harrington","Ecosystems, Food & Agriculture",2017-02-04 Yale Climate Connections -- Warming winters are altering old patterns for maple sy...,#N/A,#N/A,http://www.yaleclimateconnections.org/2017/02/spring-and-syrup-start-early/,$10.06,6064045524294,"4,012",474,75,,$0.0212,$0.134,#DIV/0!,,118.146,0,"Warming winters are altering old patterns for maple syrup producers. Listen in to hear one Wisconsin producer’s concerns and scientists’ predictions for how winters will change in the future. 

#MapleSyrupMonth Wisconsin Foodie Wisconsin FPAQ Inter-Tribal Maple Syrup Producers Cooperative WXPR Public Radio 1410 WIZM - La Crosse's News Station","Spring, and syrup, start early ",https://www.facebook.com/130268756992804/posts/1397520370267630/,3/4/2017
"Nonprofits install solar, save money",3/23/2017,"coal, energy, Sara Peach",Energy,2017-03-23 Yale Climate Connections -- Startup Solar Holler is helping nonprofits reduce thei...,#N/A,#N/A,http://www.yaleclimateconnections.org/2017/03/west-virginia-nonprofits-install-solar-save-money/,$112.44,6066649796494,"20,446","2,713",321,,$0.0414,$0.350,#DIV/0!,,132.691,0,"Startup Solar Holler is helping nonprofits reduce their electricity costs: “Every dollar a homeless shelter or a church or library doesn't have to spend on energy bills means another dollar that they can put toward their programs.” 

Coalfield Development Corporation U.S. Department of Energy Office of Energy Efficiency and Renewable Energy West Virginia Public Broadcasting","West Virginia nonprofits install solar, save money ",https://www.facebook.com/130268756992804/posts/1453670474652619/,4/4/2017
How vanishing lizards in Madagascar led to a troubling discovery about deforestation and climate change,4/30/19 7:10,Daniel Grossman,"Feature Article, Species &amp; Ecosystems",2019-05-18 Yale Climate Connections -- Extreme heat poses a long-term threat to the grid in L...,#N/A,#N/A,https://www.yaleclimateconnections.org/2019/05/climate-change-could-cause-l-a-blackouts/,$33.36,6117031518094,"3,839",814,87,19,$0.0410,$0.383,$1.76,9,212.034,5,Extreme heat poses a long-term threat to the grid in L.A. county:,Climate change could lead to blackouts in Los Angeles,https://www.facebook.com/130268756992804/posts/2449303701755953/,6/4/2019
E.U. plans to boost electric cars,2/7/2017,"Diana Madson, electric vehicles","Energy, Policy",2017-02-07 Yale Climate Connections -- The European Union hopes to encourage electric vehicle...,#N/A,#N/A,http://www.yaleclimateconnections.org/2017/02/e-u-plans-to-boost-electric-cars/,$48.55,6064214805694,"17,488","2,167",210,,$0.0224,$0.231,#DIV/0!,,123.914,0,"The European Union hopes to encourage electric vehicle ownership by requiring new and renovated residential buildings to provide charging stations. Learn more.

European Union in the United States European Environment Agency Tesla",E.U. plans to boost electric cars,https://www.facebook.com/130268756992804/posts/1414842061868794/,3/4/2017
12 books on how climate change is transforming businesses and the global economy,5/31/19 7:10,Michael Svoboda,"Arts &amp; Culture, Jobs &amp; Economy",2019-05-09 Yale Climate Connections -- Pam Dawling lives at Twin Oaks commune in Virginia. Th...,#N/A,#N/A,https://www.yaleclimateconnections.org/2019/05/twin-oaks-residents-share-almost-everything/,$54.94,6116291979094,"4,995","1,019",86,153,$0.0539,$0.639,$0.36,9,204.004,31,"Pam Dawling lives at Twin Oaks commune in Virginia. This lifestyle isn’t right for everyone, but she says sharing doesn’t have to be all-or-nothing:","These 100 people share nearly everything — vehicles, meals, even some clothes",https://www.facebook.com/130268756992804/posts/2436960142990309/,6/4/2019
More trees could cool Phoenix,12/26/2016,"Diana Madson, trees","Ecosystems, Food & Agriculture",2016-12-26 Yale Climate Connections -- Phoenix can reach a brutal 100 degrees on average abou...,#N/A,#N/A,http://www.yaleclimateconnections.org/2016/12/more-trees-could-cool-phoenix/,$24.45,6062070632294,"5,316",613,69,,$0.0399,$0.354,#DIV/0!,,115.312,0,Phoenix can reach a brutal 100 degrees on average about 90 days a year.   Listen in to learn about a new tree planting effort which aims to provide more than just shade. American Forests Urban Resources Initiative,More Trees Could Cool Phoenix,https://www.facebook.com/130268756992804/posts/1364437216909279/,1/4/2017
Lake Erie's shores are being eroded by heavy rains,10/30/18 7:00,Samantha Harrington,Weather Extremes,2018-10-30 Yale Climate Connections -- The impacts of climate change don’t stop at the coasts.,#N/A,#N/A,https://www.yaleclimateconnections.org/2018/10/heavy-rains-are-eroding-lake-eries-shore/,$183.07,6101992582494,"11,655","2,216",227,102,$0.0826,$0.806,$1.79,8,190.133,9,The impacts of climate change don’t stop at the coasts.,Heavy rains are eroding Lake Erie’s shore,https://www.facebook.com/130268756992804/posts/2140269415992718/,11/4/2018
Not in database,n/a,n/a,n/a,2018-04-02 Yale Climate Connections -- Researchers wondered how closing a coal plant in Tongl...,#N/A,#N/A,https://bit.ly/2pV7msy,$41.65,6086984696294,"16,520","3,929",547,70,$0.0106,$0.076,$0.60,,237.833,4,"Researchers wondered how closing a coal plant in Tongliang, China, would affect children’s health. The results are in:","After a coal plant closed, children’s health improved ",https://www.facebook.com/130268756992804/posts/1849280635091599/,5/4/2018
Fewer CO2 emissions by reusing others' 'stuff',7/5/2017,"Dan Grossman, sustainability","Feature Article, Sustainability",2017-07-10 Yale Climate Connections -- Looking to reduce your household carbon emissions? Nex...,#N/A,#N/A,https://www.yaleclimateconnections.org/2017/07/fewer-co2-emissions-by-reusing-others-stuff/,$31.67,6072213670294,"12,961","1,533",169,40,$0.0207,$0.187,$0.79,,118.278,3,"Looking to reduce your household carbon emissions? Next time you're looking to renovate your home or furnishings, consider the humble yard sale.",Fewer CO2 emissions by reusing others' 'stuff',https://www.facebook.com/130268756992804/posts/1572751816077817/,8/4/2017
U.S. cities lose 28 million trees a year,8/29/18 7:00,Bruce Lieberman,Species &amp; Ecosystems,2018-08-29 Yale Climate Connections -- Why aren't more people talking about tree loss in the ...,#N/A,#N/A,https://www.yaleclimateconnections.org/2018/08/u-s-cities-lose-28-million-trees-a-year/,$81.07,6097581721094,"18,892","4,197",707,174,$0.0193,$0.115,$0.47,9,222.158,9,Why aren't more people talking about tree loss in the U.S.?,American cities are losing 28 million trees a year,https://www.facebook.com/130268756992804/posts/2054977154521945/,9/4/2018
Naval Academy readies for rising seas,6/14/18 7:00,Diana Madson,"National Security, Oceans","2018-06-15 Yale Climate Connections -- Rising waters have sailors at sea, even when they’re o...",#N/A,#N/A,https://www.yaleclimateconnections.org/2018/06/naval-academy-readies-for-rising-seas/,$454.02,6092436418494,"58,192","8,454","1,416",1614,$0.0537,$0.321,$0.28,7,145.278,28,"Rising waters have sailors at sea, even when they’re on land.",The Naval Academy is getting ready for sea-level rise,https://www.facebook.com/130268756992804/posts/1928508957168766/,7/4/2018
Not in database,n/a,n/a,n/a,"2017-01-25 Yale Climate Connections -- “If I have to come forward as a real person, then so b...",#N/A,#N/A,,$9.07,6063505573894,"3,242",606,74,,$0.0150,$0.123,#DIV/0!,,186.922,0,,,,2/16/2017
Not in database,n/a,n/a,n/a,"2016-09-27 Yale Climate Connections -- If you listen carefully, you can hear global warming. ...",#N/A,#N/A,https://bit.ly/2d6Lxz4,$22.31,6057123215694,"5,444",524,64,,$0.0426,$0.349,#DIV/0!,,96.253,0,"If you listen carefully, you can hear global warming. Listen to soundscape ecologist Bernie Krause talk about his 20 years of recordings at Sugarloaf Ridge State Park on todays episode of Yale Climate Connection. #climatechange #SugarloafRidgeStatePark #birdwatching 
http://bit.ly/2d6Lxz4",Can you hear global warming? - Yale Climate Connections,https://www.facebook.com/130268756992804/posts/1277411995611802/,10/4/2016
Solar power is saving this farmer money,10/2/18 7:00,NULL,"Energy, Food &amp; Agriculture","2018-10-12 Yale Climate Connections -- “I would highly encourage any grower, no matter the si...",#N/A,#N/A,https://www.yaleclimateconnections.org/2018/10/solar-power-is-saving-this-farmer-money/,$22.27,6100819140294,"1,765",470,27,5,$0.0474,$0.825,$4.45,9,266.289,3,"“I would highly encourage any grower, no matter the size, to explore solar. The financial aspect of it just makes sense.” — A. J. Hood, manager of Tillar and Company",Solar power is saving this farmer money » Yale Climate Connections,https://www.facebook.com/130268756992804/posts/2113996485286678/,11/4/2018
Four scientists make creativity a key to communicating their research,5/21/19 7:05,Peter Sinclair,"Arts &amp; Culture, Communicating Climate",2019-05-14 Yale Climate Connections -- Major changes are required in order to avoid catastrop...,#N/A,#N/A,https://www.yaleclimateconnections.org/2019/05/planetary-health-and-12-years-to-act/,$59.43,6116721638094,"5,638",929,145,40,$0.0640,$0.410,$1.49,7,164.775,7,"Major changes are required in order to avoid catastrophic warming, and those changes can be made starting right now.",Planetary health and '12 years' to act » by Jeffrey T. Kiehl,https://www.facebook.com/130268756992804/posts/2446029482083375/,6/4/2019
Researchers find way to reduce deforestation,10/19/2017,Bud Ward,Sustainability,2017-10-19 Yale Climate Connections -- This program could be a cost-effective way to reduce e...,#N/A,#N/A,https://www.yaleclimateconnections.org/2017/10/researchers-find-way-to-reduce-deforestation-uganda/,$48.66,6078536665294,"11,620","1,830",168,207,$0.0266,$0.290,$0.24,,157.487,18,This program could be a cost-effective way to reduce emissions in Uganda and elsewhere.,Researchers find an effective way to reduce deforestation ,https://www.facebook.com/130268756992804/posts/1674598989226432/,11/4/2017
Not in database,n/a,n/a,n/a,2019-04-01 Yale Climate Connections -- This family made an upfront investment to reduce their...,#N/A,#N/A,https://bit.ly/2CMwg3Y,$32.01,6113178814494,"2,940",566,43,43,$0.0566,$0.744,$0.74,9,192.517,15,"This family made an upfront investment to reduce their carbon emissions. Now, they’re reaping the benefits:",How a Tennessee family dramatically reduced their carbon pollution,https://www.facebook.com/130268756992804/posts/2374383449247979/,5/4/2019
"Bounty hunter George Pakenham fights air pollution, one idling vehicle at a time",12/12/18 7:00,Jan OBrien,"Policy &amp; Politics, Transportation","2018-12-12 Yale Climate Connections -- “If you see ecological injustice, for goodness’ sakes,...",#N/A,#N/A,https://www.yaleclimateconnections.org/2018/12/bounty-hunter-fights-air-pollution/,$56.69,6105279661694,"5,778",888,47,69,$0.0638,$1.206,$0.82,9,153.686,12,"“If you see ecological injustice, for goodness’ sakes, speak out.” — George Pakenham","This bounty hunter is fighting air pollution, one idling vehicle at a time",https://www.facebook.com/130268756992804/posts/2206977755988550/,1/4/2019
A stop-gap plan to save coral reefs,4/16/18 7:00,Justyna Bicz,"Oceans, Species &amp; Ecosystems",2018-04-16 Yale Climate Connections -- Many corals are dying faster than they’re being natura...,#N/A,#N/A,https://www.yaleclimateconnections.org/2018/04/scientists-stop-gap-plan-save-coral-reefs/,$13.40,6087857659094,"5,836","1,298",170,61,$0.0103,$0.079,$0.22,,222.413,10,Many corals are dying faster than they’re being naturally replaced. This could be a big help to conservation efforts:,Scientists’ stop-gap plan to save coral reefs ,https://www.facebook.com/130268756992804/posts/1864342446918751/,5/4/2018
Not in database,n/a,n/a,n/a,2018-08-31 Yale Climate Connections -- What are the human consequences of sea level rise?,#N/A,#N/A,https://www.yaleclimateconnections.org/2018/08/sea-level-rise-is-already-harming-americans,$75.23,6097735474894,"16,368","3,684",502,368,$0.0204,$0.150,$0.20,9,225.073,22,What are the human consequences of sea level rise?,Sea-level rise is already harming Americans,https://www.facebook.com/130268756992804/posts/2057575707595423/,9/4/2018
How family size shapes your carbon footprint,3/29/19 7:05,Craig K. Chandler,"Feature Article, Religion &amp; Morality",2019-04-11 Yale Climate Connections -- Are bison the new climate stewards?,#N/A,#N/A,https://www.yaleclimateconnections.org/2019/04/bison-ranch-puts-carbon-into-the-soil/,$126.96,6114092856694,"18,227","4,078",413,404,$0.0311,$0.307,$0.31,9,223.734,22,Are bison the new climate stewards?,How a bison ranch is putting carbon pollution back into the ground,https://www.facebook.com/130268756992804/posts/2390029741016683/,5/4/2019
"In a new climate fiction course, students will imagine solutions",11/22/18 7:00,Daisy Simmons,Education,2018-11-22 Yale Climate Connections -- Can fiction help people understand climate change?,#N/A,#N/A,https://www.yaleclimateconnections.org/2018/11/students-to-imagine-new-solutions-in-cli-fi-course/,$127.23,6103756934294,"8,019","1,324",99,41,$0.0961,$1.285,$3.10,7,165.108,5,Can fiction help people understand climate change?,"In this new writing course, students will pen their own climate fiction",https://www.facebook.com/130268756992804/posts/2176270532392606/,12/4/2018
How to address climate grief,12/5/2016,"climate grief, Sara Peach",Public Health,2016-12-05 Yale Climate Connections -- Does climate change have you down? Is sea-level rise k...,#N/A,#N/A,http://www.yaleclimateconnections.org/2016/12/how-to-address-climate-grief/,$16.44,6060996305894,"4,042",593,60,,$0.0277,$0.274,#DIV/0!,,146.710,0,Does climate change have you down? Is sea-level rise keeping you up at night? Do your anxieties have anxieties?  Listen in to hear how Laura Schmidt coped and is now helping others through their “climate grief.”,How to Address ‘Climate Grief’,https://www.facebook.com/130268756992804/posts/1339808932705441/,1/4/2017
Should a Green New Deal include nuclear power?,4/9/19 14:17,Peter Sinclair,"Energy, Policy &amp; Politics","2019-04-30 Yale Climate Connections -- “It became very, very obvious, very sobering that clim...",#N/A,#N/A,https://www.yaleclimateconnections.org/2019/04/torrential-rain-plagues-pennsylvania-farms/,$96.34,6115530114094,"10,116","2,125",281,116,$0.0453,$0.343,$0.83,8,210.063,11,"“It became very, very obvious, very sobering that climate change is already here,” says Franklin Egan of the Pennsylvania Association for Sustainable Agriculture:",Torrential rains have been plaguing Pennsylvania farms,https://www.facebook.com/130268756992804/posts/2422290027790654/,5/4/2019
Dear Tomorrow - Letters to the future,11/11/2016,"Bud Ward, Dear Tomorrow",Sustainability,2016-11-12 Yale Climate Connections -- If you could write a letter to your loved one to be re...,#N/A,#N/A,http://www.yaleclimateconnections.org/2016/11/dear-tomorrow-letters-to-the-future/,$5.96,6059756887894,"1,051",117,9,,$0.0509,$0.662,#DIV/0!,,111.323,0,"If you could write a letter to your loved one to be read in the year 2030, what would you say? Would you tell them to invest in renewable energy or warn them to not live on a coastline?  Listen in to learn how to send messages into the future.  DearTomorrow",Dear Tomorrow – Letters to the Future,https://www.facebook.com/130268756992804/posts/1317247354961599/,12/4/2016
"Warmer oceans, stronger hurricanes",8/3/2016,"extreme weather, hurricanes, ocean temperatures, Sara Peach","Oceans, Science Questions, Weather",Hurricanes Katrina and Irene and Superstorm Sandy were deadly and costly. But...,#N/A,#N/A,http://www.yaleclimateconnections.org/2016/08/warmer-oceans-stronger-hurricanes/,$57.86,6054186449894,"11,004","1,640",301,,$0.0353,$0.192,#DIV/0!,,149.037,0,Hurricanes Katrina and Irene and Superstorm Sandy were deadly and costly. But scientists say we may see even stronger storms as the world heats up. Hear more about the forecast for super storms on today's episode.,Climate Change: Warmer Oceans & Stronger Storms,https://www.facebook.com/130268756992804/posts/1227315630621439/,9/4/2016
Climate change affecting bird migrations,1/2/2017,"bird migration patterns, Daisy Simmons",Ecosystems,"2017-01-02 Yale Climate Connections -- Every year, 5,000,000 song birds migrate through Chica... - Copy_6062384638094",#N/A,#N/A,http://www.yaleclimateconnections.org/2017/01/climate-change-affecting-bird-migrations/,$19.82,6062384638094,982,84,18,,$0.2360,$1.101,#DIV/0!,,85.540,0,"Every year, 5,000,000 song birds migrate through Chicago, but climate change is influencing their patterns.  Today, The Field Museum describes effects this can have across ecosystems.  National Audubon Society",Climate Change Affecting Bird Migrations,https://www.facebook.com/130268756992804/posts/1371310349555299/,1/8/2017
How the World Evangelical Alliance engages climate skeptics,2/4/19 7:00,NULL,Religion &amp; Morality,2019-02-04 Yale Climate Connections -- More than a third of white Christian evangelicals are ...,#N/A,#N/A,https://www.yaleclimateconnections.org/2019/02/how-an-evangelical-group-engages-skeptics/,$19.82,6109000448694,"2,254",446,28,29,$0.0444,$0.708,$0.68,8,197.870,13,More than a third of white Christian evangelicals are doubtful about climate change. But Chris Elisara is working to change that:,How the World Evangelical Alliance engages climate skeptics,https://www.facebook.com/130268756992804/posts/2289483944404597/,3/4/2019
Not in database,n/a,n/a,n/a,2018-07-07 Yale Climate Connections -- ¿Escuchaste de las abuelitas que arrestaron por partic...,#N/A,#N/A,,$11.74,6094025620894,"1,126",100,2,,$0.1174,$5.870,#DIV/0!,7,88.810,0,,,,8/4/2018
Bionic leaf' helps produce energy,8/22/2016,"bionic leaf, Bruce Lieberman, energy",Energy,A newly developed 'bionic leaf' simulates photosynthesis and provides the hyd...,#N/A,#N/A,http://www.yaleclimateconnections.org/2016/08/bionic-leaf-helps-produce-energy/,$27.66,6055260267694,"4,753",457,87,,$0.0605,$0.318,#DIV/0!,,96.150,0,A newly developed 'bionic leaf' simulates photosynthesis and provides the hydrogen for a process that creates liquid fuel. Hear more on today's episode.,Bionic leaf' helps produce energy ,https://www.facebook.com/130268756992804/posts/1243365562349779/,9/4/2016
Citizens help track nature's changes,9/7/2016,"citizen science, Jan OBrien, Nature's Notebook","Ecosystems, Science","As the climate changes, the four seasons do not always arrive when expected. ...",#N/A,#N/A,http://www.yaleclimateconnections.org/2016/09/citizens-help-track-natures-changes/,$24.71,6056083925294,"4,036",504,76,,$0.0490,$0.325,#DIV/0!,,124.876,0,"As the climate changes, the four seasons do not always arrive when expected. And because climate scientists cannot be everywhere at once, they need help tracking these changes. Hear about how ""citizen scientists"" are helping out on today's episode.",Citizens help track nature's changes ,https://www.facebook.com/130268756992804/posts/1258761680810167/,10/4/2016
Atlanta airport cuts tarmac wait times - and pollution,12/21/18 7:00,NULL,Transportation,"2018-12-21 Yale Climate Connections -- When your plane is idling on the runway, it’s not just...",#N/A,#N/A,https://www.yaleclimateconnections.org/2018/12/atlanta-airport-cuts-wait-times-emissions/,$15.16,6105971625094,"1,491",320,10,12,$0.0474,$1.516,$1.26,9,214.621,8,"When your plane is idling on the runway, it’s not just an annoyance:",The Atlanta airport is getting you to the gate faster — and cutting carbon pollution,https://www.facebook.com/130268756992804/posts/2220422541310738/,1/4/2019
Not in database,n/a,n/a,n/a,2019-06-04 Yale Climate Connections -- Daniel Klier says that most investors want to allocate...,#N/A,#N/A,"https://www.yaleclimateconnections.org/2019/06/the-task-force-on-climate-related-financial-disclosures-could-help-create-a-new,-low-carbon-economy/",$20.39,6118509053894,"1,433",354,21,9,$0.0576,$0.971,$2.27,5,247.034,6,"Daniel Klier says that most investors want to allocate more to sustainability, but many are unsure where to put their money. This task force is trying to help:","This task force could help investors fund a new, low-carbon economy",https://www.facebook.com/130268756992804/posts/2482736195079370/,7/4/2019
Not in database,n/a,n/a,n/a,"2018-02-15 Yale Climate Connections -- Baltimore is taking action to protect its shoreline, t...",#N/A,#N/A,https://bit.ly/2snjLJp,$94.27,6084293407894,"15,944","2,944",425,203,$0.0320,$0.222,$0.46,,184.646,13,"Baltimore is taking action to protect its shoreline, the heart of its economy.",How Baltimore is preparing for sea-level rise ,https://www.facebook.com/130268756992804/posts/1797347980284865/,3/4/2018
"In 'Buddhist Economics,' sustainability is more important than GDP",2/11/19 7:00,NULL,"Education, Religion &amp; Morality",2019-02-26 Yale Climate Connections -- It’s about “inoculating” people against bad actors and...,#N/A,#N/A,https://www.yaleclimateconnections.org/2019/02/lessons-on-telling-scientific-fact-from-fiction/,$28.54,6110651936094,"4,059",778,87,57,$0.0367,$0.328,$0.50,9,191.673,14,It’s about “inoculating” people against bad actors and faulty info.,Science has a misinformation problem. This new curriculum is designed to fight back.,https://www.facebook.com/130268756992804/posts/2324354230917568/,3/4/2019
A young scientist's view,1/9/2017,Sara Peach,"Faith & Ethics, Science",2017-01-09 Yale Climate Connections -- Studying the serious consequences of climate change ca...,#N/A,#N/A,http://www.yaleclimateconnections.org/2017/01/a-young-scientists-view-on-moral-responsibility-and-climate-change/,$29.76,6062703589494,"9,354",916,128,,$0.0325,$0.233,#DIV/0!,,97.926,0,"Studying the serious consequences of climate change can be emotionally taxing.  Today’s story shares planetary and personal change through the eyes of one global warming researcher. 

University of Washington  500 Women Scientists NASA Climate Change",A Young Scientist’s View	,https://www.facebook.com/130268756992804/posts/1377519185601082/,2/16/2017
Small city sets big clean-energy goal,5/3/2017,"energy, Sara Peach",Energy,"2017-05-03 Yale Climate Connections -- Traverse City, Michigan, has joined a growing list of ...",#N/A,#N/A,https://www.yaleclimateconnections.org/2017/05/small-city-sets-big-clean-energy-goal/,$62.18,6068861764294,"12,972","2,231",234,20,$0.0279,$0.266,$3.11,,171.986,2,"Traverse City, Michigan, has joined a growing list of clean energy pioneers. Along with nearly 20 other U.S. cities, it has set a goal of powering all municipal operations with 100 percent clean energy by 2020. Michigan Climate Action Network",Small city sets big clean-energy goal,https://www.facebook.com/130268756992804/posts/1500109443342055/,6/4/2017
Rooftop solar at the Navy yard,12/30/2016,"Bruce Lieberman, renewable energy, rooftop solar",Energy,2016-12-30 Yale Climate Connections -- One of NYC's largest arrays of #solarpanels was just i...,#N/A,#N/A,http://www.yaleclimateconnections.org/2016/12/rooftop-solar-at-the-navy-yard/,$144.52,6062245733094,"25,504","3,951",427,,$0.0366,$0.338,#DIV/0!,,154.917,0,"One of NYC's largest arrays of #solarpanels was just installed on the Brooklyn Navy Yard's rooftop.  Energy demands of expected population growth prompted this facility to take action and plan ahead.  Tune in to learn more magnificent mosaic.  

Brooklyn Navy Yard Center at Building 92 (a.k.a. BLDG 92) City of New York Government #BNYDC (Image courtesy of the Mayor’s Press Office)",Rooftop Solar at the Navy Yard,https://www.facebook.com/130268756992804/posts/1364927543526913/,1/4/2017
Solar job training in coal country,3/8/2017,"coal, economy, Sara Peach","Economics, Energy","2017-03-08 Yale Climate Connections -- In West Virginia, the number of jobs in coal mining ha...",#N/A,#N/A,http://www.yaleclimateconnections.org/2017/03/solar-job-training-in-coal-country/,$94.57,6065683008094,"31,017","5,770",929,,$0.0164,$0.102,#DIV/0!,,186.027,0,"In West Virginia, the number of jobs in coal mining has fallen dramatically since the 1950s. But one organization is eyeing new job opportunities for West Virginians in another energy industry: solar. 

Coalfield Development Corporation West Virginia Public Broadcasting Renewable Energy Jobs Vermont Sustainable Jobs Fund Clean Energy & Jobs Oakland NewsRadio 800 WVHU",Coal country group trains solar installers	,https://www.facebook.com/130268756992804/posts/1438912756128391/,4/4/2017
Cranberry bog returns to the wild,11/22/2017,Samantha Harrington,Food & Agriculture,2017-11-22 Yale Climate Connections -- This owner’s former cranberry farm is now helping prev...,#N/A,#N/A,https://www.yaleclimateconnections.org/2017/11/old-cranberry-bog-returns-to-the-wild/,$41.06,6080180295294,"9,594","2,014",155,83,$0.0204,$0.265,$0.49,,209.923,9,This owner’s former cranberry farm is now helping prevent flooding in extreme weather.,Cranberry bog returns to the wild,https://www.facebook.com/130268756992804/posts/1708347245851606/,12/4/2017
Alabama utility is charging fees on houses with solar panels,10/31/18 7:00,Samantha Harrington,"Energy, Jobs &amp; Economy",2018-10-31 Yale Climate Connections -- Why is one of the nation’s sunniest states charging ex...,#N/A,#N/A,https://www.yaleclimateconnections.org/2018/10/in-alabama-a-disincentive-to-going-solar/,$106.84,6102073481894,"6,170","1,358",100,62,$0.0787,$1.068,$1.72,8,220.097,10,Why is one of the nation’s sunniest states charging extra fees to people who install solar panels?,"In Alabama, there’s a major disincentive to going solarYale Climate Connections",https://www.facebook.com/130268756992804/posts/2143286525691007/,11/4/2018
Why a paid climate doubter switched sides,4/23/18 7:00,Sara Peach,Climate Science,2018-04-23 Yale Climate Connections -- Jerry Taylor was once paid to dispute the seriousness ...,#N/A,#N/A,https://www.yaleclimateconnections.org/2018/04/why-a-paid-climate-doubter-switched-sides/,$32.16,6088683306094,"13,691","2,695",382,168,$0.0119,$0.084,$0.19,,196.845,12,Jerry Taylor was once paid to dispute the seriousness of climate change. Now he argues for climate action.,Why a paid climate doubter switched sides ,https://www.facebook.com/130268756992804/posts/1871753079511021/,5/4/2018
A mom's environmental legacy,12/9/2016,"Natasha Harper-Madison, Sara Peach",Sustainability,2016-12-09 Yale Climate Connections -- What’s your truth?  When Natasha Harper-Madison was di...,#N/A,#N/A,http://www.yaleclimateconnections.org/2016/12/a-moms-environmental-legacy/,$9.66,6061239849294,"1,771",190,7,,$0.0508,$1.380,#DIV/0!,,107.284,0,"What’s your truth?  When Natasha Harper-Madison was diagnosed with breast cancer, she was told to prepare for the worst but thought about her children and the environment instead.  Listen in to hear how Harper-Madison is now “living her truth.” 

(Image Courtesy Greater Austin Black Chamber of Commerce; Hakeem Adewumi, Photographer) The Greater Austin Black Chamber of Commerce  #IAMBLACKAUSTIN #blacklivesmatter",A Mom’s Environmental Legacy,https://www.facebook.com/130268756992804/posts/1339836109369390/,1/4/2017
Not in database,n/a,n/a,n/a,"2017-01-19 Yale Climate Connections -- The Proximity Hotel in Greensboro, North Carolina, was...",#N/A,#N/A,http://www.yaleclimateconnections.org/2017/01/a-green-hotel-leaves-a-sustainable-legacy,$12.62,6063217838094,"4,667",461,45,,$0.0274,$0.280,#DIV/0!,,98.779,0,"The Proximity Hotel in Greensboro, North Carolina, was the first hotel to achieve LEED platinum status in the United States. Click to learn how this hotel’s investment in #solar and energy efficiency has already paid for itself. 

North Carolina Sierra Club U.S. Green Building Council (USGBC) U.S. Department of Energy Office of Energy Efficiency and Renewable Energy WNCW",A Green Hotel Leaves a Sustainable Legacy,https://www.facebook.com/130268756992804/posts/1386801758006158/,2/16/2017
Mine shaft could be used to store energy,7/26/18 7:00,Diana Madson,Energy,2018-07-26 Yale Climate Connections -- Solving the energy storage problem requires thinking o...,#N/A,#N/A,https://www.yaleclimateconnections.org/2018/07/abandoned-mine-shaft-could-be-used-to-store-energy/,$41.33,6095256528894,"7,050",888,59,136,$0.0465,$0.701,$0.30,8,125.957,19,"Solving the energy storage problem requires thinking outside the box — in this case, thinking inside the mine shaft.",A unique place to store energy: an abandoned mine shaft,https://www.facebook.com/130268756992804/posts/1996815510338110/,8/4/2018
Republicans and Democrats alike go solar,4/27/2017,"Bud Ward, energy, solar","Energy, Policy",2017-04-27 Yale Climate Connections -- Want to know what Republicans and Democrats agree on? ...,#N/A,#N/A,http://www.yaleclimateconnections.org/2017/04/republicans-and-democrats-alike-go-solar/,$59.66,6068608919694,"11,067","1,561",98,,$0.0382,$0.609,#DIV/0!,,141.050,0,"Want to know what Republicans and Democrats agree on? It’s solar panels. 

PowerScout  Solar America Solar Energy International (SEI)",Republicans and Democrats alike go solar ,https://www.facebook.com/130268756992804/posts/1492620030757663/,5/4/2017
What's the difference between the ozone hole and global warming?,5/28/19 7:00,NULL,Climate Science,2019-05-21 Yale Climate Connections -- Climate change may mean less colorful springtimes in N...,#N/A,#N/A,https://www.yaleclimateconnections.org/2019/05/springs-are-arriving-earlier-but-new-englands-woodland-wildflowers-are-slow-to-catch-on/,$78.04,6117315833694,"8,402","1,619",142,119,$0.0482,$0.550,$0.66,7,192.692,14,Climate change may mean less colorful springtimes in New England:,"Springs are arriving earlier, but New England’s woodland wildflowers are slow to catch on",https://www.facebook.com/130268756992804/posts/2458019584217698/,6/4/2019
Keep carbon in the ground,11/30/2016,"carbon farming, Daisy Simmons","Ecosystems, Food & Agriculture",2016-11-30 Yale Climate Connections -- Jesse McDougall and his wife inherited a farm in Vermo...,#N/A,#N/A,http://www.yaleclimateconnections.org/2016/11/keep-carbon-in-the-ground-where-its-helpful/,$91.02,6060739542894,"15,776","2,419",279,,$0.0376,$0.326,#DIV/0!,,153.334,0,"Jesse McDougall and his wife inherited a farm in Vermont that wouldn’t even support grass, but turned it into a productive, small family farm.  Listen in to learn how the McDougals revitalized their soil without degrading the environment.",Keep Carbon in the Ground … Where It’s Helpful,https://www.facebook.com/130268756992804/posts/1331797186839949/,12/4/2016
The octopus in the parking garage,1/31/2017,"Eileen Mignoni, nuisance flooding, stormwater management",Sea Level Rise,2017-01-31 Yale Climate Connections -- “The Octopus in the Parking Garage”: It sounds like a ...,#N/A,#N/A,http://www.yaleclimateconnections.org/2017/01/the-bizarre-case-of-the-octopus-in-the-parking-garage/,$2.27,6063833979294,"1,512",148,21,,$0.0153,$0.108,#DIV/0!,,97.884,0,"“The Octopus in the Parking Garage”: It sounds like a comic book. But the real-life octopus that ended up in a parking garage last fall is actually a sign of climate change. Tune in to learn what this anomaly could mean. 

University of Miami Florida Climate Institute NASA Sea Level WLRN Public Radio and Television WVUM 90.5 FM The Voice Moody Radio South Florida",The bizarre case of the octopus in the parking garage,https://www.facebook.com/130268756992804/posts/1400852959934371/,2/16/2017
The Edmonton Declaration calls on cities to lead on climate change,2/8/19 7:00,NULL,Policy &amp; Politics,"2019-03-01 Yale Climate Connections -- The Green New Deal, as it currently stands, is best un...",#N/A,#N/A,https://www.yaleclimateconnections.org/2019/02/green-new-deal-an-rfp-and-what-more/,$17.80,6110903122894,"1,339",310,18,21,$0.0574,$0.989,$0.85,7,231.516,16,"The Green New Deal, as it currently stands, is best understood as a request for proposals. Commentary by Bud Ward.",Green New Deal: An 'RFP' and what more? » by Bud Ward,https://www.facebook.com/130268756992804/posts/2327344290618562/,4/4/2019
"In San Francisco suburb, NIMBY concerns lead city manager to resign",1/28/19 7:10,Bruce Lieberman,"Feature Article, Policy &amp; Politics","2019-01-29 Yale Climate Connections -- Even small cities need to address ""the most significan...",#N/A,#N/A,https://www.yaleclimateconnections.org/2019/01/city-manager-resigns-over-nimby-climate-concerns/,$4.12,6108558777694,886,145,7,25,$0.0284,$0.589,$0.16,8,163.657,28,"Even small cities need to address ""the most significant challenges of our time"" -- climate change, income inequality, and affordable housing -- writes a frustrated city manager in his resignation letter.",City manager resigns over NIMBY/climate concerns » by Bruce Lieberman,https://www.facebook.com/130268756992804/posts/2279541695398822/,2/4/2019
Venomous snakes could slither north,9/15/2017,"ecosystems, Eileen Mignoni",Ecosystems,2017-09-15 Yale Climate Connections -- Snakes. Why did it have to be snakes?,#N/A,#N/A,https://www.yaleclimateconnections.org/2017/09/as-climate-warms-venomous-snakes-could-slither-north/,$126.37,6075476884094,"23,404","4,242",543,333,$0.0298,$0.233,$0.38,,181.251,14,Snakes. Why did it have to be snakes?,"As the climate warms, poisonous snakes could slither north",https://www.facebook.com/130268756992804/posts/1642709519082046/,10/4/2017
The woman who stopped a fracking truck,4/17/2017,"Eileen Mignoni, fracking, public health","Latino Communities, Public Health","2017-04-28 Yale Climate Connections -- Two years ago, Elida Tamez of Denton, Texas, stepped i...",#N/A,#N/A,http://www.yaleclimateconnections.org/2017/04/the-woman-who-stopped-a-fracking-truck/,$121.99,6068658121294,"15,692","2,296",132,,$0.0531,$0.924,#DIV/0!,,146.317,0,"Two years ago, Elida Tamez of Denton, Texas, stepped in front of a truck to protest #fracking. “It was one of the nicest days of my life because it showed me that yes, little people can still have a big effect,” she says.",The woman who stopped a fracking truck ,https://www.facebook.com/130268756992804/posts/1476566925696307/,5/4/2017
"In the future, tropical forests may hold fewer big trees",4/25/19 7:00,NULL,"Species &amp; Ecosystems, Weather Extremes","2019-04-10 Yale Climate Connections -- In the face of climate change, “all industries have to...",#N/A,#N/A,https://www.yaleclimateconnections.org/2019/04/union-leader-every-industry-will-need-to-change/,$21.84,6113990394694,"2,509",730,67,9,$0.0299,$0.326,$2.43,9,290.953,4,"In the face of climate change, “all industries have to change,” says Sharan Burrow of the International Trade Union Confederation. And that means jobs will change, too.","To protect the climate, every industry will need to change, union leader says ",https://www.facebook.com/130268756992804/posts/2388487657837558/,5/4/2019
Fuel cells: Pros and cons,11/21/2016,"fuel cells, Jan Ellen Spiegel, pros and cons","Energy, Feature Article",2016-11-23 Yale Climate Connections -- Fuel cells have been the next best clean-energy thing ...,#N/A,#N/A,http://www.yaleclimateconnections.org/2016/11/fuel-cells-pros-and-cons/,$10.68,6060370805494,"1,696",144,19,,$0.0742,$0.562,#DIV/0!,,84.906,0,"Fuel cells have been the next best clean-energy thing for, well, a long time. Promising, but struggling to catch on. Read up on the pros and cons ...",Fuel cells: Pros and cons - Yale Climate Connections,https://www.facebook.com/130268756992804/posts/1337647072921627/,12/4/2016
"Imperial Beach, California, sues fossil-fuel companies over sea-level rise",12/4/18 7:00,NULL,"Oceans, Policy &amp; Politics",2018-12-04 Yale Climate Connections -- Mayor Serge Dedina’s city is already experiencing the ...,#N/A,#N/A,https://www.yaleclimateconnections.org/2018/12/city-sues-fossil-fuel-companies/,$65.87,6104670299894,"7,872","1,781",197,217,$0.0370,$0.334,$0.30,10,226.245,28,"Mayor Serge Dedina’s city is already experiencing the effects of sea-level rise. “We’re not going to take this lying down. We think that those who cause climate change should pay up,” he says.",This coastal city is flooding as seas rise. Now it’s suing fossil-fuel companies.,https://www.facebook.com/130268756992804/posts/2194273347258991/,1/4/2019
Company turns food waste into electricity,3/21/18 7:00,Jan Ellen Spiegel,"Energy, Food &amp; Agriculture",2018-03-21 Yale Climate Connections -- Food waste is a huge source of greenhouse emissions. H...,#N/A,#N/A,https://www.yaleclimateconnections.org/2018/03/company-turns-food-waste-into-electricity/,$8.55,6086264393494,"3,777",818,97,32,$0.0105,$0.088,$0.27,,216.574,8,Food waste is a huge source of greenhouse emissions. Here’s one potential solution.,Yale Climate ConnectionsCompany turns food waste into electricity ,https://www.facebook.com/130268756992804/posts/1835612606458402/,4/4/2018
Two scientists' concerns over years of inaction,1/21/2017,"Bud Ward, Daniel Grossman, Donald Trump, global temperatures","Feature Article, Policy, Science, Science Questions",2017-01-31 Yale Climate Connections -- Scientists caution that a four- or eight-year delay in...,#N/A,#N/A,http://www.yaleclimateconnections.org/2017/01/two-scientists-fears-over-4-or-8-years-of-inaction-on-climate-change/,$1.82,6063841605094,996,176,33,,$0.0103,$0.055,#DIV/0!,,176.707,0,Scientists caution that a four- or eight-year delay in reducing greenhouse gas emissions could lead to dangerously higher global temperatures and long-term adverse impacts. (Article includes a Q&A with scientist Ben Sanderson.),"Two Scientists' Concerns Over Years of Inaction, by Daniel Grossman & Bud Ward",https://www.facebook.com/130268756992804/posts/1404477296238604/,2/16/2017
Restoring natural habitats helps salmon,9/28/2016,"David Appell, drought, salmon",Ecosystems,2016-09-28 Yale Climate Connections -- Salmon struggle to survive as droughts become more fre...,#N/A,#N/A,http://www.yaleclimateconnections.org/2016/09/restoring-natural-habitats-helps-salmon-survive-hotter-temps/,$51.52,6057186415694,"10,515",971,136,,$0.0531,$0.379,#DIV/0!,,92.344,0,"Salmon struggle to survive as droughts become more frequent.  Listen to today’s episode of Yale Climate Connection’s Radio Show to learn how scientists are creatively sustaining streams for salmon spawning. #climatechange #salmon #fishing #drought #resilience #watershed #wetlands Oregon State University, College of Agricultural Sciences",Restoring natural habitats helps salmon - Yale Climate Connections,https://www.facebook.com/130268756992804/posts/1278194928866842/,10/4/2016
Are Antarctica's glaciers losing or gaining ice?,8/8/18 7:00,Diana Madson,Snow &amp; Ice,2018-08-08 Yale Climate Connections -- A big question — and the answer will have major conseq...,#N/A,#N/A,https://www.yaleclimateconnections.org/2018/08/are-antarcticas-glaciers-losing-or-gaining-ice/,$19.92,6096164095494,"5,100",726,65,236,$0.0274,$0.306,$0.08,8,142.353,46,A big question — and the answer will have major consequences for anyone living near a coast.,Are Antarctica’s glaciers losing or gaining ice?,https://www.facebook.com/130268756992804/posts/2019171174769210/,9/4/2018
Why Australian Mina Guli attempted to run 100 marathons in 100 days,3/28/19 7:00,NULL,"Policy &amp; Politics, Youth",2019-03-01 Yale Climate Connections -- Many Hmong people fled from Laos after the Vietnam War...,#N/A,#N/A,https://www.yaleclimateconnections.org/2019/03/hmong-farmers-face-new-challenges/,$153.27,6110894406294,"18,684","3,663",295,905,$0.0418,$0.520,$0.17,7,196.050,48,"Many Hmong people fled from Laos after the Vietnam War and settled in Minnesota. Now, they face a new crisis that threatens their livelihoods:","Once refugees, Hmong farmers face new challenges as the climate changes ",https://www.facebook.com/130268756992804/posts/2328807360472255/,4/4/2019
Minister urges Christians to act on climate,2/22/18 7:00,Daisy Simmons,Religion &amp; Morality,2018-02-22 Yale Climate Connections -- “We’re facing a living hell on Earth if we don’t turn ...,#N/A,#N/A,https://www.yaleclimateconnections.org/2018/02/minister-urges-christians-to-act-on-climate/,$69.37,6084645448494,"10,306","2,252",235,43,$0.0308,$0.295,$1.61,,218.513,4,“We’re facing a living hell on Earth if we don’t turn things around — and that is going to require systemic change.” — Minister and activist Sharon Delgado,Minister calls on Christians to act on climate,https://www.facebook.com/130268756992804/posts/1804879599531703/,3/4/2018
How family size shapes your carbon footprint,3/29/19 7:05,Craig K. Chandler,"Feature Article, Religion &amp; Morality",2019-04-17 Yale Climate Connections -- Is it worth investing in a clean energy source that ma...,#N/A,#N/A,https://www.yaleclimateconnections.org/2019/04/could-nuclear-fusion-solve-our-energy-problems/,$11.85,6114555443894,"1,233",237,12,10,$0.0500,$0.988,$1.19,9,192.214,8,Is it worth investing in a clean energy source that may not be able to produce electricity for decades? Mike Mauel of Columbia University says yes:,Could nuclear fusion solve our energy problems? ,https://www.facebook.com/130268756992804/posts/2400209379998719/,5/4/2019
Nonprofit installs solar on leaders' homes,10/20/2016,"Sara Peach, solar energy, Solar Head of State","Energy, Policy",2016-10-20 Yale Climate Connections -- A group called Solar Head of State aims to install sol...,#N/A,#N/A,http://www.yaleclimateconnections.org/2016/10/nonprofit-installs-solar-on-leaders-homes/,$4.61,6058523897094,"1,187",118,12,,$0.0391,$0.384,#DIV/0!,,99.410,0,"A group called Solar Head of State aims to install solar panels on the homes of world leaders.  “They have some of the highest energy costs in the world” says James Ellsmoor, director of project development.  Listen to today’s episode to learn about their mission and how they convinced Barack Obama to replace the solar panels on the The White House!",Nonprofit installs solar on leaders' homes ,https://www.facebook.com/130268756992804/posts/1300585816627753/,11/4/2016
A destructive beetle has jumped the Rockies,1/22/18 7:00,Daisy Simmons,Species &amp; Ecosystems,2018-01-22 Yale Climate Connections -- A major threat to jack pine forests is spreading west ...,#N/A,#N/A,https://www.yaleclimateconnections.org/2018/01/a-destructive-beetle-has-jumped-the-rockies/,$72.13,6082993946494,"19,616","3,838",682,347,$0.0188,$0.106,$0.21,,195.657,18,A major threat to jack pine forests is spreading west because of the warming climate.,A destructive beetle has jumped the Rockies,https://www.facebook.com/130268756992804/posts/1771680152851648/,2/4/2018
New electric car has tiny carbon footprint,5/11/18 7:00,Bruce Lieberman,Energy,"2018-05-11 Yale Climate Connections -- It’s easier to find parking, too.",#N/A,#N/A,https://www.yaleclimateconnections.org/2018/05/new-electric-car-has-tiny-carbon-footprint/,$32.68,6090110450494,"12,187","1,787",118,192,$0.0183,$0.277,$0.17,,146.632,16,"It’s easier to find parking, too.",Teeny electric car has a weeny carbon footprint ,https://www.facebook.com/130268756992804/posts/1890459987640330/,6/4/2018
Native Americans adapting to climate changes,9/21/2016,"Bud Ward, sustainability, Tribal Climate Camp","Food & Agriculture, Sustainability",Hunting and gathering are deeply embedded in the cultures of many Native Amer...,#N/A,#N/A,http://www.yaleclimateconnections.org/2016/09/native-americans-adapting-to-climate-changes/,$10.05,6056835167694,"2,589",236,35,,$0.0426,$0.287,#DIV/0!,,91.155,0,"Hunting and gathering are deeply embedded in the cultures of many Native American tribes. But as the climate changes, the animals and plants available are changing, too. Hear more about what tribes are doing to adapt on today's episode.",Native Americans adapting to climate changes ,https://www.facebook.com/130268756992804/posts/1271953786157623/,10/4/2016
"Same foods, different environmental footprints",9/3/18 7:00,Bruce Lieberman,Food &amp; Agriculture,2018-09-03 Yale Climate Connections -- What’s in your shopping cart?,#N/A,#N/A,https://www.yaleclimateconnections.org/2018/09/same-foods-different-environmental-footprints/,$57.65,6097913084694,"7,790",788,50,137,$0.0732,$1.153,$0.42,6,101.155,18,What’s in your shopping cart?,The same foods can have wildly different environmental footprints,https://www.facebook.com/130268756992804/posts/2061604537192540/,10/4/2018
Not in database,n/a,n/a,n/a,2018-03-13 Yale Climate Connections -- This chilly Midwestern state is becoming a hotspot for...,#N/A,#N/A,https://www.facebook.com/YaleClimateConnections/videos/1826531540699842/,$125.76,6085727808894,"27,174","20,838",269,7,$0.0060,$0.468,$17.97,,766.836,0,"This chilly Midwestern state is becoming a hotspot for clean energy, and firing up a booming clean energy workforce: http://bit.ly/2FD45UA",Clean Energy Jobs Minnesota,https://www.facebook.com/YaleClimateConnections/videos/1826531540699842/,4/4/2018
Turning shipping containers into gardens,8/4/2016,"aquaponics, Erika Street Hopman, Farmpods",Food & Agriculture,FarmPod containers brings home-scale efficient gardening to your front door. ...,#N/A,#N/A,http://www.yaleclimateconnections.org/2016/08/entrepreneur-turns-shipping-containers-into-gardens/,$20.91,6054273742494,"4,266",376,75,,$0.0556,$0.279,#DIV/0!,,88.139,0,"FarmPod containers brings home-scale efficient gardening to your front door. Hear more about this innovative, climate-friendly solution on today's podcast.",Turning shipping containers into gardens,https://www.facebook.com/130268756992804/posts/1228081653878170/,9/4/2016
How family size shapes your carbon footprint,3/29/19 7:05,Craig K. Chandler,"Feature Article, Religion &amp; Morality","2019-04-23 Yale Climate Connections -- Do your children know how to stay safe in a flood? 

T...",#N/A,#N/A,https://www.yaleclimateconnections.org/2019/04/how-to-prepare-kids-for-climate-change/,$14.10,6114999212494,"1,227",324,33,24,$0.0435,$0.427,$0.59,6,264.059,20,"Do your children know how to stay safe in a flood? 

That's just one of the skills that will help them cope with climate change:",How to prepare kids for climate change » Yale Climate Connections,https://www.facebook.com/130268756992804/posts/2411004642252526/,5/4/2019
Skier says winter has turned weird,4/25/2017,"Bruce Lieberman, skiing, weather","Polar Ice, Weather",2017-04-26 Yale Climate Connections -- When professional skier Lexi duPont arrived in Kyrgyzs...,#N/A,#N/A,http://www.yaleclimateconnections.org/2017/04/pro-skier-says-winter-has-turned-weird/,$20.48,6068541081694,"2,524",231,11,,$0.0887,$1.862,#DIV/0!,,91.521,0,"When professional skier Lexi duPont arrived in Kyrgyzstan to teach a community to ski, it was so hot that she found herself in flip-flops rather than on skis. #climatechange",Pro skier says winter has turned weird ,https://www.facebook.com/130268756992804/posts/1497384643614535/,5/4/2017
The woman who helped thousands go solar,4/5/2017,"Jan Ellen Spiegel, solar","Economics, Energy","2017-04-05 Yale Climate Connections -- Financing for home solar is not widely available, and ... - Copy",#N/A,#N/A,http://www.yaleclimateconnections.org/2017/04/meet-the-woman-who-has-helped-thousands-go-solar/,$75.90,6067819665694,"9,114","1,077",162,,$0.0705,$0.469,#DIV/0!,,118.170,0,"Financing for home solar is not widely available, and one woman’s quest to install panels on her home led her to develop a unique solar finance company. She saw a problem, thought of a solution, and said, “Why not try it?” Listen in to hear from the founder of Sungage. 

Sungage Financial WGBH News Solar Energy International (SEI) Solar Energy Industries Association WBUR 90.9 FM SolarCity","Meet the woman who has helped thousands go solar 
",https://www.facebook.com/130268756992804/posts/1462677147085285/,5/4/2017
The campaign to end coal power,5/2/2017,"coal, energy, Sara Peach",Energy,2017-05-02 Yale Climate Connections -- You don’t need to be a politician to reduce America’s ...,#N/A,#N/A,http://www.yaleclimateconnections.org/2017/05/the-campaign-to-end-coal-power/,$15.88,6068822139894,"2,615",435,28,2,$0.0365,$0.567,$7.94,,166.348,1,"You don’t need to be a politician to reduce America’s coal consumption. Ordinary people – with organizing support from Sierra Club's Beyond Coal campaign – have helped stop more than 180 new coal power plants from construction, says director Mary Anne Hitt.","The campaign to end coal power, one plant at a time",https://www.facebook.com/130268756992804/posts/1498207740198892/,6/4/2017
When solar is a family affair,6/27/18 7:00,Diana Madson,"Energy, Jobs &amp; Economy","2018-06-27 Yale Climate Connections -- “They enjoy solar, and they know for sure it’s going t...",#N/A,#N/A,https://www.yaleclimateconnections.org/2018/06/when-solar-energy-is-a-family-affair/,$123.77,6093262862694,"10,772","1,716",65,30,$0.0721,$1.904,$4.13,6,159.302,3,"“They enjoy solar, and they know for sure it’s going to be around for a while.” — Tim Martinez","For the Martinezes, solar energy is a family affair",https://www.facebook.com/130268756992804/posts/1949060988446896/,7/4/2018
Warming threatens the 'greatest show on snow',2/8/2017,"Sara Peach, skiing",Weather,2017-02-08 Yale Climate Connections -- Wisconsin’s changing winter temperatures are creating ...,#N/A,#N/A,http://www.yaleclimateconnections.org/2017/02/warming-threatens-the-greatest-show-on-snow/,$7.80,6064277795294,"3,773",263,45,,$0.0297,$0.173,#DIV/0!,,69.706,0,"Wisconsin’s changing winter temperatures are creating problems for the annual “Birkie” – the largest cross-country ski race in North America. Listen in.

WXPR Public Radio WOJB Woodlands Radio Life 97.3 FM American Birkebeiner Ski Foundation Attitash Ski Resort Stratton Mountain Resort Beaver Creek Mountain Park City Mountain Powder Mountain",Warming threatens the “Greatest Show on Snow” ,https://www.facebook.com/130268756992804/posts/1414874961865504/,3/4/2017
What are zero-energy buildings?,9/6/18 7:00,Daisy Simmons,Energy,2018-09-06 Yale Climate Connections -- Buildings generate more than 40 percent of all carbon ...,#N/A,#N/A,https://www.yaleclimateconnections.org/2018/09/what-are-zero-energy-buildings/,$43.91,6098138487094,"7,360","1,134",106,132,$0.0387,$0.414,$0.33,6,154.076,18,Buildings generate more than 40 percent of all carbon pollution in the U.S.,What are zero-energy buildings?,https://www.facebook.com/130268756992804/posts/2065377486815245/,10/4/2018
Climate change is making it harder for young people to become farmers,1/15/19 7:00,NULL,Food &amp; Agriculture,2019-01-27 Yale Climate Connections -- Who will replace the older generation of farmers if cl...,#N/A,#N/A,https://www.yaleclimateconnections.org/2019/01/young-farmers-face-new-climate-challenges/,$9.90,6108409266694,"1,724",421,45,5,$0.0235,$0.220,$1.98,9,244.200,3,Who will replace the older generation of farmers if climate change makes farming too risky for the new generation?,Climate change is making it harder for young people to become farmers,https://www.facebook.com/130268756992804/posts/2259251710761154/,2/4/2019
NYC bans cars from Central Park,8/22/18 7:00,Bruce Lieberman,Policy &amp; Politics,2018-08-22 Yale Climate Connections -- ”We would love for the Catholic church to be a leader ...,#N/A,#N/A,https://www.yaleclimateconnections.org/2018/08/nyc-bans-cars-from-central-park/,$38.98,6097120915894,"7,442","1,256",62,27,$0.0310,$0.629,$1.44,8,168.772,4,"”We would love for the Catholic church to be a leader and an inspiration with regard to climate action in spirit, word, and deed.” — Jose Aguto of the Catholic Climate Covenant",Catholic institutions commit to climate action,https://www.facebook.com/130268756992804/posts/2044531252233202/,9/4/2018
Airline tests fuel made from trees,2/10/2017,"biofuel, Bud Ward",Energy,2017-02-10 Yale Climate Connections -- Leftover tree limbs and branches are being turned into...,#N/A,#N/A,http://www.yaleclimateconnections.org/2017/02/airline-tests-fuel-made-from-trees/,$40.24,6064401248894,"7,410",832,86,,$0.0484,$0.468,#DIV/0!,,112.281,0,"Leftover tree limbs and branches are being turned into … jet fuel? Learn more about an effort of the Northwest Advanced Renewables Alliance. 

Alaska Airlines American Airlines Virgin Airlines Group U.S. Department of Agriculture #biofuels",Airline tests fuel made from trees ,https://www.facebook.com/130268756992804/posts/1414898041863196/,3/4/2017
Climate change could threaten fishing in North Carolina,12/20/18 7:00,Diana Madson,Species &amp; Ecosystems,2018-12-20 Yale Climate Connections -- New worries about the impacts of climate change on fis...,#N/A,#N/A,https://www.yaleclimateconnections.org/2018/12/climate-change-spells-trouble-for-fishermen/,$16.41,6105910867894,"1,701",420,41,10,$0.0391,$0.400,$1.64,7,246.914,6,New worries about the impacts of climate change on fishing in North Carolina — a billion-dollar industry:,A warming climate spells trouble for fishing in North Carolina,https://www.facebook.com/130268756992804/posts/2218958801457112/,1/4/2019
Not in database,n/a,n/a,n/a,2017-03-10 Yale Climate Connections -- Is there still hope for coral reefs?. New efforts are ...,#N/A,#N/A,http://sustainability.thomsonreuters.com/2017/02/23/scientists-to-test-50-coral-reefs-to-seek-ways-to-counter-climate-change/,$12.66,6065943192894,"4,713",636,75,,$0.0199,$0.169,#DIV/0!,,134.946,0,"Is there still hope for coral reefs?. New efforts are underway to find out how to limit damage from climate change, pollution and over-fishing. (Via The Christian Science Monitor)",Scientists to test 50 coral reefs to seek ways to counter climate change | | Thomson Reuters,https://www.facebook.com/130268756992804/posts/1438749616144705/,4/4/2017
Not in database,n/a,n/a,n/a,2016-11-24 Yale Climate Connections -- Happy Thanksgiving!  Originally a day to give thanks a...,#N/A,#N/A,http://www.yaleclimateconnections.org/2016/06/rescuing-leftover-food/,$8.49,6060436719494,966,72,4,,$0.1179,$2.123,#DIV/0!,,74.534,0,"Happy Thanksgiving!  Originally a day to give thanks and bless the year’s harvest, this holiday has become much more. Nowadays, it’s about family, food, overeating and leftovers. In high spirits, we're excited to enrich our regularly scheduled content by sharing an additional daily story related to food from our 2016 collection. Listen in below for more on rescuing your holiday food from the landfill.",Rescuing leftover food ,https://www.facebook.com/130268756992804/posts/1335857223100612/,12/4/2016
Not in database,n/a,n/a,n/a,2016-12-20 Yale Climate Connections -- Why use a boring graph when you can paint a beautiful ...,#N/A,#N/A,http://www.yaleclimateconnections.org/2016/12/artist-turns-climate-data-into-paintings,$6.53,6061805251294,"2,053",188,20,,$0.0347,$0.327,#DIV/0!,,91.573,0,"Why use a boring graph when you can paint a beautiful picture? Meet Jill Pelto, a scientist and an artist that uses art to creatively communicate information about extreme environmental issues.  Listen in to hear her story. University of Maine",Artist Turns Climate Data into Paintings ,https://www.facebook.com/130268756992804/posts/1354494387903562/,1/4/2017
Great Plains powering up its wind energy,7/6/2016,"Bruce Lieberman, wind power",Energy,Work is underway to connect Oklahoma's enormous wind power potential with the...,#N/A,#N/A,http://www.yaleclimateconnections.org/2016/07/great-plains-powering-up-its-wind-energy/,$16.69,6053587451294,"2,959",284,40,,$0.0588,$0.417,#DIV/0!,,95.978,0,Work is underway to connect Oklahoma's enormous wind power potential with the energy hungry cities of the Southeast. Hear the story in 90 seconds on today's episode.,Great Plains powering up its wind energy - Yale Climate Connections,https://www.facebook.com/130268756992804/posts/1219523328067336/,8/4/2016
Portland's fossil-fuel ban,4/25/18 7:00,Bruce Lieberman,Energy,2018-04-25 Yale Climate Connections -- The campaign grew out of a decade of activism against ...,#N/A,#N/A,https://www.yaleclimateconnections.org/2018/04/portlands-fossil-fuel-ban/,$32.73,6088974219294,"13,260","2,714",242,77,$0.0121,$0.135,$0.43,,204.676,6,The campaign grew out of a decade of activism against fossil-fuel projects.,What other cities can learn from Portland’s fossil-fuel ban,https://www.facebook.com/130268756992804/posts/1873864345966561/,5/4/2018
How vanishing lizards in Madagascar led to a troubling discovery about deforestation and climate change,4/30/19 7:10,Daniel Grossman,"Feature Article, Species &amp; Ecosystems",2019-05-29 Yale Climate Connections -- Reverend Heber Brown III says his church’s food progra...,#N/A,#N/A,https://www.yaleclimateconnections.org/2019/05/baltimore-church-provides-worshippers-with-fresh-veggies-grown-right-out-front/,$82.54,6118030061294,"6,881","1,618",155,64,$0.0510,$0.533,$1.29,7,235.140,9,Reverend Heber Brown III says his church’s food program simultaneously cuts climate pollution and protects people by providing healthy food:,These church-goers can pick up fresh veggies on Sundays — and they’re grown right out front,https://www.facebook.com/130268756992804/posts/2472296149456708/,6/4/2019
The world's soil holds more carbon than the atmosphere,12/5/18 7:00,Daisy Simmons,"Climate Science, Food &amp; Agriculture","2018-12-05 Yale Climate Connections -- Today is World Soil Day, a time to celebrate one of th...",#N/A,#N/A,https://www.yaleclimateconnections.org/2018/12/soil-holds-more-carbon-than-the-atmosphere/,$15.72,6104756704494,"1,662",374,24,7,$0.0420,$0.655,$2.25,8,225.030,4,"Today is World Soil Day, a time to celebrate one of the world’s greatest carbon sinks:",The world’s soil holds more carbon than the atmosphere.,https://www.facebook.com/130268756992804/posts/2195762757110050/,1/4/2019
How family size shapes your carbon footprint,3/29/19 7:05,Craig K. Chandler,"Feature Article, Religion &amp; Morality",2019-04-05 Yale Climate Connections -- Reducing our carbon emissions to meet Paris goals will...,#N/A,#N/A,https://www.yaleclimateconnections.org/2019/04/reforestation-is-seen-key-to-climate-progress/,$48.98,6113596604094,"5,417","1,527",161,22,$0.0321,$0.304,$2.23,9,281.890,4,Reducing our carbon emissions to meet Paris goals will require a major effort -- and reforestation will likely need to be part of the solution.,Reforestation is seen key to climate progress » by Sarah Wesseler,https://www.facebook.com/130268756992804/posts/2380769438609380/,5/4/2019
What's on your climate fiction syllabus?,4/13/18 7:10,Amy Brady,"Arts &amp; Culture, Feature Article","2018-04-13 Yale Climate Connections -- Like cli-fi? This professor has some ""climate fiction""...",#N/A,#N/A,https://www.yaleclimateconnections.org/2018/04/whats-on-your-climate-fiction-syllabus/,$7.22,6087729088694,"1,186",204,9,28,$0.0354,$0.802,$0.26,,172.007,24,"Like cli-fi? This professor has some ""climate fiction"" recommendations - short stories and novels - and fascinating questions that frame her course.",What's on your climate fiction syllabus?,https://www.facebook.com/130268756992804/posts/1861755520510777/,5/4/2018
Photographer focuses on climate solutions,8/9/2016,"art and climate change, climate change solutions, Sara Peach","Arts, Energy","On today's show hear the story of Joan Sullivan, a photographer documenting s...",#N/A,#N/A,http://www.yaleclimateconnections.org/2016/08/photographer-focuses-on-climate-solutions/,$15.36,6054555963094,"1,632",210,30,,$0.0731,$0.512,#DIV/0!,,128.676,0,"On today's show hear the story of Joan Sullivan, a photographer documenting successes in clean energy and climate action. Says Sullivan: “I don’t think that we’re responding very well anymore to the facts, to the statistics. I think we need signs of hope, we need signs of progress. We need examples of how do we get from here to there.”",Photographer focuses on climate solutions ,https://www.facebook.com/130268756992804/posts/1232099553476380/,9/4/2016
Connecticut initiatives help low-income people go solar,11/27/18 7:00,Jan Ellen Spiegel,Jobs &amp; Economy,"2018-11-27 Yale Climate Connections -- In Connecticut, low-income homeowners install solar at...",#N/A,#N/A,https://www.yaleclimateconnections.org/2018/11/connecticut-initiatives-help-low-income-people-go-solar/,$40.80,6104130763094,"3,779",774,60,14,$0.0527,$0.680,$2.91,9,204.816,4,"In Connecticut, low-income homeowners install solar at the same rates as homeowners with higher incomes. Find out why:",Low-income people don’t usually go solar. A Connecticut investment fund is changing that.,https://www.facebook.com/130268756992804/posts/2183731901646469/,12/4/2018
Climate change science comeback strategies,7/26/18 14:00,Karin Kirk,"Communicating Climate, Feature Article",2018-07-27 Yale Climate Connections -- If you talk about climate change with somebody who dou...,#N/A,#N/A,https://www.yaleclimateconnections.org/2018/07/climate-change-science-comeback-strategies-part-one/,$36.67,6095345357494,"7,528",988,157,264,$0.0371,$0.234,$0.14,6,131.243,35,"If you talk about climate change with somebody who doubts the science, here are a few ways to make sure the conversation is constructive. (Getting angry is not one of them.)","How to have a productive discussion about climate change, part one",https://www.facebook.com/130268756992804/posts/1998760333476961/,8/4/2018
Should a Green New Deal include nuclear power?,4/9/19 14:17,Peter Sinclair,"Energy, Policy &amp; Politics",2019-04-08 Yale Climate Connections -- The Trump administration is considering establishing a...,#N/A,#N/A,https://www.yaleclimateconnections.org/2019/04/the-long-history-of-climate-change-security-risks/,$13.27,6113811040694,"1,782",447,40,16,$0.0297,$0.332,$0.83,7,250.842,9,The Trump administration is considering establishing a special commission to investigate whether there’s a link between climate change and national security. We already know.,The long history of climate change security risks » by Dana Nuccitelli,https://www.facebook.com/130268756992804/posts/2385276788158645/,5/4/2019
Trends fueling move to EVs,8/19/2016,"Bud Ward, electric vehicles, Lyft, self driving cars",Energy,"If you live in a city, you’ve likely heard of #Uber and #Lyft. These on-deman...",#N/A,#N/A,http://www.yaleclimateconnections.org/2016/08/trends-fueling-move-to-evs/,$5.66,6055136590694,866,71,8,,$0.0797,$0.708,#DIV/0!,,81.986,0,"If you live in a city, you’ve likely heard of #Uber and #Lyft. These on-demand ride-sharing services are rapidly gaining popularity. And it’s a trend that could help expand the adoption of electric vehicles. Hear more on today's episode.",Trends Fueling Move to Electric Vehicles,https://www.facebook.com/130268756992804/posts/1239883216031347/,9/4/2016
Rechargeable or disposable batteries?,11/29/2016,"batteries, Daniel Grossman, greenhouse gases",Energy,2016-11-29 Yale Climate Connections -- Consumers want to be environmentally conscious.  Becau...,#N/A,#N/A,http://www.yaleclimateconnections.org/2016/11/which-battery-is-better-rechargeable-or-disposable/,$5.93,6060653638494,905,109,13,,$0.0544,$0.456,#DIV/0!,,120.442,0,"Consumers want to be environmentally conscious.  Because products don’t begin or end with us, they have life cycles of their own.  Listen in to learn about Politecnico di Milano's cradle to grave study on batteries to help determine which ones are right for you.",Which Battery is Better: Rechargeable or Disposable?,https://www.facebook.com/130268756992804/posts/1331789426840725/,12/4/2016
Gift guide: 12 books on climate change for the holidays,12/5/18 7:10,Michael Svoboda,"Arts &amp; Culture, Feature Article",2018-12-14 Yale Climate Connections -- This has been a big year for books about climate chang...,#N/A,#N/A,https://www.yaleclimateconnections.org/2018/12/climate-books-as-holiday-gifts/,$15.69,6105449582694,"1,094",191,16,10,$0.0821,$0.981,$1.57,5,174.589,9,This has been a big year for books about climate change. Take a look at these 12. https://www.yaleclimateconnections.org/2018/12/climate-books-as-holiday-gifts/,Climate books as holiday gifts » Yale Climate Connections,https://www.facebook.com/130268756992804/posts/2203749519644707/,1/4/2019
